docname,from,to,pre,keyword,post,pattern
BEL_2016.L719,39,39,find way logic confrontation russia many interests common allow luxury diplomatic paralysis past years made lot progress reducing poverty improving access basichealth_careknow well still much sustainable development goals paris agreement,climate_change,given us proactive framework continue making progress strive unstintingly implement duty future generations create safer world respectful planet economic exchanges,climate
BHR_2016.L103,1,1,,climate_change,enter force end year also endorse proposal establishment high-level panel find practical solutions improve decision-making mechanisms united nations support continued pursuit great achievements took place domains notably fields educationhealthpast decade,climate
BIH_2016.L44,32,32,yet world today anything peaceful secure marred injustice inequality intolerance erodes foundations human society witnessing human suffering unprecedented scale suffering reaches far beyond national boundaries capacities deal poverty hungerdiseasenatural disasters,climate_change,afflict millions fellow human beings many states societies trapped protracted conflicts cycles violence claiming countless victims facing worst forced displacement crisis since second world war million people,climate
BIH_2016.L1324,33,33,building just equitable tolerant open inclusive societies respect human rights promotion rule law core every action history judge us difference make lives millions people suffering marginalization discrimination povertymalnutritiondisease natural disasters,climate_change,must listen voices respond needs hopes aspirations must find courage take urgent actions turn agendas agreed upon instruments true global change honouring pledge humankind leaving legacy,climate
BIH_2016.L1325,32,32,building just equitable tolerant open inclusive societies respect human rights promotion rule law core every action history judge us difference make lives millions people suffering marginalization discrimination poverty malnutritiondiseasenatural disasters,climate_change,must listen voices respond needs hopes aspirations must find courage take urgent actions turn agendas agreed upon instruments true global change honouring pledge humankind leaving legacy true,climate
BLZ_2016.L982,39,39,also fully embraced sustainable development goals urge international community welcome taiwan's meaningful participation mechanisms meetings activities united nations specialized agencies including worldhealthorganization international civil aviation organization united nations framework convention,climate_change,setbacks global economy externalities resulting institutional policies public private safeguard financial security risks well adverse impacts climate_change conspired belize's sustainable,climate
BLZ_2016.L982,56,56,nations specialized agencies including worldhealthorganization international civil aviation organization united nations framework convention climate_change setbacks global economy externalities resulting institutional policies public private safeguard financial security risks well adverse impacts,climate_change,conspired belize's sustainable,climate
BWA_2016.L397,50,50,us throughout challenging journey today made great strides achievements areas educationhealth_careinfrastructure human-resource development well women youth empowerment achievements however make us complacent like many nations botswana already feeling adverse impact,climate_change,impact manifested decline agricultural production rising food insecurity increasing,climate
COL_2016.L484,51,51,context colombia resources used finance war now better used educationhealthsecurity citizens colombia opens arms world welcomes investment trade tourism sustainable development goals already adopted law country first country paris agreement,climate_change,now congress enacted law peace undoubtedly allow us,climate
COM_2016.L329,35,35,tirelessly persevere furthermore ambitious new long-term programme adopted last year improve lives population protect planet future generations enables us optimistically perceive future can reduce poverty improvehealtheducation build sustainable habitat fight,climate_change,protect oceans forests however issue refugees migrants focus debate since start current session requires urgent action well aware migrant men women put lives risk,climate
FSM_2016.L1119,29,29,earlier month heads state government convened forty-seventh annual meeting forum micronesia meeting french polynesia new caledonia seated full members forum federated states micronesia became member small island states,climate_change,oceanshealthhuman rights partnership featured prominently agenda climate_change forum reaffirmed position achieving paris agreement's goal limiting average global temperature increase c degrees pre-industrial levels existential matter many forum members must addressed,climate
FSM_2016.L1119,36,36,convened forty-seventh annual meeting forum micronesia meeting french polynesia new caledonia seated full members forum federated states micronesia became member small island states climate_change oceanshealthhuman rights partnership featured prominently agenda,climate_change,forum reaffirmed position achieving paris agreement's goal limiting average global temperature increase c degrees pre-industrial levels existential matter many forum members must addressed,climate
FSM_2016.L1119,47,47,seated full members forum federated states micronesia became member small island states climate_change oceanshealthhuman rights partnership featured prominently agenda climate_change forum reaffirmed position achieving paris agreement's goal limiting average global,temperature,increase c degrees pre-industrial levels existential matter many forum members must addressed,climate
HTI_2016.L229,44,44,within security council haiti stands alongside encourages united nations intentions strengthen capabilities conduct peacekeeping operations fight pandemicshealthcrises promotion democracy human rights without overlooking neglecting economic social cultural rights paris agreement,climate_change,perfectly illustrates concept collective destiny peoples lies heart organization vision inspired urgent united international action,climate
ISR_2016.L796,31,31,wait decade keep vilifying israel perhaps appreciate obsessive bias israel just problem country problem countries united nations spends much time condemning liberal democracy middle east far less time address wardiseasepoverty,climate_change,serious problems plague planet half-million slaughtered syrians helped member states condemnation israel israel treated thousands injured syrians hospitals including field hospital built right along golan heights border syria,climate
JAM_2016.L1075,48,48,recently concluded high-level meeting antimicrobial resistance hiv aids also highlighted another problem globalhealthsituation must halted ensure citizens full productive lives another issue demands continued cooperation global regional national levels response,climate_change,increasing occurrence natural disasters including extreme weather-related phenomena events increasingly spurred,climate
KGZ_2016.L232,49,49,priority areas sustainable development goals include poverty reduction food security quality educationhealth_careeconomic growth energy preservation environment know one three pillars 2030 agenda consists environmental issues paris worked together reach consensus,climate_change,kyrgyzstan fully supports global agreement yesterday signed paris agreement climate_change,climate
KGZ_2016.L232,59,59,quality educationhealth_careeconomic growth energy preservation environment know one three pillars 2030 agenda consists environmental issues paris worked together reach consensus climate_change kyrgyzstan fully supports global agreement yesterday signed paris agreement,climate_change,,climate
KIR_2016.L282,38,38,family conflicts around world scourge terrorism transnational organized crime war nuclear testing mass movements refugees migrants often unstated invisible silent killer non-communicable diseaseshealthoceans looming challenges uncertainties incremental real existential threats,climate_change,continue undermine efforts global family achieve sustainable development also like add new session provides great opportunity us opportunity reaffirm renew commitment,climate
KOR_2016.L172,41,41,technology rural development introduced korea aid new development cooperation initiative mobile customized service delivered need vulnerable groups already experiencing betterhealthmedical services well enjoying adequate food cultural activities sdgs paris agreement,climate_change,inextricably linked future planet people mutually reinforcing lead virtuous cycle respect host copenhagen green climate fund government taking,climate
LSO_2016.L261,32,32,united nations forum collective diplomacy can bear fruit theme chosen current session namely sustainable development goals universal push transform world relevant appropriate time humankind tottering precipice resulting hunger povertydiseaseadverse consequences,climate_change,theme highlights collective desire united nations eradicate poverty forms dimensions may recall overriding message 2030 agenda leave one behind unique special challenges faced least-developed countries landlocked developing,climate
LSO_2016.L636,5,5,fund threats posed underdevelopment,climate_change,hiv aids pricked conscience humankind many years lesotho adopted innovative indigenous leadership programme seeks galvanize collective wisdom levels leadership join fight hiv aids particular ensurehealthdelivery system affordable accessible effective programme,climate
MCO_2016.L20,27,27,hearing since beginning week representatives world crisis war-torn world divided inequality shocked ever- increasing massive population displacements afflicted hungerdiseasetorn apart grief-stricken violence also representatives world threatened,global_warming,made vulnerable attacks biodiversity concerned new dangers ocean acidification melting permafrost doubly responsible situation world responsible human beings tragedy one perpetrator,climate
MDV_2016.L544,8,8,want international community continue invest action prevent,climate_change,forging meaningful partnerships investing today saving tomorrow continue alarmed realities climate_change another crisis looms state oceans large-ocean state major economic activities dependhealthwealth oceans concerned many situations issue hand one needs,climate
MDV_2016.L544,19,19,want international community continue invest action prevent climate_change forging meaningful partnerships investing today saving tomorrow continue alarmed realities,climate_change,another crisis looms state oceans large-ocean state major economic activities dependhealthwealth oceans concerned many situations issue hand one needs collective response one opportunity united nations conference support implementation sustainable development,climate
MLI_2016.L779,26,26,put end forms poverty change lives people substantial inclusive manner 2030 mali convinced need adopt strategies strengthen economic growth respond vital needs population including combating,climate_change,protecting environment providing educationhealth_caresocial protection jobs young people also empowering women ensuring involvement young people management critical issues relating socioeconomic development country context adopted law setting aside per cent elective,climate
MWI_2016.L218,4,4,great danger everywhere,global_warming,threatens existence hurricanes cyclones earthquakes wildfires extreme flooding droughts dangers threaten fragile economies africa third world everywhere africa rest developing world suffering dehumanizing poverty pain hungerdiseaseinequalities gender imbalances tragedies challenges,climate
MWI_2016.L529,2,2,agreement,climate_change,headquarters commit government ratification implementation crucial document malawi already adopted climate_change policy guide domestic implementation paris agreement taking action climate_change let also put record malawi making exemplary progresshealthsector pioneering innovative,climate
MWI_2016.L529,13,13,agreement climate_change headquarters commit government ratification implementation crucial document malawi already adopted,climate_change,policy guide domestic implementation paris agreement taking action climate_change let also put record malawi making exemplary progresshealthsector pioneering innovative approaches management hiv aids pandemic among countries african continent successfully rolled,climate
MWI_2016.L529,22,22,agreement climate_change headquarters commit government ratification implementation crucial document malawi already adopted climate_change policy guide domestic implementation paris agreement taking action,climate_change,let also put record malawi making exemplary progresshealthsector pioneering innovative approaches management hiv aids pandemic among countries african continent successfully rolled test-and-treat programme managing pandemic need concerted efforts manage non-communicable,climate
MWI_2016.L537,5,5,document malawi already adopted,climate_change,policy guide domestic implementation paris agreement taking action climate_change let also put record malawi making exemplary progress health sector pioneering innovative approaches management hiv aidspandemicamong countries african continent successfully rolled,climate
MWI_2016.L537,14,14,document malawi already adopted climate_change policy guide domestic implementation paris agreement taking action,climate_change,let also put record malawi making exemplary progress health sector pioneering innovative approaches management hiv aidspandemicamong countries african continent successfully rolled test-and-treat programme managing pandemic need concerted efforts manage non-communicable,climate
MWI_2016.L547,4,4,agreement taking action,climate_change,let also put record malawi making exemplary progress health sector pioneering innovative approaches management hiv aids pandemic among countries african continent successfully rolled test-and-treat programme managingpandemicneed concerted efforts manage non-communicable,climate
SGP_2016.L701,40,40,land degradation loss biodiversity form issue addressed sdg 2030 agenda south-east asia transboundary haze forest peatland fires started human beings impairedhealthmillions people compromised safety aircraft navigation damaged regional economies accelerated,climate_change,association southeast asian nations asean adopted road map achieve hope haze-free asean 2020 need strengthen partnerships among governments private,climate
SLE_2016.L71,10,10,historic adoption sustainable development goals sdgs signing paris agreement,climate_change,convening first world humanitarian summit sierra leone always remember secretary-general deep appreciation exemplary role mobilizing support successful fight deadly eboladiseasetheme chosen president debate year sustainable development goals universal push transform,climate
SWZ_2016.L543,56,56,disappearance ecosystems drought exacerbated foodnutritioninsecurity many people kingdom throughout southern african development community sadc region across entire african continent high proportion economic activity agro-based therefore country continued feel harsh effects,climate_change,levels subsistence farming,climate
TON_2016.L732,7,7,signatory party united nations framework convention,climate_change,subsequent protocol tonga affirms ongoing commitment implementing objectives core international framework climate_change seriousness negative impacts climate_change underestimated impacts threaten territorial integrity land waterhealthinfrastructure food security biological diversity livelihoods ecosystems maintenance,climate
TON_2016.L732,19,19,signatory party united nations framework convention climate_change subsequent protocol tonga affirms ongoing commitment implementing objectives core international framework,climate_change,seriousness negative impacts climate_change underestimated impacts threaten territorial integrity land waterhealthinfrastructure food security biological diversity livelihoods ecosystems maintenance international peace security determined solely major way issue disarmament proliferation weapons forms,climate
TON_2016.L732,23,23,signatory party united nations framework convention climate_change subsequent protocol tonga affirms ongoing commitment implementing objectives core international framework climate_change seriousness negative impacts,climate_change,underestimated impacts threaten territorial integrity land waterhealthinfrastructure food security biological diversity livelihoods ecosystems maintenance international peace security determined solely major way issue disarmament proliferation weapons forms threatens international peace security,climate
TTO_2016.L162,21,21,journey 2030 scope 2030 agenda sustainable development goals sdgs covers multitudinous threats collective well-being longevity civilization existential hazard caused unmitigated,climate_change,insidious threats violence extremism terrorism crises forced displacement spreadinfectiousdiseases illnesses ebola chikungunya zika clear challenges time far exceed limits geography demography therefore diminish efficacy unilateral responses however grave threats collectively,climate
VCT_2016.L367,28,28,robber barons people-centred programmes policies mind saint vincent grenadines government comprehensively incorporated 2030 agenda planning focused economic development job creation quality education poverty eradication strengthening institutions infrastructure,renewable_energy,climate resiliencehealthwell-being security citizens central national medium-term development plans year saint vincent grenadines launched zero-hunger trust fund inspired goals sdgs zero-hunger trust fund employs narrowly targeted multifaceted set tools designed,climate
VUT_2016.L502,9,9,september agreed 2030 agenda sustainable development paris agreement,climate_change,efforts make pacific resilient climate_change natural disasters remain essential components journey towards sustainable future region oceans fisheries gender equality human rightshealth_careeducation important priorities region given coherence 2030 agenda sustainable development,climate
VUT_2016.L502,14,14,september agreed 2030 agenda sustainable development paris agreement climate_change efforts make pacific resilient,climate_change,natural disasters remain essential components journey towards sustainable future region oceans fisheries gender equality human rightshealth_careeducation important priorities region given coherence 2030 agenda sustainable development global frameworks united nations innovative,climate
VUT_2016.L795,39,39,level rise seen pacific impact provoked number problems epidemics multiplication destructive insects undermining food security affecting variability precipitation situation caused various problemspublic_healthpresence extreme climate events caused major harm infrastructure economy,climate_change,vanuatu responsible loss land sea also devastating effect food eat subsistence economy else health people despite fact pacific known floods,climate
VUT_2016.L819,17,17,variability precipitation situation caused various problems public_health presence extreme climate events caused major harm infrastructure economy,climate_change,vanuatu responsible loss land sea also devastating effect food eat subsistence economy elsehealthpeople despite fact pacific known floods owing rise sea levels disappearance entire islands means people vanuatu forced move,climate
VUT_2016.L819,54,54,devastating effect food eat subsistence economy elsehealthpeople despite fact pacific known floods owing rise sea levels disappearance entire islands means people vanuatu forced move inland however transforming ways life adapt,climate_change,already affecting population although profoundly,climate
WSM_2016.L961,35,35,billions people important source employment income many communities around world sustainable management oceans seas therefore critical economic social development poverty eradication raising living standards worldwide yethealthoceans increasingly compromised pressures overfishing,climate_change,ocean acidification habitat loss pollution health marine ecosystems declines capacity provide food livelihoods incomes impacts disproportionately affect island countries vulnerable least able adapt trends,climate
WSM_2016.L973,25,25,around world sustainable management oceans seas therefore critical economic social development poverty eradication raising living standards worldwide yet health oceans increasingly compromised pressures overfishing,climate_change,ocean acidification habitat loss pollutionhealthmarine ecosystems declines capacity provide food livelihoods incomes impacts disproportionately affect island countries vulnerable least able adapt trends continue critical thresholds may soon reached potentially dire,climate
AUS_2017.L554,28,28,disasters 2030 agenda paris agreement sendai declaration world humanitarian summit's grand bargain blueprint global action addresses problems can addressed working together challenges face respect national borders includes,climate_change,diseases includingmalariamanagement precious water resources modern slavery unpalatable truth forced labour child labour human trafficking modern slavery rampant world australia strongly committed working international community urgently address egregious crimes last,climate
BLZ_2017.L1107,58,58,development advance globalhealthpolicies bring justice victims crimes humanity protect vulnerable control spread weapons mass destruction including small arms light weapons forefront global fight protect preserve shared natural environment environmental degradation,climate_change,ensure,climate
CHE_2017.L43,32,32,switzerland support region since year 2000 humankind made remarkable progress fight major scourges hunger extreme poverty difficulties accessing education famine still affects million people world every seconds child diesmalnutritionchallenges include,climate_change,global inequality conflict humanitarian disasters well forced displacement migration country actor world stage position find alone answers challenges today large complex transcend borders concern entire international community,climate
COG_2017.L529,22,22,quality life people protect forests congo basin second-largest green lung world amazon invite international community support congo initiative aimed protecting planet,global_warming,decent life also means allowing populations benefit high-qualityhealth_careproliferation counterfeit sub-standard medicines increasingly serious threat world particularly developing countries expansion scourge brings mind various carefully organized forms trafficking helped finance terrorism,climate
ERI_2017.L453,53,53,nutritious food clean water electricity shelter transport communicationshealth_careeducational services well cultural sports recreational facilities eritrea also embarked massive water soil conservation programme afforestation programme part comprehensive plan enhance environment fight,climate_change,eritrea confident meet sustainable development goals,climate
FIN_2017.L518,57,57,universal access sexual reproductivehealthensuring sexual rights comprehensive sexuality education key factors sustainable development candidate unesco executive board finland also considers gender equality high-quality education fulfilment 2030 agenda sustainable development priorities,climate_change,binds south,climate
GNQ_2017.L358,31,31,security council republic equatorial guinea cooperate states ensure peace world mean ensuring peace country protecting political economic social cultural rights also great deal uncertainty fact despite commendable initiatives 1990s combatmalnutritionhunger,climate_change,others despite high-level plenary meeting general assembly millennium development goals held 2010 years much progress seen areas contrary increase number people world go hungry environment continues deteriorate causing,climate
GTM_2017.L437,20,20,president emmanuel macron initiative global pact environment support aware high degree vulnerability threats nature guatemala already national action plan,climate_change,domestic legislation may carried achieve mitigation adaptation resilience climate_change regardnutritionfood security support world food programme put together final report strategic review situation guatemala regard emphasis chronic malnutrition root causes tool,climate
GTM_2017.L437,29,29,president emmanuel macron initiative global pact environment support aware high degree vulnerability threats nature guatemala already national action plan climate_change domestic legislation may carried achieve mitigation adaptation resilience,climate_change,regardnutritionfood security support world food programme put together final report strategic review situation guatemala regard emphasis chronic malnutrition root causes tool working hard national strategy prevention chronic malnutrition period 2016-2020,climate
GTM_2017.L455,2,2,plan,climate_change,domestic legislation may carried achieve mitigation adaptation resilience climate_change regard nutrition food security support world food programme put together final report strategic review situation guatemala regard emphasis chronicmalnutritionroot causes tool,climate
GTM_2017.L455,11,11,plan climate_change domestic legislation may carried achieve mitigation adaptation resilience,climate_change,regard nutrition food security support world food programme put together final report strategic review situation guatemala regard emphasis chronicmalnutritionroot causes tool working hard national strategy prevention chronic malnutrition period 2016-2020,climate
