docname,from,to,pre,keyword,post,pattern
SWZ_2008.L61,24,24,extend appreciation secretary-general ban ki-moon entire staff united nations efforts carrying vision programmes united nations world continues face many challenges include catastrophic effects,climate_change,complicated diseases tuberculosis malaria hiv aidsepidemicfood shortages situation compounded high prices fuel food instability international finance slow efforts fight poverty attain sustainable development encouraging note united nations particular food agriculture,climate
TUR_2008.L98,33,33,pressing task international community bridge quickly possible enormous gap wealthiest least fortunate certainly made considerable progress direction including towards meeting millennium development goals however common fight poverty illiteracyepidemicdiseases child mortality,climate_change,still far contrary volatile fuel prices food crisis global economic slowdown brought even 08-51570 challenging development security environment circumstances fight terrorism racism xenophobia forms religious discrimination,climate
VCT_2008.L832,49,49,economy recognized participation wto compelling reason equally vibrant people denied participation worldhealthorganization specialized agencies caribbean midst annual hurricane season awesome winds sea surges torrential rains gustav hanna ike brought issue,climate_change,sharp relief matter life death people caribbean small island developing,climate
ZMB_2008.L814,13,13,address development adaptation mitigation measures zambia like sub-saharan africa spared adverse effects,climate_change,increased exposure drought rising temperatures erratic rainfall extreme_weather conditions threatening water agricultural systems thereby condemning millions facemalnutritionwater shortages mr tanin afghanistan vice-president took chair let now turn ongoing reforms united,climate
ZMB_2008.L814,21,21,address development adaptation mitigation measures zambia like sub-saharan africa spared adverse effects climate_change increased exposure drought rising temperatures erratic rainfall,extreme_weather,conditions threatening water agricultural systems thereby condemning millions facemalnutritionwater shortages mr tanin afghanistan vice-president took chair let now turn ongoing reforms united nations particular protracted discussions reform security council zambia,climate
ARE_2009.L46,58,58,unemployment poverty outbreaksinfectiousdiseases lack security stability number countries stalemate middle east peace process united arab emirates like seize opportunity express pride international community selected masdar city abu dhabi seat international,renewable_energy,agency,climate
ATG_2009.L95,40,40,later just timely common humanity tested worst economic crisis since great depression additional challenges currently confront us include increased incidence impactpandemicdiseases worsening poverty hunger trap millions around globe adverse consequences,climate_change,tensions peace security increasing environmental degradation history recorded success leaders determined stewardship turbulent times years ago much warmer gentler,climate
BEN_2009.L498,45,45,agriculture promoting education offering free mandatory primary education making free caesarean sections available better approach reproductivehealthsocial measures implemented time major work begun infrastructure however ongoing economic recession worsening harmful consequences,climate_change,threaten seriously jeopardize considerable progress made implementing pivotal national project one year ago international,climate
BGD_2009.L664,5,5,development agenda time now,climate_change,adversely impacting low-lying deltaic monsoonal country although bangladesh's contribution climate_change negligible one worst victims erratic floods cyclones droughts earthquakes disrupting agriculture challenging water resources wellhealthenergy urban planning particular cyclones battering,climate
BGD_2009.L664,15,15,development agenda time now climate_change adversely impacting low-lying deltaic monsoonal country although bangladesh's contribution,climate_change,negligible one worst victims erratic floods cyclones droughts earthquakes disrupting agriculture challenging water resources wellhealthenergy urban planning particular cyclones battering coastal areas taken countless lives sudden floods uprooted families thousands,climate
BHR_2009.L1014,2,2,layer,climate_change,world financial crisis challenges represent imminent threat life now future generations therefore overstatement say twenty-first century destinies intertwined need redouble collective efforts address universal dangers daily threaten humanityhealthfood security regard,climate
CHN_2009.L75,25,25,community countries become interdependent time world remains grip financial crisis prospects economic recovery still clear worldwide unemployment poverty worsening development imbalances acute global issues,climate_change,food security energy resource securitypublic_healthsecurity thrown sharp relief non-traditional security threats including terrorism proliferation weapons mass destruction transnational organized crime major communicable diseases threatening world long-standing hotspot issues remain unresolved,climate
CHN_2009.L481,25,25,efforts also interest increase trade investment cooperation open markets one another step south-south cooperation thirdly pursue cooperation open mind work mutual benefit common progress,climate_change,food security energy resource securitypublic_healthsecurity global challenges country immune way us meet challenges ensure harmony peace engage closer international cooperation climate_change one serious challenges human survival development international cooperation key,climate
CHN_2009.L481,46,46,pursue cooperation open mind work mutual benefit common progress climate_change food security energy resource securitypublic_healthsecurity global challenges country immune way us meet challenges ensure harmony peace engage closer international cooperation,climate_change,one serious challenges human survival development international cooperation key tackling challenge retain united,climate
CMR_2009.L540,9,9,becoming increasingly worrisome visible consequences every country regarding,climate_change,particular africa like continents hard hit despite low level greenhouse gas emissions global_warming salient feature affects many socio-economic sectors including energyhealthagriculture livestock production ecosystems rapid desertification regard spectacular drying lake,climate
CMR_2009.L540,19,19,becoming increasingly worrisome visible consequences every country regarding climate_change particular africa like continents hard hit despite low level,greenhouse,gas emissions global_warming salient feature affects many socio-economic sectors including energyhealthagriculture livestock production ecosystems rapid desertification regard spectacular drying lake chad surface shrunk square kilometres 1960s square kilometres today clearly,climate
CMR_2009.L540,22,22,becoming increasingly worrisome visible consequences every country regarding climate_change particular africa like continents hard hit despite low level greenhouse gas emissions,global_warming,salient feature affects many socio-economic sectors including energyhealthagriculture livestock production ecosystems rapid desertification regard spectacular drying lake chad surface shrunk square kilometres 1960s square kilometres today clearly requires significant collective,climate
COG_2009.L158,32,32,commitment determination foresee future owe forged freedom human rights solidarity universal justice word destiny humankind men women know billion people still live less dollar day children die unnecessarily hungerdiseaseus know,climate_change,abetting scourges countries least responsible suffer effects producing per cent greenhouse gas emissions continent affected global_warming poor populations main victims agriculture fauna infrastructure coastal regions front line,climate
COG_2009.L158,43,43,justice word destiny humankind men women know billion people still live less dollar day children die unnecessarily hungerdiseaseus know climate_change abetting scourges countries least responsible suffer effects producing per cent,greenhouse,gas emissions continent affected global_warming poor populations main victims agriculture fauna infrastructure coastal regions front line,climate
COG_2009.L158,48,48,women know billion people still live less dollar day children die unnecessarily hungerdiseaseus know climate_change abetting scourges countries least responsible suffer effects producing per cent greenhouse gas emissions continent affected,global_warming,poor populations main victims agriculture fauna infrastructure coastal regions front line,climate
EGY_2009.L75,3,3,challenges facing,climate_change,food crisis crises international peace supplemented additional emerging global challenges make essential us redouble efforts coordinated collective manner global financial crisis together spread diseases h1n1 virus threatenspublic_healthworldwide meeting challenge requires,climate
FJI_2009.L87,32,32,importance country small island developing state enriched membership participation united nations fiji people like small developing island states among first victims contemporary global crises financial economic crisis 2009 h1n1pandemicdramatic phenomenon,climate_change,small economies like global events real effect daily livelihoods people part attempted respond crises making policy changes adjustments encouraging people grow food discouraging food imports wherever possible,climate
FSM_2009.L854,32,32,strong deal means mistrust countries become reason failure can economic considerations become excuse inaction 09-52470 throughout history humankind examples nations disagreed coming together survival crisis time war economic hardshipepidemictoday crisis,climate_change,simply time waste therefore stop talk cheap action speaks louder words need action let us go copenhagen seal deal meet copenhagen,climate
GBR_2009.L281,50,50,global fiscal expansion agreed now put place act together prevent avoidableillnesscan plan save tomorrow children dying africa today every day say need world agreement urgent challenges now let elaborate first,climate_change,despite promises made road successful outcome copenhagen assured robust,climate
HTI_2009.L140,57,57,major sections population lackhealth_caredecent housing even good education whole humankind accept half inhabitants planet live privations hunger misery prospect improvement situation whole humankind accept planet endangered irresponsibly species condemned extinction,climate_change,populations become,climate
KNA_2009.L116,58,58,human rights protectionhealthpublic security protecting environment issues become interlinked complexity means country can act alone circumstances precipitated virtual collapse several financial institutions created small states st kitts nevis yet case,climate_change,consequences,climate
MCO_2009.L316,53,53,arise failed risks linked poor sanitation cause outbreaksinfectiousdiseases pandemics phenomena desertification drought well acidification seas oceans exacerbated man-made climatic change failure copenhagen negotiations option commitment worldwide counterparts stated yesterday framework,climate_change,summit convened secretary- general unequivocal must,climate
MDA_2009.L71,31,31,tireless efforts leading united nations complex times distinguished speakers taken floor debate elaborated extensively pressing issues international community faced past year current financial economic crisis food energy crises first flupandemiccentury,climate_change,core deliberations united nations revealing central role organization dealing problems reformed robust effective organization deliver prompt reactions sustainable responses major challenges peace security development disarmament non-proliferation climate_change food,climate
MDA_2009.L71,58,58,crises first flupandemiccentury climate_change core deliberations united nations revealing central role organization dealing problems reformed robust effective organization deliver prompt reactions sustainable responses major challenges peace security development disarmament non-proliferation,climate_change,food,climate
MMR_2009.L249,16,16,period expires effective deal must comprehensive consistent principle common differentiated responsibilities global financial economic crisis,climate_change,crisis compounded problems faced recent years include rising food prices high energy prices spreadpandemicdiseases single country can effectively overcome problems alone global community must work together meet common challenges trying,climate
MNE_2009.L69,29,29,like pay tribute secretary-general mr ban ki-moon outstanding efforts leading organization trying times heard statements previous distinguished speakers given impact world economic financial crisis related food energy crises,climate_change,flupandemiceconomic social growth development politics global relations including achievement millennium development goals mdgs internationally agreed development goals coordinated concerted global effort can yield positive results response current challenges requires therefore,climate
MNE_2009.L548,10,10,development reaching successful deal copenhagen montenegro organize regional conference,climate_change,sustainable development mediterranean south-east european countries budva october millennium development goals require every one us redouble efforts reduce poverty improvehealtheducation promote peace human rights achieve sustainable development aware primary responsibility,climate
MNE_2009.L646,42,42,needs root poverty african continent regard support message 2008 yokohama declaration aimed giving momentum current development issues including educationhealthsanitary measures within framework mdgs development agriculture improve food security measures tackle,climate_change,well establishing maintaining peace prerequisite economic growth emphasize crucial importance debate concept responsibility protect fully support activities,climate
MNG_2009.L215,3,3,extensive effects,climate_change,already appeared parts subregion become exposed drought desertification reduced water resources land degradation increased occurrence natural disasters melting permafrost glaciers snow cover resulting poverty food shortages spreadinfectiousdisease increasing effect sustainable,climate
MNG_2009.L216,2,2,effects,climate_change,already appeared parts subregion become exposed drought desertification reduced water resources land degradation increased occurrence natural disasters melting permafrost glaciers snow cover resulting poverty food shortages spread infectiousdiseaseincreasing effect sustainable,climate
MOZ_2009.L271,43,43,create conditions prevent return economic social growth just described mozambique welcomes launching united nations september 2009 african leadersmalariaalliance pledges play active role support new mechanism aimed coordinating responses scourge malaria,climate_change,another pressing challenge therefore afford fail seal deal december fifteenth conference parties united nations framework convention,climate
MOZ_2009.L284,47,47,leaders malaria alliance pledges play active role support new mechanism aimed coordinating responses scourgemalariaclimate_change another pressing challenge therefore afford fail seal deal december fifteenth conference parties united nations framework convention,climate_change,copenhagen hope commitments made summit climate_change held september inspire deliberations copenhagen southern,climate
MOZ_2009.L284,53,53,role support new mechanism aimed coordinating responses scourgemalariaclimate_change another pressing challenge therefore afford fail seal deal december fifteenth conference parties united nations framework convention climate_change copenhagen hope commitments made summit,climate_change,held september inspire deliberations copenhagen southern,climate
NAM_2009.L286,14,14,republic namibia fully supports efforts secretary-general mobilize political ensure good legally binding agreement,climate_change,copenhagen december namibia one countries highest socio-economic inequality world colonial past nevertheless country made progress provisionhealtheducation critical services majority population course meet number mdgs however face severe difficulties responding combination,climate
NGA_2009.L296,59,59,goal eliminatingmalariaend nigeria intends host abuja-plus ten summit roll back malaria 2011 therefore appreciate support secretary-general make proposed summit possible also facilitate realization objective quality participation just concluded 2009 summit,climate_change,,climate
NGA_2009.L306,49,49,goal eliminating malaria end nigeria intends host abuja-plus ten summit roll backmalaria2011 therefore appreciate support secretary-general make proposed summit possible also facilitate realization objective quality participation just concluded 2009 summit,climate_change,testimony global realization climate_change truly become seen genuine existential threat,climate
NGA_2009.L306,53,53,nigeria intends host abuja-plus ten summit roll backmalaria2011 therefore appreciate support secretary-general make proposed summit possible also facilitate realization objective quality participation just concluded 2009 summit climate_change testimony global realization,climate_change,truly become seen genuine existential threat,climate
NPL_2009.L1017,2,2,annual,temperature,increase celsius degrees 1977 2000 threat glacial lake outbursts increased flash floods become frequent destructive delayed insufficient rainfall affected crop production poorest poor farmers suffered worst effects agriculturehealthlivelihoods infrastructure affected,climate
NPL_2009.L1017,39,39,glacial lake outbursts increased flash floods become frequent destructive delayed insufficient rainfall affected crop production poorest poor farmers suffered worst effects agriculturehealthlivelihoods infrastructure affected nepal recently hosted high-level regional conference,climate_change,focusing himalayan region order highlight seriousness problem global_warming impacts himalayan range unprecedented snow melt himalayas jeopardize lives livelihoods million people,climate
NPL_2009.L1017,47,47,destructive delayed insufficient rainfall affected crop production poorest poor farmers suffered worst effects agriculturehealthlivelihoods infrastructure affected nepal recently hosted high-level regional conference climate_change focusing himalayan region order highlight seriousness problem,global_warming,impacts himalayan range unprecedented snow melt himalayas jeopardize lives livelihoods million people,climate
NRU_2009.L611,6,6,wait catastrophic scenario see impacts,climate_change,live every day flooding inundation already eroding shores contaminating water supply higher water temperatures ocean acidification damaging marine ecosystems depend food economic livelihood praymalariafind way doorstep applaud commitment secretary- general,climate
NRU_2009.L611,49,49,water temperatures ocean acidification damaging marine ecosystems depend food economic livelihood praymalariafind way doorstep applaud commitment secretary- general addressing issue efforts build consensus among world leaders week high- level summit,climate_change,asia africa arctic visited affected regions observe effects climate_change first,climate
NRU_2009.L611,58,58,economic livelihood praymalariafind way doorstep applaud commitment secretary- general addressing issue efforts build consensus among world leaders week high- level summit climate_change asia africa arctic visited affected regions observe effects,climate_change,first,climate
NRU_2009.L714,9,9,atmosphere parts per million less order avoid dire,climate_change,scenarios however developed countries proposed emissions targets result concentrations far higher acceptable policy human lives stake doctor prescribes medicine treat seriousillnessgive patient half needed engineer says eight columns necessary support,climate
PER_2009.L815,11,11,refining uses direct indirect peru also proposes comprehensive programmes adaptation,climate_change,established programmes financed global environment facility world bank identify comprehensive approach sectoral adaptation emphasize strategies reduce occurrence disasters protecthealthfood security affected populations economic infrastructure biodiversity finally wish raise issue particular,climate
PLW_2009.L704,56,56,china invite taiwan attend worldhealthassembly health safety world's peoples heart ideals united nations order promote ideals recommend taiwan invited participate meaningfully international civil aviation organization icao united nations framework convention,climate_change,coming copenhagen international,climate
PLW_2009.L706,54,54,china invite taiwan attend world health assemblyhealthsafety world's peoples heart ideals united nations order promote ideals recommend taiwan invited participate meaningfully international civil aviation organization icao united nations framework convention,climate_change,coming copenhagen international organizations forums,climate
PNG_2009.L247,14,14,global issues challenges face collectively human family together must confront first continuing threats,climate_change,global_warming global food crisis now compounded global financial crisis threats diseases know borders h1n1 hiv aidsmalariatuberculosis cholera et cetera secondly must achieve together social agenda millennium development goals mdgs papua,climate
PNG_2009.L247,15,15,global issues challenges face collectively human family together must confront first continuing threats climate_change,global_warming,global food crisis now compounded global financial crisis threats diseases know borders h1n1 hiv aidsmalariatuberculosis cholera et cetera secondly must achieve together social agenda millennium development goals mdgs papua new,climate
PNG_2009.L960,26,26,emerged one greatest crises now facing humanity consequences appear dire truly global global challenge can met concerted global response papua new guinea today see evidence,climate_change,inundation coastal areas increasemalariadue warming highlands region country especially plight people carteret islands sea level risen people resettled therefore strongly support recent alliance small island states declaration climate_change many small,climate
PNG_2009.L960,54,54,see evidence climate_change inundation coastal areas increasemalariadue warming highlands region country especially plight people carteret islands sea level risen people resettled therefore strongly support recent alliance small island states declaration,climate_change,many small island states survive,climate
POL_2009.L146,25,25,undermined therefore devote address problem crisis extent crisis new problem participating general assembly session first time can state earlier problems conflicts many recent problem,climate_change,problem poverty new add problemhealthaids epidemics however problem current crisis appeared last year coming like refer president ukraine said many causes conflict world one violation faith territorial integrity many new,climate
ROU_2009.L548,27,27,multilateral approach guaranteeing safer sustainable system consider least four essential elements first managing current economic crisis secure sustainable development growth second staying focused demanding interconnected issues,climate_change,poverty food securityhealthenergy migration lack democracy parts world maintaining international peace security stability third element concerns consolidation international law fourth concerns strengthening increasing efficiency international institutions united nations bodies must,climate
SLB_2009.L295,4,4,call global average,temperature,increase well degrees celsius prevent acidification oceans threatening existence deforestation forest degradation contribute nearly per cent greenhouse gas emissions solomon islands agrees one mitigating solutions protectinghealthenvironment urge considered outcome copenhagen,climate
SLB_2009.L295,21,21,call global average temperature increase well degrees celsius prevent acidification oceans threatening existence deforestation forest degradation contribute nearly per cent,greenhouse,gas emissions solomon islands agrees one mitigating solutions protectinghealthenvironment urge considered outcome copenhagen country currently carrying inventory forests intends participate carbon market also hope multilateral financial mechanisms become available vulnerable,climate
SLB_2009.L295,57,57,one mitigating solutions protectinghealthenvironment urge considered outcome copenhagen country currently carrying inventory forests intends participate carbon market also hope multilateral financial mechanisms become available vulnerable states ensuring appropriate technology transfer,renewable_energy,receives attention,climate
STP_2009.L412,39,39,translated declaration heard yesterday goals hopes declaration embodies need attention can say sao tome principe made determined efforts especially achieve goals areashealtheducation almost although yet completely satisfied biggest debates related,global_warming,concentrate substitutions fossil fuels order reduce carbon emissions contribute greenhouse effect debate gone temperatures risen causing glaciers polar ice caps,climate
STP_2009.L412,49,49,can say sao tome principe made determined efforts especially achieve goals areashealtheducation almost although yet completely satisfied biggest debates related global_warming concentrate substitutions fossil fuels order reduce carbon emissions contribute,greenhouse,effect debate gone temperatures risen causing glaciers polar ice caps,climate
