docname,from,to,pre,keyword,post,pattern
UKR_2011.L720,54,54,reduction ensuring quality education environmental protection improvinghealthreducing child mortality curbing spread hiv aids tuberculosis ensuring gender equality working today's immediate tasks believe necessary pay greater attention 11-50702 increasingly acute issue,climate_change,environmental protection endorse idea creating,climate
UKR_2011.L723,51,51,reduction ensuring quality education environmental protection improving health reducing childmortalitycurbing spread hiv aids tuberculosis ensuring gender equality working today's immediate tasks believe necessary pay greater attention 11-50702 increasingly acute issue,climate_change,environmental protection endorse idea creating effective international mechanism,climate
USA_2011.L1963,42,42,health organization affirm commitment meeting challenge today urge nations join us meeting goal making sure nations core capacities addresspublic_healthemergencies place 2012 commitment health people demands preserve planet must put action,climate_change,demands tap power science save resources scarce together must continue work build progress made copenhagen cancún major,climate
USA_2011.L1968,37,37,health organization affirm commitment meeting challenge today urge nations join us meeting goal making sure nations core capacities address public_health emergencies place 2012 commitmenthealthpeople demands preserve planet must put action,climate_change,demands tap power science save resources scarce together must continue work build progress made copenhagen cancún major economies represented today follow commitments,climate
BGD_2012.L727,36,36,local government ensure availability e-services rural people nearly per cent school-age children enrolled primary schools achieved gender parity primary secondary education established community clinics ensurenutritionhealth_care rural people especially mothers children,climate_change,trust fund set implement adaptation mitigation programmes undertakings helped achieving millennium development goals mdgs gender parity infant maternal mortality ahead 2015 achievements earned,climate
BGD_2012.L728,35,35,local government ensure availability e-services rural people nearly per cent school-age children enrolled primary schools achieved gender parity primary secondary education established community clinics ensure nutritionhealth_carerural people especially mothers children,climate_change,trust fund set implement adaptation mitigation programmes undertakings helped achieving millennium development goals mdgs gender parity infant maternal mortality ahead 2015 achievements earned us,climate
BGD_2012.L753,12,12,established community clinics ensure nutrition health_care rural people especially mothers children,climate_change,trust fund set implement adaptation mitigation programmes undertakings helped achieving millennium development goals mdgs gender parity infant maternalmortalityahead 2015 achievements earned us global recognition mdg south-south food agriculture organization awards,climate
BGD_2012.L775,55,55,general acknowledged achievements including member scalingnutritionlead group champion education first initiative welcome high-level panel post-2015 development agenda consider coherence sustainable development goals prioritize poverty hunger nutrition global food energy security,climate_change,global partnership sustainable development,climate
BGD_2012.L796,34,34,general acknowledged achievements including member scaling nutrition lead group champion education first initiative welcome high-level panel post-2015 development agenda consider coherence sustainable development goals prioritize poverty hungernutritionglobal food energy security,climate_change,global partnership sustainable development hope high-level panel also consider formulating position painful plight autistic disadvantaged children constitute per cent world's population home put place special-needs,climate
BGD_2012.L836,56,56,children july 2011 collaboration worldhealthorganization autism speaks launched global autism public_health initiative current assembly session submit draft resolution autism spectrum disorder hope receive assembly's support efforts hindered unjust developments resulting,climate_change,increasing poverty property,climate
BGD_2012.L843,49,49,children july 2011 collaboration world health organization autism speaks launched global autismpublic_healthinitiative current assembly session submit draft resolution autism spectrum disorder hope receive assembly's support efforts hindered unjust developments resulting,climate_change,increasing poverty property loss human displacement consequent terrorism inevitable sea-level,climate
BWA_2012.L274,27,27,provocation blatant acts aggression republic south sudan north led instability region typical sudanese regime many years live times common well-being seriously compromised threats nuclear proliferation terrorism,climate_change,environmental degradation underdevelopmentpandemicdiseases coupled effects global economic financial crisis internal conflicts resolution myriad challenges threats confronting mankind requires urgent concerted action international community universality united nations commands requisite legitimacy moral,climate
COG_2012.L776,53,53,millennium development goals areas fight poverty employment educationhealthaffected crisis light delegation reaffirms responsibility central role united nations forging spirit solidarity cooperation can enable commitments made areas aid financing development respected,climate_change,remains serious threat equilibrium mankind sadly,climate
CPV_2012.L1007,28,28,secretary-general ban ki-moon affirmed princeton university united nations needed new vision new paradigm new multilateralism help ensure global economic financial stability combat poverty re-establish peace respond effects,climate_change,improve globalhealthfight terrorism ensure disarmament non-proliferation closing ceremony united nations conference sustainable development rio june stated rio shown multilateralism irreplaceable instrument global expression democracy reaffirm legitimate path finding solutions problems,climate
FSM_2012.L497,56,56,growing burden non-communicable diseases reachedepidemicproportions pacific accept primary responsibility health rests government seeking assistance international community capacity-building institutional strengthening policy formulation recognize contributing effects nutrition lifestyle epidemic also mindful fact,climate_change,magnified challenge result,climate
FSM_2012.L503,50,50,growing burden non-communicable diseases reached epidemic proportions pacific accept primary responsibilityhealthrests government seeking assistance international community capacity-building institutional strengthening policy formulation recognize contributing effects nutrition lifestyle epidemic also mindful fact,climate_change,magnified challenge result threat poses food security traditional lifestyle,climate
FSM_2012.L518,35,35,growing burden non-communicable diseases reached epidemic proportions pacific accept primary responsibility health rests government seeking assistance international community capacity-building institutional strengthening policy formulation recognize contributing effectsnutritionlifestyle epidemic also mindful fact,climate_change,magnified challenge result threat poses food security traditional lifestyle micronesians federated states micronesia supports greater participation women social political economic development look development partners,climate
FSM_2012.L520,33,33,growing burden non-communicable diseases reached epidemic proportions pacific accept primary responsibility health rests government seeking assistance international community capacity-building institutional strengthening policy formulation recognize contributing effects nutrition lifestyleepidemicalso mindful fact,climate_change,magnified challenge result threat poses food security traditional lifestyle micronesians federated states micronesia supports greater participation women social political economic development look development partners enhance investment,climate
GMB_2012.L287,22,22,stopped tracks costs late relevance organization times questioned one element remains unchallenged character best forum confronting global challenges convene discuss issues,climate_change,economic crises financial turmoil food insecurity conflicts fightingdiseasepoverty special interests africa convening power united nations confers legitimacy indeed unparalleled elsewhere developing countries therefore believe work organization reason support efforts president,climate
IRL_2012.L789,48,48,per cent aid budget priority partners worked closely secretary- general build support scalingnutritionmovement must collectively must act now recognize systemic linkages recurring food price crises humanitarian emergencies chronic undernourishment effects,climate_change,nothing connects us across borders across oceans across generations mutual dependence,climate
KNA_2012.L1421,25,25,agriculture agritourism green energy information technology community development education name just nation even region however taiwan's unfailing valued contributions work united nations framework convention,climate_change,international civil aviation organization worldhealthassembly forums long demonstrated outstanding credentials valued impactful member global community fitting just remaining strictures pertaining taiwan's standing among international community nations removed saint kitts nevis,climate
KOR_2012.L41,29,29,general assembly sixty-seventh session every confidence able leadership session crowned great success humankind continues advance drawing collective wisdom address challenges throughout human history although new global challenges mankind,climate_change,povertydiseaseunderdevelopment terrorism proliferation weapons mass destruction now testing international community doubt overcome challenges future path united nations symbol collective wisdom take greater responsibility coping challenges note great satisfaction united nations,climate
MEX_2012.L2331,44,44,put end scourge claims tens thousands lives region united nations considers finds solutions global problems threaten integrityhealthlives millions around world deals famine starvation horn africa epidemics h1n1 virus mexico tackles,climate_change,must also take action stop wave death suffering drug trade blights lives people respectfully urge,climate
MLI_2012.L772,34,34,debt decline development assistance therefore need undertake in-depth dialogue new strategies aimed mobilizing additional stable predictable resources ensure financing development programmes achievement millennium development goals particular areashealtheducation food security environment,climate_change,one major challenges facing world survival planet threatened natural disasters caused phenomenon seriously affecting living conditions countries sahel mine inter alia inexorable advance desert silting,climate
MUS_2012.L119,2,2,partners,climate_change,already vulnerable nations face greater threats international level vulnerable groups face greater difficulties within nations young people faced higher levels unemployment women children faced reduced access public serviceshealtheducation secretary-general ban,climate
NIC_2012.L919,45,45,presided comandante daniel ortega saavedra people achieving important results struggle poverty strengthens process restoring rights translateshealthbetter education productive service-oriented infrastructure higher living standard citizens soon transformed energy matrix using sources,renewable_energy,2017 per cent energy consumed renewable_energy decided take necessary steps construction great inter-ocean canal,climate
NIC_2012.L919,51,51,achieving important results struggle poverty strengthens process restoring rights translateshealthbetter education productive service-oriented infrastructure higher living standard citizens soon transformed energy matrix using sources renewable_energy 2017 per cent energy consumed,renewable_energy,decided take necessary steps construction great inter-ocean canal,climate
SMR_2012.L1448,39,39,young people ages affected hiv children still vulnerable group population subjected violence abuse exploitation vast number children world still access basic serviceshealth_careeducation besides facing global challenges economic crisis problems connected,climate_change,states must find resources necessary best meet needs children immediately improve conditions living poorest areas world imperative us want guarantee,climate
TTO_2012.L621,13,13,future generations regard move decisively fully implement obligations united nations framework convention,climate_change,kyoto protocol guarantee survival us vulnerable climate_change climate_variability sea-level rise every moment delay takes us closer demisehealthwell-being people central development prevalence non-communicable diseases particular poses serious threat caribbean development trinidad,climate
TTO_2012.L621,20,20,future generations regard move decisively fully implement obligations united nations framework convention climate_change kyoto protocol guarantee survival us vulnerable,climate_change,climate_variability sea-level rise every moment delay takes us closer demisehealthwell-being people central development prevalence non-communicable diseases particular poses serious threat caribbean development trinidad tobago laments lack action political declaration prevention,climate
TTO_2012.L621,21,21,future generations regard move decisively fully implement obligations united nations framework convention climate_change kyoto protocol guarantee survival us vulnerable climate_change,climate_variability,sea-level rise every moment delay takes us closer demisehealthwell-being people central development prevalence non-communicable diseases particular poses serious threat caribbean development trinidad tobago laments lack action political declaration prevention control,climate
BGR_2013.L75,50,50,unsteady limited nowadays hard accept billion people still suffer extreme povertymalnutritionbasic health services many women babies remain remote luxury disparities wealth distribution quality life personal opportunities become extreme across globe,climate_change,environmental degradation reached alarming level require urgent collective response,climate
BGR_2013.L77,48,48,unsteady limited nowadays hard accept billion people still suffer extreme poverty malnutrition basichealthservices many women babies remain remote luxury disparities wealth distribution quality life personal opportunities become extreme across globe,climate_change,environmental degradation reached alarming level require urgent collective response well-being future,climate
BRB_2013.L177,9,9,financial economic crisis made worse many manifestations impact,climate_change,extreme_weather events food crises volatile food crises compounded unprecedented levels terror violence time seen global determination tackle issues barbados recognizes stabilityhealthproductivity global environment particularly coastal marine resources fundamental survival barbados,climate
BRB_2013.L177,10,10,financial economic crisis made worse many manifestations impact climate_change,extreme_weather,events food crises volatile food crises compounded unprecedented levels terror violence time seen global determination tackle issues barbados recognizes stabilityhealthproductivity global environment particularly coastal marine resources fundamental survival barbados caricom,climate
BRB_2013.L515,23,23,perspective sids barbados believes post-2015 development agenda involve commitments eradication poverty hunger environmental sustainability strong emphasis coastal marine resources development sustainable accessible,renewable_energy,technologies pursuit sustainable agriculture agenda tandem foodnutritionsecurity gender equality women's empowerment youth development education employment also call emphasis inclusion vulnerable groups including persons disabilities requisite means implementation including capacity-building technology,climate
BWA_2013.L140,37,37,goals constitute significant part post- 2015 development agenda therefore pledge full support cooperation president ashe efforts usher new development paradigm doubt challenges extreme povertydiseaselack access affordable energy potable water sanitation,climate_change,gender inequality continue haunt millions people especially developing countries account delegation strong view formulation sustainable development goals predicated outcome current review implementation,climate
BWA_2013.L342,14,14,special categories including middle-income countries botswana among sub-saharan african countries suffer adverse impact,climate_change,notable manifestations climate_change extreme temperatures water shortages land degradation desertification persistent drought climate_change also adverse impactshealthfood security gratifying progress continues made many countries implementation united nations framework convention climate_change delegation,climate
BWA_2013.L342,17,17,special categories including middle-income countries botswana among sub-saharan african countries suffer adverse impact climate_change notable manifestations,climate_change,extreme temperatures water shortages land degradation desertification persistent drought climate_change also adverse impactshealthfood security gratifying progress continues made many countries implementation united nations framework convention climate_change delegation believes needs done,climate
BWA_2013.L342,27,27,special categories including middle-income countries botswana among sub-saharan african countries suffer adverse impact climate_change notable manifestations climate_change extreme temperatures water shortages land degradation desertification persistent drought,climate_change,also adverse impactshealthfood security gratifying progress continues made many countries implementation united nations framework convention climate_change delegation believes needs done particularly assist vulnerable countries arid semi-arid areas landlocked transit countries,climate
BWA_2013.L342,43,43,impact climate_change notable manifestations climate_change extreme temperatures water shortages land degradation desertification persistent drought climate_change also adverse impactshealthfood security gratifying progress continues made many countries implementation united nations framework convention,climate_change,delegation believes needs done particularly assist vulnerable countries arid semi-arid areas landlocked transit countries also susceptible,climate
CPV_2013.L350,29,29,advanced development unless part global agenda led united nations involving intensive international cooperation partnership multilateral bilateral levels cape verde committed joint effort cape verdeans deeply focused global issues,climate_change,hungermalnutritionvarious forms inequality well importance ensuring environmental sustainability national international partnerships support global development climate_change pressing problem times must addressed urgency great sense responsibility world reached record highs terms emissions,climate
CPV_2013.L350,44,44,partnership multilateral bilateral levels cape verde committed joint effort cape verdeans deeply focused global issues climate_change hungermalnutritionvarious forms inequality well importance ensuring environmental sustainability national international partnerships support global development,climate_change,pressing problem times must addressed urgency great sense responsibility world reached record highs terms emissions,climate
FRA_2013.L766,47,47,2006 country decided increase tax per cent enhance fight great pandemics hiv aids tuberculosismalariaeurope france also established tax financial transactions decided allocate per cent income towards development-related actions access water,renewable_energy,development assistance can help poorest countries ensure future thereby security respond global_warming,climate
FRA_2013.L766,59,59,aids tuberculosismalariaeurope france also established tax financial transactions decided allocate per cent income towards development-related actions access water renewable_energy development assistance can help poorest countries ensure future thereby security respond,global_warming,,climate
IRL_2013.L779,21,21,see clear commitment ending extreme poverty hunger generation want see specific commitments relation empowerment women girls want see integrated approach,climate_change,strong focus climate-sensitive agriculture aid programme government prioritized hungermalnutritiontheme resonates ireland's history simple message vital importance investment nutrition mothers babies leading supporters scaling nutrition movement committed doubling aid spending nutrition,climate
IRL_2013.L789,11,11,specific commitments relation empowerment women girls want see integrated approach,climate_change,strong focus climate-sensitive agriculture aid programme government prioritized hunger malnutrition theme resonates ireland's history simple message vital importance investmentnutritionmothers babies leading supporters scaling nutrition movement committed doubling aid spending nutrition,climate
IRL_2013.L795,5,5,want see integrated approach,climate_change,strong focus climate-sensitive agriculture aid programme government prioritized hunger malnutrition theme resonates ireland's history simple message vital importance investment nutrition mothers babies leading supporters scalingnutritionmovement committed doubling aid spending nutrition,climate
KNA_2013.L1552,52,52,mutual concern delegation convinced arrangements made taiwan's presence worldhealthassembly referred wha model serve useful point reference taiwan's meaningful participation international agencies international civil aviation organization icao united nations framework convention,climate_change,note permit commend mr roberto kobeh gonzález,climate
MNG_2013.L105,36,36,today million people jobless million children school one eight fellow citizens still goes hungry yet billion dollars earmarked military expenditures every year fraction sum spenthealth_careeducation state affairs tolerated comes climate,temperature,increase two degrees centigrade disastrous catastrophic environment changing rapidly production side global consumption far exceeds fragile planet's capacity resources exhausted humankind gravely endangered,climate
NAM_2013.L105,46,46,deadline ask whether lived commitments made 2000 believe post-2015 development agenda people-centred inclusive focus provisionhealth_careeducation food security nutrition energy potable water gender equality empowerment women young people people disabilities challenges,climate_change,environmental conservation continue focus attention united nations conference sustainable development 2012 made commitments,climate
NAM_2013.L109,42,42,deadline ask whether lived commitments made 2000 believe post-2015 development agenda people-centred inclusive focus provision health_care education food securitynutritionenergy potable water gender equality empowerment women young people people disabilities challenges,climate_change,environmental conservation continue focus attention united nations conference sustainable development 2012 made commitments create new global partnership,climate
NER_2013.L666,23,23,terrorists sahelo-saharan area convey condolences families call efforts achieve prompt release problems sahel just security problems part world among afflicted subject effects,climate_change,desertification recurring droughts well resulting food shortagesmalnutritionneeds significant investment part sustained global strategy supported entire international community ensure economic progress vital stabilization deliverance clutches violence terrorism africa affects sahel also,climate
SLB_2013.L1422,21,21,aviation organization icao guest organization's president recognize first step continue seek observer status republic china icao united nations framework convention,climate_change,requests mirror observer status republic china currently enjoys worldhealthassembly solomon islands continues serve united nations executive board welcome new executive director un-women ms phumzile mlambo-ngcuka assure cooperation note concern un-women,climate
SUR_2013.L581,41,41,development agenda emanate inclusive intergovernmental process process directed towards continued eradication poverty people-centred approach combining economic activity social need educationhealth_carethereby promoting welfare well-being integration economic social action strengthening human capital,global_warming,direct negative impact development small island developing states low-lying coastal states including suriname suriname shares grave concern regarding,climate
SWZ_2013.L824,40,40,still faced problem hiv aids therefore post- 2015 development agenda pressure address scourge well non-communicable diseases maintained ensuring food security goodnutritionremains priority feature prominently post- 2015 development agenda however issue,climate_change,continues drawback many developing countries food production seriously affected climate-change patterns related challenges provision adequate financial resources transfer environmentally,climate
TTO_2013.L314,36,36,since 2000 summit progress achievement internationally agreed goals including mdgs also many pitfalls become apparent business-as-usual approaches suffice address eradicate poverty global scale ensure foodnutritionenergy security reverse environmental degradation deal,climate_change,current approaches advance mdg agenda 2015 ensure sustainable development post-2015 context agreed june 2012 rio de janeiro united nations conference sustainable development rio,climate
