docname,from,to,pre,keyword,post,pattern
SWE_1988.L732,21,21,environmental degradation dramatic large-scale effects threat survival inferior arms race alarming research reports tell us climate begun change probable result,greenhouse,effect life-giving resources destroyed erosion desertification devastation forests people'shealthincreasingly affected poisoning water food chains depletion ozone layer causes threats environment lie excessive exploitation natural resources brought poverty industrial pollution waste,climate
FIN_1989.L627,3,3,recognized problem,climate_change,industrialized developing countries directly affected depletion ozone layer increasing emissions carbon dioxides produce so-called greenhouse effect climate earth increasing presence substances atmosphere cause acid rain direct dangershealththerefore hardly surprise witnessed,climate
FIN_1989.L627,18,18,recognized problem climate_change industrialized developing countries directly affected depletion ozone layer increasing emissions carbon dioxides produce so-called,greenhouse,effect climate earth increasing presence substances atmosphere cause acid rain direct dangershealththerefore hardly surprise witnessed increasing international activity field several initiatives taken launch concerted international action combat atmospheric pollution aspects,climate
JPN_1989.L2207,33,33,planet's ecosystem global damage weald irrevocable just past years blink eye vast continuum history mankind ventured far reaches space sought explore oceans- depths ominous acceleration pace environmental destructionhealthplanet gravely threatened,global_warming,destruction ozone layer depletion tropical rain forests acid rain desertification global environmental problems confront us today must dealt entire international community working together generation solemn responsibility,climate
LBY_1989.L2158,35,35,environment also major concern us world facing unprecedented environmental crisis nature sending us urgent warnings can ignored peril numerous growing indicators crisis around us addition seriousair_pollutiondesertification soil erosion depletion forests,greenhouse,effect unusual climatic changes deterioration ozone layer also problem nuclear industrial toxic wastes given rise justifiable concern especially third world scheming outsiders dump materials,climate
DEU_1990.L2676,16,16,recycling materials must made worthwhile companies squandering energy resources another key problem changing world climate,greenhouse,effect depletion ozone layer bach earth's many environmental problems exacerbated two central problems solvedair_pollutionextinction species erosion increase dramatically reduce chances survival future generations federal republic germany signatory hague declaration spring,climate
ATG_1991.L880,59,59,earth's environmentalhealthsignificant source food oceans fish fragile ecological system allow raped hope successful exploitation industrial activity antarctica tilt carbon dioxide imbalance atmosphere drill larger holes earth's protective ozone layer precipitate,global_warming,,climate
BTN_1991.L1119,21,21,corollary responsible stewardship world's resources far goal indeed every day brings alarming evidence diminishing capacity planet sustain life ominous signs,greenhouse,effect depletion ozone layer include climatic changes increase certainhealthproblems air water pollution soil degradation desertification deforestation threaten world's food supplies living conditions overpopulation puts strains pressures environment picture unbelievably bleak,climate
CAN_1991.L1826,12,12,developed countries slide towards two solitudes rich poor true canada worried,climate_change,worried loss species pollutants arctic food chain ocean resources forests developed country recognise developing countries eliminating poverty ensuringnutritioneradicating disease top priorities inextricably linked environment recognise find solutions one set problems,climate
CAN_1991.L1828,10,10,slide towards two solitudes rich poor true canada worried,climate_change,worried loss species pollutants arctic food chain ocean resources forests developed country recognise developing countries eliminating poverty ensuring nutrition eradicatingdiseasetop priorities inextricably linked environment recognise find solutions one set problems,climate
NZL_1992.L278,59,59,planet povertydiseasemalnutrition crippling levels debt negligible economic growth scourges can unleash despair anger destabilize political social institutions environmental degradation threaten immediate surroundings livelihoods problems depletion ozone layer spread toxic chemicals,climate_change,,climate
NZL_1992.L279,58,58,planet poverty diseasemalnutritioncrippling levels debt negligible economic growth scourges can unleash despair anger destabilize political social institutions environmental degradation threaten immediate surroundings livelihoods problems depletion ozone layer spread toxic chemicals,climate_change,overfishing,climate
ATG_1993.L554,37,37,world unsustainable abundant quantities harmful gases toxins emitted atmosphere altering global environment fatal consequences forecast earth's climate biodiverse flora fauna agriculture living animals humanhealthwell-being borne mind contribution small island states,climate_change,global_warming sea-level rise zero effects climate_change global_warming sea-level rise reduce small island states like mine zero existence stake peace security threatened actions,climate
ATG_1993.L554,38,38,unsustainable abundant quantities harmful gases toxins emitted atmosphere altering global environment fatal consequences forecast earth's climate biodiverse flora fauna agriculture living animals humanhealthwell-being borne mind contribution small island states climate_change,global_warming,sea-level rise zero effects climate_change global_warming sea-level rise reduce small island states like mine zero existence stake peace security threatened actions,climate
ATG_1993.L554,43,43,toxins emitted atmosphere altering global environment fatal consequences forecast earth's climate biodiverse flora fauna agriculture living animals humanhealthwell-being borne mind contribution small island states climate_change global_warming sea-level rise zero effects,climate_change,global_warming sea-level rise reduce small island states like mine zero existence stake peace security threatened actions,climate
ATG_1993.L554,44,44,emitted atmosphere altering global environment fatal consequences forecast earth's climate biodiverse flora fauna agriculture living animals humanhealthwell-being borne mind contribution small island states climate_change global_warming sea-level rise zero effects climate_change,global_warming,sea-level rise reduce small island states like mine zero existence stake peace security threatened actions,climate
BHS_1995.L173,34,34,emerge framers charter determined save succeeding generations scourge war managed far global war concerned saved generations heritage future good enough save seemingly inevitable lot chronic poverty ignorancediseasethreat nuclear annihilation consequences,global_warming,good enough save generations life security existence planet live jeopardy clearly responsible establishing parameters action past produced result desirable necessary ensure stable secure viable future,climate
FJI_1995.L2096,46,46,present time new commitments attach developing countries given overriding priority remain combatting poverty recognizing presenthealthworld's climate system result detrimental patterns production consumption industrialized countries countries continue take lead reducing emission,greenhouse,gases fiji welcomes successful completion united nations conference straddling fish stocks highly migratory,climate
JPN_1995.L141,39,39,world today secretary-general boutros boutros-ghali pointed recent statement geneva approach end twentieth century billion people living absolute poverty billion receive even basichealth_careneedless say remain increasingly grave problems environmental degradation including,global_warming,deforestation marine pollution united nations universal international organization exists cope grave problems ensure international community enjoys peace prosperity thus necessary,climate
LUX_1995.L970,37,37,reaching changes occurred growing globalization problems review take cognizance fact countries faced new phenomena often diverse alike reaching beyond national borders thinking inter aliahealthproblems aids environmental problems depletion ozone layer,global_warming,also social phenomena population growth pressure migration problem refugees violations human rights trans-border issues increasing concern drug trafficking new forms violence crime,climate
GBR_1996.L802,45,45,help must primarily targeted creating growth equity developing human resources full potential giving priority needs poorhealtheducation clean water small enterprises increasingly partnership development amongst us deal growing problems planet survival,climate_change,environment future world's oceans forests pandemic diseases development ignores sustainable united nations central forum,climate
GBR_1996.L824,25,25,human resources full potential giving priority needs poor health education clean water small enterprises increasingly partnership development amongst us deal growing problems planet survival,climate_change,environment future world's oceans forestspandemicdiseases development ignores sustainable united nations central forum focusing attention action governments civil society challenges enter next century next year's general assembly special session review rio,climate
SLB_1996.L638,47,47,designed maximize rural community participation planning decision-making overseas development assistance therefore directed needed fosteringpublic_healthliteracy electrification recent completion first solar-powered village important us implementing habitat agenda encouraging self-reliance village development solar,renewable_energy,resources water wind economic education health development plans several weeks ago internet,climate
SLB_1996.L662,25,25,development assistance therefore directed needed fostering public_health literacy electrification recent completion first solar-powered village important us implementing habitat agenda encouraging self-reliance village development solar,renewable_energy,resources water wind economic educationhealthdevelopment plans several weeks ago internet reached solomon islands personal computers growing number secondary schools possibility lap-top computers hands teachers students give new hope country's future,climate
AUT_1998.L1781,8,8,development developed countries prepared take lead combating,climate_change,european community member states determined translate commitments made kyoto concrete actions achievements context sustainable development population issues particular concern directly relate humanhealthquality life coming decades population size age structure important,climate
TTO_1998.L1176,31,31,private citizens context welcome establishment united nations fund international partnerships strengthen partnerships support united nations projects deliver resources programmes peoples served united nations agencies approval grants projects broad categories children'shealthenvironment,climate_change,women population food security drug control poverty alleviation landmines contribute significantly pursuit goals united nations establishment fund testimony can achieved shared vision commitment principles ideals organization urge optimum,climate
FRA_1999.L914,5,5,biodiversity desertification kyoto protocol,climate_change,current negotiations protocol biosafety attest importance achievements uncertain future climates recurrence natural catastrophes urge us make efforts earth fragile human species spread new epidemics endangershealthentire populations inequalities development exacerbate scourges,climate
MHL_1999.L298,3,3,deeply concerned,climate_change,devastating effect may livelihood culture natural resources economy existence climate_change us now must stressed bad weather climate_change however extreme events observed recent years indications expected climate_change climate_changediseaseobserving symptoms pacific experienced,climate
MHL_1999.L298,13,13,deeply concerned climate_change devastating effect may livelihood culture natural resources economy existence,climate_change,us now must stressed bad weather climate_change however extreme events observed recent years indications expected climate_change climate_changediseaseobserving symptoms pacific experienced number severe weather events changes normal climate kiribati northern cook,climate
MHL_1999.L298,20,20,deeply concerned climate_change devastating effect may livelihood culture natural resources economy existence climate_change us now must stressed bad weather,climate_change,however extreme events observed recent years indications expected climate_change climate_changediseaseobserving symptoms pacific experienced number severe weather events changes normal climate kiribati northern cook islands become wetter fiji tonga become drier,climate
MHL_1999.L298,29,29,deeply concerned climate_change devastating effect may livelihood culture natural resources economy existence climate_change us now must stressed bad weather climate_change however extreme events observed recent years indications expected,climate_change,climate_changediseaseobserving symptoms pacific experienced number severe weather events changes normal climate kiribati northern cook islands become wetter fiji tonga become drier samoa difference daytime night-time temperatures decreased southern cook islands,climate
MHL_1999.L422,12,12,follow suit taking steps limit already small emissions part effort develop,renewable_energy,sector regard pleased inform assembly government approved solar energy policy first stage project install solar panels outer islandhealthcentres one high schools support united nations trust fund new renewable sources energy,climate
USA_1999.L532,41,41,struggling rise held burden debt g-7 nations adopted plan reduce per cent outstanding debt world's poorest countries freeing resources educationhealthgrowth us developed developing countries alike take action now halt global,climate_change,fighting poverty great deal vulnerable members human family hurt first hurt rising temperatures devastate agriculture accelerate spread disease,climate
USA_1999.L562,13,13,health growth us developed developing countries alike take action now halt global,climate_change,fighting poverty great deal vulnerable members human family hurt first hurt rising temperatures devastate agriculture accelerate spreaddiseasetropical countries flood island nations mean developing countries must sacrifice growth protect environment absolutely,climate
KGZ_2000.L815,27,27,kyrgyz republic believing stability political economic aspects also environmental perspective submitted secretary- general year instruments ratification accession following treaties concerning environmental issues united nations framework convention,climate_change,convention long-range transboundaryair_pollutionrotterdam convention prior informed consent procedure certain hazardous chemicals pesticides international trade vienna convention protection ozone layer montreal protocol substances deplete ozone layer today kyrgyz parliament working ratification,climate
MHL_2000.L809,4,4,global action combat,climate_change,terrible tragedy unless international cooperation displaced populations whatever reasons displaced able enjoy sustain basic human rights generations come cultures livelihoods able survive benefit future generations educationhealthparamount importance every country world,climate
PLW_2000.L77,33,33,mankind national regional international levels problems must seriously looked body international regional organizations solutions may found remedies provided alleviate suffering impose world peoples problems ranging hunger poverty tuberculosismalariaspread hiv aids,global_warming,environmental degradation vulnerability just responsibilities countries regions affected every member global community must play part order planet inhabitants survive destructive forces today live era production food,climate
PLW_2000.L192,42,42,plagued disease global community charged responsibility security mankind must confront real danger hiv aids work collectively towards eradication horriblediseaseuncontrolled unregulated human activities affected continue affect ecosystem thereby endangering threatening existence,global_warming,difficult scientifically complicated phenomenon even today scientists still divided issue particularly causes effects agree emission greenhouse gases,climate
PLW_2000.L192,58,58,towards eradication horriblediseaseuncontrolled unregulated human activities affected continue affect ecosystem thereby endangering threatening existence global_warming difficult scientifically complicated phenomenon even today scientists still divided issue particularly causes effects agree emission,greenhouse,gases,climate
MHL_2001.L406,42,42,systems affected high levels saltwater intrusion increasing salinity direct impact subsistence cropping vulnerabilities together prolonged drought constitute deadly perilhealthsurvival welcome successful outcome sixth session conference parties united nations framework convention,climate_change,recently concluded marrakesh kyoto protocol best available solution address environmental concerns able look back coming days commend,climate
PNG_2001.L969,24,24,el niño 1998 came tsunami la niña phenomenon bringing floods landslides leaving death destruction wake acknowledge prompt generous support neighbours dealing effects disasters,global_warming,also brought increased numbers cases diseasesmalariahigher-altitude populous region country threat increased incidence malaria region real negatively affect demographics country definitely link among climate_change natural disaster spread increased incidence disease papua,climate
PNG_2001.L969,47,47,prompt generous support neighbours dealing effects disasters global_warming also brought increased numbers cases diseasesmalariahigher-altitude populous region country threat increased incidence malaria region real negatively affect demographics country definitely link among,climate_change,natural disaster spread increased incidence disease papua new guinea exempt hiv aids,climate
PNG_2001.L977,16,16,bringing floods landslides leaving death destruction wake acknowledge prompt generous support neighbours dealing effects disasters,global_warming,also brought increased numbers cases diseases malaria higher-altitude populous region country threat increased incidencemalariaregion real negatively affect demographics country definitely link among climate_change natural disaster spread increased incidence disease papua,climate
PNG_2001.L977,39,39,prompt generous support neighbours dealing effects disasters global_warming also brought increased numbers cases diseases malaria higher-altitude populous region country threat increased incidencemalariaregion real negatively affect demographics country definitely link among,climate_change,natural disaster spread increased incidence disease papua new guinea exempt hiv aids epidemic tuberculosis grateful australia partners provided assistance field,climate
PNG_2001.L993,25,25,also brought increased numbers cases diseases malaria higher-altitude populous region country threat increased incidence malaria region real negatively affect demographics country definitely link among,climate_change,natural disaster spread increased incidencediseasepapua new guinea exempt hiv aids epidemic tuberculosis grateful australia partners provided assistance field health_care also welcome last year's announcement japanese government set aside substantial financial,climate
PNG_2001.L1000,18,18,higher-altitude populous region country threat increased incidence malaria region real negatively affect demographics country definitely link among,climate_change,natural disaster spread increased incidence disease papua new guinea exempt hiv aidsepidemictuberculosis grateful australia partners provided assistance field health_care also welcome last year's announcement japanese government set aside substantial financial,climate
PNG_2001.L1008,10,10,region real negatively affect demographics country definitely link among,climate_change,natural disaster spread increased incidence disease papua new guinea exempt hiv aids epidemic tuberculosis grateful australia partners provided assistance fieldhealth_carealso welcome last year's announcement japanese government set aside substantial financial,climate
SLB_2001.L736,49,49,protection avoidance marine pollution us success national development planning depends significantly continuedhealthmarine environment unique circumstances small island developing states must fully understood international community strive address serious threats natural disasters,climate_change,sea-level rise kyoto protocol remains significant first step path ensuring,climate
ATG_2002.L701,48,48,poverty environment welcome commitments increase access clean water proper sanitation energy services improvehealthconditions agriculture particularly dry lands better protect world's biodiversity ecosystems however summit's failure agree target date increasing use,renewable_energy,major disappointment small island developing states true test summit's success follow-up,climate
EGY_2002.L1359,44,44,fallen short countries around world suffer spread hiv aids threatens stability owing lack capacity resources unable containpandemicthus necessitating assistance countries dealing crisis world also confronts numerous environmental challenges related biodiversity,climate_change,drought desertification require redoubling international efforts address order safeguard right future generations secure life scarcity,climate
FRA_2002.L1089,41,41,commitments made doha monterrey johannesburg time come strengthen concrete cooperation permit access basic resources water energy basic social services educationhealthfood security let us also call ratification full implementation kyoto protocol,climate_change,let us establish true global governance sustainable development give necessary coherence france proposes creation economic social security council,climate
KHM_2002.L750,33,33,interrelated affect peoples nations planet point view essential continue work together build caring community nations development gap developed developing countries reduced threat terrorism totally eliminated menace hiv aidspandemiccurbed poverty alleviated,global_warming,kept check possible building better cooperation closer partnership fostering mutual respect cultivating greater tolerance enhancing spirit real united nations strongly believe can collective strong determination well,climate
LVA_2002.L443,48,48,organized crime illegal trafficking abuse exploitation women children endemic poverty unemployment drug addictiondiseaseenvironmental pollution global ecological crisis planet now experiencing resulted reckless disregard earth sustains us radically curb excessive amount,greenhouse,gases pollutants produce every day continue experience natural disasters climate changes,climate
NRU_2002.L252,12,12,india canada russia china ratify instrument first step universal campaign address,climate_change,therefore join call united states australia see way clear not-too-distant future ratifying protocol another issue special importance nauruhealthocean custodians largest ocean rich natural marine resources minerals ocean also frames cultures,climate
PNG_2002.L890,24,24,concerns shipment radioactive materials region called states engaging activities accept full responsibility liability compensation damage may result directly indirectly transport radioactive material region,global_warming,brought increase number cases diseases likemalariahigher- altitude regions country still major threat papua new guinea particularly populous region highlands papua new guinea immune hiv aids epidemic tuberculosis rise urgent need,climate
PNG_2002.L911,3,3,material region,global_warming,brought increase number cases diseases like malaria higher- altitude regions country still major threat papua new guinea particularly populous region highlands papua new guinea immune hiv aidsepidemictuberculosis rise urgent need,climate
SLB_2002.L1010,1,1,,climate_change,kyoto protocol seriously commit reducing greenhouse gas emissions least developed countries still grapple harsh realities poverty vulnerability external economic shocks debt burden poor infrastructure poor limited access better educationhealthsocial services,climate
SLB_2002.L1010,7,7,climate_change kyoto protocol seriously commit reducing,greenhouse,gas emissions least developed countries still grapple harsh realities poverty vulnerability external economic shocks debt burden poor infrastructure poor limited access better educationhealthsocial services list goes even increasing commitment globalization,climate
LVA_2003.L700,50,50,office riga also established working group devoting particular attention reduction childmortalityimprovement mothers health twentieth century mankind inflicted environmental damage planet previous centuries combined devote greater efforts reducing environmental pollution including,greenhouse,gas emissions future generations stand inherit planet increasingly destructive,climate
LVA_2003.L703,47,47,office riga also established working group devoting particular attention reduction child mortality improvement mothershealthtwentieth century mankind inflicted environmental damage planet previous centuries combined devote greater efforts reducing environmental pollution including,greenhouse,gas emissions future generations stand inherit planet increasingly destructive climate_change forest cover,climate
