docname,from,to,pre,keyword,post,pattern
CHN_2014.L1197,9,9,aim creating fairer equitable effective arrangements international cooperation,climate_change,ebolaepidemicraging african countries sounded alarm global health security good brother,climate
CHN_2014.L1204,2,2,cooperation,climate_change,ebola epidemic raging african countries sounded alarm globalhealthsecurity good brother,climate
CIV_2014.L346,12,12,infrastructure energy agriculture employment capability ensuring food security continenthealthsector combating,climate_change,also active africa entering era progress development,climate
CYP_2014.L457,15,15,migration flows create demographic changes spreadepidemicrecent example ebola moreover effects,climate_change,eventually distant future turn,climate
DNK_2014.L64,6,6,principles rules-based international order built,climate_change,causing great risks humanhealthglobal food security economic development natural resources,climate
FSM_2014.L213,6,6,yet face brunt adverse impacts,climate_change,threatens food water securityhealthpopulation health oceans coral reefs biodiversity existence,climate
FSM_2014.L215,4,4,brunt adverse impacts,climate_change,threatens food water security health populationhealthoceans coral reefs biodiversity existence,climate
FSM_2014.L752,14,14,death pacific therefore pacific leaders declared ncdsepidemicdiseases lifestyle diseases compounded,climate_change,destroys food crops contaminates water,climate
IND_2014.L1185,7,7,draw assembly's attention another idea talk,climate_change,also talking holistichealth_careconnecting nature going back basics today like underscore,climate
MDV_2014.L49,4,4,realities daunting effects,climate_change,ever-pressing challenges poverty want uncontrollable spreaddiseasecommunities everywhere striving overcome obstacles,climate
MHL_2014.L614,19,19,including worldhealthorganization international civil aviation organization united nations framework convention,climate_change,,climate
PLW_2014.L463,14,14,receives attention financing deserves must understand termspublic_healthclimate_change defining issue century,climate_change,affects air breathe food eat,climate
PLW_2014.L476,3,3,issue century,climate_change,affects air breathe food eat water drinkinfectiousdiseases find way homes,climate
PNG_2014.L243,11,11,assistance programme aimed assisting pacific sids critical areas development educationhealthcapacity-building,climate_change,reconstruction important infrastructure natural disasters reiterate call international,climate
SEN_2014.L197,15,15,challenges faced people particularly areas educationhealthfight poverty extreme poverty energy,climate_change,endemic poverty mind government,climate
SLB_2014.L702,8,8,specialized bodies namely united nations framework convention,climate_change,unfccc worldhealthorganization international civil aviation organization icao united nations bodies,climate
SLB_2014.L719,9,9,united nations bodies deal urgent global issues interest,climate_change,evolvinghealthchallenges icao works keep travelling public air services safe wish,climate
SLB_2014.L1260,11,11,lands result sea-level rise right live harmony nature threatened declininghealthplanet,climate_change,remains greatest challenge time calls widest possible international,climate
SLE_2014.L100,3,3,sustainable energy,climate_change,among others particular appreciate robust response ebolaepidemiccausing much havoc lives,climate
SLV_2014.L214,7,7,agenda must integrate universal issues migration,climate_change,food security educationhealthpublic safety world peace must keep repeating errors,climate
SRB_2014.L174,7,7,global challenges concern just serbia us,climate_change,global security deadlyinfectiousdiseases vast proportions believe addressed wisely systematically challenges,climate
SVK_2014.L758,2,2,sustainable,climate_change,inequalities development distribution goods services poverty unequal accesshealtheducation slovakia remain,climate
TUR_2014.L91,19,19,struggle hungermalnutritioncommunicable diseases lack education rich countries world enjoy prosperity,climate_change,,climate
TUV_2014.L1048,4,4,sectors national priority,climate_change,energy food security fisheries information technologyhealth_careeducation outer islands development much,climate
TUV_2014.L1116,19,19,including worldhealthorganization international civil aviation organization united nations framework convention,climate_change,,climate
ZMB_2014.L378,8,8,multilateral approaches address underlying cross-border factors affect,climate_change,global povertypublic_healthchildren's welfare labour migration youth unemployment advancement women many,climate
BLZ_2015.L361,2,2,posed,climate_change,imperative threat treated less urgency gravity diagnosis terminalillnesstreated must tandem,climate
BWA_2015.L651,15,15,decline agricultural output changing weather patternshealthchallenges caused changing climate conditions,climate_change,also presents serious security,climate
CIV_2015.L504,14,14,reducing poverty hunger around world improving people'shealtheducation fighting adverse effects,climate_change,together also promote good governance,climate
KOR_2015.L261,4,4,world war global,climate_change,threatening lives even future generations ebolainfectiousdiseases causing countless victims awakening,climate
LAO_2015.L118,11,11,environment continues face numerous challenges armed conflicts terrorism poverty hungerinfectiousdiseases,climate_change,natural disasters turn posed major threats peace development,climate
MCO_2015.L459,8,8,just mentioned must also address issues victims,climate_change,natural disastershealthcrisis regard international community define new humanitarian deployment framework,climate
PLW_2015.L108,16,16,home challenges violence war povertydiseaserising seas wildfires well droughts caused,climate_change,enormous resolve share,climate
PNG_2015.L647,11,11,programme support pacific sids critical areas development good governance educationhealthcapacity-building,climate_change,relief assistance natural disaster reconstruction efforts assistance pacific,climate
SEN_2015.L80,16,16,remains threatened extreme poverty hungerdiseaseunprecedented degradation environment senegal's hope paris,climate_change,conference successful adopt,climate
SLE_2015.L811,5,5,shore capabilities deal effects,climate_change,country reiterate immune physical socialhealthconsequences climate_change need integrate insight decisions,climate
SLE_2015.L811,11,11,shore capabilities deal effects climate_change country reiterate immune physical socialhealthconsequences,climate_change,need integrate insight decisions urgent matters youth unemployment,climate
SWZ_2015.L429,5,5,opportunities investment sector particularly,renewable_energy,envisage world free poverty hungerdiseasewant life can thrive becomes critical,climate
THA_2015.L201,19,19,ensure universalhealthwell-being promote good governance rule law reduce disaster risks,climate_change,,climate
TJK_2015.L288,9,9,terror food energy financial economic crises degradation environment,climate_change,spreadinfectiousdiseases demand us concerted comprehensive response context united nations remains,climate
TUV_2015.L1118,19,19,assembly worldhealthorganization international civil aviation organization united nations framework convention,climate_change,,climate
VAT_2015.L1315,1,1,,climate_change,link shows threat climate_change responses can promising opportunity improvinghealthtransportation energy,climate
VAT_2015.L1315,5,5,climate_change link shows threat,climate_change,responses can promising opportunity improvinghealthtransportation energy security new opportunities employment,climate
AUS_2016.L965,18,18,conflict prevent globalhealthpandemics ensure universal access clean water sanitation address,climate_change,require,climate
BEL_2016.L719,19,19,access basichealth_careknow well still much sustainable development goals paris agreement,climate_change,,climate
BIH_2016.L44,12,12,reaches far beyond national boundaries capacities deal poverty hungerdiseasenatural disasters,climate_change,afflict millions fellow human beings many states,climate
BIH_2016.L1324,13,13,make lives millions people suffering marginalization discrimination povertymalnutritiondisease natural disasters,climate_change,must listen voices respond needs hopes,climate
BIH_2016.L1325,12,12,make lives millions people suffering marginalization discrimination poverty malnutritiondiseasenatural disasters,climate_change,must listen voices respond needs hopes aspirations,climate
BLZ_2016.L982,19,19,including worldhealthorganization international civil aviation organization united nations framework convention,climate_change,,climate
COM_2016.L329,15,15,perceive future can reduce poverty improvehealtheducation build sustainable habitat fight,climate_change,protect oceans forests however,climate
FSM_2016.L1119,9,9,federated states micronesia became member small island states,climate_change,oceanshealthhuman rights partnership featured prominently agenda climate_change forum reaffirmed position,climate
FSM_2016.L1119,16,16,small island states climate_change oceanshealthhuman rights partnership featured prominently agenda,climate_change,forum reaffirmed position,climate
ISR_2016.L796,11,11,condemning liberal democracy middle east far less time address wardiseasepoverty,climate_change,serious problems plague planet half-million slaughtered syrians helped,climate
KIR_2016.L282,18,18,killer non-communicable diseaseshealthoceans looming challenges uncertainties incremental real existential threats,climate_change,continue,climate
LSO_2016.L261,12,12,relevant appropriate time humankind tottering precipice resulting hunger povertydiseaseadverse consequences,climate_change,theme highlights collective desire united nations eradicate,climate
MCO_2016.L20,18,18,displacements afflicted hungerdiseasetorn apart grief-stricken violence also representatives world threatened,global_warming,made,climate
MLI_2016.L779,6,6,vital needs population including combating,climate_change,protecting environment providing educationhealth_caresocial protection jobs young people also empowering,climate
MWI_2016.L529,2,2,action,climate_change,let also put record malawi making exemplary progresshealthsector pioneering innovative,climate
TON_2016.L732,3,3,negative impacts,climate_change,underestimated impacts threaten territorial integrity land waterhealthinfrastructure food security biological,climate
TTO_2016.L162,1,1,,climate_change,insidious threats violence extremism terrorism crises forced displacement spreadinfectiousdiseases illnesses,climate
VCT_2016.L367,8,8,quality education poverty eradication strengthening institutions infrastructure,renewable_energy,climate resiliencehealthwell-being security citizens central national medium-term development plans year,climate
VUT_2016.L795,19,19,various problemspublic_healthpresence extreme climate events caused major harm infrastructure economy,climate_change,,climate
WSM_2016.L961,15,15,eradication raising living standards worldwide yethealthoceans increasingly compromised pressures overfishing,climate_change,ocean acidification habitat loss,climate
WSM_2016.L973,5,5,increasingly compromised pressures overfishing,climate_change,ocean acidification habitat loss pollutionhealthmarine ecosystems declines capacity provide food,climate
AUS_2017.L554,8,8,together challenges face respect national borders includes,climate_change,diseases includingmalariamanagement precious water resources modern slavery unpalatable truth forced,climate
CHE_2017.L43,12,12,still affects million people world every seconds child diesmalnutritionchallenges include,climate_change,global inequality conflict humanitarian disasters well forced,climate
COG_2017.L529,2,2,planet,global_warming,decent life also means allowing populations benefit high-qualityhealth_careproliferation counterfeit sub-standard,climate
GNQ_2017.L358,11,11,also great deal uncertainty fact despite commendable initiatives 1990s combatmalnutritionhunger,climate_change,others despite high-level plenary meeting general assembly millennium,climate
GTM_2017.L437,9,9,domestic legislation may carried achieve mitigation adaptation resilience,climate_change,regardnutritionfood security support world food programme put together final report,climate
MHL_2017.L1026,9,9,international civil aviation organization united nations framework convention,climate_change,worldhealthorganization security council resolution 2758 1971 misused justify people taiwan's,climate
NRU_2017.L820,16,16,including sustainable development goals worldhealthorganization unesco united nations framework convention,climate_change,united nations-related agencies,climate
PNG_2017.L132,9,9,nature facing serious adverse impacts uncertain global economy,climate_change,declininghealthmarine habitats heightened security fears challenges face unlikely overcome major,climate
RUS_2017.L1202,1,1,,climate_change,solutions global issues crucial developing countries food security demographicshealth_carefundamental principles,climate
TUV_2017.L693,15,15,threats conflict violence drugs weapons faminediseaseinstead male declaration human dimension,climate_change,recognized 2007 impacts climate_change,climate
TUV_2017.L693,19,19,weapons faminediseaseinstead male declaration human dimension climate_change recognized 2007 impacts,climate_change,,climate
TUV_2017.L742,14,14,food right highest attainable standard physical mentalhealthten years ago recognized,climate_change,single greatest major threat peace,climate
TUV_2017.L1104,12,12,access appropriate infrastructures maritime ports islands airports technology connectivityhealth_carequality education,renewable_energy,critical areas particular priority tuvalu welcome development,climate
VUT_2017.L852,1,1,,climate_change,country deeply concerned climate_change paris agreement committed reversing declinehealthoceans united,climate
VUT_2017.L852,5,5,climate_change country deeply concerned,climate_change,paris agreement committed reversing declinehealthoceans united nations ocean conference held,climate
ATG_2018.L675,12,12,humankind recognize today nations world interdependent effort stop spreaddiseasecurb effects,climate_change,make peoples safe terrorists organized crime share,climate
BEL_2018.L1002,14,14,better fairer world everything poverty eradication accesshealtheducation gender equality fight,global_warming,possible option general mobilization ownership,climate
CHE_2018.L54,9,9,inequality war internal conflict well extremism migration flows,climate_change,evenhealthcrises digital revolution shared responsibility responsibility every state member united,climate
CHE_2018.L447,19,19,projects areashealth_careeducation energy innovation nonetheless aware still work done combat,global_warming,,climate
CZE_2018.L60,11,11,global prosperity sustainable development including gender inequality youth unemployment globalhealththreats,climate_change,violent extremism terrorism forced displacement uncontrolled migration furthermore,climate
FJI_2018.L814,9,9,target c matters now action fiji press action,climate_change,oceanhealthevery forum part simply wait rest world come around effects,climate
KNA_2018.L210,18,18,ensuring access affordablehealth_careenhancing standard living citizens residents gains erased phenomenon,climate_change,damage,climate
KWT_2018.L1403,18,18,rights dignity educationhealthpolitical participation empower young people women address effects,climate_change,context,climate
LCA_2018.L863,19,19,institutions worldhealthorganization international civil aviation organization united nations framework convention,climate_change,,climate
MDG_2018.L156,5,5,global challenges yet mastered,climate_change,terrorism mention iniquitous severity povertydiseasewitnessing humanitarian crises caused conflicts affecting,climate
MHL_2018.L1076,15,15,agencies international civil aviation organization worldhealthorganization united nations framework convention,climate_change,people taiwan deserve equal,climate
MNG_2018.L1245,18,18,resolve issues pertaininghealth_caresocial insurance dual citizenship improve related legal environment,climate_change,yet,climate
MWI_2018.L578,14,14,also like report government endeavouring eliminate hungermalnutrition2030 given hostile consequences,climate_change,food insecurity malnutrition serious threats,climate
MWI_2018.L586,8,8,eliminate hunger malnutrition 2030 given hostile consequences,climate_change,food insecuritymalnutritionserious threats country still relies rain-fed subsistence agriculture believe,climate
NPL_2018.L830,5,5,qua non paris agreement,climate_change,must implemented entirety good faithhealthwell-being children young people investment future,climate
PLW_2018.L145,11,11,goals unique recognize interlinked reinforce one another palau's core prioritieshealthoceans,climate_change,rest development objectives genuine durable partnerships realized palau,climate
SLB_2018.L1343,9,9,nations specialized bodies including united nations framework convention,climate_change,worldhealthorganization international civil aviation organization taiwan twenty-second-largest economy world taiwan,climate
SLE_2018.L785,17,17,job creation increased investmentshealthwater delivery cities determined make sierra leone,renewable_energy,hub economic,climate
TTO_2018.L170,1,1,,climate_change,global_warming extreme poverty violent extremism gender-based violence spread newinfectiousdiseases one,climate
TTO_2018.L170,2,2,climate_change,global_warming,extreme poverty violent extremism gender-based violence spread newinfectiousdiseases one best,climate
TZA_2018.L423,3,3,extremism radicalism,climate_change,restrictive trade policies trafficking persons drug abusepandemicdiseases absolute abject poverty,climate
URY_2018.L251,1,1,,climate_change,making progress irrefutible responsibility protect environment members aware fighthealthpeople struggle,climate
VNM_2018.L182,15,15,women children promoting human rights improvinghealth_careculture education preserving environment responding,climate_change,today united nations truly,climate
AUS_2019.L1237,15,15,building capacities developing nations supporting essentialhealthprojects protecting oceans taking action,climate_change,achieving results like many,climate
CIV_2019.L213,15,15,development challenges issues remain persistence hungermalnutritionpoverty world increasingly worrisome impact,climate_change,migration crises socioeconomic effects,climate
GEO_2019.L93,6,6,global challenges confronting today's world,climate_change,biodiversity loss universal accessiblehealtheducation overcoming poverty unemployment inequalities sustainable development,climate
KEN_2019.L629,19,19,solutions oceanhealthwealth policy governance technology finance horn africa witnessing confluence,climate_change,,climate
LSO_2019.L193,9,9,seeking address pertinent issues facing world right now,climate_change,universalhealthcoverage sustainable development financing development experiences shared summits ideas exchanged,climate
MCO_2019.L161,5,5,attention aligning policies combating,climate_change,preserving air quality order safeguardhealthline commitments breathelife campaign coordinated world,climate
MHL_2019.L967,9,9,relevant specialized agencies mechanisms united nations framework convention,climate_change,worldhealthassembly international civil aviation organization world united nations truly serious,climate
MUS_2019.L478,5,5,flows among uneven exposure,climate_change,unequal way stand benefit technologyhealthoceans continues deteriorate alarming rate progress,climate
NER_2019.L1200,6,6,survival humankind niger aware emphasized,climate_change,resilience sectoral policies strategieshealthtransport agricultural pastoral production local regional land,climate
NLD_2019.L719,7,7,achievement sdgs world people feeling impact,climate_change,affecting livelihoods securityhealthliving environments future 2030 agenda sustainable development demands,climate
NPL_2019.L947,15,15,believe organic linkage oceans mountains concernedhealthoceans deteriorating alarmingly mainly due,climate_change,reckless human activities confident,climate
PLW_2019.L946,19,19,multilateralism worldhealthorganization international civil aviation organization united nations framework convention,climate_change,,climate
RWA_2019.L30,9,9,clear never well-defined road maps joint action development,climate_change,globalhealththerefore congratulate secretary-general team well president general assembly relevance week's,climate
SLB_2019.L1838,19,19,halted reversedncdepidemic undermine future countries view challenge urgent right now,climate_change,,climate
SLB_2019.L1839,18,18,halted reversed ncdepidemicundermine future countries view challenge urgent right now,climate_change,great,climate
SLE_2019.L1115,6,6,convening climate action summit september,extreme_weather,events increase risk hungerdiseaseforced migration conflict poverty science indisputable effects,climate
SMR_2019.L491,12,12,transformation achieved 2030 secretary-general's special-edition report also reveals hungermalnutritionfar resolved,greenhouse,gas emissions continuing increase biological diversity rapidly,climate
SWZ_2019.L651,17,17,tuberculosis malaria building strongerhealthsystems enable us achieve universal health coverage,climate_change,serious implications,climate
SWZ_2019.L657,11,11,tuberculosis malaria building stronger health systems enable us achieve universalhealthcoverage,climate_change,serious implications development prospects everywhere even african continent,climate
TGO_2019.L582,13,13,addition improving legal framework promote good governance accesshealtheducation well-being issue,climate_change,environmental protection major concern country entire,climate
TGO_2019.L602,8,8,entire international community's responsibility demonstrate closely issue,climate_change,linked foodhealthsecurity poverty reduction economic growth human development therefore believe,climate
THA_2019.L284,11,11,events thereby reflecting thailand's resolute commitment respective topics namely universalhealthcoverage,climate_change,sustainable development goals sdgs thailand causes just abstract,climate
TON_2019.L853,7,7,traditional threats armed conflict newer threats,climate_change,rising sea levelshealthepidemics ensure one left behind may almighty god,climate
TTO_2019.L113,1,1,,climate_change,continued exclusion vulnerable societies respect access education social protectionhealth_caremigration violent,climate
TUV_2019.L957,19,19,quality educationhealthinclusion important issues small low-lying island atoll country tuvalu,climate_change,,climate
VUT_2019.L416,15,15,energy effort part nationally determined contributionshealthoceans threatened irresponsible human activities,climate_change,particularly worrisome vanuatu part,climate
