docname,from,to,pre,keyword,post,pattern
SWE_1988.L732,1,1,,greenhouse,effect life-giving resources destroyed erosion desertification devastation forests people'shealthincreasingly affected,climate
JPN_1989.L2207,13,13,explore oceans- depths ominous acceleration pace environmental destructionhealthplanet gravely threatened,global_warming,destruction ozone layer depletion tropical rain,climate
LBY_1989.L2158,15,15,indicators crisis around us addition seriousair_pollutiondesertification soil erosion depletion forests,greenhouse,effect unusual climatic changes,climate
BTN_1991.L1119,1,1,,greenhouse,effect depletion ozone layer include climatic changes increase certainhealthproblems air,climate
ATG_1993.L554,17,17,agriculture living animals humanhealthwell-being borne mind contribution small island states,climate_change,global_warming sea-level,climate
ATG_1993.L554,18,18,living animals humanhealthwell-being borne mind contribution small island states climate_change,global_warming,sea-level,climate
BHS_1995.L173,14,14,save seemingly inevitable lot chronic poverty ignorancediseasethreat nuclear annihilation consequences,global_warming,good enough save generations life,climate
JPN_1995.L141,19,19,even basichealth_careneedless say remain increasingly grave problems environmental degradation including,global_warming,,climate
LUX_1995.L970,17,17,borders thinking inter aliahealthproblems aids environmental problems depletion ozone layer,global_warming,also social,climate
GBR_1996.L824,5,5,growing problems planet survival,climate_change,environment future world's oceans forestspandemicdiseases development ignores sustainable united nations,climate
SLB_1996.L662,5,5,self-reliance village development solar,renewable_energy,resources water wind economic educationhealthdevelopment plans several weeks ago internet,climate
TTO_1998.L1176,11,11,served united nations agencies approval grants projects broad categories children'shealthenvironment,climate_change,women population food security drug control poverty alleviation,climate
MHL_1999.L298,9,9,however extreme events observed recent years indications expected,climate_change,climate_changediseaseobserving symptoms pacific experienced number severe weather events changes normal,climate
KGZ_2000.L815,7,7,environmental issues united nations framework convention,climate_change,convention long-range transboundaryair_pollutionrotterdam convention prior informed consent procedure certain hazardous,climate
PLW_2000.L77,13,13,impose world peoples problems ranging hunger poverty tuberculosismalariaspread hiv aids,global_warming,environmental degradation vulnerability just responsibilities countries,climate
PNG_2001.L969,4,4,dealing effects disasters,global_warming,also brought increased numbers cases diseasesmalariahigher-altitude populous region country threat,climate
PNG_2001.L977,19,19,increased incidencemalariaregion real negatively affect demographics country definitely link among,climate_change,,climate
PNG_2001.L993,5,5,country definitely link among,climate_change,natural disaster spread increased incidencediseasepapua new guinea exempt hiv aids,climate
KHM_2002.L750,13,13,reduced threat terrorism totally eliminated menace hiv aidspandemiccurbed poverty alleviated,global_warming,kept check possible building better cooperation,climate
PNG_2002.L890,4,4,radioactive material region,global_warming,brought increase number cases diseases likemalariahigher- altitude regions country still,climate
PNG_2003.L720,8,8,challenges poverty eradication hunger illiteracy environmental degradation,climate_change,hiv aidsmalariapreventable diseases also committed addressing issues good governance desire,climate
KIR_2004.L102,4,4,environmental degradation threat,global_warming,sea-level rise hunger poverty hiv aidspandemicnon- communicable diseases marginalization least,climate
BRA_2005.L733,16,16,faced two crises global scopepandemicexplosion hiv aids serious threats posed,climate_change,brazil continue promote,climate
AUS_2006.L488,18,18,confronting ravages povertydiseasecan sign high- minded manifestos protect environment risk,climate_change,alongside,climate
MUS_2006.L849,8,8,one biggest threats humankind particular concern impact,global_warming,certain vectorsdiseaseleading proliferation estimated africa example may witness many millions,climate
MUS_2006.L860,13,13,estimated africa example may witness many millions casesmalariamosquito-borne diseases result,climate_change,mauritius fully committed successful conclusion doha,climate
NZL_2006.L315,1,1,,climate_change,reality political instability help threats communicable diseases hiv aidspandemicinfluenza must,climate
VCT_2006.L302,1,1,,climate_change,empowerment women protection children promotion peace security hiv aidspandemicprovision clean,climate
AND_2007.L352,11,11,accurate assertion really threatened vulnerable persons countries ones suffer warillnessunderdevelopment,climate_change,affect us us equally time trafficking abuse children,climate
ATG_2007.L590,13,13,employment generation provision free low-cost social services areashealtheducation among others,climate_change,global problem requiring collective response respond,climate
BWA_2007.L121,11,11,peoples earth human cultural resources technology end severe global povertydiseasereverse,climate_change,prevent wars alleviate human suffering unfortunately substantial resources,climate
CHE_2007.L451,17,17,living conditions risks securityhealthdevelopment discussed fourth assessment report intergovernmental panel,climate_change,today environmental,climate
ISL_2007.L325,11,11,participation levels fundamental issue new millennium whether relation peace securityhealthpoverty,climate_change,empowerment women key success women men need equally,climate
JAM_2007.L822,17,17,necessary funding curtail spreaddiseaseowing assigned middle-income status implementing global response,climate_change,must remain,climate
JOR_2007.L729,5,5,challenges human rights armaments,climate_change,terrorism international crime poverty hungerinfectiousdiseases increasing factional sectarian ethnic conflicts,climate
PRT_2007.L186,12,12,eradicating poverty building true partnership development promoting education decenthealthstandards combating,climate_change,context must mention one stated objectives european,climate
SRB_2007.L774,13,13,security terrorism bellicose extremism mass poverty organized crimepandemicdiseases harmful consequences,climate_change,global_warming surely major problem age rightly,climate
SRB_2007.L774,14,14,terrorism bellicose extremism mass poverty organized crimepandemicdiseases harmful consequences climate_change,global_warming,surely major problem age rightly,climate
TZA_2007.L105,1,1,,climate_change,four days ago meeting gave us opportunity discuss statehealthcommon planet,climate
UGA_2007.L167,8,8,well agriculture overwhelmingly subsistence rain-fed therefore vulnerable,climate_variability,change vulnerabilityhealthsector also evident frequent floods result outbreaks waterborne diseases,climate
UGA_2007.L182,11,11,floods result outbreaks waterborne diseases cholera typhoid dysentery increased incidencemalariaindeed,climate_change,today constitutes danger human security considering effects climate_change,climate
UGA_2007.L182,19,19,increased incidencemalariaindeed climate_change today constitutes danger human security considering effects,climate_change,,climate
WSM_2007.L396,19,19,wild spreadepidemicdiseases mapped discussed debated negotiated cases agreed life organization,climate_change,,climate
ZMB_2007.L166,4,4,conflict human trafficking,climate_change,terrorism violations human rights hiv aidspandemicgender inequality challenges recently emerged,climate
ZMB_2007.L632,13,13,per cent zambia's development efforts compromised hiv aidspandemicnow adverse effects,climate_change,regard hiv aids pandemic government declared,climate
ZMB_2007.L640,7,7,hiv aids pandemic now adverse effects,climate_change,regard hiv aidspandemicgovernment declared national crisis requiring sustained mitigation preventive,climate
BWA_2008.L430,13,13,effectively swiftly complex challenges twenty-first century conflicts povertydiseasenatural man-made disasters,climate_change,energy terrorism among myriad pressing problems,climate
ECU_2008.L277,11,11,development programmes especially fundamentally important programmes fight poverty hiv aidsmalariaeffects,climate_change,citizens beginning call us account regard resources contribute,climate
GNQ_2008.L242,6,6,injustice poverty energy food crises,climate_change,inequality poor access educationhealth_carenew technologies needed poor countries develop thus,climate
GUY_2008.L420,16,16,improved access food maintenance basicnutritionrecent times assembly deeply concerned consequences,climate_change,rightly future generations,climate
LCA_2008.L591,7,7,global prices issues surrounding energy use,climate_change,implications region's foodnutritionsecurity among issues arising deliberations emphasized need governments,climate
LVA_2008.L425,12,12,2015 clearer picture must achieve interim main clusters mdgshealtheducation growth,climate_change,united nations needs immediately also need clearer,climate
MDG_2008.L381,14,14,need environmental management sustainable development resistance cropsdiseaseclimate_change given impact global,climate_change,maintaining healthy biodiversity critical sustaining,climate
NGA_2008.L523,4,4,avert looming disaster,climate_change,continent already vulnerable tenth need breakthroughmalariavaccine together greater sustained support,climate
NZL_2008.L212,14,14,governance achieving broader-based growth sustainable livelihoods improvinghealtheducation reducing vulnerabilities including,climate_change,challenging times look united nations,climate
SUR_2008.L103,1,1,,climate_change,recently global food energy crises infringement people's rights foodhealtheducation security,climate
SWZ_2008.L58,7,7,face many challenges include catastrophic effects,climate_change,complicated diseases tuberculosismalariahiv aids epidemic food shortages situation compounded high,climate
SWZ_2008.L61,4,4,include catastrophic effects,climate_change,complicated diseases tuberculosis malaria hiv aidsepidemicfood shortages situation compounded high,climate
TUR_2008.L98,13,13,millennium development goals however common fight poverty illiteracyepidemicdiseases child mortality,climate_change,still far contrary volatile fuel prices,climate
ZMB_2008.L814,1,1,,extreme_weather,conditions threatening water agricultural systems thereby condemning millions facemalnutritionwater shortages,climate
CHN_2009.L75,5,5,imbalances acute global issues,climate_change,food security energy resource securitypublic_healthsecurity thrown sharp relief non-traditional security,climate
CHN_2009.L481,5,5,mutual benefit common progress,climate_change,food security energy resource securitypublic_healthsecurity global challenges country immune way,climate
CMR_2009.L540,2,2,emissions,global_warming,salient feature affects many socio-economic sectors including energyhealthagriculture livestock production,climate
COG_2009.L158,12,12,still live less dollar day children die unnecessarily hungerdiseaseus know,climate_change,abetting scourges countries least responsible suffer effects,climate
FJI_2009.L87,12,12,victims contemporary global crises financial economic crisis 2009 h1n1pandemicdramatic phenomenon,climate_change,small economies like global events real effect,climate
FSM_2009.L854,12,12,disagreed coming together survival crisis time war economic hardshipepidemictoday crisis,climate_change,simply time waste therefore stop talk cheap,climate
MDA_2009.L71,11,11,year current financial economic crisis food energy crises first flupandemiccentury,climate_change,core deliberations united nations revealing central role organization,climate
MNE_2009.L69,9,9,world economic financial crisis related food energy crises,climate_change,flupandemiceconomic social growth development politics global relations including achievement millennium,climate
NPL_2009.L1017,19,19,effects agriculturehealthlivelihoods infrastructure affected nepal recently hosted high-level regional conference,climate_change,,climate
PNG_2009.L960,6,6,new guinea today see evidence,climate_change,inundation coastal areas increasemalariadue warming highlands region country especially plight,climate
POL_2009.L146,5,5,conflicts many recent problem,climate_change,problem poverty new add problemhealthaids epidemics however problem current crisis,climate
ROU_2009.L548,7,7,second staying focused demanding interconnected issues,climate_change,poverty food securityhealthenergy migration lack democracy parts world maintaining international,climate
SLB_2009.L295,1,1,,greenhouse,gas emissions solomon islands agrees one mitigating solutions protectinghealthenvironment urge,climate
STP_2009.L412,19,19,goals areashealtheducation almost although yet completely satisfied biggest debates related,global_warming,,climate
STP_2009.L604,19,19,observer worldhealthorganization hope united nations agencies united nations framework convention,climate_change,,climate
SVN_2009.L239,7,7,challenges time consistent manner food crisis,climate_change,energy crisis spreadinginfectiousdiseases problems may different roots produce single communicative,climate
THA_2009.L48,19,19,attack povertydiseasehunger still affect many supply traditional sources energy dwindling,climate_change,,climate
TUV_2009.L580,8,8,vulnerable global economic shocks highly vulnerable impacts,climate_change,least vulnerablediseaseoutbreaks however despite wide recognition given reiterated regard vulnerability,climate
VCT_2009.L845,19,19,universality globalhealthchallenges logically compelled participation world health assembly global reach,climate_change,,climate
VCT_2009.L851,13,13,universality global health challenges logically compelled participation worldhealthassembly global reach,climate_change,merit 09-53165 meaningful participation united nations,climate
AND_2010.L171,1,1,,climate_change,can phenomenon jeopardizes poorest populations affects access water compoundsmalnutritionleads violence,climate
CAN_2010.L719,9,9,boat solo voyagers travel together matters interests interconnected,climate_change,healthpandemicthreats course economy example nations consider effects economic choices others,climate
CHL_2010.L670,8,8,know frontiers territories jurisdictions attempts effectively tackle,global_warming,natural disastershealthemergencies hunger extreme poverty going require action much attentive,climate
COG_2010.L18,15,15,conflicts inequality among states poverty hungerdiseaserecurrent problems added new challenges,climate_change,natural disasters terrorism piracy,climate
CPV_2010.L216,4,4,water conveyance development,renewable_energy,part national growth dynamics alongside educationhealthemployment infrastructure process implementing ambitious,climate
CYP_2010.L55,4,4,china environmental degradation,climate_change,rising poverty food insecurity lack basichealth_caremany fellow human beings world,climate
CYP_2010.L926,9,9,peace security region challenges faced international community increasing,climate_change,povertymalnutritionlack access basic health_care terrorism wars threat nuclear proliferation nuclear,climate
CYP_2010.L930,5,5,faced international community increasing,climate_change,poverty malnutrition lack access basichealth_careterrorism wars threat nuclear proliferation nuclear,climate
GHA_2010.L273,9,9,development challenge africa countries region also grappling problems,climate_change,highdiseaseburden poor infrastructure brain drain lack development productive capacity last,climate
KEN_2010.L224,19,19,maternal childmortalityfight hiv aids malaria promoting gender equality empowerment women,climate_change,,climate
KEN_2010.L228,15,15,maternal child mortality fight hiv aidsmalariapromoting gender equality empowerment women,climate_change,continues hamper development aspirations,climate
LCA_2010.L1424,11,11,taiwan make contribution world collaboration membership effective participation air transporthealthbodies,climate_change,discussions including international civil aviation organization world health,climate
LCA_2010.L1434,3,3,health bodies,climate_change,discussions including international civil aviation organization worldhealthorganization united nations framework,climate
LCA_2010.L1434,15,15,including international civil aviation organization worldhealthorganization united nations framework convention,climate_change,organizations universal nature contribution,climate
MMR_2010.L515,13,13,nations step efforts deal prevention control preparedness responsepandemicdiseases region issue,climate_change,become pressing global challenge threatens humankind,climate
MWI_2010.L521,2,2,effects,climate_change,fragile peace security terrorism piracy maternal infant childmortalityslow reform united,climate
MWI_2010.L521,17,17,piracy maternal infant childmortalityslow reform united nations african leaders recognize,climate_change,environmental degradation,climate
ROU_2010.L79,6,6,face mounting threats often interrelated,climate_change,exacerbates food energy insecurityhealthpopulation issues increase migration poverty puts pressure,climate
SLB_2010.L935,3,3,concern world,climate_change,aviation issues need participation countries aviation safetyhealthatmosphere delegation finds regrettable,climate
SMR_2010.L335,3,3,direct way,climate_change,biodiversity economic financial employment crises food securitypublic_healthdisarmament proliferation weapons fight,climate
SWE_2010.L1246,8,8,interconnected today unprecedented way globalized world problems,climate_change,natural disastersdiseasedrugs terrorism conflicts take new proportions time alleviation poverty,climate
TTO_2010.L626,11,11,nations put place common set principles tackle important concern globalpublic_healthissue,climate_change,say trinidad tobago small island developing state seeks,climate
VCT_2010.L1065,19,19,universality globalhealthchallenges logically compelled participation world health assembly global reach,climate_change,,climate
VCT_2010.L1071,13,13,universality global health challenges logically compelled participation worldhealthassembly global reach,climate_change,merit meaningful participation taiwan united nations,climate
BHR_2011.L623,9,9,work organization convinced imperative member states cooperate issues,climate_change,internationalhealthdrought poverty alleviation disarmament non-proliferation nuclear weapons fight terrorism urgent,climate
BLZ_2011.L206,17,17,remains less global threatmortalitynon-communicable diseases now rivals mortality communicable diseases,greenhouse,gas emissions,climate
BLZ_2011.L211,12,12,remains less global threat mortality non-communicable diseases now rivalsmortalitycommunicable diseases,greenhouse,gas emissions continue fuel global_warming perilous rate,climate
BLZ_2011.L211,17,17,non-communicable diseases now rivalsmortalitycommunicable diseases greenhouse gas emissions continue fuel,global_warming,perilous rate,climate
CHL_2011.L192,6,6,territories jurisdictions attempt deal effectively,global_warming,environmental protection natural disastershealthemergencies hunger extreme poverty certainly require greater,climate
ISL_2011.L181,9,9,country expertise offer can help fuel green revolution,renewable_energy,marinehealthsustainable use land least gender equality always core icelandic foreign,climate
ISL_2011.L285,12,12,energy one largest fishing nations iceland always deeply protectivehealthoceans today,climate_change,threatens place fisheries world new strain speak,climate
MHL_2011.L816,7,7,11-51398 stability asia-pacific region including regard,climate_change,2009 invitation worldhealthorganization taiwan participate observer benefited global medical progress,climate
MRT_2011.L127,6,6,millennium development goals mdgs combating,climate_change,mitigating threats famine endemicdiseasewell challenges hinder well-being humanity sixty-sixth session,climate
NIC_2011.L610,15,15,avoid similar accidents gravely endanger people'shealthharm environment 11-51398 upcoming durban,climate_change,conference rio conference sustainable,climate
PLW_2011.L1075,12,12,nations system believe united nations fully properly address issueshealthaviation safety,climate_change,unless taiwan allowed participate activities world health,climate
PLW_2011.L1085,4,4,health aviation safety,climate_change,unless taiwan allowed participate activities worldhealthorganization international civil aviation organization,climate
PLW_2011.L1085,19,19,activities worldhealthorganization international civil aviation organization united nations framework convention,climate_change,,climate
PNG_2011.L180,13,13,beginning january 2012 target areas governance social justicehealtheducation gender environment,climate_change,disaster management new country programme part,climate
SMR_2011.L626,2,2,threats,climate_change,biodiversity loss economic financial employment crises food securitypublic_healthdisarmament non-proliferation weapons,climate
TUV_2011.L371,9,9,developed country tuvalu vulnerable global economic shocks impacts,climate_change,outbreaksdiseaseincluding non-communicable diseases tuvalu continues call appeal united nations take,climate
USA_2011.L1968,17,17,emergencies place 2012 commitmenthealthpeople demands preserve planet must put action,climate_change,demands tap,climate
BGD_2012.L727,16,16,education established community clinics ensurenutritionhealth_care rural people especially mothers children,climate_change,trust fund set,climate
BGD_2012.L728,15,15,education established community clinics ensure nutritionhealth_carerural people especially mothers children,climate_change,trust fund set implement,climate
BGD_2012.L796,14,14,coherence sustainable development goals prioritize poverty hungernutritionglobal food energy security,climate_change,global partnership sustainable development hope,climate
BWA_2012.L274,7,7,seriously compromised threats nuclear proliferation terrorism,climate_change,environmental degradation underdevelopmentpandemicdiseases coupled effects global economic financial crisis internal,climate
CPV_2012.L1007,8,8,stability combat poverty re-establish peace respond effects,climate_change,improve globalhealthfight terrorism ensure disarmament non-proliferation closing ceremony united nations,climate
FSM_2012.L518,15,15,strengthening policy formulation recognize contributing effectsnutritionlifestyle epidemic also mindful fact,climate_change,magnified challenge result threat,climate
FSM_2012.L520,13,13,strengthening policy formulation recognize contributing effects nutrition lifestyleepidemicalso mindful fact,climate_change,magnified challenge result threat poses food,climate
GMB_2012.L287,2,2,issues,climate_change,economic crises financial turmoil food insecurity conflicts fightingdiseasepoverty special interests,climate
KNA_2012.L1421,5,5,united nations framework convention,climate_change,international civil aviation organization worldhealthassembly forums long demonstrated outstanding credentials,climate
KOR_2012.L41,9,9,throughout human history although new global challenges mankind,climate_change,povertydiseaseunderdevelopment terrorism proliferation weapons mass destruction now testing international community,climate
MLI_2012.L772,14,14,programmes achievement millennium development goals particular areashealtheducation food security environment,climate_change,one major challenges facing world,climate
SMR_2012.L1448,19,19,basic serviceshealth_careeducation besides facing global challenges economic crisis problems connected,climate_change,,climate
TTO_2012.L621,1,1,,climate_variability,sea-level rise every moment delay takes us closer demisehealthwell-being people,climate
BRB_2013.L515,3,3,sustainable accessible,renewable_energy,technologies pursuit sustainable agriculture agenda tandem foodnutritionsecurity gender equality women's,climate
BWA_2013.L140,17,17,doubt challenges extreme povertydiseaselack access affordable energy potable water sanitation,climate_change,gender inequality,climate
BWA_2013.L342,7,7,shortages land degradation desertification persistent drought,climate_change,also adverse impactshealthfood security gratifying progress continues made many countries,climate
CPV_2013.L350,9,9,joint effort cape verdeans deeply focused global issues,climate_change,hungermalnutritionvarious forms inequality well importance ensuring environmental sustainability national international,climate
IRL_2013.L779,1,1,,climate_change,strong focus climate-sensitive agriculture aid programme government prioritized hungermalnutritiontheme resonates,climate
MNG_2013.L105,16,16,every year fraction sum spenthealth_careeducation state affairs tolerated comes climate,temperature,increase two degrees,climate
NER_2013.L666,3,3,subject effects,climate_change,desertification recurring droughts well resulting food shortagesmalnutritionneeds significant investment part,climate
SLB_2013.L1422,1,1,,climate_change,requests mirror observer status republic china currently enjoys worldhealthassembly solomon,climate
TTO_2013.L314,16,16,poverty global scale ensure foodnutritionenergy security reverse environmental degradation deal,climate_change,current approaches advance,climate
ATG_2014.L1319,1,1,,climate_change,rising sea levels persistent unemployment armed conflicts ebola virusepidemiccalled global,climate
BHR_2014.L122,6,6,number challenges facing us including,climate_change,spread diseases particularly ebolaepidemicwest africa aggravated refugee problem propagation extremism,climate
BRN_2014.L394,6,6,challenges global nature ranging impact,climate_change,extremism terrorism serious repercussionspandemicdiseases brunei darussalam stands united international community,climate
CHN_2014.L1042,18,18,hunger improving educationhealthwomen children also facing new challenges form environment,climate_change,energy,climate
