docname,from,to,pre,keyword,post,pattern
Iceland-SEP-2019-SEP-HealthCareEquipment&Ser...-SEP-%C3%96ssur_CSR_Report18_final.pdf?1551370092,1925,1925,business travel freight large contributors,greenhouse,gas emissions international company ˇˆ,climate
Iceland-SEP-2019-SEP-HealthCareEquipment&Ser...-SEP-%C3%96ssur_CSR_Report18_final.pdf?1551370092,2334,2334,consumption ˇ ˇ ˆ ˆ,renewable_energy,consumption gj ˇˇnon-renewable energy consumption,climate
Iceland-SEP-2019-SEP-HealthCareEquipment&Ser...-SEP-%C3%96ssur_CSR_Report18_final.pdf?1551370092,2402,2402,ˆˇˇˇ ˇ ˇ ˆ ˇ,renewable_energy,non-renewable energyˆ ˆ ˇe water,climate
Japan-SEP-2011-SEP-HealthCareEquipment&Ser...-SEP-sysmex_sustainability_report11.pdf?1324270204,148,148,commitment toward global environmentenvironmental management,global_warming,countermeasures environmental impact business activitiescorporate,climate
Japan-SEP-2011-SEP-HealthCareEquipment&Ser...-SEP-sysmex_sustainability_report11.pdf?1324270204,5561,5561,consumption diagnostics conventional models reduce,greenhouse,gas emissions businessreduce domestic carbon_dioxide,climate
Japan-SEP-2011-SEP-HealthCareEquipment&Ser...-SEP-sysmex_sustainability_report11.pdf?1324270204,5566,5566,greenhouse gas emissions businessreduce domestic,carbon_dioxide,emissions forset target reducing global,climate
Japan-SEP-2011-SEP-HealthCareEquipment&Ser...-SEP-sysmex_sustainability_report11.pdf?1324270204,5575,5575,reducing global carbon dioxideemissions logisticsreduce,carbon_dioxide,emissions per unit domestic sales,climate
Japan-SEP-2011-SEP-HealthCareEquipment&Ser...-SEP-sysmex_sustainability_report11.pdf?1324270204,6037,6037,co emissions logisticsin order reduce,greenhouse,gas emissions business offices sysmex,climate
Japan-SEP-2011-SEP-HealthCareEquipment&Ser...-SEP-sysmex_sustainability_report11.pdf?1324270204,6076,6076,indicate total electricity required factory.reducing,greenhouse,gas emissions atglobal warming countermeasuresamount,climate
Japan-SEP-2012-SEP-HealthCareEquipment&Ser...-SEP-Sustainability_Report12.pdf?1354669045,4486,4486,consumption comparison conventional models reduce,greenhouse,gas emissions business reduce domestic,climate
Japan-SEP-2012-SEP-HealthCareEquipment&Ser...-SEP-Sustainability_Report12.pdf?1354669045,4492,4492,gas emissions business reduce domestic,carbon_dioxide,emissions set target reducing global,climate
Japan-SEP-2012-SEP-HealthCareEquipment&Ser...-SEP-Sustainability_Report12.pdf?1354669045,4498,4498,emissions set target reducing global,carbon_dioxide,emissions logistics promoted developments reduce,climate
Japan-SEP-2012-SEP-HealthCareEquipment&Ser...-SEP-Sustainability_Report12.pdf?1354669045,4545,4545,providers using suppliers generate power,renewable_energy,sysmex europe commenced modal shift,climate
Japan-SEP-2012-SEP-HealthCareEquipment&Ser...-SEP-Sustainability_Report12.pdf?1354669045,4562,4562,air transportation previously high reduce,carbon_dioxide,emissions per unit domestic sales,climate
Japan-SEP-2012-SEP-HealthCareEquipment&Ser...-SEP-Sustainability_Report12.pdf?1354669045,4741,4741,japantransportation overseast-co t-co t-co t-co,greenhouse,gas emissions fiscal year fiscal,climate
Japan-SEP-2012-SEP-HealthCareEquipment&Ser...-SEP-Sustainability_Report12.pdf?1354669045,4813,4813,various measures factories introduced thorough,temperature,sheets assiduously reduced unnecessary lighting,climate
Japan-SEP-2012-SEP-HealthCareEquipment&Ser...-SEP-Sustainability_Report12.pdf?1354669045,4826,4826,measures designed according site characteristics.reducing,co2_emissions,domestic company carsto reduce cojapan,climate
Japan-SEP-2012-SEP-HealthCareEquipment&Ser...-SEP-Sustainability_Report12.pdf?1354669045,5490,5490,substantially silkworms can cultivated room,temperature,simply using shelves breeding containers,climate
Japan-SEP-2013-SEP-HealthCareEquipment&Ser...-SEP-sys_csr2013_e_all.pdf?1386045528,5011,5011,placement occupancy sensors toilets measures,global_warming,business office reduced number production,climate
Japan-SEP-2013-SEP-HealthCareEquipment&Ser...-SEP-sys_csr2013_e_all.pdf?1386045528,5070,5070,offices higher business offices reduce,carbon_dioxide,emissions freight ton-km japan domestic,climate
Japan-SEP-2013-SEP-HealthCareEquipment&Ser...-SEP-sys_csr2013_e_all.pdf?1386045528,5079,5079,japan domestic inter-regional transportation reduce,greenhouse,gas emissions per unit consolidated,climate
Japan-SEP-2013-SEP-HealthCareEquipment&Ser...-SEP-sys_csr2013_e_all.pdf?1386045528,5138,5138,reagent factories nine sites reduce,carbon_dioxide,emissions freight ton-km japan domestic,climate
Japan-SEP-2013-SEP-HealthCareEquipment&Ser...-SEP-sys_csr2013_e_all.pdf?1386045528,5147,5147,japan domestic inter-regional transportation reduce,greenhouse,gas emissions per unit consolidated,climate
Japan-SEP-2013-SEP-HealthCareEquipment&Ser...-SEP-sys_csr2013_e_all.pdf?1386045528,5243,5243,tanks control environmental factors sterility,temperature,oxygen concentrations using cells mammals,climate
Japan-SEP-2013-SEP-HealthCareEquipment&Ser...-SEP-sys_csr2013_e_all.pdf?1386045528,5260,5260,substantially silkworms can cultivated room,temperature,simply using shelves bree ding,climate
Japan-SEP-2013-SEP-HealthCareEquipment&Ser...-SEP-sys_csr2013_e_all.pdf?1386045528,5412,5412,logistics co emissions eco-friendly servicereducing,greenhouse,gas emissions promoting various measures,climate
Japan-SEP-2013-SEP-HealthCareEquipment&Ser...-SEP-sys_csr2013_e_all.pdf?1386045528,5423,5423,site order introduced thorough building,temperature,controls insulated applied reﬂective coatings,climate
Japan-SEP-2013-SEP-HealthCareEquipment&Ser...-SEP-sys_csr2013_e_all.pdf?1386045528,5549,5549,cases caused resulted year-on-year reduction,greenhouse,gas emissions t-co ton-kilometers t-co,climate
Japan-SEP-2013-SEP-HealthCareEquipment&Ser...-SEP-sys_csr2013_e_all.pdf?1386045528,5953,5953,photovoltaic systems installed factories entering,renewable_energy,power supply agreements power companies,climate
Japan-SEP-2013-SEP-HealthCareEquipment&Ser...-SEP-sys_csr2013_e_all.pdf?1386045528,6120,6120,t usedisposaltransportation productiondesignsysmex's businessactivitiescoco volume,greenhouse,gases emitted employ emissions factors,climate
Japan-SEP-2014-SEP-HealthCareEquipment&Ser...-SEP-sys_csr2014_e_all.pdf?1417565049,2767,2767,rights employees supply chain well,climate_change,cultivate internal awareness overseas anti-bribery,climate
Japan-SEP-2014-SEP-HealthCareEquipment&Ser...-SEP-sys_csr2014_e_all.pdf?1417565049,4226,4226,participants actually experience reduction scalp,temperature,dignilife team employees also took,climate
Japan-SEP-2014-SEP-HealthCareEquipment&Ser...-SEP-sys_csr2014_e_all.pdf?1417565049,7714,7714,backup system keeping reagent specified,temperature,reducing risk becoming unable ship,climate
Japan-SEP-2014-SEP-HealthCareEquipment&Ser...-SEP-sys_csr2014_e_all.pdf?1417565049,12531,12531,expansion remote service asian regions,co2_emissions,reduction improved service efficiency reduce,climate
Japan-SEP-2014-SEP-HealthCareEquipment&Ser...-SEP-sys_csr2014_e_all.pdf?1417565049,12537,12537,reduction improved service efficiency reduce,carbon_dioxide,emissions logistics per unit freight,climate
Japan-SEP-2014-SEP-HealthCareEquipment&Ser...-SEP-sys_csr2014_e_all.pdf?1417565049,12549,12549,japan domestic inter-regional transportation 1reduce,carbon_dioxide,emissions logistics per unit freight,climate
Japan-SEP-2014-SEP-HealthCareEquipment&Ser...-SEP-sys_csr2014_e_all.pdf?1417565049,12577,12577,base year environment consciousness businessofficesreduce,greenhouse,gas emissions business offices per,climate
Japan-SEP-2014-SEP-HealthCareEquipment&Ser...-SEP-sys_csr2014_e_all.pdf?1417565049,12587,12587,per unit consolidated sales 2reduce,greenhouse,gas emissions business offices per,climate
Japan-SEP-2014-SEP-HealthCareEquipment&Ser...-SEP-sys_csr2014_e_all.pdf?1417565049,12615,12615,detectors activate staircase lighting measures,global_warming,business office purchased electricity power,climate
Japan-SEP-2014-SEP-HealthCareEquipment&Ser...-SEP-sys_csr2014_e_all.pdf?1417565049,12828,12828,tanks control environmental factors sterility,temperature,oxygen concentrations using cells mammals,climate
Japan-SEP-2014-SEP-HealthCareEquipment&Ser...-SEP-sys_csr2014_e_all.pdf?1417565049,12845,12845,substantially silkworms can cultivated room,temperature,simply using shelves breeding containers,climate
Japan-SEP-2014-SEP-HealthCareEquipment&Ser...-SEP-sys_csr2014_e_all.pdf?1417565049,13050,13050,logistics also promoting efforts reduce,co2_emissions,generated logistics processes shifting air,climate
Japan-SEP-2014-SEP-HealthCareEquipment&Ser...-SEP-sys_csr2014_e_all.pdf?1417565049,13086,13086,reduce need rush shipments fiscal,co2_emissions,increased approximately year year converted,climate
Japan-SEP-2014-SEP-HealthCareEquipment&Ser...-SEP-sys_csr2014_e_all.pdf?1417565049,13163,13163,various measures site order reduce,greenhouse,gas emissions business offices business,climate
Japan-SEP-2014-SEP-HealthCareEquipment&Ser...-SEP-sys_csr2014_e_all.pdf?1417565049,13210,13210,business sites result initiatives fiscal,greenhouse,gas emissions unit per consolidated,climate
Japan-SEP-2014-SEP-HealthCareEquipment&Ser...-SEP-sys_csr2014_e_all.pdf?1417565049,13230,13230,environment consciousne ss business officesreducing,greenhouse,gas emis sions business offices,climate
Japan-SEP-2014-SEP-HealthCareEquipment&Ser...-SEP-sys_csr2014_e_all.pdf?1417565049,13236,13236,gas emis sions business offices,greenhouse,gas emissions business officesnotes scope,climate
Japan-SEP-2014-SEP-HealthCareEquipment&Ser...-SEP-sys_csr2014_e_all.pdf?1417565049,13487,13487,e fuel-efficient cars hybrid cars,co2_emissions,company cars increased approximately previous,climate
Japan-SEP-2014-SEP-HealthCareEquipment&Ser...-SEP-sys_csr2014_e_all.pdf?1417565049,15455,15455,risks opportunities organization's activities due,climate_change,f·ec3corecoverage organization's defined benefit plan,climate
Japan-SEP-2014-SEP-HealthCareEquipment&Ser...-SEP-sys_csr2014_e_all.pdf?1417565049,15601,15601,business activities en6addinitiatives provide energy-efficient,renewable_energy,based products services reductions energy,climate
Japan-SEP-2014-SEP-HealthCareEquipment&Ser...-SEP-sys_csr2014_e_all.pdf?1417565049,15729,15729,effluents waste en16coretotal direct indirect,greenhouse,gas emissions weight p71 environmental,climate
Japan-SEP-2014-SEP-HealthCareEquipment&Ser...-SEP-sys_csr2014_e_all.pdf?1417565049,15744,15744,business activities en17coreother relevant indirect,greenhouse,gas emissions weight p68 environmental,climate
Japan-SEP-2014-SEP-HealthCareEquipment&Ser...-SEP-sys_csr2014_e_all.pdf?1417565049,15758,15758,consciousness business offices en18addinitiatives reduce,greenhouse,gas emissions reductions achieved p68,climate
Japan-SEP-2014-SEP-HealthCareEquipment&Ser...-SEP-Terumo_Annual_Report14_EN_141009.pdf?1412850116,8788,8788,hr joint line glucose body,temperature,blood pressure monitors equipped data,climate
Japan-SEP-2014-SEP-HealthCareEquipment&Ser...-SEP-Terumo_Annual_Report14_EN_141009.pdf?1412850116,9517,9517,hr joint line glucose body,temperature,blood pressure monitors equipped data,climate
Japan-SEP-2014-SEP-HealthCareEquipment&Ser...-SEP-Terumo_Annual_Report14_EN_141009.pdf?1412850116,14411,14411,environmentally-friendly safety products initiatives deal,climate_change,effective use resources proper control,climate
Japan-SEP-2015-SEP-HealthCareEquipment&Ser...-SEP-AnnualReport15_Sustainability_E.pdf?1444358562,4131,4131,one causes cerebral aneurysms body,temperature,prevention falls among elderly.following implementation,climate
Japan-SEP-2015-SEP-HealthCareEquipment&Ser...-SEP-AnnualReport15_Sustainability_E.pdf?1444358562,5016,5016,developing environmentally-friendlyand safe productsinitiatives deal,climate_change,effective use resources proper control,climate
Japan-SEP-2015-SEP-HealthCareEquipment&Ser...-SEP-AnnualReport15_Sustainability_E.pdf?1444358562,5690,5690,supply efficiency iso14001 ohsas18001 certifications,co2_emissions,energy cost reductionsfujinomiya factory ehs,climate
Japan-SEP-2015-SEP-HealthCareEquipment&Ser...-SEP-AnnualReport15_Sustainability_E.pdf?1444358562,7193,7193,"per unit consolidatednet sales 1,000t-co2",co2_emissions,japan fy 80100406020019020057711220109911423320111141182442012122121253201313112210084787970255201413112468212co2 emissions fy,climate
Japan-SEP-2015-SEP-HealthCareEquipment&Ser...-SEP-AnnualReport15_Sustainability_E.pdf?1444358562,7222,7222,entire terumo group working reduce,co2_emissions,armed knowledge nearly co2_emissions accounted,climate
Japan-SEP-2015-SEP-HealthCareEquipment&Ser...-SEP-AnnualReport15_Sustainability_E.pdf?1444358562,7226,7226,reduce co2_emissions armed knowledge nearly,co2_emissions,accounted manufacturing sites r d,climate
Japan-SEP-2015-SEP-HealthCareEquipment&Ser...-SEP-AnnualReport15_Sustainability_E.pdf?1444358562,7243,7243,lead planning advancing energy efficiency,global_warming,measures implemented individual business facilities,climate
Japan-SEP-2015-SEP-HealthCareEquipment&Ser...-SEP-AnnualReport15_Sustainability_E.pdf?1444358562,7296,7296,group energy-saving activities result global,co2_emissions,per consolidated net sales unit,climate
Japan-SEP-2015-SEP-HealthCareEquipment&Ser...-SEP-AnnualReport15_Sustainability_E.pdf?1444358562,7317,7317,protocol s scope standards calculate,greenhouse,gas emissions scope standard direct,climate
Japan-SEP-2015-SEP-HealthCareEquipment&Ser...-SEP-AnnualReport15_Sustainability_E.pdf?1444358562,7324,7324,emissions scope standard direct emissions,greenhouse,gases corporate facilities plants scope,climate
Japan-SEP-2015-SEP-HealthCareEquipment&Ser...-SEP-AnnualReport15_Sustainability_E.pdf?1444358562,7332,7332,facilities plants scope standard indirect,greenhouse,gas emissions associated consumption purchased,climate
Japan-SEP-2015-SEP-HealthCareEquipment&Ser...-SEP-AnnualReport15_Sustainability_E.pdf?1444358562,7343,7343,electricity scope standard terumo employ,greenhouse,gas emissions business activities global,climate
Japan-SEP-2015-SEP-HealthCareEquipment&Ser...-SEP-AnnualReport15_Sustainability_E.pdf?1444358562,7380,7380,defined regional coefficients published iea,co2_emissions,fuel combustion target reduction co2_emissions,climate
Japan-SEP-2015-SEP-HealthCareEquipment&Ser...-SEP-AnnualReport15_Sustainability_E.pdf?1444358562,7385,7385,co2_emissions fuel combustion target reduction,co2_emissions,scope1 mid- long-term goal global,climate
Japan-SEP-2015-SEP-HealthCareEquipment&Ser...-SEP-AnnualReport15_Sustainability_E.pdf?1444358562,7392,7392,mid- long-term goal global reduce,co2_emissions,per consolidated net sales unit,climate
Japan-SEP-2015-SEP-HealthCareEquipment&Ser...-SEP-AnnualReport15_Sustainability_E.pdf?1444358562,7404,7404,level fiscal 2025climate change due,global_warming,among critical environmental problems threatening,climate
Japan-SEP-2015-SEP-HealthCareEquipment&Ser...-SEP-AnnualReport15_Sustainability_E.pdf?1444358562,7435,7435,subject greater risk working fight,climate_change,reducing co2_emissions associated business activities.initiatives,climate
Japan-SEP-2015-SEP-HealthCareEquipment&Ser...-SEP-AnnualReport15_Sustainability_E.pdf?1444358562,7437,7437,risk working fight climate_change reducing,co2_emissions,associated business activities.initiatives deal climate,climate
Japan-SEP-2015-SEP-HealthCareEquipment&Ser...-SEP-AnnualReport15_Sustainability_E.pdf?1444358562,7475,7475,planning advancing terumo s energy-saving,global_warming,measures fiscal convened meeting consider,climate
Japan-SEP-2015-SEP-HealthCareEquipment&Ser...-SEP-AnnualReport15_Sustainability_E.pdf?1444358562,7483,7483,convened meeting consider technologies prevent,global_warming,shared examples best practices within,climate
Japan-SEP-2015-SEP-HealthCareEquipment&Ser...-SEP-AnnualReport15_Sustainability_E.pdf?1444358562,7500,7500,focusing terumo business locations highest,co2_emissions,also commissioned third-party energy- saving,climate
Japan-SEP-2015-SEP-HealthCareEquipment&Ser...-SEP-AnnualReport15_Sustainability_E.pdf?1444358562,7517,7517,continue consider advance measures achieve,co2_emissions,reductions scope data disclosed extent,climate
Japan-SEP-2015-SEP-HealthCareEquipment&Ser...-SEP-AnnualReport15_Sustainability_E.pdf?1444358562,7524,7524,scope data disclosed extent gatheredreducing,co2_emissions,distribution scope terumo switching truck-based,climate
Japan-SEP-2015-SEP-HealthCareEquipment&Ser...-SEP-AnnualReport15_Sustainability_E.pdf?1444358562,7545,7545,environmental impact distribution.in fiscal cut,co2_emissions,increasing number warehouses receive imported,climate
Japan-SEP-2015-SEP-HealthCareEquipment&Ser...-SEP-AnnualReport15_Sustainability_E.pdf?1444358562,8874,8874,operations japan coefficients used calculating,co2_emissions,related electricity use provided electricity,climate
Japan-SEP-2015-SEP-HealthCareEquipment&Ser...-SEP-AnnualReport15_Sustainability_E.pdf?1444358562,9052,9052,hazardous waste coefficients used calculating,co2_emissions,related electricity use provided electric,climate
Japan-SEP-2015-SEP-HealthCareEquipment&Ser...-SEP-AnnualReport15_Sustainability_E.pdf?1444358562,9070,9070,geographic emissions coefficients presented iea,co2_emissions,fuel combustion 2012.60initiativefiscal voluntary targets,climate
Japan-SEP-2015-SEP-HealthCareEquipment&Ser...-SEP-AnnualReport15_Sustainability_E.pdf?1444358562,9305,9305,effective use energy resources reduction,co2_emissions,ł reduce co2_emissions per unit,climate
Japan-SEP-2015-SEP-HealthCareEquipment&Ser...-SEP-AnnualReport15_Sustainability_E.pdf?1444358562,9308,9308,resources reduction co2_emissions ł reduce,co2_emissions,per unit consolidated net sales,climate
Japan-SEP-2015-SEP-HealthCareEquipment&Ser...-SEP-AnnualReport15_Sustainability_E.pdf?1444358562,9328,9328,target reduce fy 2025ł improve,co2_emissions,per net product sales unit,climate
Japan-SEP-2015-SEP-HealthCareEquipment&Ser...-SEP-AnnualReport15_Sustainability_E.pdf?1444358562,9360,9360,taken regarding situation ł reduce,co2_emissions,per unit consolidated net sales,climate
Japan-SEP-2015-SEP-HealthCareEquipment&Ser...-SEP-AnnualReport15_Sustainability_E.pdf?1444358562,9378,9378,overseas manufacturing sites ł reduce,co2_emissions,per unit terumo corporation net,climate
Japan-SEP-2015-SEP-HealthCareEquipment&Ser...-SEP-sys_csr2015_e_all.pdf?1449111236,3760,3760,values outlined sysmex eco-vision reduce,greenhouse,gas emissions products services reduce,climate
Japan-SEP-2015-SEP-HealthCareEquipment&Ser...-SEP-sys_csr2015_e_all.pdf?1449111236,4549,4549,p115 owing revisions scope data,greenhouse,gas emissions per unit sales,climate
Japan-SEP-2015-SEP-HealthCareEquipment&Ser...-SEP-sys_csr2015_e_all.pdf?1449111236,18004,18004,business offices including direct indirect,greenhouse,gas emissions waste discharge water,climate
Japan-SEP-2015-SEP-HealthCareEquipment&Ser...-SEP-sys_csr2015_e_all.pdf?1449111236,18271,18271,per unit parent-only sales reduce,greenhouse,gas emissions business offices per,climate
Japan-SEP-2015-SEP-HealthCareEquipment&Ser...-SEP-sys_csr2015_e_all.pdf?1449111236,18526,18526,packaging promoting eco-friendly service modelsreduce,carbon_dioxide,emissions logistics per unit freight,climate
Japan-SEP-2015-SEP-HealthCareEquipment&Ser...-SEP-sys_csr2015_e_all.pdf?1449111236,18539,18539,domestic inter- regional transportation 1reduce,carbon_dioxide,emissions logistics per unit freight,climate
Japan-SEP-2015-SEP-HealthCareEquipment&Ser...-SEP-sys_csr2015_e_all.pdf?1449111236,18580,18580,environment consciousness business offices reduce,greenhouse,gas emissions business offices per,climate
Japan-SEP-2015-SEP-HealthCareEquipment&Ser...-SEP-sys_csr2015_e_all.pdf?1449111236,18590,18590,per unit consolidated sales 2reduce,greenhouse,gas emissions business offices per,climate
Japan-SEP-2015-SEP-HealthCareEquipment&Ser...-SEP-sys_csr2015_e_all.pdf?1449111236,18909,18909,tanks control environmental factors sterility,temperature,oxygen concentrations using cells mammals,climate
Japan-SEP-2015-SEP-HealthCareEquipment&Ser...-SEP-sys_csr2015_e_all.pdf?1449111236,18927,18927,ially silkworms can cultivated room,temperature,simply using shelves breeding containers,climate
Japan-SEP-2015-SEP-HealthCareEquipment&Ser...-SEP-sys_csr2015_e_all.pdf?1449111236,19116,19116,automo bile use service curtail,co2_emissions,reducing co2_emissions logisticswe also promoting,climate
Japan-SEP-2015-SEP-HealthCareEquipment&Ser...-SEP-sys_csr2015_e_all.pdf?1449111236,19118,19118,use service curtail co2_emissions reducing,co2_emissions,logisticswe also promoting efforts reduce,climate
Japan-SEP-2015-SEP-HealthCareEquipment&Ser...-SEP-sys_csr2015_e_all.pdf?1449111236,19197,19197,co emissions fell year year,co2_emissions,logistics notes range calculation co,climate
Japan-SEP-2015-SEP-HealthCareEquipment&Ser...-SEP-sys_csr2015_e_all.pdf?1449111236,19217,19217,various measures site order reduce,greenhouse,gas emissions business offices business,climate
Japan-SEP-2015-SEP-HealthCareEquipment&Ser...-SEP-sys_csr2015_e_all.pdf?1449111236,19266,19266,offices result initiative s fiscal,greenhouse,gas emissions unit per conso,climate
Japan-SEP-2015-SEP-HealthCareEquipment&Ser...-SEP-sys_csr2015_e_all.pdf?1449111236,19307,19307,led lighting ono factory reducing,greenhouse,gas emissionspromoting reductions electricity usegreenhouse,climate
Japan-SEP-2015-SEP-HealthCareEquipment&Ser...-SEP-sys_csr2015_e_all.pdf?1449111236,20503,20503,t 49prtr t 0.15outputfiscal 2013fiscal,greenhouse,gas emissions business offices t-co,climate
Japan-SEP-2015-SEP-HealthCareEquipment&Ser...-SEP-sys_csr2015_e_all.pdf?1449111236,20509,20509,gas emissions business offices t-co,co2_emissions,domestic company cars t-co total,climate
Japan-SEP-2015-SEP-HealthCareEquipment&Ser...-SEP-sys_csr2015_e_all.pdf?1449111236,21517,21517,risks opportunities organization's activities due,climate_change,f·ec3corecoverage organization's defined benefit plan,climate
Japan-SEP-2015-SEP-HealthCareEquipment&Ser...-SEP-sys_csr2015_e_all.pdf?1449111236,21653,21653,environmental data en6addinitiatives provide energy-efficient,renewable_energy,based products services reductions energy,climate
Japan-SEP-2015-SEP-HealthCareEquipment&Ser...-SEP-sys_csr2015_e_all.pdf?1449111236,21777,21777,effluents waste en16coretotal direct indirect,greenhouse,gas emissions weight p122 environmental,climate
Japan-SEP-2015-SEP-HealthCareEquipment&Ser...-SEP-sys_csr2015_e_all.pdf?1449111236,21787,21787,environmental data en17coreother relevant indirect,greenhouse,gas emissions weight p113 environmental,climate
Japan-SEP-2015-SEP-HealthCareEquipment&Ser...-SEP-sys_csr2015_e_all.pdf?1449111236,21798,21798,consciousness business offices en18addinitiatives reduce,greenhouse,gas emissions reductions achieved p113,climate
Japan-SEP-2016-SEP-HealthCareEquipment&Ser...-SEP-%E2%98%85sysmex_CSR16_Eng%28Full%29.pdf?1480649858,2247,2247,system purchase electric power generated,renewable_energy,sources utilize solar generation reduced,climate
Japan-SEP-2016-SEP-HealthCareEquipment&Ser...-SEP-%E2%98%85sysmex_CSR16_Eng%28Full%29.pdf?1480649858,2253,2253,sources utilize solar generation reduced,greenhouse,gas emissions ˇ per unit,climate
Japan-SEP-2016-SEP-HealthCareEquipment&Ser...-SEP-%E2%98%85sysmex_CSR16_Eng%28Full%29.pdf?1480649858,2507,2507,processgreenhouse gas emissions ghg scope,greenhouse,gas emissions ghg scope scope,climate
Japan-SEP-2016-SEP-HealthCareEquipment&Ser...-SEP-%E2%98%85sysmex_CSR16_Eng%28Full%29.pdf?1480649858,2776,2776,fiscal ˇ based act promotion,global_warming,countermeasures conversion factor city gas,climate
Japan-SEP-2016-SEP-HealthCareEquipment&Ser...-SEP-%E2%98%85sysmex_CSR16_Eng%28Full%29.pdf?1480649858,2803,2803,adjustments credits based act promotion,global_warming,countermeasures using information announced power,climate
Japan-SEP-2016-SEP-HealthCareEquipment&Ser...-SEP-%E2%98%85sysmex_CSR16_Eng%28Full%29.pdf?1480649858,2837,2837,fiscal ˇ based act promotion,global_warming,countermeasures conversion factor city gas,climate
Japan-SEP-2016-SEP-HealthCareEquipment&Ser...-SEP-%E2%98%85sysmex_CSR16_Eng%28Full%29.pdf?1480649858,3161,3161,source according calculation reporting manual,greenhouse,gas emissions using recent factors,climate
Japan-SEP-2016-SEP-HealthCareEquipment&Ser...-SEP-%E2%98%85sysmex_CSR16_Eng%28Full%29.pdf?1480649858,3209,3209,source according calculation reporting manual,greenhouse,gas emissions using recent factors,climate
Japan-SEP-2016-SEP-HealthCareEquipment&Ser...-SEP-%E2%98%85sysmex_CSR16_Eng%28Full%29.pdf?1480649858,3246,3246,source according calculation reporting manual,greenhouse,gas emissions using recent factors,climate
Japan-SEP-2016-SEP-HealthCareEquipment&Ser...-SEP-%E2%98%85sysmex_CSR16_Eng%28Full%29.pdf?1480649858,3283,3283,source according calculation reporting manual,greenhouse,gas emissions using recent factors,climate
Japan-SEP-2016-SEP-HealthCareEquipment&Ser...-SEP-%E2%98%85sysmex_CSR16_Eng%28Full%29.pdf?1480649858,3319,3319,inputgreenhouse gas emissions ghg scope,greenhouse,gas emissions ghg scope japanoverseasjapanoverseastotal,climate
Japan-SEP-2016-SEP-HealthCareEquipment&Ser...-SEP-%E2%98%85sysmex_CSR16_Eng%28Full%29.pdf?1480649858,3547,3547,source according calculation reporting manual,greenhouse,gas emissions using recent factors,climate
Japan-SEP-2016-SEP-HealthCareEquipment&Ser...-SEP-%E2%98%85sysmex_CSR16_Eng%28Full%29.pdf?1480649858,3577,3577,source according calculation reporting manual,greenhouse,gas emissions using recent factors,climate
Japan-SEP-2016-SEP-HealthCareEquipment&Ser...-SEP-%E2%98%85sysmex_CSR16_Eng%28Full%29.pdf?1480649858,3608,3608,source according calculation reporting manual,greenhouse,gas emissions using recent factors,climate
