docname,from,to,pre,keyword,post,pattern
France-SEP-2013-SEP-HealthCareEquipment&Ser...-SEP-2012_Registration_Document_ESSILOR.pdf?1370128493,50836,50836,identify possible risks including related,climate_change,essilor wants protect risks much,climate
France-SEP-2013-SEP-HealthCareEquipment&Ser...-SEP-2012_Registration_Document_ESSILOR.pdf?1370128493,51345,51345,protection eyes corrective lenses context,climate_change,may uence quantity nature harmful,climate
France-SEP-2013-SEP-HealthCareEquipment&Ser...-SEP-2012_Registration_Document_ESSILOR.pdf?1370128493,54851,54851,indirect energy consumption primary source,co2_emissions,related direct indirect energy consumption,climate
France-SEP-2013-SEP-HealthCareEquipment&Ser...-SEP-2012_Registration_Document_ESSILOR.pdf?1370128493,55173,55173,delaroquephilippe arnaud partner partner charge,climate_change,sustainability services 223registration document essilor4social,climate
France-SEP-2013-SEP-HealthCareEquipment&Ser...-SEP-2012_Registration_Document_ESSILOR.pdf?1370128493,56473,56473,ftseuro rst addition essilor included,low_carbon,europe index since launched index,climate
France-SEP-2014-SEP-HealthCareEquipment&Ser...-SEP-2013_Registration_Document_Essilor.pdf?1400732134,18960,18960,strategies operations attentive aware consequences,climate_change,essilor supported carbon disclosure project,climate
France-SEP-2014-SEP-HealthCareEquipment&Ser...-SEP-2013_Registration_Document_Essilor.pdf?1400732134,44620,44620,waste management sustainable use resources,climate_change,safeguarding biodiversity information societal commitment,climate
France-SEP-2014-SEP-HealthCareEquipment&Ser...-SEP-2013_Registration_Document_Essilor.pdf?1400732134,48902,48902,objectives targets existing discharges indirect,greenhouse,gas emissions essentially co related,climate
France-SEP-2014-SEP-HealthCareEquipment&Ser...-SEP-2013_Registration_Document_Essilor.pdf?1400732134,50110,50110,social environmental reporting environmental information,climate_change,greenhouse gas emissions co2_emissions related,climate
France-SEP-2014-SEP-HealthCareEquipment&Ser...-SEP-2013_Registration_Document_Essilor.pdf?1400732134,50111,50111,environmental reporting environmental information climate_change,greenhouse,gas emissions co2_emissions related energy,climate
France-SEP-2014-SEP-HealthCareEquipment&Ser...-SEP-2013_Registration_Document_Essilor.pdf?1400732134,50114,50114,information climate_change greenhouse gas emissions,co2_emissions,related energy consumption electricity liquid,climate
France-SEP-2014-SEP-HealthCareEquipment&Ser...-SEP-2013_Registration_Document_Essilor.pdf?1400732134,50136,50136,indicator table total direct indirect,greenhouse,gas emissions following three headings,climate
France-SEP-2014-SEP-HealthCareEquipment&Ser...-SEP-2013_Registration_Document_Essilor.pdf?1400732134,50148,50148,en17 indicator table relevant indirect,greenhouse,gas emissions include co2_emissions related,climate
France-SEP-2014-SEP-HealthCareEquipment&Ser...-SEP-2013_Registration_Document_Essilor.pdf?1400732134,50152,50152,indirect greenhouse gas emissions include,co2_emissions,related primary transportation production unit,climate
France-SEP-2014-SEP-HealthCareEquipment&Ser...-SEP-2013_Registration_Document_Essilor.pdf?1400732134,50163,50163,"distribution center assessed t 4,680t",co2_emissions,related secondary transportation distribution center,climate
France-SEP-2014-SEP-HealthCareEquipment&Ser...-SEP-2013_Registration_Document_Essilor.pdf?1400732134,50173,50173,"center subsidiary assessed 10,980t 11,230t",co2_emissions,related signiﬁ cant portion professional,climate
France-SEP-2014-SEP-HealthCareEquipment&Ser...-SEP-2013_Registration_Document_Essilor.pdf?1400732134,50188,50188,"made total 22,620t 23,900t assessment",co2_emissions,related tertiary transportation so-called last-kilometer,climate
France-SEP-2014-SEP-HealthCareEquipment&Ser...-SEP-2013_Registration_Document_Essilor.pdf?1400732134,50296,50296,cargo tricycles 20132012en16total direct indirect,greenhouse,gas emissions weight tco2e q,climate
France-SEP-2014-SEP-HealthCareEquipment&Ser...-SEP-2013_Registration_Document_Essilor.pdf?1400732134,50306,50306,"q 60,908t 55,100ten17other relevant indirect",greenhouse,gas emissions weight tco2e q,climate
France-SEP-2014-SEP-HealthCareEquipment&Ser...-SEP-2013_Registration_Document_Essilor.pdf?1400732134,50394,50394,equivalent per kilowatt-hour electricity listed,low_carbon,europe index essilor international already,climate
France-SEP-2014-SEP-HealthCareEquipment&Ser...-SEP-2013_Registration_Document_Essilor.pdf?1400732134,50400,50400,europe index essilor international already,low_carbon,economy thanks light environmental footprint,climate
France-SEP-2014-SEP-HealthCareEquipment&Ser...-SEP-2013_Registration_Document_Essilor.pdf?1400732134,50410,50410,footprint products services particularly regard,greenhouse,gases group's greenhouse gas emissions,climate
France-SEP-2014-SEP-HealthCareEquipment&Ser...-SEP-2013_Registration_Document_Essilor.pdf?1400732134,50413,50413,particularly regard greenhouse gases group's,greenhouse,gas emissions largely indirect emissions,climate
France-SEP-2014-SEP-HealthCareEquipment&Ser...-SEP-2013_Registration_Document_Essilor.pdf?1400732134,50419,50419,gas emissions largely indirect emissions,carbon_dioxide,co generated manufacture distribution corrective,climate
France-SEP-2014-SEP-HealthCareEquipment&Ser...-SEP-2013_Registration_Document_Essilor.pdf?1400732134,50573,50573,table indicator en20 adapting consequences,climate_change,signatory united nations caring climate,climate
France-SEP-2014-SEP-HealthCareEquipment&Ser...-SEP-2013_Registration_Document_Essilor.pdf?1400732134,50585,50585,essilor international aware challenges related,climate_change,general first stages preceding potential,climate
France-SEP-2014-SEP-HealthCareEquipment&Ser...-SEP-2013_Registration_Document_Essilor.pdf?1400732134,50608,50608,risks including natural disasters related,climate_change,essilor wants protect risks much,climate
France-SEP-2014-SEP-HealthCareEquipment&Ser...-SEP-2013_Registration_Document_Essilor.pdf?1400732134,50970,50970,protection eyes corrective lenses context,climate_change,may inﬂ uence quantity nature,climate
France-SEP-2014-SEP-HealthCareEquipment&Ser...-SEP-2013_Registration_Document_Essilor.pdf?1400732134,55315,55315,consumption electricity gas liquid fuel,greenhouse,gas emissio ns related energy,climate
France-SEP-2014-SEP-HealthCareEquipment&Ser...-SEP-2013_Registration_Document_Essilor.pdf?1400732134,55397,55397,delaroque partner philippe arnaudpartner department,climate_change,sustainable development 223registration document essilor4corporate,climate
France-SEP-2014-SEP-HealthCareEquipment&Ser...-SEP-2013_Registration_Document_Essilor.pdf?1400732134,57707,57707,ftseuroﬁ rst addition essilor included,low_carbon,europe index since launched index,climate
France-SEP-2015-SEP-HealthCareEquipment&Ser...-SEP-2014_Registration_Document_Essilor.pdf?1432026288,19354,19354,stoxx esg leaders essilor member,low_carbon,europe index third cyear corporate,climate
France-SEP-2015-SEP-HealthCareEquipment&Ser...-SEP-2014_Registration_Document_Essilor.pdf?1432026288,19425,19425,strategies operations attentive aware consequences,climate_change,essilor supported carbon disclosure project,climate
France-SEP-2015-SEP-HealthCareEquipment&Ser...-SEP-2014_Registration_Document_Essilor.pdf?1432026288,45436,45436,waste management sustainable use resources,climate_change,safeguarding biodiversity information societal engagement,climate
France-SEP-2015-SEP-HealthCareEquipment&Ser...-SEP-2014_Registration_Document_Essilor.pdf?1432026288,45690,45690,chief ex cer information section,low_carbon,europe index 202essilor registration document,climate
France-SEP-2015-SEP-HealthCareEquipment&Ser...-SEP-2014_Registration_Document_Essilor.pdf?1432026288,49942,49942,contribute signiﬁ c ciency already,low_carbon,economy listed manyears low_carbon europe,climate
France-SEP-2015-SEP-HealthCareEquipment&Ser...-SEP-2014_Registration_Document_Essilor.pdf?1432026288,49946,49946,already low_carbon economy listed manyears,low_carbon,europe index essilor's green revolution,climate
France-SEP-2015-SEP-HealthCareEquipment&Ser...-SEP-2014_Registration_Document_Essilor.pdf?1432026288,50688,50688,objectives targets existing discharges indirect,greenhouse,gas emissions essentially co related,climate
France-SEP-2015-SEP-HealthCareEquipment&Ser...-SEP-2014_Registration_Document_Essilor.pdf?1432026288,51908,51908,information corporate social environmental reporting,climate_change,greenhouse gas emissions co2_emissions related,climate
France-SEP-2015-SEP-HealthCareEquipment&Ser...-SEP-2014_Registration_Document_Essilor.pdf?1432026288,51909,51909,corporate social environmental reporting climate_change,greenhouse,gas emissions co2_emissions related energy,climate
France-SEP-2015-SEP-HealthCareEquipment&Ser...-SEP-2014_Registration_Document_Essilor.pdf?1432026288,51912,51912,reporting climate_change greenhouse gas emissions,co2_emissions,related energy consumption electricity liquid,climate
France-SEP-2015-SEP-HealthCareEquipment&Ser...-SEP-2014_Registration_Document_Essilor.pdf?1432026288,51934,51934,indicator table total direct indirect,greenhouse,gas emissions following three headings,climate
France-SEP-2015-SEP-HealthCareEquipment&Ser...-SEP-2014_Registration_Document_Essilor.pdf?1432026288,51946,51946,en17 indicator table relevant indirect,greenhouse,gas emissions include co2_emissions related,climate
France-SEP-2015-SEP-HealthCareEquipment&Ser...-SEP-2014_Registration_Document_Essilor.pdf?1432026288,51950,51950,indirect greenhouse gas emissions include,co2_emissions,related primary transportation production unit,climate
France-SEP-2015-SEP-HealthCareEquipment&Ser...-SEP-2014_Registration_Document_Essilor.pdf?1432026288,51969,51969,reclassification secondary transportation primary transportation,co2_emissions,related secondary transportation distribution center,climate
France-SEP-2015-SEP-HealthCareEquipment&Ser...-SEP-2014_Registration_Document_Essilor.pdf?1432026288,52000,52000,"secondary transportation 17,177t ear 15,806t",co2_emissions,related signiﬁ cant portion professional,climate
France-SEP-2015-SEP-HealthCareEquipment&Ser...-SEP-2014_Registration_Document_Essilor.pdf?1432026288,52015,52015,"made total 24,691t 22,620t assessment",co2_emissions,related tertiary transportation so-called last-kilometer,climate
France-SEP-2015-SEP-HealthCareEquipment&Ser...-SEP-2014_Registration_Document_Essilor.pdf?1432026288,52124,52124,cargo tricycles 20142013en16total direct indirect,greenhouse,gas emissions weight t co,climate
France-SEP-2015-SEP-HealthCareEquipment&Ser...-SEP-2014_Registration_Document_Essilor.pdf?1432026288,52135,52135,2eq t en17other relevant indirect,greenhouse,gas emissions weight t co,climate
France-SEP-2015-SEP-HealthCareEquipment&Ser...-SEP-2014_Registration_Document_Essilor.pdf?1432026288,52183,52183,sc makes comparison easier listed,low_carbon,europe index essilor international already,climate
France-SEP-2015-SEP-HealthCareEquipment&Ser...-SEP-2014_Registration_Document_Essilor.pdf?1432026288,52189,52189,europe index essilor international already,low_carbon,economy thanks light environmental footprint,climate
France-SEP-2015-SEP-HealthCareEquipment&Ser...-SEP-2014_Registration_Document_Essilor.pdf?1432026288,52199,52199,footprint products services particularly regard,greenhouse,gases group's greenhouse gas emissions,climate
France-SEP-2015-SEP-HealthCareEquipment&Ser...-SEP-2014_Registration_Document_Essilor.pdf?1432026288,52202,52202,particularly regard greenhouse gases group's,greenhouse,gas emissions largely indirect emissions,climate
France-SEP-2015-SEP-HealthCareEquipment&Ser...-SEP-2014_Registration_Document_Essilor.pdf?1432026288,52208,52208,gas emissions largely indirect emissions,carbon_dioxide,co generated manufacture distribution corrective,climate
France-SEP-2015-SEP-HealthCareEquipment&Ser...-SEP-2014_Registration_Document_Essilor.pdf?1432026288,52362,52362,table indicator en20 adapting consequences,climate_change,signatory united nations caring climate,climate
France-SEP-2015-SEP-HealthCareEquipment&Ser...-SEP-2014_Registration_Document_Essilor.pdf?1432026288,52374,52374,essilor international aware challenges related,climate_change,general first stages preceding potential,climate
France-SEP-2015-SEP-HealthCareEquipment&Ser...-SEP-2014_Registration_Document_Essilor.pdf?1432026288,52399,52399,risks including natural disasters related,climate_change,essilor wants protect risks much,climate
France-SEP-2015-SEP-HealthCareEquipment&Ser...-SEP-2014_Registration_Document_Essilor.pdf?1432026288,53028,53028,protection eyes corrective lenses context,climate_change,may inﬂ uence quantity nature,climate
France-SEP-2015-SEP-HealthCareEquipment&Ser...-SEP-2014_Registration_Document_Essilor.pdf?1432026288,57636,57636,quantitative information total energy consumption,greenhouse,gas emissions related energy cons,climate
France-SEP-2015-SEP-HealthCareEquipment&Ser...-SEP-2014_Registration_Document_Essilor.pdf?1432026288,57668,57668,processes environmental assessment certiﬁ cation,greenhouse,gas emissions company-speciﬁ c information,climate
France-SEP-2015-SEP-HealthCareEquipment&Ser...-SEP-2014_Registration_Document_Essilor.pdf?1432026288,57749,57749,kpmg s.a philippe arnaudpartner department,climate_change,sustainable development alphonse delaroque partner,climate
France-SEP-2015-SEP-HealthCareEquipment&Ser...-SEP-2014_Registration_Document_Essilor.pdf?1432026288,59788,59788,ftseuroﬁ rst addition essilor included,low_carbon,europe index since launched index,climate
France-SEP-2015-SEP-HealthCareEquipment&Ser...-SEP-See_Change_Report.pdf?1432026288,6585,6585,responsibility recognition sustainable practices inclusion,low_carbon,europe global sustainable corporations index,climate
France-SEP-2015-SEP-HealthCareEquipment&Ser...-SEP-See_Change_Report.pdf?1432026288,6853,6853,engineers optimized insulating pump regulating,temperature,achieving overall energy reduction 4546innovation,climate
France-SEP-2016-SEP-HealthCareEquipment&Ser...-SEP-2015_Registration_Document_Essilor.pdf?1463414119,19795,19795,strategy operations attentive aware consequences,climate_change,essilor supported united nations caring,climate
France-SEP-2016-SEP-HealthCareEquipment&Ser...-SEP-2015_Registration_Document_Essilor.pdf?1463414119,43906,43906,world esg world sri europe,low_carbon,leaders ftse4good ethibel sustainability indexes,climate
France-SEP-2016-SEP-HealthCareEquipment&Ser...-SEP-2015_Registration_Document_Essilor.pdf?1463414119,44093,44093,impacts centers therefore felt terms,greenhouse,gas emissions transportation air road,climate
France-SEP-2016-SEP-HealthCareEquipment&Ser...-SEP-2015_Registration_Document_Essilor.pdf?1463414119,44188,44188,impact low energy buildings paper,greenhouse,gas emissions associated business travel,climate
France-SEP-2016-SEP-HealthCareEquipment&Ser...-SEP-2015_Registration_Document_Essilor.pdf?1463414119,44766,44766,efficiency reducing carbon footprint adapting,climate_change,lastly reducing recovering waste document,climate
France-SEP-2016-SEP-HealthCareEquipment&Ser...-SEP-2015_Registration_Document_Essilor.pdf?1463414119,45203,45203,communication lastly update methodology measurement,greenhouse,gas emissions eporting reference scof,climate
France-SEP-2016-SEP-HealthCareEquipment&Ser...-SEP-2015_Registration_Document_Essilor.pdf?1463414119,50261,50261,processes decrease carbon footprint adapt,climate_change,limit waste generation optimize recycling,climate
France-SEP-2016-SEP-HealthCareEquipment&Ser...-SEP-2015_Registration_Document_Essilor.pdf?1463414119,51054,51054,energy ciency helps reduce direct,greenhouse,gas emissions water reboost program,climate
France-SEP-2016-SEP-HealthCareEquipment&Ser...-SEP-2015_Registration_Document_Essilor.pdf?1463414119,51253,51253,transportation reviewed reﬂ ected indicator,greenhouse,gas emissions metric tons co2,climate
France-SEP-2016-SEP-HealthCareEquipment&Ser...-SEP-2015_Registration_Document_Essilor.pdf?1463414119,51275,51275,conference essilor renewed commitment limit,greenhouse,gas emissions maintain position low-carbon,climate
France-SEP-2016-SEP-HealthCareEquipment&Ser...-SEP-2015_Registration_Document_Essilor.pdf?1463414119,51285,51285,low-carbon business despite fact group's,greenhouse,gas emissions largely indirect sc2,climate
France-SEP-2016-SEP-HealthCareEquipment&Ser...-SEP-2015_Registration_Document_Essilor.pdf?1463414119,51326,51326,key accounts lastly analysis consequences,climate_change,essilor's business plays part controlling,climate
France-SEP-2016-SEP-HealthCareEquipment&Ser...-SEP-2015_Registration_Document_Essilor.pdf?1463414119,51344,51344,suppliers essilor expanded scof reporting,greenhouse,gas emissions revised associated calculation,climate
France-SEP-2016-SEP-HealthCareEquipment&Ser...-SEP-2015_Registration_Document_Essilor.pdf?1463414119,51390,51390,recalculated new basis direct indirect,greenhouse,gas emissions deriving ener tot,climate
France-SEP-2016-SEP-HealthCareEquipment&Ser...-SEP-2015_Registration_Document_Essilor.pdf?1463414119,51430,51430,energy consumption deriving increase production,co2_emission,t co2 -eq production growthimpactscope,climate
France-SEP-2016-SEP-HealthCareEquipment&Ser...-SEP-2015_Registration_Document_Essilor.pdf?1463414119,51449,51449,social environmental societal information indirect,greenhouse,gas emissions deriving tr three,climate
France-SEP-2016-SEP-HealthCareEquipment&Ser...-SEP-2015_Registration_Document_Essilor.pdf?1463414119,51551,51551,"impact reporting sc23,097 adapting consequences",climate_change,signatory united nations caring climate,climate
France-SEP-2016-SEP-HealthCareEquipment&Ser...-SEP-2015_Registration_Document_Essilor.pdf?1463414119,51563,51563,essilor international aware challenges related,climate_change,general faced consequences climate_change essilor,climate
France-SEP-2016-SEP-HealthCareEquipment&Ser...-SEP-2015_Registration_Document_Essilor.pdf?1463414119,51567,51567,related climate_change general faced consequences,climate_change,essilor deﬁ ned two key,climate
France-SEP-2016-SEP-HealthCareEquipment&Ser...-SEP-2015_Registration_Document_Essilor.pdf?1463414119,51601,51601,including risks natural disasters related,climate_change,essilor wants protect risks much,climate
France-SEP-2016-SEP-HealthCareEquipment&Ser...-SEP-2015_Registration_Document_Essilor.pdf?1463414119,51630,51630,protection eyes corrective lenses context,climate_change,may influence quantity nature harmful,climate
France-SEP-2016-SEP-HealthCareEquipment&Ser...-SEP-2015_Registration_Document_Essilor.pdf?1463414119,53582,53582,ghg protocol accounting reporting standard,greenhouse,gas emissions http www.ghgprotocol org,climate
France-SEP-2016-SEP-HealthCareEquipment&Ser...-SEP-2015_Registration_Document_Essilor.pdf?1463414119,54021,54021,enewable energies4.5.3 land use4.5.1climate change,greenhouse,gas emissions 4.5.4adapting consequences climate_change,climate
France-SEP-2016-SEP-HealthCareEquipment&Ser...-SEP-2015_Registration_Document_Essilor.pdf?1463414119,54026,54026,greenhouse gas emissions 4.5.4adapting consequences,climate_change,4.5.4safeguarding biodiversity measures taken safeguard,climate
France-SEP-2016-SEP-HealthCareEquipment&Ser...-SEP-2015_Registration_Document_Essilor.pdf?1463414119,54583,54583,ected withdrawal water4.5.2 oach 4.5.4g4-en15direct,greenhouse,gas ghg emissions sc4.5.4 g4-en16energy,climate
France-SEP-2016-SEP-HealthCareEquipment&Ser...-SEP-2015_Registration_Document_Essilor.pdf?1463414119,54590,54590,ghg emissions sc4.5.4 g4-en16energy indirect,greenhouse,gas ghg emissions sc4.5.4 g4-en17other,climate
France-SEP-2016-SEP-HealthCareEquipment&Ser...-SEP-2015_Registration_Document_Essilor.pdf?1463414119,54597,54597,ghg emissions sc4.5.4 g4-en17other indirect,greenhouse,gas ghg emissions sc4.5.4 oach4.5.2,climate
France-SEP-2016-SEP-HealthCareEquipment&Ser...-SEP-2015_Registration_Document_Essilor.pdf?1463414119,55483,55483,hours environmental indicators energy consumption,greenhouse,gases emissions related energy consumptions,climate
France-SEP-2016-SEP-HealthCareEquipment&Ser...-SEP-2015_Registration_Document_Essilor.pdf?1463414119,55575,55575,p march kpmg s.a.philippe arnaudpartner,climate_change,sustainability alphonse delaroque partner 235registration,climate
France-SEP-2017-SEP-HealthCareEquipment&Ser...-SEP-2016_Sustainability__Chap_4_Essilor_Registration_Document.pdf?1493999865,294,294,initiatives key areas human rights,climate_change,adaptation set clear roadmap based,climate
France-SEP-2017-SEP-HealthCareEquipment&Ser...-SEP-2016_Sustainability__Chap_4_Essilor_Registration_Document.pdf?1493999865,376,376,europe msci w sri world,low_carbon,leader ftse4good stoxx global esg,climate
France-SEP-2017-SEP-HealthCareEquipment&Ser...-SEP-2016_Sustainability__Chap_4_Essilor_Registration_Document.pdf?1493999865,406,406,assesses companies orts measure reduce,greenhouse,gas emissions water footprint cdp,climate
France-SEP-2017-SEP-HealthCareEquipment&Ser...-SEP-2016_Sustainability__Chap_4_Essilor_Registration_Document.pdf?1493999865,581,581,impacts centers therefore felt terms,greenhouse,gas emissions transportation air road,climate
France-SEP-2017-SEP-HealthCareEquipment&Ser...-SEP-2016_Sustainability__Chap_4_Essilor_Registration_Document.pdf?1493999865,702,702,impact low energy buildings paper,greenhouse,gas emissions associated business travel,climate
France-SEP-2017-SEP-HealthCareEquipment&Ser...-SEP-2016_Sustainability__Chap_4_Essilor_Registration_Document.pdf?1493999865,1116,1116,three main issues circular econom4.5.5,climate_change,see group updated materiality matrix,climate
France-SEP-2017-SEP-HealthCareEquipment&Ser...-SEP-2016_Sustainability__Chap_4_Essilor_Registration_Document.pdf?1493999865,1165,1165,development compliance business ethicspriority topics,climate_change,adaptation mitigation diversity inclusion responsible,climate
France-SEP-2017-SEP-HealthCareEquipment&Ser...-SEP-2016_Sustainability__Chap_4_Essilor_Registration_Document.pdf?1493999865,1548,1548,efficiency reducing carbon footprint adapting,climate_change,lastly reducing recovering waste orking,climate
France-SEP-2017-SEP-HealthCareEquipment&Ser...-SEP-2016_Sustainability__Chap_4_Essilor_Registration_Document.pdf?1493999865,7627,7627,processes decrease carbon footprint adapt,climate_change,limit waste generation optimize recycling,climate
France-SEP-2017-SEP-HealthCareEquipment&Ser...-SEP-2016_Sustainability__Chap_4_Essilor_Registration_Document.pdf?1493999865,8572,8572,energy ciency helps reduce direct,greenhouse,gas emissions water reboost program,climate
France-SEP-2017-SEP-HealthCareEquipment&Ser...-SEP-2016_Sustainability__Chap_4_Essilor_Registration_Document.pdf?1493999865,8788,8788,transportation reviewed reﬂ ected indicator,greenhouse,gas emissions metric tons co2,climate
France-SEP-2017-SEP-HealthCareEquipment&Ser...-SEP-2016_Sustainability__Chap_4_Essilor_Registration_Document.pdf?1493999865,8812,8812,conference essilor renewed commitment limit,greenhouse,gas emissions maintain position low-,climate
France-SEP-2017-SEP-HealthCareEquipment&Ser...-SEP-2016_Sustainability__Chap_4_Essilor_Registration_Document.pdf?1493999865,8859,8859,packaging eco-design instance help combat,climate_change,essilor created first mapping carbon,climate
France-SEP-2017-SEP-HealthCareEquipment&Ser...-SEP-2016_Sustainability__Chap_4_Essilor_Registration_Document.pdf?1493999865,8877,8877,order identify signiﬁ cant producers,greenhouse,gas generated result group's business,climate
France-SEP-2017-SEP-HealthCareEquipment&Ser...-SEP-2016_Sustainability__Chap_4_Essilor_Registration_Document.pdf?1493999865,8920,8920,gas emissions despite fact group's,greenhouse,gas emissions largely indirect sc2,climate
France-SEP-2017-SEP-HealthCareEquipment&Ser...-SEP-2016_Sustainability__Chap_4_Essilor_Registration_Document.pdf?1493999865,8964,8964,key accounts lastly analysis consequences,climate_change,essilor's business plays part controlling,climate
France-SEP-2017-SEP-HealthCareEquipment&Ser...-SEP-2016_Sustainability__Chap_4_Essilor_Registration_Document.pdf?1493999865,9023,9023,44in essilor expanded scof reporting,greenhouse,gas emissions revised associated calculation,climate
France-SEP-2017-SEP-HealthCareEquipment&Ser...-SEP-2016_Sustainability__Chap_4_Essilor_Registration_Document.pdf?1493999865,9064,9064,framework transportation lenses direct indirect,greenhouse,gas emissions deriving ener tot,climate
France-SEP-2017-SEP-HealthCareEquipment&Ser...-SEP-2016_Sustainability__Chap_4_Essilor_Registration_Document.pdf?1493999865,9113,9113,ghg emission energy consumption indirect,greenhouse,gas emissions deriving transportation sc,climate
France-SEP-2017-SEP-HealthCareEquipment&Ser...-SEP-2016_Sustainability__Chap_4_Essilor_Registration_Document.pdf?1493999865,9360,9360,ect availability resources faced consequences,climate_change,essilor deﬁ ned two key,climate
France-SEP-2017-SEP-HealthCareEquipment&Ser...-SEP-2016_Sustainability__Chap_4_Essilor_Registration_Document.pdf?1493999865,9395,9395,including risks natural disasters related,climate_change,essilor wants protect risks much,climate
France-SEP-2017-SEP-HealthCareEquipment&Ser...-SEP-2016_Sustainability__Chap_4_Essilor_Registration_Document.pdf?1493999865,9424,9424,protection eyes corrective lenses context,climate_change,may influence quantity nature harmful,climate
France-SEP-2017-SEP-HealthCareEquipment&Ser...-SEP-2016_Sustainability__Chap_4_Essilor_Registration_Document.pdf?1493999865,11691,11691,ghg protocol accounting reporting standard,greenhouse,gas emissions http www.ghgprotocol org,climate
