docname,from,to,pre,keyword,post,pattern
Kenya-SEP-2014-SEP-HealthCareEquipment&Ser...-SEP-AAR_UN_Global_Compact_COP_FY2013.pdf?1401970229.L5511,31,31,strengthening effort s design implementation activities th address climate_change well advocating favorable nationa l policies promotion climate justice especially vulnerable aar beckmann trust partnering kccwg major force combating ill effects,climate_change,kenya kccwg supports projects effective replicable easy implement trees trees trees trees fo fofo r r r health healthhealthhealth conceived implemented aar beckmann trust project significant demonstrable impact current future kenyans simply stated trees trees trees trees forfor health health health health convenes groups school settings plant trees learn basic,climate
Kenya-SEP-2014-SEP-HealthCareEquipment&Ser...-SEP-AAR_UN_Global_Compact_COP_FY2013.pdf?1401970229.L5512,8,8,effort s design implementation activities th address,climate_change,well advocating favorable nationa l policies promotion climate justice especially vulnerable aar beckmann trust partnering kccwg major force combating ill effects climate_change kenya kccwg supports projects effective replicable easy implement trees trees trees trees fo fofo r r r health health healthhealthconceived implemented aar beckmann trust project significant demonstrable impact,climate
Kenya-SEP-2014-SEP-HealthCareEquipment&Ser...-SEP-AAR_UN_Global_Compact_COP_FY2013.pdf?1401970229.L5512,30,30,effort s design implementation activities th address climate_change well advocating favorable nationa l policies promotion climate justice especially vulnerable aar beckmann trust partnering kccwg major force combating ill effects,climate_change,kenya kccwg supports projects effective replicable easy implement trees trees trees trees fo fofo r r r health health healthhealthconceived implemented aar beckmann trust project significant demonstrable impact current future kenyans simply stated trees trees trees trees forfor health health health health convenes groups school settings plant trees learn basic,climate
Kenya-SEP-2014-SEP-HealthCareEquipment&Ser...-SEP-AAR_UN_Global_Compact_COP_FY2013.pdf?1401970229.L5532,10,10,beckmann trust partnering kccwg major force combating ill effects,climate_change,kenya kccwg supports projects effective replicable easy implement trees trees trees trees fo fofo r r r health health health health conceived implemented aar beckmann trust project significant demonstrable impact current future kenyans simply stated trees trees trees trees forforhealthhealth health health convenes groups school settings plant trees learn basic,climate
Kenya-SEP-2014-SEP-HealthCareEquipment&Ser...-SEP-AAR_UN_Global_Compact_COP_FY2013.pdf?1401970229.L5533,9,9,trust partnering kccwg major force combating ill effects,climate_change,kenya kccwg supports projects effective replicable easy implement trees trees trees trees fo fofo r r r health health health health conceived implemented aar beckmann trust project significant demonstrable impact current future kenyans simply stated trees trees trees trees forfor healthhealthhealth health convenes groups school settings plant trees learn basic,climate
Kenya-SEP-2014-SEP-HealthCareEquipment&Ser...-SEP-AAR_UN_Global_Compact_COP_FY2013.pdf?1401970229.L5534,8,8,partnering kccwg major force combating ill effects,climate_change,kenya kccwg supports projects effective replicable easy implement trees trees trees trees fo fofo r r r health health health health conceived implemented aar beckmann trust project significant demonstrable impact current future kenyans simply stated trees trees trees trees forfor health healthhealthhealth convenes groups school settings plant trees learn basic,climate
Kenya-SEP-2014-SEP-HealthCareEquipment&Ser...-SEP-AAR_UN_Global_Compact_COP_FY2013.pdf?1401970229.L5535,7,7,kccwg major force combating ill effects,climate_change,kenya kccwg supports projects effective replicable easy implement trees trees trees trees fo fofo r r r health health health health conceived implemented aar beckmann trust project significant demonstrable impact current future kenyans simply stated trees trees trees trees forfor health health healthhealthconvenes groups school settings plant trees learn basic,climate
Kenya-SEP-2014-SEP-HealthCareEquipment&Ser...-SEP-AAR_UN_Global_Compact_COP_FY2013.pdf?1401970229.L5565,90,90,basic sanitation education since little cost trees trees trees trees forforhealthhealth health health created projects school-based sites end schools selected bases operation several reasons first schools natural gathe ring places children primary target population secondarily teachers families secondly schools typically located sites th suffer deforestation loss trees tha t attributed,climate_change,over-h arvesting wood fuel thirdly schools w ell- suited,climate
Kenya-SEP-2014-SEP-HealthCareEquipment&Ser...-SEP-AAR_UN_Global_Compact_COP_FY2013.pdf?1401970229.L5566,89,89,basic sanitation education since little cost trees trees trees trees forfor healthhealthhealth health created projects school-based sites end schools selected bases operation several reasons first schools natural gathe ring places children primary target population secondarily teachers families secondly schools typically located sites th suffer deforestation loss trees tha t attributed,climate_change,over-h arvesting wood fuel thirdly schools w ell- suited sites,climate
Kenya-SEP-2014-SEP-HealthCareEquipment&Ser...-SEP-AAR_UN_Global_Compact_COP_FY2013.pdf?1401970229.L5567,88,88,basic sanitation education since little cost trees trees trees trees forfor health healthhealthhealth created projects school-based sites end schools selected bases operation several reasons first schools natural gathe ring places children primary target population secondarily teachers families secondly schools typically located sites th suffer deforestation loss trees tha t attributed,climate_change,over-h arvesting wood fuel thirdly schools w ell- suited sites implement,climate
Kenya-SEP-2014-SEP-HealthCareEquipment&Ser...-SEP-AAR_UN_Global_Compact_COP_FY2013.pdf?1401970229.L5568,87,87,basic sanitation education since little cost trees trees trees trees forfor health health healthhealthcreated projects school-based sites end schools selected bases operation several reasons first schools natural gathe ring places children primary target population secondarily teachers families secondly schools typically located sites th suffer deforestation loss trees tha t attributed,climate_change,over-h arvesting wood fuel thirdly schools w ell- suited sites implement deworming,climate
Kenya-SEP-2014-SEP-HealthCareEquipment&Ser...-SEP-AAR_UN_Global_Compact_COP_FY2013.pdf?1401970229.L5632,25,25,natural gathe ring places children primary target population secondarily teachers families secondly schools typically located sites th suffer deforestation loss trees tha t attributed,climate_change,over-h arvesting wood fuel thirdly schools w ell- suited sites implement deworming children teach basic sanitation principles includ ing appropriate toilet behavior hand-washing promote betterhealthinhibiting spread disease date trees trees trees trees forfor health health health health planted trees locations loc al resources trained responsible ongoing maintenance children de-wormed erasing,climate
Kenya-SEP-2014-SEP-HealthCareEquipment&Ser...-SEP-AAR_UN_Global_Compact_COP_FY2013.pdf?1401970229.L5635,22,22,places children primary target population secondarily teachers families secondly schools typically located sites th suffer deforestation loss trees tha t attributed,climate_change,over-h arvesting wood fuel thirdly schools w ell- suited sites implement deworming children teach basic sanitation principles includ ing appropriate toilet behavior hand-washing promote better health inhibiting spreaddiseasedate trees trees trees trees forfor health health health health planted trees locations loc al resources trained responsible ongoing maintenance children de-wormed erasing,climate
Kenya-SEP-2014-SEP-HealthCareEquipment&Ser...-SEP-AAR_UN_Global_Compact_COP_FY2013.pdf?1401970229.L5642,15,15,families secondly schools typically located sites th suffer deforestation loss trees tha t attributed,climate_change,over-h arvesting wood fuel thirdly schools w ell- suited sites implement deworming children teach basic sanitation principles includ ing appropriate toilet behavior hand-washing promote better health inhibiting spread disease date trees trees trees trees forforhealthhealth health health planted trees locations loc al resources trained responsible ongoing maintenance children de-wormed erasing,climate
Kenya-SEP-2014-SEP-HealthCareEquipment&Ser...-SEP-AAR_UN_Global_Compact_COP_FY2013.pdf?1401970229.L5643,14,14,secondly schools typically located sites th suffer deforestation loss trees tha t attributed,climate_change,over-h arvesting wood fuel thirdly schools w ell- suited sites implement deworming children teach basic sanitation principles includ ing appropriate toilet behavior hand-washing promote better health inhibiting spread disease date trees trees trees trees forfor healthhealthhealth health planted trees locations loc al resources trained responsible ongoing maintenance children de-wormed erasing,climate
Kenya-SEP-2014-SEP-HealthCareEquipment&Ser...-SEP-AAR_UN_Global_Compact_COP_FY2013.pdf?1401970229.L5644,13,13,schools typically located sites th suffer deforestation loss trees tha t attributed,climate_change,over-h arvesting wood fuel thirdly schools w ell- suited sites implement deworming children teach basic sanitation principles includ ing appropriate toilet behavior hand-washing promote better health inhibiting spread disease date trees trees trees trees forfor health healthhealthhealth planted trees locations loc al resources trained responsible ongoing maintenance children de-wormed erasing,climate
Kenya-SEP-2014-SEP-HealthCareEquipment&Ser...-SEP-AAR_UN_Global_Compact_COP_FY2013.pdf?1401970229.L5645,12,12,typically located sites th suffer deforestation loss trees tha t attributed,climate_change,over-h arvesting wood fuel thirdly schools w ell- suited sites implement deworming children teach basic sanitation principles includ ing appropriate toilet behavior hand-washing promote better health inhibiting spread disease date trees trees trees trees forfor health health healthhealthplanted trees locations loc al resources trained responsible ongoing maintenance children de-wormed erasing,climate
Kenya-SEP-2014-SEP-HealthCareEquipment&Ser...-SEP-AAR_UN_Global_Compact_COP_FY2013.pdf?1401970229.L6246,79,79,commercialisation agriculture food security higher contribution o f manufacturing gdp wider access african global markets wider access kenyan s better quality educationhealthcare job creation targeting unemployed youth provision better housing provision improved water sources sanitation kenyan households t hat presently lack kenya pay full attention securing envir onment building resilience,climate_change,much done collaboration county governments new urban management boards provided constit ution laws overall aim plan kenyan families experienc ed,climate
Kenya-SEP-2014-SEP-HealthCareEquipment&Ser...-SEP-AAR_UN_Global_Compact_COP_FY2013.pdf?1401970229.L6487,47,47,small market lack industrialization underdeveloped services sector underdevelopment agriculture poor democracy among others tanzania development vision tanzania development vision achieve high quality livelihood peop le attain good governance people attain good governance t hrough rule law develop strong competitive economy taking action measures aar part kenya,climate_change,working group œhealththematic group preamble kccwg health thematic group wake climate_change kenya seen one vulnerable countries climate_change national climate_change action plan s adaptatio n analysis explains key climate_change impacts kenya drought water scarcity f looding sea level rise research suggests temperatures continue increase freq uency hot days nights rise precipitati,climate
Kenya-SEP-2014-SEP-HealthCareEquipment&Ser...-SEP-AAR_UN_Global_Compact_COP_FY2013.pdf?1401970229.L6487,58,58,underdevelopment agriculture poor democracy among others tanzania development vision tanzania development vision achieve high quality livelihood peop le attain good governance people attain good governance t hrough rule law develop strong competitive economy taking action measures aar part kenya climate_change working group œhealththematic group preamble kccwg health thematic group wake,climate_change,kenya seen one vulnerable countries climate_change national climate_change action plan s adaptatio n analysis explains key climate_change impacts kenya drought water scarcity f looding sea level rise research suggests temperatures continue increase freq uency hot days nights rise precipitati expected increase,climate
Kenya-SEP-2014-SEP-HealthCareEquipment&Ser...-SEP-AAR_UN_Global_Compact_COP_FY2013.pdf?1401970229.L6487,64,64,tanzania development vision tanzania development vision achieve high quality livelihood peop le attain good governance people attain good governance t hrough rule law develop strong competitive economy taking action measures aar part kenya climate_change working group œhealththematic group preamble kccwg health thematic group wake climate_change kenya seen one vulnerable countries,climate_change,national climate_change action plan s adaptatio n analysis explains key climate_change impacts kenya drought water scarcity f looding sea level rise research suggests temperatures continue increase freq uency hot days nights rise precipitati expected increase,climate
Kenya-SEP-2014-SEP-HealthCareEquipment&Ser...-SEP-AAR_UN_Global_Compact_COP_FY2013.pdf?1401970229.L6487,66,66,vision tanzania development vision achieve high quality livelihood peop le attain good governance people attain good governance t hrough rule law develop strong competitive economy taking action measures aar part kenya climate_change working group œhealththematic group preamble kccwg health thematic group wake climate_change kenya seen one vulnerable countries climate_change national,climate_change,action plan s adaptatio n analysis explains key climate_change impacts kenya drought water scarcity f looding sea level rise research suggests temperatures continue increase freq uency hot days nights rise precipitati expected increase,climate
Kenya-SEP-2014-SEP-HealthCareEquipment&Ser...-SEP-AAR_UN_Global_Compact_COP_FY2013.pdf?1401970229.L6487,75,75,le attain good governance people attain good governance t hrough rule law develop strong competitive economy taking action measures aar part kenya climate_change working group œhealththematic group preamble kccwg health thematic group wake climate_change kenya seen one vulnerable countries climate_change national climate_change action plan s adaptatio n analysis explains key,climate_change,impacts kenya drought water scarcity f looding sea level rise research suggests temperatures continue increase freq uency hot days nights rise precipitati expected increase,climate
Kenya-SEP-2014-SEP-HealthCareEquipment&Ser...-SEP-AAR_UN_Global_Compact_COP_FY2013.pdf?1401970229.L6492,42,42,services sector underdevelopment agriculture poor democracy among others tanzania development vision tanzania development vision achieve high quality livelihood peop le attain good governance people attain good governance t hrough rule law develop strong competitive economy taking action measures aar part kenya,climate_change,working group œ health thematic group preamble kccwghealththematic group wake climate_change kenya seen one vulnerable countries climate_change national climate_change action plan s adaptatio n analysis explains key climate_change impacts kenya drought water scarcity f looding sea level rise research suggests temperatures continue increase freq uency hot days nights rise precipitati,climate
Kenya-SEP-2014-SEP-HealthCareEquipment&Ser...-SEP-AAR_UN_Global_Compact_COP_FY2013.pdf?1401970229.L6492,53,53,underdevelopment agriculture poor democracy among others tanzania development vision tanzania development vision achieve high quality livelihood peop le attain good governance people attain good governance t hrough rule law develop strong competitive economy taking action measures aar part kenya climate_change working group œ health thematic group preamble kccwghealththematic group wake,climate_change,kenya seen one vulnerable countries climate_change national climate_change action plan s adaptatio n analysis explains key climate_change impacts kenya drought water scarcity f looding sea level rise research suggests temperatures continue increase freq uency hot days nights rise precipitati expected increase areas larges t rise rainfall,climate
Kenya-SEP-2014-SEP-HealthCareEquipment&Ser...-SEP-AAR_UN_Global_Compact_COP_FY2013.pdf?1401970229.L6492,59,59,tanzania development vision tanzania development vision achieve high quality livelihood peop le attain good governance people attain good governance t hrough rule law develop strong competitive economy taking action measures aar part kenya climate_change working group œ health thematic group preamble kccwghealththematic group wake climate_change kenya seen one vulnerable countries,climate_change,national climate_change action plan s adaptatio n analysis explains key climate_change impacts kenya drought water scarcity f looding sea level rise research suggests temperatures continue increase freq uency hot days nights rise precipitati expected increase areas larges t rise rainfall,climate
Kenya-SEP-2014-SEP-HealthCareEquipment&Ser...-SEP-AAR_UN_Global_Compact_COP_FY2013.pdf?1401970229.L6492,61,61,vision tanzania development vision achieve high quality livelihood peop le attain good governance people attain good governance t hrough rule law develop strong competitive economy taking action measures aar part kenya climate_change working group œ health thematic group preamble kccwghealththematic group wake climate_change kenya seen one vulnerable countries climate_change national,climate_change,action plan s adaptatio n analysis explains key climate_change impacts kenya drought water scarcity f looding sea level rise research suggests temperatures continue increase freq uency hot days nights rise precipitati expected increase areas larges t rise rainfall,climate
Kenya-SEP-2014-SEP-HealthCareEquipment&Ser...-SEP-AAR_UN_Global_Compact_COP_FY2013.pdf?1401970229.L6492,70,70,le attain good governance people attain good governance t hrough rule law develop strong competitive economy taking action measures aar part kenya climate_change working group œ health thematic group preamble kccwghealththematic group wake climate_change kenya seen one vulnerable countries climate_change national climate_change action plan s adaptatio n analysis explains key,climate_change,impacts kenya drought water scarcity f looding sea level rise research suggests temperatures continue increase freq uency hot days nights rise precipitati expected increase areas larges t rise rainfall,climate
Kenya-SEP-2014-SEP-HealthCareEquipment&Ser...-SEP-AAR_UN_Global_Compact_COP_FY2013.pdf?1401970229.L6679,71,71,œ denied right education schools lack private de cent sanitation facilities women forced spe nd large parts day fetching water without wa sh water sanitation hygiene sustainable development impossible kccwghealthgroup health thematic group constitutes various ganizations individuals health sector private government ngos health thematic group technical arm kccwg matters concerning,climate_change,health und ertake situation analysis looking impact s climate_change human health carry n impact assessment well establish document findings among activities g roup hopes carry include promote health,climate
Kenya-SEP-2014-SEP-HealthCareEquipment&Ser...-SEP-AAR_UN_Global_Compact_COP_FY2013.pdf?1401970229.L6679,80,80,sanitation facilities women forced spe nd large parts day fetching water without wa sh water sanitation hygiene sustainable development impossible kccwghealthgroup health thematic group constitutes various ganizations individuals health sector private government ngos health thematic group technical arm kccwg matters concerning climate_change health und ertake situation analysis looking impact s,climate_change,human health carry n impact assessment well establish document findings among activities g roup hopes carry include promote health,climate
Kenya-SEP-2014-SEP-HealthCareEquipment&Ser...-SEP-AAR_UN_Global_Compact_COP_FY2013.pdf?1401970229.L6681,69,69,œ denied right education schools lack private de cent sanitation facilities women forced spe nd large parts day fetching water without wa sh water sanitation hygiene sustainable development impossible kccwg health grouphealththematic group constitutes various ganizations individuals health sector private government ngos health thematic group technical arm kccwg matters concerning,climate_change,health und ertake situation analysis looking impact s climate_change human health carry n impact assessment well establish document findings among activities g roup hopes carry include promote health wellbeing children,climate
Kenya-SEP-2014-SEP-HealthCareEquipment&Ser...-SEP-AAR_UN_Global_Compact_COP_FY2013.pdf?1401970229.L6681,78,78,sanitation facilities women forced spe nd large parts day fetching water without wa sh water sanitation hygiene sustainable development impossible kccwg health grouphealththematic group constitutes various ganizations individuals health sector private government ngos health thematic group technical arm kccwg matters concerning climate_change health und ertake situation analysis looking impact s,climate_change,human health carry n impact assessment well establish document findings among activities g roup hopes carry include promote health wellbeing children,climate
Kenya-SEP-2014-SEP-HealthCareEquipment&Ser...-SEP-AAR_UN_Global_Compact_COP_FY2013.pdf?1401970229.L6688,62,62,œ denied right education schools lack private de cent sanitation facilities women forced spe nd large parts day fetching water without wa sh water sanitation hygiene sustainable development impossible kccwg health group health thematic group constitutes various ganizations individualshealthsector private government ngos health thematic group technical arm kccwg matters concerning,climate_change,health und ertake situation analysis looking impact s climate_change human health carry n impact assessment well establish document findings among activities g roup hopes carry include promote health wellbeing children n pertinent areas kenya starting de- worming,climate
Kenya-SEP-2014-SEP-HealthCareEquipment&Ser...-SEP-AAR_UN_Global_Compact_COP_FY2013.pdf?1401970229.L6688,71,71,sanitation facilities women forced spe nd large parts day fetching water without wa sh water sanitation hygiene sustainable development impossible kccwg health group health thematic group constitutes various ganizations individualshealthsector private government ngos health thematic group technical arm kccwg matters concerning climate_change health und ertake situation analysis looking impact s,climate_change,human health carry n impact assessment well establish document findings among activities g roup hopes carry include promote health wellbeing children n pertinent areas kenya starting de- worming,climate
Kenya-SEP-2014-SEP-HealthCareEquipment&Ser...-SEP-AAR_UN_Global_Compact_COP_FY2013.pdf?1401970229.L6693,57,57,œ denied right education schools lack private de cent sanitation facilities women forced spe nd large parts day fetching water without wa sh water sanitation hygiene sustainable development impossible kccwg health group health thematic group constitutes various ganizations individuals health sector private government ngoshealththematic group technical arm kccwg matters concerning,climate_change,health und ertake situation analysis looking impact s climate_change human health carry n impact assessment well establish document findings among activities g roup hopes carry include promote health wellbeing children n pertinent areas kenya starting de- worming project various schools selected partnership,climate
Kenya-SEP-2014-SEP-HealthCareEquipment&Ser...-SEP-AAR_UN_Global_Compact_COP_FY2013.pdf?1401970229.L6693,66,66,sanitation facilities women forced spe nd large parts day fetching water without wa sh water sanitation hygiene sustainable development impossible kccwg health group health thematic group constitutes various ganizations individuals health sector private government ngoshealththematic group technical arm kccwg matters concerning climate_change health und ertake situation analysis looking impact s,climate_change,human health carry n impact assessment well establish document findings among activities g roup hopes carry include promote health wellbeing children n pertinent areas kenya starting de- worming project various schools selected partnership,climate
Kenya-SEP-2014-SEP-HealthCareEquipment&Ser...-SEP-AAR_UN_Global_Compact_COP_FY2013.pdf?1401970229.L6702,57,57,sanitation facilities women forced spe nd large parts day fetching water without wa sh water sanitation hygiene sustainable development impossible kccwg health group health thematic group constitutes various ganizations individuals health sector private government ngos health thematic group technical arm kccwg matters concerning climate_changehealthund ertake situation analysis looking impact s,climate_change,human health carry n impact assessment well establish document findings among activities g roup hopes carry include promote health wellbeing children n pertinent areas kenya starting de- worming project various schools selected partnership aar beckmann trust proven track record implementing nee d,climate
