docname,from,to,pre,keyword,post,pattern
Australia-SEP-2017-SEP-HealthCareEquipment&Ser...-SEP-UNGC_COP_-_International_SOS_-17.pdf?1507163431.L4416,15,15,media aim reduce electricity consumption maintaining air conditioning systems energy efficient general recommended indoor,temperature,reminding employees switch lights leave workplace meeting room use lights necessary also enc ourage use energy saving lighting systems medical waste management measures reduce medical waste procedures place facilities ensure waste disposal pose risk publichealthen vironmental practices protecting environment international sos environmental sustainability statement international sos aims embed sustainability practices,climate
Australia-SEP-2018-SEP-HealthCareEquipment&Ser...-SEP-International_SOS_Sustainability_Report19_WEB.pdf?1545386138.L138,63,63,employees increasing globalisation increasing international mobility security threats can affect anyone geopolitical changes increase instability digitalisation revolutionising services sustainability us philosophy sustainability governance material topics goals progress protecting saving lives patient care client satisfaction quality assistance security safetyepidemicspublic health26 mobility evolving traveller behaviour non-communicable diseases mental health digitalisation healthcare assistance,extreme_weather,conditions fuelling clients growth people partners34 access skilled workforce employee health safety wellbeing modern leadership engaging work engagement regulators stakeholders community impact engagement relationship assistance partners suppliers living principles practices business continuity data privacy protection cyber,climate
Australia-SEP-2018-SEP-HealthCareEquipment&Ser...-SEP-International_SOS_Sustainability_Report19_WEB.pdf?1545386138.L146,55,55,employees increasing globalisation increasing international mobility security threats can affect anyone geopolitical changes increase instability digitalisation revolutionising services sustainability us philosophy sustainability governance material topics goals progress protecting saving lives patient care client satisfaction quality assistance security safety epidemics public health26 mobility evolving traveller behaviour non-communicablediseasesmental health digitalisation healthcare assistance,extreme_weather,conditions fuelling clients growth people partners34 access skilled workforce employee health safety wellbeing modern leadership engaging work engagement regulators stakeholders community impact engagement relationship assistance partners suppliers living principles practices business continuity data privacy protection cyber security business integrity transparency ethics environmental impacts operations,climate
Australia-SEP-2018-SEP-HealthCareEquipment&Ser...-SEP-International_SOS_Sustainability_Report19_WEB.pdf?1545386138.L148,53,53,employees increasing globalisation increasing international mobility security threats can affect anyone geopolitical changes increase instability digitalisation revolutionising services sustainability us philosophy sustainability governance material topics goals progress protecting saving lives patient care client satisfaction quality assistance security safety epidemics public health26 mobility evolving traveller behaviour non-communicable diseases mentalhealthdigitalisation healthcare assistance,extreme_weather,conditions fuelling clients growth people partners34 access skilled workforce employee health safety wellbeing modern leadership engaging work engagement regulators stakeholders community impact engagement relationship assistance partners suppliers living principles practices business continuity data privacy protection cyber security business integrity transparency ethics environmental impacts operations duty care,climate
Australia-SEP-2018-SEP-HealthCareEquipment&Ser...-SEP-International_SOS_Sustainability_Report19_WEB.pdf?1545386138.L150,51,51,employees increasing globalisation increasing international mobility security threats can affect anyone geopolitical changes increase instability digitalisation revolutionising services sustainability us philosophy sustainability governance material topics goals progress protecting saving lives patient care client satisfaction quality assistance security safety epidemics public health26 mobility evolving traveller behaviour non-communicable diseases mental health digitalisationhealthcareassistance,extreme_weather,conditions fuelling clients growth people partners34 access skilled workforce employee health safety wellbeing modern leadership engaging work engagement regulators stakeholders community impact engagement relationship assistance partners suppliers living principles practices business continuity data privacy protection cyber security business integrity transparency ethics environmental impacts operations duty care international sos,climate
Australia-SEP-2018-SEP-HealthCareEquipment&Ser...-SEP-International_SOS_Sustainability_Report19_WEB.pdf?1545386138.L163,40,40,increase instability digitalisation revolutionising services sustainability us philosophy sustainability governance material topics goals progress protecting saving lives patient care client satisfaction quality assistance security safety epidemics public health26 mobility evolving traveller behaviour non-communicable diseases mental health digitalisation healthcare assistance,extreme_weather,conditions fuelling clients growth people partners34 access skilled workforce employeehealthsafety wellbeing modern leadership engaging work engagement regulators stakeholders community impact engagement relationship assistance partners suppliers living principles practices business continuity data privacy protection cyber security business integrity transparency ethics environmental impacts operations duty care international sos foundation report gri standards,climate
Australia-SEP-2018-SEP-HealthCareEquipment&Ser...-SEP-International_SOS_Sustainability_Report19_WEB.pdf?1545386138.L524,66,66,ever now busy embedding new standards behaviours within organisation worldwide sincerely arnaud vaissié co-founder chairman chief executive cer 4internationalsos.com world international sos international sos international sos group companies business saving lives protecting clients global workforceshealthsecurity threats wherever clients deliver customised health security risk management wellbeing solutions fuel growth productivity event,extreme_weather,epidemic security incident provide immediate response brings peace mind innovative technology medical security expertise focus prevention offering real-time actionable insights on-the-ground quality delivery help clients meet compliance reporting needs good governance partnering us,climate
Australia-SEP-2018-SEP-HealthCareEquipment&Ser...-SEP-International_SOS_Sustainability_Report19_WEB.pdf?1545386138.L531,59,59,ever now busy embedding new standards behaviours within organisation worldwide sincerely arnaud vaissié co-founder chairman chief executive cer 4internationalsos.com world international sos international sos international sos group companies business saving lives protecting clients global workforces health security threats wherever clients deliver customisedhealthsecurity risk management wellbeing solutions fuel growth productivity event,extreme_weather,epidemic security incident provide immediate response brings peace mind innovative technology medical security expertise focus prevention offering real-time actionable insights on-the-ground quality delivery help clients meet compliance reporting needs good governance partnering us organisations can ful l duty care responsibilities,climate
Australia-SEP-2018-SEP-HealthCareEquipment&Ser...-SEP-International_SOS_Sustainability_Report19_WEB.pdf?1545386138.L3213,67,67,directors complete crisis trainings efforts support several sdgs progress started completed international sos sustainability report 18internationalsos.com international sos sustainability report worldwide reach human touch 19protecting saving lives business saving lives protecting clients global workforceshealthsecurity threats wherever clients might deliver customised health security risk management wellbeing solutions fuel growth productivity event,extreme_weather,epidemic security incident provide immediate response peace mind innovative technology medical security expertise focus prevention offering real-time actionable insights on-the-ground quality delivery 20internationalsos.com patient care client satisfaction quality assistance help organisations develop,climate
Australia-SEP-2018-SEP-HealthCareEquipment&Ser...-SEP-International_SOS_Sustainability_Report19_WEB.pdf?1545386138.L3221,59,59,directors complete crisis trainings efforts support several sdgs progress started completed international sos sustainability report 18internationalsos.com international sos sustainability report worldwide reach human touch 19protecting saving lives business saving lives protecting clients global workforces health security threats wherever clients might deliver customisedhealthsecurity risk management wellbeing solutions fuel growth productivity event,extreme_weather,epidemic security incident provide immediate response peace mind innovative technology medical security expertise focus prevention offering real-time actionable insights on-the-ground quality delivery 20internationalsos.com patient care client satisfaction quality assistance help organisations develop grow protect human capital work life now future,climate
Australia-SEP-2019-SEP-HealthCareEquipment&Ser...-SEP-Sustainability_Progress_Update20.pdf?1576751067.L288,91,91,understanding past year developed training course sustainability management reporting occupationalhealthsafety practitioner course covers prepare organisation manage ohs wellbeing sustainably metrics initiatives prioritise sustainability reporting following overwhelming success pilot course clients formally launch roll training international sos care planet impact business environment made noticeable progress recycling efforts responsible energy consumptions lower,carbon_emission,step embarked effort reduce single-use plastic ces report,climate
Australia-SEP-2019-SEP-HealthCareEquipment&Ser...-SEP-Sustainability_Progress_Update20.pdf?1576751067.L366,15,15,care planet impact business environment made noticeable progress recycling efforts responsible energy consumptions lower,carbon_emission,step embarked effort reduce single-use plastic ces report progress next year proud won two awards year ethical business practices valued business best business travel management forum expatriate management fem furthermore shortlisted sdg award work preventionncdsnon-communicable diseases sustainability report shortlisted award french chamber great britain looking forward making sustainability strides throughout,climate
Australia-SEP-2019-SEP-HealthCareEquipment&Ser...-SEP-Sustainability_Progress_Update20.pdf?1576751067.L368,13,13,impact business environment made noticeable progress recycling efforts responsible energy consumptions lower,carbon_emission,step embarked effort reduce single-use plastic ces report progress next year proud won two awards year ethical business practices valued business best business travel management forum expatriate management fem furthermore shortlisted sdg award work prevention ncds non-communicablediseasessustainability report shortlisted award french chamber great britain looking forward making sustainability strides throughout,climate
Australia-SEP-2019-SEP-HealthCareEquipment&Ser...-SEP-Sustainability_Progress_Update20.pdf?1576751067.L412,66,66,looking forward making sustainability strides throughout organisation beyond sincerely arnaud vaissié co-founder chairman chief executive cer international sos sustainability progress update 2internationalsos.com international sos international sos group companies business saving lives protecting clients global workforceshealthsecurity threats wherever clients deliver customised health security risk management wellbeing solutions fuel growth productivity event,extreme_weather,epidemic security incident provide immediate response brings peace mind innovative technology medical security expertise focus prevention offering real-time actionable insights on-the-ground quality delivery help clients meet compliance reporting needs good governance partnering us,climate
Australia-SEP-2019-SEP-HealthCareEquipment&Ser...-SEP-Sustainability_Progress_Update20.pdf?1576751067.L419,59,59,looking forward making sustainability strides throughout organisation beyond sincerely arnaud vaissié co-founder chairman chief executive cer international sos sustainability progress update 2internationalsos.com international sos international sos group companies business saving lives protecting clients global workforces health security threats wherever clients deliver customisedhealthsecurity risk management wellbeing solutions fuel growth productivity event,extreme_weather,epidemic security incident provide immediate response brings peace mind innovative technology medical security expertise focus prevention offering real-time actionable insights on-the-ground quality delivery help clients meet compliance reporting needs good governance partnering us organisations can ful l duty care responsibilities,climate
Brazil-SEP-2012-SEP-HealthCareEquipment&Ser...-SEP-2012_19_relatorio_sustentabilidade_2012_ingles_com_carta_adesao_pacto_global.pdf?1343048121.L12937,15,15,agents employees sociedade work voluntarily multipliers agents sust ainable practices focus impact everyday activities,climate_change,taken reduce waste raw materials resources food bes ides reduction proper collection recycling among others #j #h- #p#27- #e b 7c gri en29 adherence ghc protocol brazilian program provide transparency attest commitment sustainability sociedade #xhealthinstitution publish inventory emissions greenhouse gases took reference yea r base q1 #j0j#h7 #27- #h7'67- #e,climate
Brazil-SEP-2012-SEP-HealthCareEquipment&Ser...-SEP-2012_19_relatorio_sustentabilidade_2012_ingles_com_carta_adesao_pacto_global.pdf?1343048121.L12937,54,54,work voluntarily multipliers agents sust ainable practices focus impact everyday activities climate_change taken reduce waste raw materials resources food bes ides reduction proper collection recycling among others #j #h- #p#27- #e b 7c gri en29 adherence ghc protocol brazilian program provide transparency attest commitment sustainability sociedade #xhealthinstitution publish inventory emissions,greenhouse,gases took reference yea r base q1 #j0j#h7 #27- #h7'67- #e #iju 5# 7@ l# escola de administração de empresas de são paulo da fundação getúlio vargas eaesp fgv #;24 são paulo #j r #u-76- #d @l# -7 #b #b #8 institute wri aims establish,climate
Brazil-SEP-2012-SEP-HealthCareEquipment&Ser...-SEP-2012_19_relatorio_sustentabilidade_2012_ingles_com_carta_adesao_pacto_global.pdf?1343048121.L13002,43,43,#h7'67- #e #iju 5# 7@ l# escola de administração de empresas de são paulo da fundação getúlio vargas eaesp fgv #;24 são paulo #j r #u-76- #d @l# -7 #b #b #8 institute wri aims establish culture dev elopment publication corporate inventories,greenhouse,gases emissions co untry aware environmental impactshealthse ctor besides monitoring emissions sociedade drawing policies implementing actions reduce #67 1'4 #6- l# #'7 7# 7# 7# 5# planet past two years emissions stationary combustion sociedade decreased main reason replacement d iesel used power generation emergency situations page gri ec2 hospital also,climate
Brazil-SEP-2012-SEP-HealthCareEquipment&Ser...-SEP-2012_19_relatorio_sustentabilidade_2012_ingles_com_carta_adesao_pacto_global.pdf?1343048121.L13002,99,99,environmental impactshealthse ctor besides monitoring emissions sociedade drawing policies implementing actions reduce #67 1'4 #6- l# #'7 7# 7# 7# 5# planet past two years emissions stationary combustion sociedade decreased main reason replacement d iesel used power generation emergency situations page gri ec2 hospital also took initiative raise impact two,greenhouse,,climate
Brazil-SEP-2012-SEP-HealthCareEquipment&Ser...-SEP-2012_19_relatorio_sustentabilidade_2012_ingles_com_carta_adesao_pacto_global.pdf?1343048121.L14427,8,8,led wwf symbolic act ale rt risks,global_warming,#w-7 1#jfl#jkppl# #kf kk# n #kz gk# n n# sociedade participated turning a# #3 n#d morumbi #3 l#b a# building houses administrative areas o f building dedicated clinic w 7-#d4 l#- #b o #l n#2 l# sociedade 17'461# l#- 6# commitment improvehealthplanet s #e #b cl#- environmental issues sociedade promoted,climate
Brazil-SEP-2012-SEP-HealthCareEquipment&Ser...-SEP-2012_19_relatorio_sustentabilidade_2012_ingles_com_carta_adesao_pacto_global.pdf?1343048121.L14677,28,28,manaus march event brought 7# #fkk#b n sociedade also participated c40 summit held são paulo june c40 5# l#w-5'7# l# #b c cities set ways cooperate reducing,greenhouse,gases emission promote action among group cities companies power public sociedade global climate_change among contributions sociedade collaborated preparation document pointed solutions preventhealthproblems population related example waste generation air_pollution materiality chapter sustainable management accountability public #4 knowledge innovation excellence management gain eminent position among health institutions latin america s ociedade beneficente,climate
Brazil-SEP-2012-SEP-HealthCareEquipment&Ser...-SEP-2012_19_relatorio_sustentabilidade_2012_ingles_com_carta_adesao_pacto_global.pdf?1343048121.L14677,41,41,manaus march event brought 7# #fkk#b n sociedade also participated c40 summit held são paulo june c40 5# l#w-5'7# l# #b c cities set ways cooperate reducing greenhouse gases emission promote action among group cities companies power public sociedade global,climate_change,among contributions sociedade collaborated preparation document pointed solutions preventhealthproblems population related example waste generation air_pollution materiality chapter sustainable management accountability public #4 knowledge innovation excellence management gain eminent position among health institutions latin america s ociedade beneficente israelita brasileira albert einstein provide excellent services health care environment strongly marked innovation,climate
Brazil-SEP-2012-SEP-HealthCareEquipment&Ser...-SEP-2012_19_relatorio_sustentabilidade_2012_ingles_com_carta_adesao_pacto_global.pdf?1343048121.L14684,21,21,sociedade also participated c40 summit held são paulo june c40 5# l#w-5'7# l# #b c cities set ways cooperate reducing,greenhouse,gases emission promote action among group cities companies power public sociedade global climate_change among contributions sociedade collaborated preparation document pointed solutions prevent health problems population related example waste generationair_pollutionmateriality chapter sustainable management accountability public #4 knowledge innovation excellence management gain eminent position among health institutions latin america s ociedade beneficente,climate
Brazil-SEP-2012-SEP-HealthCareEquipment&Ser...-SEP-2012_19_relatorio_sustentabilidade_2012_ingles_com_carta_adesao_pacto_global.pdf?1343048121.L14684,34,34,sociedade also participated c40 summit held são paulo june c40 5# l#w-5'7# l# #b c cities set ways cooperate reducing greenhouse gases emission promote action among group cities companies power public sociedade global,climate_change,among contributions sociedade collaborated preparation document pointed solutions prevent health problems population related example waste generationair_pollutionmateriality chapter sustainable management accountability public #4 knowledge innovation excellence management gain eminent position among health institutions latin america s ociedade beneficente israelita brasileira albert einstein provide excellent services health care environment strongly marked innovation,climate
Brazil-SEP-2012-SEP-HealthCareEquipment&Ser...-SEP-2012_19_relatorio_sustentabilidade_2012_ingles_com_carta_adesao_pacto_global.pdf?1343048121.L14700,5,5,set ways cooperate reducing,greenhouse,gases emission promote action among group cities companies power public sociedade global climate_change among contributions sociedade collaborated preparation document pointed solutions prevent health problems population related example waste generation air_pollution materiality chapter sustainable management accountability public #4 knowledge innovation excellence management gain eminent position amonghealthinstitutions latin america s ociedade beneficente,climate
Brazil-SEP-2012-SEP-HealthCareEquipment&Ser...-SEP-2012_19_relatorio_sustentabilidade_2012_ingles_com_carta_adesao_pacto_global.pdf?1343048121.L14700,18,18,set ways cooperate reducing greenhouse gases emission promote action among group cities companies power public sociedade global,climate_change,among contributions sociedade collaborated preparation document pointed solutions prevent health problems population related example waste generation air_pollution materiality chapter sustainable management accountability public #4 knowledge innovation excellence management gain eminent position amonghealthinstitutions latin america s ociedade beneficente israelita brasileira albert einstein provide excellent services health care environment strongly marked innovation,climate
Brazil-SEP-2012-SEP-HealthCareEquipment&Ser...-SEP-2012_19_relatorio_sustentabilidade_2012_ingles_com_carta_adesao_pacto_global.pdf?1343048121.L14714,4,4,public sociedade global,climate_change,among contributions sociedade collaborated preparation document pointed solutions prevent health problems population related example waste generation air_pollution materiality chapter sustainable management accountability public #4 knowledge innovation excellence management gain eminent position among health institutions latin america s ociedade beneficente israelita brasileira albert einstein provide excellent serviceshealthcare environment strongly marked innovation,climate
Brazil-SEP-2019-SEP-HealthCareEquipment&Ser...-SEP-F00285_relatorio00x800px_ingles.pdf?1574364502.L2545,97,97,organizational climate survey regardshealthchronic disease healthy pregnancy program help bradesco perform careful monitoring employee s health 06environmental principlesodontoprev principle principle principle business support precautionary approach environmental challenges undertake initiatives promote greater environmental responsibility encourage development di usion environmentally friendly technologies environmental management performed odontoprev focuses four main aspects energy water,greenhouse,gas emissions,climate
Brazil-SEP-2019-SEP-HealthCareEquipment&Ser...-SEP-F00285_relatorio00x800px_ingles.pdf?1574364502.L2547,95,95,organizational climate survey regards health chronicdiseasehealthy pregnancy program help bradesco perform careful monitoring employee s health 06environmental principlesodontoprev principle principle principle business support precautionary approach environmental challenges undertake initiatives promote greater environmental responsibility encourage development di usion environmentally friendly technologies environmental management performed odontoprev focuses four main aspects energy water,greenhouse,gas emissions ghg residue,climate
Brazil-SEP-2019-SEP-HealthCareEquipment&Ser...-SEP-F00285_relatorio00x800px_ingles.pdf?1574364502.L2558,84,84,organizational climate survey regards health chronic disease healthy pregnancy program help bradesco perform careful monitoring employee shealth06environmental principlesodontoprev principle principle principle business support precautionary approach environmental challenges undertake initiatives promote greater environmental responsibility encourage development di usion environmentally friendly technologies environmental management performed odontoprev focuses four main aspects energy water,greenhouse,gas emissions ghg residue management.to address aspects company uses approach reduce consumption awareness-raising campaigns e,climate
Brazil-SEP-2019-SEP-HealthCareEquipment&Ser...-SEP-UHG18_Book_navegavel_-_VF_PORT-ING.pdf?1571679641.L36508,92,92,following stand summer care dengue chikungunya zika january carnivalhealthcare yellow fever february women s health women s day honor world water day campaign women cancer march opening employees area morumbi may world environment day contest flu immunization cvs presentation company morumbi unit presentation live well area june sustainability report ergonomics,temperature,working place july guidance act case ire,climate
Brazil-SEP-2019-SEP-HealthCareEquipment&Ser...-SEP-UHG18_Book_navegavel_-_VF_PORT-ING.pdf?1571679641.L36515,85,85,following stand summer care dengue chikungunya zika january carnival health care yellow fever february women shealthwomen s day honor world water day campaign women cancer march opening employees area morumbi may world environment day contest flu immunization cvs presentation company morumbi unit presentation live well area june sustainability report ergonomics,temperature,working place july guidance act case ire pink october october table cleaning november message,climate
