docname,from,to,pre,keyword,post,pattern
Japan-SEP-2015-SEP-HealthCareEquipment&Ser...-SEP-AnnualReport15_Sustainability_E.pdf?1444358562.L4113,67,67,performed japan annually website provide accurate easy-to-understand information ft people infertility concerns addition explanation ft approach treating infertility also provide list facilities perform ft procedures japan.terumo created numerous websites providing information disease prevention dailyhealthmanagement society large also established websites devoted particular health topics subarachnoid hemorrhages one causes cerebral aneurysms body,temperature,prevention falls among elderly.following implementation japan s act special measures pandemic influenza new infectious diseases preparedness response april company deemed specified public institution developed operation plan called article act.in event influenza new,climate
Japan-SEP-2015-SEP-HealthCareEquipment&Ser...-SEP-AnnualReport15_Sustainability_E.pdf?1444358562.L4122,58,58,performed japan annually website provide accurate easy-to-understand information ft people infertility concerns addition explanation ft approach treating infertility also provide list facilities perform ft procedures japan.terumo created numerous websites providing information disease prevention daily health management society large also established websites devoted particularhealthtopics subarachnoid hemorrhages one causes cerebral aneurysms body,temperature,prevention falls among elderly.following implementation japan s act special measures pandemic influenza new infectious diseases preparedness response april company deemed specified public institution developed operation plan called article act.in event influenza new infectious disease pandemic terumo fulfill social responsibility implementing plan,climate
Japan-SEP-2015-SEP-HealthCareEquipment&Ser...-SEP-AnnualReport15_Sustainability_E.pdf?1444358562.L4142,40,40,explanation ft approach treating infertility also provide list facilities perform ft procedures japan.terumo created numerous websites providing information disease prevention daily health management society large also established websites devoted particular health topics subarachnoid hemorrhages one causes cerebral aneurysms body,temperature,prevention falls among elderly.following implementation japan s act special measurespandemicinfluenza new infectious diseases preparedness response april company deemed specified public institution developed operation plan called article act.in event influenza new infectious disease pandemic terumo fulfill social responsibility implementing plan working institutions provide continuous supply syringes needles devices administering vaccines.providing information,climate
Japan-SEP-2015-SEP-HealthCareEquipment&Ser...-SEP-AnnualReport15_Sustainability_E.pdf?1444358562.L4146,36,36,infertility also provide list facilities perform ft procedures japan.terumo created numerous websites providing information disease prevention daily health management society large also established websites devoted particular health topics subarachnoid hemorrhages one causes cerebral aneurysms body,temperature,prevention falls among elderly.following implementation japan s act special measures pandemic influenza new infectiousdiseasespreparedness response april company deemed specified public institution developed operation plan called article act.in event influenza new infectious disease pandemic terumo fulfill social responsibility implementing plan working institutions provide continuous supply syringes needles devices administering vaccines.providing information,climate
Japan-SEP-2015-SEP-HealthCareEquipment&Ser...-SEP-AnnualReport15_Sustainability_E.pdf?1444358562.L4165,17,17,society large also established websites devoted particular health topics subarachnoid hemorrhages one causes cerebral aneurysms body,temperature,prevention falls among elderly.following implementation japan s act special measures pandemic influenza new infectious diseases preparedness response april company deemed specified public institution developed operation plan called article act.in event influenza new infectiousdiseasepandemic terumo fulfill social responsibility implementing plan working institutions provide continuous supply syringes needles devices administering vaccines.providing information,climate
Japan-SEP-2015-SEP-HealthCareEquipment&Ser...-SEP-AnnualReport15_Sustainability_E.pdf?1444358562.L4166,16,16,large also established websites devoted particular health topics subarachnoid hemorrhages one causes cerebral aneurysms body,temperature,prevention falls among elderly.following implementation japan s act special measures pandemic influenza new infectious diseases preparedness response april company deemed specified public institution developed operation plan called article act.in event influenza new infectious diseasepandemicterumo fulfill social responsibility implementing plan working institutions provide continuous supply syringes needles devices administering vaccines.providing information,climate
Japan-SEP-2015-SEP-HealthCareEquipment&Ser...-SEP-AnnualReport15_Sustainability_E.pdf?1444358562.L5004,61,61,geared toward introducing career opportunities science technology engineering math stem fields event provides girls interaction professionals stem careers introduces students stem business gestem event free presented percent volunteers made possible donations sponsors including donation terumo bct 33for ehs ehs environmenthealthsafety35404248 61ehs management employee health safety developing environmentally-friendlyand safe productsinitiatives deal,climate_change,effective use resources proper control chemical substances initiatives biodiversity conservation material flow environmental data fiscal ehs goals achievements34in october revised basic environmental policy instituted terumo global ehs environment health safety policy outlines stances reducing impact business activities environment,climate
Japan-SEP-2015-SEP-HealthCareEquipment&Ser...-SEP-AnnualReport15_Sustainability_E.pdf?1444358562.L5009,56,56,geared toward introducing career opportunities science technology engineering math stem fields event provides girls interaction professionals stem careers introduces students stem business gestem event free presented percent volunteers made possible donations sponsors including donation terumo bct 33for ehs ehs environment health safety35404248 61ehs management employeehealthsafety developing environmentally-friendlyand safe productsinitiatives deal,climate_change,effective use resources proper control chemical substances initiatives biodiversity conservation material flow environmental data fiscal ehs goals achievements34in october revised basic environmental policy instituted terumo global ehs environment health safety policy outlines stances reducing impact business activities environment conserving biodiversity safety health associates,climate
Japan-SEP-2015-SEP-HealthCareEquipment&Ser...-SEP-AnnualReport15_Sustainability_E.pdf?1444358562.L5045,22,22,sponsors including donation terumo bct 33for ehs ehs environment health safety35404248 61ehs management employee health safety developing environmentally-friendlyand safe productsinitiatives deal,climate_change,effective use resources proper control chemical substances initiatives biodiversity conservation material flow environmental data fiscal ehs goals achievements34in october revised basic environmental policy instituted terumo global ehs environmenthealthsafety policy outlines stances reducing impact business activities environment conserving biodiversity safety health associates policy applies entire terumo group forms basis corporate activities.terumo,climate
Japan-SEP-2015-SEP-HealthCareEquipment&Ser...-SEP-AnnualReport15_Sustainability_E.pdf?1444358562.L5058,9,9,employee health safety developing environmentally-friendlyand safe productsinitiatives deal,climate_change,effective use resources proper control chemical substances initiatives biodiversity conservation material flow environmental data fiscal ehs goals achievements34in october revised basic environmental policy instituted terumo global ehs environment health safety policy outlines stances reducing impact business activities environment conserving biodiversity safetyhealthassociates policy applies entire terumo group forms basis corporate activities.terumo,climate
Japan-SEP-2015-SEP-HealthCareEquipment&Ser...-SEP-AnnualReport15_Sustainability_E.pdf?1444358562.L5647,92,92,required participate also strive increase ehs awareness distributing environmentalhealthsafety information holding internal events associates families may also participate in.environmental safety training associateshandling potential ehs accidents emergenciesehs education award system38award project recipient fiscal 2014award project recipient fiscal 2015projectaward recipientehs-ms construction steam supply system renovations greater energy supply efficiency iso14001 ohsas18001 certifications,co2_emissions,energy cost reductionsfujinomiya factory ehs team administration,climate
Japan-SEP-2015-SEP-HealthCareEquipment&Ser...-SEP-AnnualReport15_Sustainability_E.pdf?1444358562.L7148,94,94,"packaging also use alternatives pioneer removal mercuryhealthcarepracticepromoting pvc-free dehp-free productsmeasures hazardous substancesmercury terumo ceased production mercury thermometers years since developed digital thermometers digital blood pressure monitors devices mercury-free safer people friendlier environment.di-2 ethylhexyl phthalate dehp whenever possible since concerns may biologically harmful 47co2 emissions overseas per unit consolidatednet sales 1,000t-co2",co2_emissions,japan fy 80100406020019020057711220109911423320111141182442012122121253201313112210084787970255201413112468212co2 emissions fy,climate
Japan-SEP-2015-SEP-HealthCareEquipment&Ser...-SEP-AnnualReport15_Sustainability_E.pdf?1444358562.L7423,8,8,conversion coefficients defined regional coefficients published iea,co2_emissions,fuel combustion target reduction co2_emissions scope1 mid- long-term goal global reduce co2_emissions per consolidated net sales unit fiscal level fiscal 2025climate change due global_warming among critical environmental problems threatening humanity unusual weather events expected cause increase natural disasters affect ecosystems ways serioushealthimpacts terumo s business activities also subject greater risk,climate
Japan-SEP-2015-SEP-HealthCareEquipment&Ser...-SEP-AnnualReport15_Sustainability_E.pdf?1444358562.L7423,13,13,conversion coefficients defined regional coefficients published iea co2_emissions fuel combustion target reduction,co2_emissions,scope1 mid- long-term goal global reduce co2_emissions per consolidated net sales unit fiscal level fiscal 2025climate change due global_warming among critical environmental problems threatening humanity unusual weather events expected cause increase natural disasters affect ecosystems ways serioushealthimpacts terumo s business activities also subject greater risk working fight climate_change reducing co2_emissions,climate
Japan-SEP-2015-SEP-HealthCareEquipment&Ser...-SEP-AnnualReport15_Sustainability_E.pdf?1444358562.L7423,20,20,conversion coefficients defined regional coefficients published iea co2_emissions fuel combustion target reduction co2_emissions scope1 mid- long-term goal global reduce,co2_emissions,per consolidated net sales unit fiscal level fiscal 2025climate change due global_warming among critical environmental problems threatening humanity unusual weather events expected cause increase natural disasters affect ecosystems ways serioushealthimpacts terumo s business activities also subject greater risk working fight climate_change reducing co2_emissions associated business activities.initiatives deal climate change48laboratoryfactoryexportterminalimportterminal160 t60,climate
Japan-SEP-2015-SEP-HealthCareEquipment&Ser...-SEP-AnnualReport15_Sustainability_E.pdf?1444358562.L7423,32,32,conversion coefficients defined regional coefficients published iea co2_emissions fuel combustion target reduction co2_emissions scope1 mid- long-term goal global reduce co2_emissions per consolidated net sales unit fiscal level fiscal 2025climate change due,global_warming,"among critical environmental problems threatening humanity unusual weather events expected cause increase natural disasters affect ecosystems ways serioushealthimpacts terumo s business activities also subject greater risk working fight climate_change reducing co2_emissions associated business activities.initiatives deal climate change48laboratoryfactoryexportterminalimportterminal160 t60 t2,180 twarehouse6,750 tsales agentproductdistributionwasteprocessorwaste transport100 tco2 emissions scope energy-saving study third-party expertsenergy",climate
Japan-SEP-2015-SEP-HealthCareEquipment&Ser...-SEP-AnnualReport15_Sustainability_E.pdf?1444358562.L7423,61,61,target reduction co2_emissions scope1 mid- long-term goal global reduce co2_emissions per consolidated net sales unit fiscal level fiscal 2025climate change due global_warming among critical environmental problems threatening humanity unusual weather events expected cause increase natural disasters affect ecosystems ways serioushealthimpacts terumo s business activities also subject greater risk working fight,climate_change,"reducing co2_emissions associated business activities.initiatives deal climate change48laboratoryfactoryexportterminalimportterminal160 t60 t2,180 twarehouse6,750 tsales agentproductdistributionwasteprocessorwaste transport100 tco2 emissions scope energy-saving study third-party expertsenergy subcommittee initiativesour ehs expert subcommittee energy composed mainly energy management experts takes lead planning advancing terumo s",climate
Japan-SEP-2015-SEP-HealthCareEquipment&Ser...-SEP-AnnualReport15_Sustainability_E.pdf?1444358562.L7423,63,63,co2_emissions scope1 mid- long-term goal global reduce co2_emissions per consolidated net sales unit fiscal level fiscal 2025climate change due global_warming among critical environmental problems threatening humanity unusual weather events expected cause increase natural disasters affect ecosystems ways serioushealthimpacts terumo s business activities also subject greater risk working fight climate_change reducing,co2_emissions,"associated business activities.initiatives deal climate change48laboratoryfactoryexportterminalimportterminal160 t60 t2,180 twarehouse6,750 tsales agentproductdistributionwasteprocessorwaste transport100 tco2 emissions scope energy-saving study third-party expertsenergy subcommittee initiativesour ehs expert subcommittee energy composed mainly energy management experts takes lead planning advancing terumo s",climate
Japan-SEP-2015-SEP-HealthCareEquipment&Ser...-SEP-sys_csr2015_e_all.pdf?1449111236.L18046,9,9,reduce environmental impact business offices including direct indirect,greenhouse,gas emissions waste discharge water use environmental considerationswe examine impact businesses environment various angles introduce countermeasures necessary green procurementsysmex promotes green procurement reduce environmental impact products.environmental datasysmex quantitatively monitors environmental burden efficiently promote environmental conservation activities environmental policy f·by shaping advancementhealthcareglobal environmental conservation activities contribute creati fulfilling healthy society core,climate
Japan-SEP-2016-SEP-HealthCareEquipment&Ser...-SEP-%E2%98%85sysmex_CSR16_Eng%28Full%29.pdf?1480649858.L2474,82,82,decent work employment labor practices decent work training education labor practices decent work diversity equal opportunity nikkei computer modernhealthcaremodern healthcare f vitro f f h salamat dok shiitake cryptobranchoidea main indicators results related environmental impactdata related sysmex group environmental action plan eco-vision aspectenvironmentconsciousnessin product lifecycle processgreenhouse gas emissions ghg scope,greenhouse,gas emissions ghg scope scope waste emissionswater useco emissions logisticsproduct logistics within japanproduct logistics overseas locationsproduct logistics,climate
Japan-SEP-2016-SEP-HealthCareEquipment&Ser...-SEP-%E2%98%85sysmex_CSR16_Eng%28Full%29.pdf?1480649858.L2476,80,80,decent work employment labor practices decent work training education labor practices decent work diversity equal opportunity nikkei computer modern healthcare modernhealthcaref vitro f f h salamat dok shiitake cryptobranchoidea main indicators results related environmental impactdata related sysmex group environmental action plan eco-vision aspectenvironmentconsciousnessin product lifecycle processgreenhouse gas emissions ghg scope,greenhouse,gas emissions ghg scope scope waste emissionswater useco emissions logisticsproduct logistics within japanproduct logistics overseas locationsproduct logistics within japan,climate
Japan-SEP-2016-SEP-HealthCareEquipment&Ser...-SEP-CSRreport2016E.pdf?1482382839.L7044,95,95,appropriate information important supporting improvement safetyhealthcarenihon kohden organizes co-sponsors workshops seminars disseminate academic information clinical knowledge leading medical safety appropriate use medical devices nihon kohden reaches nurses medical interns japan domestic international academic seminars ecg cardiology subjects vital sign seminars teach physiological opening east coast operation centerknowledge blood pressure pulse,temperature,workshops teach medical devices,climate
Japan-SEP-2016-SEP-HealthCareEquipment&Ser...-SEP-CSRreport2016E.pdf?1482382839.L7344,64,64,vessel indices.in addition testing reports can provided patients doctors better diagnosis moving forward nihon kohden continue provide medical devices help prevent adult-onset diseases.improving quality life qol patients nihon kohden released sukoyaka monitoring telecare system monitoring service advancehealthmanage pre-symptoms elderly persons living alone system detects changes lifestyle rhythms activity levels environment,temperature,humidity light using home station installed inside home provides email-based noti cations.moreover based results epidemiologic study improvement health elderly people nakanojo gunma prefecture evidence-based information kinds exercises carried degree provided support health development.improving healthcare ef,climate
Japan-SEP-2016-SEP-HealthCareEquipment&Ser...-SEP-CSRreport2016E.pdf?1482382839.L7377,33,33,prevent adult-onset diseases.improving quality life qol patients nihon kohden released sukoyaka monitoring telecare system monitoring service advance health manage pre-symptoms elderly persons living alone system detects changes lifestyle rhythms activity levels environment,temperature,humidity light using home station installed inside home provides email-based noti cations.moreover based results epidemiologic study improvementhealthelderly people nakanojo gunma prefecture evidence-based information kinds exercises carried degree provided support health development.improving healthcare ef ciency nihon kohden released fcm-2200 celltac peak high dna content measuring flow cytometer can swiftly measure cellular,climate
Japan-SEP-2016-SEP-HealthCareEquipment&Ser...-SEP-CSRreport2016E.pdf?1482382839.L7391,19,19,monitoring service advance health manage pre-symptoms elderly persons living alone system detects changes lifestyle rhythms activity levels environment,temperature,humidity light using home station installed inside home provides email-based noti cations.moreover based results epidemiologic study improvement health elderly people nakanojo gunma prefecture evidence-based information kinds exercises carried degree provided supporthealthdevelopment.improving healthcare ef ciency nihon kohden released fcm-2200 celltac peak high dna content measuring flow cytometer can swiftly measure cellular,climate
Japan-SEP-2016-SEP-HealthCareEquipment&Ser...-SEP-CSRreport2016E.pdf?1482382839.L7393,17,17,advance health manage pre-symptoms elderly persons living alone system detects changes lifestyle rhythms activity levels environment,temperature,humidity light using home station installed inside home provides email-based noti cations.moreover based results epidemiologic study improvement health elderly people nakanojo gunma prefecture evidence-based information kinds exercises carried degree provided support health development.improvinghealthcareef ciency nihon kohden released fcm-2200 celltac peak high dna content measuring flow cytometer can swiftly measure cellular,climate
Japan-SEP-2016-SEP-HealthCareEquipment&Ser...-SEP-CSRreport2016E.pdf?1482382839.L14126,86,86,environment newly commissioned tomioka production center completed iso registration activities ongoing ve sites noted sectionhealthcarenihon kohden put array sustainable products mar -ket company established worked towards quantitative targets concerning inputs outputs also commendable three targets set tomioka site seeing concrete results said context broader trends japan s draft commitment ﬁcut,co2_emissions,levels 2030ﬂ due cop21 paris agreement adopted december nihon kohden pursuing scope-based ghg,climate
Japan-SEP-2016-SEP-HealthCareEquipment&Ser...-SEP-Nihon_Kohden_CSR_Report15.pdf?1453271864.L2274,99,99,japan abroad.providinghealthcareprofessionals appropriate information important supporting improvement safety healthcare nihon kohden organizes co-sponsors workshops seminars disseminate academic information clinical knowledge leading medical safety appropriate use medical devices nihon kohden reaches nurses medical interns japan domestic international academic seminars ecg cardiology subjects vital sign seminars teach physiological knowledge blood pressure pulse,temperature,,climate
Japan-SEP-2016-SEP-HealthCareEquipment&Ser...-SEP-Nihon_Kohden_CSR_Report15.pdf?1453271864.L2282,91,91,japan abroad.providing healthcare professionals appropriate information important supporting improvement safetyhealthcarenihon kohden organizes co-sponsors workshops seminars disseminate academic information clinical knowledge leading medical safety appropriate use medical devices nihon kohden reaches nurses medical interns japan domestic international academic seminars ecg cardiology subjects vital sign seminars teach physiological knowledge blood pressure pulse,temperature,workshops teach medical devices ensure safe use rst,climate
Japan-SEP-2016-SEP-HealthCareEquipment&Ser...-SEP-terumo_sus_en1007.pdf?1475819550.L4341,54,54,management japan measures help associates nursing care responsibilities remain job japan 28activities supporting dissemination medical informationthe minimally invasive infertility treatment website japanese website provides explanation cerebral aneurysms key cause subarachnoid hemorrhages japanese infertility treatment via falloposcopic tuboplasty ft hemorrhages one causes cerebral aneurysms http terumo-kumomakka.jp body temperaturehealthhttp www.terumo-taion.jp basal body,temperature,health http www.terumo-womens-health.jp preventing falls elderly people uses websites provide society large various types medical information promoting preventive medicine routine health management march information topics following found websites japanese following implementation japan s act special measures pandemic influenza new infectious diseases preparedness response april company,climate
Japan-SEP-2016-SEP-HealthCareEquipment&Ser...-SEP-terumo_sus_en1007.pdf?1475819550.L4347,44,44,help associates nursing care responsibilities remain job japan 28activities supporting dissemination medical informationthe minimally invasive infertility treatment website japanese website provides explanation cerebral aneurysms key cause subarachnoid hemorrhages japanese infertility treatment via falloposcopic tuboplasty ft hemorrhages one causes cerebral aneurysms http terumo-kumomakka.jp body,temperature,health http www.terumo-taion.jp basal body temperaturehealthhttp www.terumo-womens-health.jp preventing falls elderly people uses websites provide society large various types medical information promoting preventive medicine routine health management march information topics following found websites japanese following implementation japan s act special measures pandemic influenza new infectious diseases preparedness response april company deemed,climate
Japan-SEP-2016-SEP-HealthCareEquipment&Ser...-SEP-terumo_sus_en1007.pdf?1475819550.L4367,24,24,provides explanation cerebral aneurysms key cause subarachnoid hemorrhages japanese infertility treatment via falloposcopic tuboplasty ft hemorrhages one causes cerebral aneurysms http terumo-kumomakka.jp body,temperature,health http www.terumo-taion.jp basal body temperature health http www.terumo-womens-health.jp preventing falls elderly people uses websites provide society large various types medical information promoting preventive medicine routinehealthmanagement march information topics following found websites japanese following implementation japan s act special measures pandemic influenza new infectious diseases preparedness response april company deemed,climate
