docname,from,to,pre,keyword,post,pattern
Philippines-SEP-2018-SEP-HealthCareEquipment&Ser...-SEP-2017_Manila_Doctors_Communication_on_Progress_Report.pdf?1536653653.L1410,23,23,circle awareness simultaneous actions leading sustainable results references world health organization health care without harm healthy hospitals healthy planet healthy people addressing,climate_change,healthcare settings discussion draft available climatefootprint_report pdf ua united nations global compact ten global compact principles businesses available https www unglobalcompact.org gc mission principles manila doctors hospitalinfectionprevention control office guidelines handling hazardous toxic waste manila doctors hospital environment waste management c ommittee envicom guidelines handling non hazardous waste manila doctors,climate
Poland-SEP-2014-SEP-HealthCareEquipment&Ser...-SEP-RR_Pelion_ENG.pdf?1403015711.L1529,59,59,49-50 cultivating polish pharmacy traditions pharmacy museums monographs pharmacies pharmacy museum lublin series monographs devoted history poland's oldest pharmacies csr initiatives challenges plans poland lithuania buisness lines services manufacturers pharmalink sp z o.o business pharmalink polish logistics operator providing services in-patient out-patienthealthcareinstitutions -to-end logistics solutions monitored transport products within wide,temperature,range storage services wholesalers order picking packaging president pharmalink management board vehicles must meet requirements ensure compliance systems monitor temperature along entire transport requirements guarantees top service quality line 53-54 challenges plans examples shared value activity value company value stakeholders,climate
Poland-SEP-2014-SEP-HealthCareEquipment&Ser...-SEP-RR_Pelion_ENG.pdf?1403015711.L1529,79,79,initiatives challenges plans poland lithuania buisness lines services manufacturers pharmalink sp z o.o business pharmalink polish logistics operator providing services in-patient out-patienthealthcareinstitutions -to-end logistics solutions monitored transport products within wide temperature range storage services wholesalers order picking packaging president pharmalink management board vehicles must meet requirements ensure compliance systems monitor,temperature,along entire transport requirements guarantees top service quality line 53-54 challenges plans examples shared value activity value company value stakeholders,climate
Saudi Arabia-SEP-2013-SEP-HealthCareEquipment&Ser...-SEP-CSRreport2012finalupload.pdf?1371818351.L9186,13,13,given fuel consumption vehicles fuel consumptio n vehicles combustion formula petrol gasoline,co2_emissions,kgs co2_emissions kgs kg litre total direct ghg used following methodology calculate ghg emi ssions emissions calculator.php#txtco2_7 freon consumption type freon consumption kgs consumption kgs consumption kgs r22 r134 r11 order comply ems iso standards started studyair_pollutionambient air quality area determine complia nce national ambient air quality standards naaqs promulgated,climate
Saudi Arabia-SEP-2013-SEP-HealthCareEquipment&Ser...-SEP-CSRreport2012finalupload.pdf?1371818351.L9186,15,15,given fuel consumption vehicles fuel consumptio n vehicles combustion formula petrol gasoline co2_emissions kgs,co2_emissions,kgs kg litre total direct ghg used following methodology calculate ghg emi ssions emissions calculator.php#txtco2_7 freon consumption type freon consumption kgs consumption kgs consumption kgs r22 r134 r11 order comply ems iso standards started studyair_pollutionambient air quality area determine complia nce national ambient air quality standards naaqs promulgated pme result,climate
Singapore-SEP-2019-SEP-HealthCareEquipment&Ser...-SEP-Sivantos_CoP-Report19.pdf?1558600807.L435,59,59,engage internal external stakeholders new level united nations adopted sus -tainable development goals sdgs set implemented characterize sustainability debate national interna -tional levels global goals system sdgs provide common language compass chal -lenges 21st century happy support wherever possible raising funds globalhealthissues universi -ty sponsorship program singapore uti -lizing clean,renewable_energy,sources denmark level engagement driven employees signatory un global compact currently focusing four sdgs ł sdg œ good health well-being ł sdg œ quality educationł sdg œ affordable clean energy ł sdg œ responsible consumption production journey presented opportunity us,climate
Singapore-SEP-2019-SEP-HealthCareEquipment&Ser...-SEP-Sivantos_CoP-Report19.pdf?1558600807.L464,32,32,-tional levels global goals system sdgs provide common language compass chal -lenges 21st century happy support wherever possible raising funds global health issues universi -ty sponsorship program singapore uti -lizing clean,renewable_energy,sources denmark level engagement driven employees signatory un global compact currently focusing four sdgs ł sdg œ goodhealthwell-being ł sdg œ quality educationł sdg œ affordable clean energy ł sdg œ responsible consumption production journey presented opportunity us engage internal external stakeholders new level choose responsibility 5the un insists energy,climate
Singapore-SEP-2019-SEP-HealthCareEquipment&Ser...-SEP-Sivantos_CoP-Report19.pdf?1558600807.L464,95,95,four sdgs ł sdg œ goodhealthwell-being ł sdg œ quality educationł sdg œ affordable clean energy ł sdg œ responsible consumption production journey presented opportunity us engage internal external stakeholders new level choose responsibility 5the un insists energy central nearly every major challenge opportunity world faces today related jobs security,climate_change,food production increasing incomes,climate
South Africa-SEP-2019-SEP-HealthCareEquipment&Ser...-SEP-UN-Global-Compact-Progress-Report-2018.pdf?1551278818.L425,97,97,per cent under- vemortalityrate halved south asia girl s risk marrying childhood declined per cent least developed countries proportion people access electricity doubled globally labour productivity increased unemployment decreased proportion world s workers living families poverty line less us day declined per cent per cent despite advances lack progress rollback,climate_change,build peaceful,climate
South Africa-SEP-2019-SEP-HealthCareEquipment&Ser...-SEP-UN-Global-Compact-Progress-Report-2018.pdf?1551278818.L1030,59,59,goals existing business reporting processes helps businesses better report impact global goals address information needs relevant stakeholders guide follows approach aligned gri standards un guiding principles business human rights 7which following global goals activities target decent work economic growth gender equality goodhealthwell-being industry innovation infrastructure responsible consumption production quality education,climate_action,affordable clean energy reduced inequalities partnership goals sustainable cities communities clean water sanitation poverty peace justice strong institutions zero hunger life land life water goal goal goal goal goal goal goal goal goal goal goal goal goal goal goal goal,climate
South Africa-SEP-2019-SEP-HealthCareEquipment&Ser...-SEP-UN-Global-Compact-Progress-Report-2018.pdf?1551278818.L7687,90,90,cities million people live slums study largest cities united states revealedhealthsavings parks amounted billion addition environmental savings 60un global compact participant responses goal companies report signi cant positive impact somewhat positive impact targeted goal products services contributing goal billion estimated urban population œ percentage global energy consumption cities percentage global,carbon_emissions,cities million number people live slums today primarily eastern,climate
South Africa-SEP-2019-SEP-HealthCareEquipment&Ser...-SEP-UN-Global-Compact-Progress-Report-2018.pdf?1551278818.L7764,15,15,contributing goal billion estimated urban population œ percentage global energy consumption cities percentage global,carbon_emissions,cities million number people live slums today primarily eastern south-eastern asia 59undp goal sustainable cities content undp en home sustainable-development-goals goal- 11-sustainable-cities-and-communities.html 60healthy parks healthy people central urban planning importance green space cities human environmentalhealthurban-planning-and-the-importance-of-green-space-in-cities- to-human-and-environmental-health un global compact progress report un global compact company contribution globally large corporations leading,climate
South Africa-SEP-2019-SEP-HealthCareEquipment&Ser...-SEP-UN-Global-Compact-Progress-Report-2018.pdf?1551278818.L8188,1,1,,climate_change,policy overall company strategy per cent companies reported measure greenhouse gas emissions science-based targets provides companies clearly de ned pathway future-proof growth specifying much quickly need reduce greenhouse gas emissions learn unglobalcompact.org take-action action science-based-target.broad considerations businessrapidly shifting climate patterns can seriously impede achievement several goals including goal goodhealthwell-being goal,climate
South Africa-SEP-2019-SEP-HealthCareEquipment&Ser...-SEP-UN-Global-Compact-Progress-Report-2018.pdf?1551278818.L8188,11,11,climate_change policy overall company strategy per cent companies reported measure,greenhouse,gas emissions science-based targets provides companies clearly de ned pathway future-proof growth specifying much quickly need reduce greenhouse gas emissions learn unglobalcompact.org take-action action science-based-target.broad considerations businessrapidly shifting climate patterns can seriously impede achievement several goals including goal goodhealthwell-being goal affordable clean energy goal decent work economic growth goal industry,climate
South Africa-SEP-2019-SEP-HealthCareEquipment&Ser...-SEP-UN-Global-Compact-Progress-Report-2018.pdf?1551278818.L8188,29,29,climate_change policy overall company strategy per cent companies reported measure greenhouse gas emissions science-based targets provides companies clearly de ned pathway future-proof growth specifying much quickly need reduce,greenhouse,gas emissions learn unglobalcompact.org take-action action science-based-target.broad considerations businessrapidly shifting climate patterns can seriously impede achievement several goals including goal goodhealthwell-being goal affordable clean energy goal decent work economic growth goal industry innovation infrastructure goal reduced inequalities goal sustainable cities communities goal responsible production consumption goal life water goal life,climate
South Africa-SEP-2019-SEP-HealthCareEquipment&Ser...-SEP-UN-Global-Compact-Progress-Report-2018.pdf?1551278818.L8188,90,90,climate patterns can seriously impede achievement several goals including goal goodhealthwell-being goal affordable clean energy goal decent work economic growth goal industry innovation infrastructure goal reduced inequalities goal sustainable cities communities goal responsible production consumption goal life water goal life land best demonstrated case sub- saharan africa among vulnerable regions,climate_change,rising temperatures led loss economy forced mass migrations competition,climate
South Africa-SEP-2019-SEP-HealthCareEquipment&Ser...-SEP-UN-Global-Compact-Progress-Report-2018.pdf?1551278818.L8633,28,28,global temperatures important part global economy providing natural resources open spaces transportation economic activity importance ocean set grow potential provide protein feed growing world population accommodate offshore,renewable_energy,production economic activity ocean land depleting common resources sh stocks degrading vital ecosystems effects greenhouse gas emissions ocean acidi cation warming stressinghealthproductivity ocean interconnected uid nature ocean ecosystem exempli ed sh migration ocean currents makes hard fully understand long-term impacts ocean depletion degradation many targets goal deadlines already taking immediate,climate
South Africa-SEP-2019-SEP-HealthCareEquipment&Ser...-SEP-UN-Global-Compact-Progress-Report-2018.pdf?1551278818.L8633,43,43,global temperatures important part global economy providing natural resources open spaces transportation economic activity importance ocean set grow potential provide protein feed growing world population accommodate offshore renewable_energy production economic activity ocean land depleting common resources sh stocks degrading vital ecosystems effects,greenhouse,gas emissions ocean acidi cation warming stressinghealthproductivity ocean interconnected uid nature ocean ecosystem exempli ed sh migration ocean currents makes hard fully understand long-term impacts ocean depletion degradation many targets goal deadlines already taking immediate action critical multi-stakeholder group participating sustainable ocean business action platform commits exploring ideas inspiring innovations,climate
South Africa-SEP-2019-SEP-HealthCareEquipment&Ser...-SEP-UN-Global-Compact-Progress-Report-2018.pdf?1551278818.L10020,8,8,justice strong institutions goal partnerships goals goal,climate_action,goal life land goal life water goal sustainable cities communities goal reduced inequalities goal responsible consumption production goal industry innovation infrastructure goal affordable clean energy goal decent work economic growth goal gender equality goal clean water sanitation goal quality education goal goodhealthwell-being goal zero hunger goal poverty source un global,climate
Sweden-SEP-2017-SEP-HealthCareEquipment&Ser...-SEP-Getinge_Annual_Report16.pdf?1495618080.L30418,98,98,cardiovascular system cardiovasculardiseasesheart blood ves -sel diseases kinetic therapy function getinge s high- tech rotoprone ž hospital bed function o ers continuous rotation immobile patients side side treat prevent complications lungs surgery perfusion heart-lung machine con -ducts work heart lungs operation arti cial gra s arti cial vascular implants low,temperature,sterilization,climate
Sweden-SEP-2017-SEP-HealthCareEquipment&Ser...-SEP-Getinge_Annual_Report16.pdf?1495618080.L30423,93,93,cardiovascular system cardiovascular diseases heart blood ves -seldiseaseskinetic therapy function getinge s high- tech rotoprone ž hospital bed function o ers continuous rotation immobile patients side side treat prevent complications lungs surgery perfusion heart-lung machine con -ducts work heart lungs operation arti cial gra s arti cial vascular implants low,temperature,sterilization low tempera -ture sterilization instruments,climate
Sweden-SEP-2018-SEP-HealthCareEquipment&Ser...-SEP-COP_UN_Global_Compact_Molnlycke.pdf?1530603609.L19,47,47,sustainability report report based facts 2contents sustainability approach 2ceo statement 4about company 8responsibility products people minimising environmental impacthealthsafety corporate social responsibility code conduct anti-bribery corruption working suppliers managing sustainability risks sales ces sustainability approach second decade twenty- rst century world faces signi cant challenges population growth,climate_change,driving demands good health wellbeing decent work economic growth lower emissions œ among many others 3in countries within un adopted,climate
Sweden-SEP-2018-SEP-HealthCareEquipment&Ser...-SEP-COP_UN_Global_Compact_Molnlycke.pdf?1530603609.L53,47,47,report based facts 2contents sustainability approach 2ceo statement 4about company 8responsibility products people minimising environmental impact health safety corporate social responsibility code conduct anti-bribery corruption working suppliers managing sustainability risks sales ces sustainability approach second decade twenty- rst century world faces signi cant challenges population growth,climate_change,driving demands goodhealthwellbeing decent work economic growth lower emissions œ among many others 3in countries within un adopted set sustainable development goals achieved national supra- national regulations also tackling time companies organisations including customers driving sustainability procurement practices ensuring companies use take responsibility people suppliers environment communities operate today s,climate
Sweden-SEP-2019-SEP-HealthCareEquipment&Ser...-SEP-elekta-annual-report-19-en.pdf?1565358444.L8016,86,86,stakeholders continuously work ensure focus matters fight cancer innovation r d quality product recalls accesshealthcarephilantrophy business ethics competition bid-rigging anti-corruption compliance privacy data security eˇective corporate governance board oversight export control safe trading tax management sustainable sourcing supply chain labor rights hazardous waste operations traceability conict minerals waste water operations,co2_emissions,energy use environmental impact supply chain life cycle reuse materials people focus health,climate
Sweden-SEP-2019-SEP-HealthCareEquipment&Ser...-SEP-elekta-annual-report-19-en.pdf?1565358444.L8066,38,38,healthcare philantrophy business ethics competition bid-rigging anti-corruption compliance privacy data security eˇective corporate governance board oversight export control safe trading tax management sustainable sourcing supply chain labor rights hazardous waste operations traceability conict minerals waste water operations,co2_emissions,energy use environmental impact supply chain life cycle reuse materials people focushealthsafety employee satisfaction diversity inclusion 16171819elekta annual report corporate responsibility report four focus areas elekta corporate responsibility program fight cancer business ethics sustainable sourcing people focus responsibility across entire value chain product development safety aspects installation handling use comprise,climate
Switzerland-SEP-2018-SEP-HealthCareEquipment&Ser...-SEP-Sonova_AR17_CSR_Report_en.pdf?1527143839.L6010,15,15,absolute terms kg co eq per kg transported kg co eq relative terms equivalent,carbon_emissions,cochlear implant segment estimated t co eq t co eq kg co eq per kg transported kg co eq respectively materials medical device manufacturer sonova group takes proactive approach evaluating materials products components assess environmentalhealthsafety risks sonova may restrict substances customer legal requirements company believes appropriate based precautionary approach evaluating,climate
Thailand-SEP-2016-SEP-HealthCareEquipment&Ser...-SEP-COP_January_2016_Chiva-Som_pdf.pdf?1452498115.L399,11,11,ter environmental responsibility principle encourage development diffusi environmentally friendly technologies,climate_change,water sustainability energy biodiversity environmental stewardship green industry assessment policy goals description relevance environmental prote ction company i.e environmental risks opportunities description policies public commitments company goals environmental prot ection chiva-som policy environmental social sustaina bility implemented chiva-som internationalhealthresorts co ltd re mains committed preservation planet earth proactively volved conserving,climate
Thailand-SEP-2017-SEP-HealthCareEquipment&Ser...-SEP-COP_January_2017_Chiva-Som_pdf.pdf?1484120274.L399,11,11,ter environmental responsibility principle encourage development diffusi environmentally friendly technologies,climate_change,water sustainability energy biodiversity environmental stewardship green industry assessment policy goals description relevance environmental prote ction company i.e environmental risks opportunities description policies public commitments company goals environmental prot ection chiva-som policy environmental social sustaina bility implemented chiva-som internationalhealthresorts co ltd re mains committed preservation planet earth proactively volved conserving,climate
Thailand-SEP-2018-SEP-HealthCareEquipment&Ser...-SEP-COP_January_2018_Chiva-Som.pdf?1515663363.L400,11,11,ter environmental responsibility principle encourage development diffusi environmentally friendly technologies,climate_change,water sustainability energy biodiversity environmental stewardship green industry assessment policy goals description relevance environmental prote ction company i.e environmental risks opportunities description policies public commitments company goals environmental prot ection chiva-som policy environmental social sustaina bility implemented chiva-som internationalhealthresorts co ltd re mains committed preservation planet earth proactively volved conserving,climate
Thailand-SEP-2019-SEP-HealthCareEquipment&Ser...-SEP-COP_January_2019_Chiva-Som.pdf?1561347307.L400,11,11,ter environmental responsibility principle encourage development diffusi environmentally friendly technologies,climate_change,water sustainability energy biodiversity environmental stewardship green industry assessment policy goals description relevance environmental prote ction company i.e environmental risks opportunities description policies public commitments company goals environmental prot ection chiva-som policy environmental social sustaina bility implemented chiva-som internationalhealthresorts co ltd re mains committed preservation planet earth proactively volved conserving,climate
United Kingdom-SEP-2019-SEP-HealthCareEquipment&Ser...-SEP-Corporate_Responsibility_Report18.pdf?1553162104.L732,26,26,œ highlights targets highlights key areas progress page number significant challenges page number continuing expansion mež customer support programme engaging suppliers supplier assessment programme development,climate_change,strategy ghg emission reduction target œ improving percentage senior management roles occupied women launch life convatec community programme development new people strategy improvements coveragehealthsafety programme key metrics progress public targets description new targets set end year provided summary targets status delivering customers customer support engagement ongoing basis maintain top position,climate
United Kingdom-SEP-2019-SEP-HealthCareEquipment&Ser...-SEP-Corporate_Responsibility_Report18.pdf?1553162104.L1573,78,78,targets six key elements cr framework report provides indication progress whilst challenging year convatec continue drive cr programme forward made good progress managementhealthsafety approach labour rights employees work supply chains recognised independent assessment conducted one key customers chairman reported statement e focus environmental aspects cr agenda context delighted move procure,renewable_energy,uk operations together approval climate_change strategy greenhouse gas reduction target convatec group plc corporate responsibility report behaving ethically transparently œ conserving,climate
United Kingdom-SEP-2019-SEP-HealthCareEquipment&Ser...-SEP-Corporate_Responsibility_Report18.pdf?1553162104.L1573,83,83,framework report provides indication progress whilst challenging year convatec continue drive cr programme forward made good progress managementhealthsafety approach labour rights employees work supply chains recognised independent assessment conducted one key customers chairman reported statement e focus environmental aspects cr agenda context delighted move procure renewable_energy uk operations together approval,climate_change,strategy greenhouse gas reduction target convatec group plc corporate responsibility report behaving ethically transparently œ conserving,climate
United Kingdom-SEP-2019-SEP-HealthCareEquipment&Ser...-SEP-Corporate_Responsibility_Report18.pdf?1553162104.L1573,85,85,provides indication progress whilst challenging year convatec continue drive cr programme forward made good progress managementhealthsafety approach labour rights employees work supply chains recognised independent assessment conducted one key customers chairman reported statement e focus environmental aspects cr agenda context delighted move procure renewable_energy uk operations together approval climate_change strategy,greenhouse,gas reduction target convatec group plc corporate responsibility report behaving ethically transparently œ conserving,climate
United Kingdom-SEP-2019-SEP-HealthCareEquipment&Ser...-SEP-Corporate_Responsibility_Report18.pdf?1553162104.L2864,87,87,security making socio-economic contribution local economic contribution local community engagement supplier diversity enabling peoplehealthsafety well-being human rights labour standards employee engagement culture employee development diversity discrimination working responsibly partners third party agents distributors ˇ engaging supply chain labour issues conserving planet product life-cycle impacts ˆ waste management recycling energy use,climate_change,environmental issues supply chain water management behaving ethically transparently openness transparency anti-bribery,climate
United Kingdom-SEP-2019-SEP-HealthCareEquipment&Ser...-SEP-Corporate_Responsibility_Report18.pdf?1553162104.L3410,99,99,support strainedhealthbudgets facing demographic trends ageing population growing middle-class less developed markets rise certain lifestyles linked chronic diseases alignment support united nations sustainable development goal ensure healthy lives promote well-being ages particular support target ﬁby reduce one third premature mortality non-communicable diseases prevention treatment promote mental well-being.ﬂ release intergovernmental panel,climate_change,,climate
