docname,from,to,pre,keyword,post,pattern
PLW_2015.L115,19,19,matched on-the-ground partnerships fight poverty protect vulnerable among us protect one planet call home challenges violence war poverty,disease,rising seas wildfires well droughts causedclimate_changeenormous resolve share today make good commitment transforming world urgent effective implementation 2030 agenda sustainable development resolution like congratulate secretary-general,health
PLW_2015.L806,42,42,participation relevant international environmental mechanisms united nations framework conventionclimate_changetaiwan possesses technical capacities many areas can shared world therefore also participate international meetings mechanisms frameworks world,health,organization international civil aviation organization trans-pacific partnership,health
PNG_2015.L649,24,24,regional cooperation integration connectivity framework papua new guinea committed million 2014-2018 regional outreach programme support pacific sids critical areas development good governance education,health,capacity-buildingclimate_changerelief assistance natural disaster reconstruction efforts assistance pacific sids exemplifies promotes spirit south-south cooperation encourage others join us similar partnerships respect papua new guinea made,health
SEN_2015.L87,19,19,burdensome world increasingly complex seventy years peace absence war also development human security remains threatened extreme poverty hunger,disease,unprecedented degradation environment senegal's hope parisclimate_changeconference successful adopt binding commitments controlling global_warming mobilizing adequate financial resources transfers environmentally friendly technologies face changes world still struggling,health
SEN_2015.L94,12,12,absence war also development human security remains threatened extreme poverty hunger,disease,unprecedented degradation environment senegal's hope paris climate_change conference successful adopt binding commitments controllingglobal_warmingmobilizing adequate financial resources transfers environmentally friendly technologies face changes world still struggling,health
SLE_2015.L792,44,44,africa believe experts right attribute disasters man-madeclimate_changecall action lower emissions greenhouse gases implicated changes also shore capabilities deal effects climate_change country reiterate immune physical social,health,consequences climate_change need integrate insight,health
SLE_2015.L797,39,39,africa believe experts right attribute disasters man-made climate_change call action lower emissionsgreenhousegases implicated changes also shore capabilities deal effects climate_change country reiterate immune physical social,health,consequences climate_change need integrate insight decisions urgent matters youth unemployment,health
SLE_2015.L806,30,30,africa believe experts right attribute disasters man-made climate_change call action lower emissions greenhouse gases implicated changes also shore capabilities deal effectsclimate_changecountry reiterate immune physical social,health,consequences climate_change need integrate insight decisions urgent matters youth unemployment insecurity extreme hunger violence women transnational organized crime piracy,health
SLE_2015.L814,24,24,attribute disasters man-made climate_change call action lower emissions greenhouse gases implicated changes also shore capabilities deal effects climate_change country reiterate immune physical social,health,consequencesclimate_changeneed integrate insight decisions urgent matters youth unemployment insecurity extreme hunger violence women transnational organized crime piracy allowing get control vulnerable nations increases vulnerability nations,health
STP_2015.L119,9,9,climate changes migrant refugee crises economic deregulation endemic,diseases,poverty hunger backdrop welcome relevance themes session reflect reality times post-2015 development agenda proper framing resolutionclimate_changeissues surely create path towards sustainable development developing countries particularly,health
SUR_2015.L181,14,14,still remain challenges armed conflicts rise fundamentalism disregard fundamental human rights freedoms global,health,concerns 15-29946 pv 2015 hiv aids non-communicable diseases well devastating effectsclimate_changenatural disasters government therefore applauds timely inspiring themes chosen general debate session whole united nations,health
SUR_2015.L181,22,22,still remain challenges armed conflicts rise fundamentalism disregard fundamental human rights freedoms global health concerns 15-29946 pv 2015 hiv aids non-communicable,diseases,well devastating effectsclimate_changenatural disasters government therefore applauds timely inspiring themes chosen general debate session whole united nations new commitment action united nations road ahead peace,health
SWZ_2015.L423,30,30,supply energy result now comprehensive strategy programme action outline gaps need addressed players energy sector present viable opportunities investment sector particularlyrenewable_energyenvisage world free poverty hunger,disease,want life can thrive becomes critical make youth empowerment central achieving goal attaining per cent enrolment rate primary education,health
SYC_2015.L92,9,9,apart vicious wars conflicts world poverty hunger famine,epidemics,continue grow unabated inequality injustice disparity rise world environmental degradation despoliation go unchecked world world menacedclimate_changelegacy want leave children friends must hear cries children hungry,health
THA_2015.L211,16,16,part transformative world agenda places people centre development order eradicate poverty reduce inequalities ensure universal,health,well-being promote good governance rule law reduce disaster risksclimate_changepose major challenge achievement various sustainable development goals therefore shared responsibility ensure outcome twenty-first session conference parties,health
TJK_2015.L286,27,27,globalization also negative impacts threaten security development individual countries world whole increase number armed conflicts acts terror food energy financial economic crises degradation environmentclimate_changespread infectious,diseases,demand us concerted comprehensive response context united nations remains key platform consensus key issues international security development coordination joint action 15-29431 2015,health
TUV_2015.L1128,13,13,supported various developmental humanitarian undertakings directly many specialized united nations bodies world,health,assembly world health organization international civil aviation organization united nations framework conventionclimate_changetaiwan's infrastructure projects technology transfer capacity-building produced genuine tangible outcomes tuvalu can achieve ambitious,health
TUV_2015.L1128,16,16,supported various developmental humanitarian undertakings directly many specialized united nations bodies world health assembly world,health,organization international civil aviation organization united nations framework conventionclimate_changetaiwan's infrastructure projects technology transfer capacity-building produced genuine tangible outcomes tuvalu can achieve ambitious goals set agenda,health
VAT_2015.L1291,48,48,transition development markedlow_carbonfootprint providing powerful impetus reinforcing intrinsic link two objectives eradicating poverty easing effects climate_change link shows threat climate_change responses can promising opportunity improving,health,transportation,health
VAT_2015.L1305,34,34,transition development marked low_carbon footprint providing powerful impetus reinforcing intrinsic link two objectives eradicating poverty easing effectsclimate_changelink shows threat climate_change responses can promising opportunity improving,health,transportation energy security new opportunities employment effective accord issues addition important value possess can contribute,health
VAT_2015.L1309,30,30,transition development marked low_carbon footprint providing powerful impetus reinforcing intrinsic link two objectives eradicating poverty easing effects climate_change link shows threatclimate_changeresponses can promising opportunity improving,health,transportation energy security new opportunities employment effective accord issues addition important value possess can contribute general agreements states regarding,health
AGO_2016.L545,41,41,sectors levels order maintain universal inclusive nature sustainable development goalsclimate_changeone complex urgent issues domestic foreign policy face today impact migration food security natural resources spread,epidemics,even social economic instability thus 2015 paris agreement,health
AGO_2016.L571,17,17,one complex urgent issues domestic foreign policy face today impact migration food security natural resources spread,epidemics,even social economic instability thus 2015 paris agreementclimate_changevaluable ambitious balanced fair tool action whose entry force encourage collective efforts control global_warming republic angola emits per,health
AGO_2016.L585,3,3,resources spread,epidemics,even social economic instability thus 2015 paris agreement climate_change valuable ambitious balanced fair tool action whose entry force encourage collective efforts controlglobal_warmingrepublic angola emits per,health
AGO_2016.L595,48,48,gases however effectsclimate_changealready felt us many ways deterioration shortening cycles drought heavy rainfall pose risk agriculture economic social infrastructures effects also increase incidence various endemic,diseases,therefore,health
AUS_2016.L974,17,17,actions home advocacy cooperation abroad course next decade beyond working together combat terrorism conflict prevent global,health,pandemics ensure universal access clean water sanitation addressclimate_changerequire enhanced global cooperation need reiterate significance complexity threat climate_change understand stake future generations around globe well-being planet,health
AUS_2016.L974,18,18,actions home advocacy cooperation abroad course next decade beyond working together combat terrorism conflict prevent global health,pandemics,ensure universal access clean water sanitation addressclimate_changerequire enhanced global cooperation need reiterate significance complexity threat climate_change understand stake future generations around globe well-being planet successful,health
AUS_2016.L984,7,7,together combat terrorism conflict prevent global,health,pandemics ensure universal access clean water sanitation address climate_change require enhanced global cooperation need reiterate significance complexity threatclimate_changeunderstand stake future generations around globe well-being planet,health
AUS_2016.L984,8,8,together combat terrorism conflict prevent global health,pandemics,ensure universal access clean water sanitation address climate_change require enhanced global cooperation need reiterate significance complexity threatclimate_changeunderstand stake future generations around globe well-being planet successful,health
BEL_2016.L730,15,15,allow luxury diplomatic paralysis past years made lot progress reducing poverty improving access basic,health,care know well still much sustainable development goals paris agreementclimate_changegiven us proactive framework continue making progress strive unstintingly implement duty future generations create safer world,health
BIH_2016.L47,23,23,injustice inequality intolerance erodes foundations human society witnessing human suffering unprecedented scale suffering reaches far beyond national boundaries capacities deal poverty hunger,disease,natural disastersclimate_changeafflict millions fellow human beings many states societies trapped protracted conflicts cycles violence claiming countless victims facing worst forced displacement crisis since second world,health
BIH_2016.L1328,22,22,respect human rights promotion rule law core every action history judge us difference make lives millions people suffering marginalization discrimination poverty,malnutrition,disease natural disastersclimate_changemust listen voices respond needs hopes aspirations must find courage take urgent actions turn agendas agreed upon instruments true global change honouring pledge,health
BIH_2016.L1328,23,23,respect human rights promotion rule law core every action history judge us difference make lives millions people suffering marginalization discrimination poverty malnutrition,disease,natural disastersclimate_changemust listen voices respond needs hopes aspirations must find courage take urgent actions turn agendas agreed upon instruments true global change honouring pledge humankind,health
BLZ_2016.L992,16,16,international community welcome taiwan's meaningful participation mechanisms meetings activities united nations specialized agencies including world,health,organization international civil aviation organization united nations framework conventionclimate_changesetbacks global economy externalities resulting institutional policies public private safeguard financial security risks well adverse impacts climate_change,health
BWA_2016.L419,4,4,achievements areas education,health,care infrastructure human-resource development well women youth empowerment achievements however make us complacent like many nations botswana already feeling adverse impactclimate_changeimpact manifested decline agricultural production,health
COL_2016.L506,4,4,better used education,health,security citizens colombia opens arms world welcomes investment trade tourism sustainable development goals already adopted law country first country paris agreementclimate_changenow congress enacted law peace,health
COM_2016.L335,20,20,adopted last year improve lives population protect planet future generations enables us optimistically perceive future can reduce poverty improve,health,education build sustainable habitat fightclimate_changeprotect oceans forests however issue refugees migrants focus debate since start current session requires urgent action well aware migrant men women,health
FSM_2016.L1115,26,26,state government convened forty-seventh annual meeting forum micronesia meeting french polynesia new caledonia seated full members forum federated states micronesia became member small island statesclimate_changeoceans,health,human rights partnership featured prominently agenda climate_change forum reaffirmed position achieving paris agreement's goal limiting average global temperature increase c degrees pre-industrial levels,health
FSM_2016.L1124,19,19,french polynesia new caledonia seated full members forum federated states micronesia became member small island states climate_change oceans,health,human rights partnership featured prominently agendaclimate_changeforum reaffirmed position achieving paris agreement's goal limiting average global temperature increase c degrees pre-industrial levels existential matter many forum,health
FSM_2016.L1135,8,8,became member small island states climate_change oceans,health,human rights partnership featured prominently agenda climate_change forum reaffirmed position achieving paris agreement's goal limiting average globaltemperatureincrease c degrees pre-industrial levels existential matter many forum,health
HTI_2016.L244,10,10,united nations intentions strengthen capabilities conduct peacekeeping operations fight,pandemics,health crises promotion democracy human rights without overlooking neglecting economic social cultural rights paris agreementclimate_changeperfectly illustrates concept collective destiny peoples lies heart organization vision inspired,health
HTI_2016.L244,11,11,united nations intentions strengthen capabilities conduct peacekeeping operations fight pandemics,health,crises promotion democracy human rights without overlooking neglecting economic social cultural rights paris agreementclimate_changeperfectly illustrates concept collective destiny peoples lies heart organization vision inspired urgent,health
ISR_2016.L798,24,24,obsessive bias israel just problem country problem countries united nations spends much time condemning liberal democracy middle east far less time address war,disease,povertyclimate_changeserious problems plague planet half-million slaughtered syrians helped member states condemnation israel israel treated thousands injured syrians hospitals including field hospital built right along golan,health
ITA_2016.L106,3,3,risks connected,pandemics,sometimes exaggerated often constitute grave risks well risks connected environment community women men together colleagues able give response signing important paris agreementclimate_changepast april also risks,health
JAM_2016.L1094,7,7,aids also highlighted another problem global,health,situation must halted ensure citizens full productive lives another issue demands continued cooperation global regional national levels responseclimate_changeincreasing occurrence natural disasters including extreme weather-related phenomena,health
KGZ_2016.L253,5,5,food security quality education,health,care economic growth energy preservation environment know one three pillars 2030 agenda consists environmental issues paris worked together reach consensusclimate_changekyrgyzstan fully supports global agreement yesterday,health
KIR_2016.L291,16,16,organized crime war nuclear testing mass movements refugees migrants often unstated invisible silent killer non-communicable,diseases,health oceans looming challenges uncertainties incremental real existential threatsclimate_changecontinue undermine efforts global family achieve sustainable development also like add new session provides great opportunity us,health
KIR_2016.L291,17,17,organized crime war nuclear testing mass movements refugees migrants often unstated invisible silent killer non-communicable diseases,health,oceans looming challenges uncertainties incremental real existential threatsclimate_changecontinue undermine efforts global family achieve sustainable development also like add new session provides great opportunity us opportunity,health
KOR_2016.L184,14,14,development cooperation initiative mobile customized service delivered need vulnerable groups already experiencing better,health,medical services well enjoying adequate food cultural activities sdgs paris agreementclimate_changeinextricably linked future planet people mutually reinforcing lead virtuous cycle respect host copenhagen green climate,health
LSO_2016.L264,23,23,fruit theme chosen current session namely sustainable development goals universal push transform world relevant appropriate time humankind tottering precipice resulting hunger poverty,disease,adverse consequencesclimate_changetheme highlights collective desire united nations eradicate poverty forms dimensions may recall overriding message 2030 agenda leave one behind unique special challenges faced least-developed,health
MCO_2016.L29,17,17,week representatives world crisis war-torn world divided inequality shocked ever- increasing massive population displacements afflicted hunger,disease,torn apart grief-stricken violence also representatives world threatenedglobal_warmingmade vulnerable attacks biodiversity concerned new dangers ocean acidification melting permafrost doubly responsible situation world responsible human beings,health
MDV_2016.L523,47,47,continue invest action preventclimate_changeforging meaningful partnerships investing today saving tomorrow continue alarmed realities climate_change another crisis looms state oceans large-ocean state major economic activities depend,health,wealth oceans,health
MDV_2016.L534,36,36,continue invest action prevent climate_change forging meaningful partnerships investing today saving tomorrow continue alarmed realitiesclimate_changeanother crisis looms state oceans large-ocean state major economic activities depend,health,wealth oceans concerned many situations issue hand one needs collective response one opportunity,health
MLI_2016.L774,29,29,poverty change lives people substantial inclusive manner 2030 mali convinced need adopt strategies strengthen economic growth respond vital needs population including combatingclimate_changeprotecting environment providing education,health,care social protection jobs young people also empowering women ensuring involvement young people management critical issues relating socioeconomic development country,health
MWI_2016.L511,42,42,commit government ratification implementation crucial document malawi already adoptedclimate_changepolicy guide domestic implementation paris agreement taking action climate_change let also put record malawi making exemplary progress,health,sector pioneering innovative approaches management hiv aids,health
MWI_2016.L520,33,33,commit government ratification implementation crucial document malawi already adopted climate_change policy guide domestic implementation paris agreement taking actionclimate_changelet also put record malawi making exemplary progress,health,sector pioneering innovative approaches management hiv aids pandemic among countries african continent successfully rolled test-and-treat programme,health
MWI_2016.L520,41,41,adopted climate_change policy guide domestic implementation paris agreement taking actionclimate_changelet also put record malawi making exemplary progress health sector pioneering innovative approaches management hiv aids,pandemic,among countries african continent successfully rolled test-and-treat programme,health
PRY_2016.L124,28,28,disappeared terrorism cowardly intolerant form reached global dimensions characterized emergence increasingly cruel inhuman groups scorn human life lack respect rights fundamental freedoms effectsclimate_changepollution continue worsen,pandemics,threaten planet global challenges transcend physical borders state immune confronted individually therefore essential promote collective comprehensive strategies based shared responsibility furthermore,health
SGP_2016.L418,14,14,partnership cooperation significant challenges time transnational nature examples include global economic growth climate_change,epidemics,terrorism therein lies importance united nations recent successful conclusion paris agreementclimate_changelast november good example countries around world come together solve problem posed global commons paris,health
SGP_2016.L712,15,15,sdg 2030 agenda south-east asia transboundary haze forest peatland fires started human beings impaired,health,millions people compromised safety aircraft navigation damaged regional economies acceleratedclimate_changeassociation southeast asian nations asean adopted road map achieve hope haze-free asean 2020 need strengthen partnerships,health
SLE_2016.L50,45,45,development goals sdgs signing paris agreementclimate_changeconvening first world humanitarian summit sierra leone always remember secretary-general deep appreciation exemplary role mobilizing support successful fight deadly ebola,disease,theme chosen president debate,health
TON_2016.L708,48,48,nations framework conventionclimate_changesubsequent protocol tonga affirms ongoing commitment implementing objectives core international framework climate_change seriousness negative impacts climate_change underestimated impacts threaten territorial integrity land water,health,infrastructure,health
TON_2016.L720,36,36,nations framework convention climate_change subsequent protocol tonga affirms ongoing commitment implementing objectives core international frameworkclimate_changeseriousness negative impacts climate_change underestimated impacts threaten territorial integrity land water,health,infrastructure food security biological diversity livelihoods ecosystems maintenance international peace security determined solely,health
TON_2016.L724,32,32,nations framework convention climate_change subsequent protocol tonga affirms ongoing commitment implementing objectives core international framework climate_change seriousness negative impactsclimate_changeunderestimated impacts threaten territorial integrity land water,health,infrastructure food security biological diversity livelihoods ecosystems maintenance international peace security determined solely major way issue disarmament,health
TTO_2016.L152,35,35,agenda sustainable development goals sdgs covers multitudinous threats collective well-being longevity civilization existential hazard caused unmitigatedclimate_changeinsidious threats violence extremism terrorism crises forced displacement spread infectious,diseases,illnesses ebola chikungunya zika clear challenges time far exceed limits geography demography therefore diminish,health
TTO_2016.L152,36,36,sustainable development goals sdgs covers multitudinous threats collective well-being longevity civilization existential hazard caused unmitigatedclimate_changeinsidious threats violence extremism terrorism crises forced displacement spread infectious diseases,illnesses,ebola chikungunya zika clear challenges time far exceed limits geography demography therefore diminish,health
VCT_2016.L364,27,27,programmes policies mind saint vincent grenadines government comprehensively incorporated 2030 agenda planning focused economic development job creation quality education poverty eradication strengthening institutions infrastructurerenewable_energyclimate resilience,health,well-being security citizens central national medium-term development plans year saint vincent grenadines launched zero-hunger trust fund inspired goals sdgs zero-hunger trust fund,health
VNM_2016.L182,27,27,industrial revolution promises bring humanity new higher level development challenges means developing countries particular continue suffer weak global economic recovery rising protectionism major economiesclimate_changenatural disasters,epidemics,food water security depletion natural resources humanitarian migration crises also negative far-reaching implications many countries regions development income gaps widening national regional,health
