docname,from,to,pre,keyword,post,pattern
SWZ_2008.L54,31,31,ban ki-moon entire staff united nations efforts carrying vision programmes united nations world continues face many challenges include catastrophic effectsclimate_changecomplicated diseases tuberculosis malaria hiv aids,epidemic,food shortages situation compounded high prices fuel food instability international finance slow efforts fight poverty attain sustainable development,health
TUR_2008.L102,22,22,enormous gap wealthiest least fortunate certainly made considerable progress direction including towards meeting millennium development goals however common fight poverty illiteracy,epidemic,diseases child mortalityclimate_changestill far contrary volatile fuel prices food crisis global economic slowdown brought even 08-51570 challenging development security environment circumstances fight terrorism racism xenophobia,health
TUR_2008.L102,23,23,enormous gap wealthiest least fortunate certainly made considerable progress direction including towards meeting millennium development goals however common fight poverty illiteracy epidemic,diseases,child mortalityclimate_changestill far contrary volatile fuel prices food crisis global economic slowdown brought even 08-51570 challenging development security environment circumstances fight terrorism racism xenophobia forms,health
VCT_2008.L852,6,6,vibrant people denied participation world,health,organization specialized agencies caribbean midst annual hurricane season awesome winds sea surges torrential rains gustav hanna ike brought issueclimate_changesharp relief matter life death people caribbean,health
VNM_2008.L377,30,30,nam seriously observed commitments actively participated addressing global issues strongly support bali road map aims establish legal framework international cooperation addressingclimate_changebeyond 2012 despite natural disasters,epidemics,viet nam honouring commitments maintain volume rice exports million tons annually intend continue efforts ease pressures caused rising price,health
ZMB_2008.L796,42,42,mitigation measures zambia like sub-saharan africa spared adverse effectsclimate_changeincreased exposure drought rising temperatures erratic rainfall extreme_weather conditions threatening water agricultural systems thereby condemning millions face,malnutrition,water shortages mr tanin afghanistan vice-president took,health
ZMB_2008.L804,34,34,mitigation measures zambia like sub-saharan africa spared adverse effects climate_change increased exposure drought rising temperatures erratic rainfallextreme_weatherconditions threatening water agricultural systems thereby condemning millions face,malnutrition,water shortages mr tanin afghanistan vice-president took chair let now turn ongoing reforms united nations,health
ATG_2009.L106,15,15,economic crisis since great depression additional challenges currently confront us include increased incidence impact,pandemic,diseases worsening poverty hunger trap millions around globe adverse consequencesclimate_changetensions peace security increasing environmental degradation history recorded success leaders determined stewardship turbulent times years ago,health
ATG_2009.L106,16,16,economic crisis since great depression additional challenges currently confront us include increased incidence impact pandemic,diseases,worsening poverty hunger trap millions around globe adverse consequencesclimate_changetensions peace security increasing environmental degradation history recorded success leaders determined stewardship turbulent times years ago much,health
BEN_2009.L514,10,10,education making free caesarean sections available better approach reproductive,health,social measures implemented time major work begun infrastructure however ongoing economic recession worsening harmful consequencesclimate_changethreaten seriously jeopardize considerable progress made implementing pivotal national project one,health
BGD_2009.L649,40,40,now climate_change adversely impacting low-lying deltaic monsoonal country although bangladesh's contributionclimate_changenegligible one worst victims erratic floods cyclones droughts earthquakes disrupting agriculture challenging water resources well,health,energy urban planning particular cyclones battering coastal areas taken,health
BHR_2009.L985,18,18,security council maintain momentum activate peace development twin concerns world natural feel frustration face prevailing environmental degradation,pandemics,desertification poverty water scarcity depletion ozone layerclimate_changeworld financial crisis challenges represent imminent threat life now future generations therefore overstatement say twenty-first century destinies intertwined need,health
BRB_2009.L118,26,26,myriad crises face need effective global responses indeed world facing major economic political social upheaval threat food fuel scarcity worst economic financial crisis decades challengeclimate_changeinfluenza,pandemics,assumed international multidimensional character together undermined foundations multilateral system exacerbating already existing disparities approach developed economies crisis create national stimulus packages bail failing,health
CHE_2009.L36,28,28,away collapsed brought global financial system verge breakdown ensuing turbulence finance sector led severe global economic downturn illustrates interconnectedness world reminds us issuesclimate_changefood crisis migration,pandemics,terrorism proliferation weapons mass destruction confined national borders rising global challenges requires determined coordinated action national regional international levels international cooperation,health
CHN_2009.L69,31,31,time world remains grip financial crisis prospects economic recovery still clear worldwide unemployment poverty worsening development imbalances acute global issuesclimate_changefood security energy resource security public,health,security thrown sharp relief non-traditional security threats including terrorism proliferation weapons mass destruction transnational organized crime major communicable,health
CHN_2009.L477,31,31,trade investment cooperation open markets one another step south-south cooperation thirdly pursue cooperation open mind work mutual benefit common progressclimate_changefood security energy resource security public,health,security global challenges country immune way us meet challenges ensure harmony peace engage closer international cooperation climate_change one,health
CHN_2009.L501,9,9,progress climate_change food security energy resource security public,health,security global challenges country immune way us meet challenges ensure harmony peace engage closer international cooperationclimate_changeone serious challenges human survival development international cooperation key tackling,health
CMR_2009.L518,46,46,visible consequences every country regardingclimate_changeparticular africa like continents hard hit despite low level greenhouse gas emissions global_warming salient feature affects many socio-economic sectors including energy,health,agriculture livestock production,health
CMR_2009.L528,36,36,visible consequences every country regarding climate_change particular africa like continents hard hit despite low levelgreenhousegas emissions global_warming salient feature affects many socio-economic sectors including energy,health,agriculture livestock production ecosystems rapid desertification regard spectacular drying lake chad surface shrunk,health
CMR_2009.L531,33,33,visible consequences every country regarding climate_change particular africa like continents hard hit despite low level greenhouse gas emissionsglobal_warmingsalient feature affects many socio-economic sectors including energy,health,agriculture livestock production ecosystems rapid desertification regard spectacular drying lake chad surface shrunk square kilometres 1960s,health
COG_2009.L161,23,23,human rights solidarity universal justice word destiny humankind men women know billion people still live less dollar day children die unnecessarily hunger,disease,us knowclimate_changeabetting scourges countries least responsible suffer effects producing per cent greenhouse gas emissions continent affected global_warming poor populations main victims agriculture fauna infrastructure coastal,health
COG_2009.L172,12,12,billion people still live less dollar day children die unnecessarily hunger,disease,us know climate_change abetting scourges countries least responsible suffer effects producing per centgreenhousegas emissions continent affected global_warming poor populations main victims agriculture fauna infrastructure coastal,health
COG_2009.L177,7,7,dollar day children die unnecessarily hunger,disease,us know climate_change abetting scourges countries least responsible suffer effects producing per cent greenhouse gas emissions continent affectedglobal_warmingpoor populations main victims agriculture fauna infrastructure coastal,health
CYP_2009.L196,42,42,dire consequences world today faces multiple challenges threats includingclimate_changedepletion resources human rights abuses failure protect vulnerable populations increased regional inter-state conflict proliferation weapons mass destruction,pandemics,rostrum heard desperate voices live small-island states,health
CYP_2009.L229,11,11,vulnerable populations increased regional inter-state conflict proliferation weapons mass destruction,pandemics,rostrum heard desperate voices live small-island states despairing appeal young people dramatic warnings scientistsclimate_changetake measures now face risk extinction join voice lend support proposals taking,health
DEU_2009.L170,18,18,stands global responsibility developing countries must also live responsibilities responsible governance respect human rights environmental protection fight,epidemics,strengthening rights women challenges country responsibility meetclimate_changepre-eminent challenge twenty-first century threatens well-being security economic development lead uncontrollable risks dramatic damage take resolute action distant future,health
EGY_2009.L47,48,48,global challenges facingclimate_changefood crisis crises international peace supplemented additional emerging global challenges make essential us redouble efforts coordinated collective manner global financial crisis together spread,diseases,h1n1,health
EGY_2009.L1332,21,21,palestinian question reform united nations unilateral sanctions global financial economic crisis internationally agreed development goals food security africa's special needs,diseases,pandemics role civil societyclimate_changeenergy human trafficking international terrorism dialogue among civilizations religions second declaration necessity ending economic commercial financial embargo imposed 09-52586 united states america,health
EGY_2009.L1332,22,22,palestinian question reform united nations unilateral sanctions global financial economic crisis internationally agreed development goals food security africa's special needs diseases,pandemics,role civil societyclimate_changeenergy human trafficking international terrorism dialogue among civilizations religions second declaration necessity ending economic commercial financial embargo imposed 09-52586 united states america cuba,health
FJI_2009.L90,23,23,membership participation united nations fiji people like small developing island states among first victims contemporary global crises financial economic crisis 2009 h1n1,pandemic,dramatic phenomenonclimate_changesmall economies like global events real effect daily livelihoods people part attempted respond crises making policy changes adjustments encouraging people grow food discouraging food,health
FSM_2009.L856,23,23,failure can economic considerations become excuse inaction 09-52470 throughout history humankind examples nations disagreed coming together survival crisis time war economic hardship,epidemic,today crisisclimate_changesimply time waste therefore stop talk cheap action speaks louder words need action let us go copenhagen seal deal meet copenhagen,health
GBR_2009.L302,5,5,act together prevent avoidable,illness,can plan save tomorrow children dying africa today every day say need world agreement urgent challenges now let elaborate firstclimate_changedespite promises made road successful outcome,health
JOR_2009.L191,27,27,changes since establishment organization well technological advancements information communications revolution well-known effects globalization made world global village everybody feels negative effects problems challenges desertificationclimate_changeterrorism poverty,pandemics,proliferation weapons mass destruction among major achievements united nations pioneering role seeking eliminate colonization occupation order ensure right peoples self-determination although organization,health
LBY_2009.L68,39,39,us whole world come together unite efforts defeat challenges principal common enemyclimate_changeinternational crises capitalist economic decline food water crises desertification terrorism immigration piracy man-made natural,epidemics,nuclear proliferation perhaps influenza h1n1 virus created laboratory got control,health
MCO_2009.L339,3,3,outbreaks infectious,diseases,pandemics phenomena desertification drought well acidification seas oceans exacerbated man-made climatic change failure copenhagen negotiations option commitment worldwide counterparts stated yesterday frameworkclimate_changesummit convened secretary- general,health
MCO_2009.L339,4,4,outbreaks infectious diseases,pandemics,phenomena desertification drought well acidification seas oceans exacerbated man-made climatic change failure copenhagen negotiations option commitment worldwide counterparts stated yesterday frameworkclimate_changesummit convened secretary- general unequivocal,health
MDA_2009.L73,24,24,distinguished speakers taken floor debate elaborated extensively pressing issues international community faced past year current financial economic crisis food energy crises first flu,pandemic,centuryclimate_changecore deliberations united nations revealing central role organization dealing problems reformed robust effective organization deliver prompt reactions sustainable responses major challenges peace security development disarmament,health
MMR_2009.L234,39,39,deal must comprehensive consistent principle common differentiated responsibilities global financial economic crisisclimate_changecrisis compounded problems faced recent years include rising food prices high energy prices spread,pandemic,diseases single country can effectively overcome problems alone global community,health
MMR_2009.L234,40,40,must comprehensive consistent principle common differentiated responsibilities global financial economic crisisclimate_changecrisis compounded problems faced recent years include rising food prices high energy prices spread pandemic,diseases,single country can effectively overcome problems alone global community,health
MNE_2009.L67,26,26,secretary-general mr ban ki-moon outstanding efforts leading organization trying times heard statements previous distinguished speakers given impact world economic financial crisis related food energy crisesclimate_changeflu,pandemic,economic social growth development politics global relations including achievement millennium development goals mdgs internationally agreed development goals coordinated concerted global effort can yield,health
MNE_2009.L527,45,45,deal copenhagen montenegro organize regional conferenceclimate_changesustainable development mediterranean south-east european countries budva october millennium development goals require every one us redouble efforts reduce poverty improve,health,education promote peace human,health
MNE_2009.L659,13,13,message 2008 yokohama declaration aimed giving momentum current development issues including education,health,sanitary measures within framework mdgs development agriculture improve food security measures tackleclimate_changewell establishing maintaining peace prerequisite economic growth emphasize crucial importance debate concept responsibility protect,health
MOZ_2009.L285,12,12,just described mozambique welcomes launching united nations september 2009 african leaders,malaria,alliance pledges play active role support new mechanism aimed coordinating responses scourge malariaclimate_changeanother pressing challenge therefore afford fail seal deal december fifteenth conference parties united,health
MOZ_2009.L302,8,8,support new mechanism aimed coordinating responses scourge,malaria,climate_change another pressing challenge therefore afford fail seal deal december fifteenth conference parties united nations framework conventionclimate_changecopenhagen hope commitments made summit climate_change held september inspire,health
MOZ_2009.L308,2,2,scourge,malaria,climate_change another pressing challenge therefore afford fail seal deal december fifteenth conference parties united nations framework convention climate_change copenhagen hope commitments made summitclimate_changeheld september inspire,health
NAM_2009.L269,41,41,supports efforts secretary-general mobilize political ensure good legally binding agreementclimate_changecopenhagen december namibia one countries highest socio-economic inequality world colonial past nevertheless country made progress provision,health,education critical services majority population course meet number,health
NGA_2009.L326,6,6,abuja-plus ten summit roll back,malaria,2011 therefore appreciate support secretary-general make proposed summit possible also facilitate realization objective quality participation just concluded 2009 summitclimate_changetestimony global realization climate_change truly become seen,health
NGA_2009.L330,2,2,back,malaria,2011 therefore appreciate support secretary-general make proposed summit possible also facilitate realization objective quality participation just concluded 2009 summit climate_change testimony global realizationclimate_changetruly become seen,health
NPL_2009.L1027,16,16,frequent destructive delayed insufficient rainfall affected crop production poorest poor farmers suffered worst effects agriculture,health,livelihoods infrastructure affected nepal recently hosted high-level regional conferenceclimate_changefocusing himalayan region order highlight seriousness problem global_warming impacts himalayan range unprecedented snow melt himalayas jeopardize lives,health
NPL_2009.L1035,8,8,poorest poor farmers suffered worst effects agriculture,health,livelihoods infrastructure affected nepal recently hosted high-level regional conference climate_change focusing himalayan region order highlight seriousness problemglobal_warmingimpacts himalayan range unprecedented snow melt himalayas jeopardize lives,health
NRU_2009.L586,49,49,see impactsclimate_changelive every day flooding inundation already eroding shores contaminating water supply higher water temperatures ocean acidification damaging marine ecosystems depend food economic livelihood pray,malaria,,health
NRU_2009.L631,6,6,depend food economic livelihood pray,malaria,find way doorstep applaud commitment secretary- general addressing issue efforts build consensus among world leaders week high- level summitclimate_changeasia africa arctic visited affected regions observe,health
NRU_2009.L692,46,46,million less order avoid direclimate_changescenarios however developed countries proposed emissions targets result concentrations far higher acceptable policy human lives stake doctor prescribes medicine treat serious,illness,give patient half,health
PER_2009.L795,44,44,indirect peru also proposes comprehensive programmes adaptationclimate_changeestablished programmes financed global environment facility world bank identify comprehensive approach sectoral adaptation emphasize strategies reduce occurrence disasters protect,health,food security affected populations economic,health
PLW_2009.L731,1,1,,health,safety world's peoples heart ideals united nations order promote ideals recommend taiwan invited participate meaningfully international civil aviation organization icao united nations framework conventionclimate_changecoming copenhagen,health
PNG_2009.L230,35,35,together address many global issues challenges face collectively human family together must confront first continuing threatsclimate_changeglobal_warming global food crisis now compounded global financial crisis threats,diseases,know borders h1n1 hiv aids malaria tuberculosis cholera et cetera secondly must achieve together,health
PNG_2009.L230,41,41,face collectively human family together must confront first continuing threatsclimate_changeglobal_warming global food crisis now compounded global financial crisis threats diseases know borders h1n1 hiv aids,malaria,tuberculosis cholera et cetera secondly must achieve together,health
PNG_2009.L231,34,34,together address many global issues challenges face collectively human family together must confront first continuing threats climate_changeglobal_warmingglobal food crisis now compounded global financial crisis threats,diseases,know borders h1n1 hiv aids malaria tuberculosis cholera et cetera secondly must achieve together social,health
PNG_2009.L231,40,40,face collectively human family together must confront first continuing threats climate_changeglobal_warmingglobal food crisis now compounded global financial crisis threats diseases know borders h1n1 hiv aids,malaria,tuberculosis cholera et cetera secondly must achieve together social,health
PNG_2009.L955,29,29,crises now facing humanity consequences appear dire truly global global challenge can met concerted global response papua new guinea today see evidenceclimate_changeinundation coastal areas increase,malaria,due warming highlands region country especially plight people carteret islands sea level risen people resettled therefore strongly support recent alliance,health
PNG_2009.L985,1,1,,malaria,due warming highlands region country especially plight people carteret islands sea level risen people resettled therefore strongly support recent alliance small island states declarationclimate_changemany small,health
POL_2009.L140,30,30,address problem crisis extent crisis new problem participating general assembly session first time can state earlier problems conflicts many recent problemclimate_changeproblem poverty new add problem,health,aids epidemics however problem current crisis appeared last year coming like refer president ukraine said many causes conflict world,health
POL_2009.L140,32,32,crisis extent crisis new problem participating general assembly session first time can state earlier problems conflicts many recent problemclimate_changeproblem poverty new add problem health aids,epidemics,however problem current crisis appeared last year coming like refer president ukraine said many causes conflict world,health
ROU_2009.L143,35,35,better understand democracy's transformational sweep throughout world now face important challenges humanity ever faced negative impactclimate_changeexacerbated global financial economic crisis food crisis rise energy prices,pandemics,world experiencing increasingly tense situations make efforts meet challenges new century even sensitive now,health
ROU_2009.L544,28,28,safer sustainable system consider least four essential elements first managing current economic crisis secure sustainable development growth second staying focused demanding interconnected issuesclimate_changepoverty food security,health,energy migration lack democracy parts world maintaining international peace security stability third element concerns consolidation international law fourth concerns strengthening increasing,health
SLB_2009.L285,34,34,temperature increase well degrees celsius prevent acidification oceans threatening existence deforestation forest degradation contribute nearly per centgreenhousegas emissions solomon islands agrees one mitigating solutions protecting,health,environment urge considered outcome copenhagen country currently carrying inventory forests intends participate carbon market also,health
SLE_2009.L122,30,30,challenges goals civilizations began magnificent blueprints meeting challenges specific particular regions world advances technology communications made problems longer specific particular regionsclimate_changehiv aids tuberculosis swine flu,pandemics,food fuel crises including present global economic meltdown terrorism nuclear proliferation drug trafficking beyond capacity world's civilizations tackle without,health
STP_2009.L421,16,16,embodies need attention can say sao tome principe made determined efforts especially achieve goals areas,health,education almost although yet completely satisfied biggest debates relatedglobal_warmingconcentrate substitutions fossil fuels order reduce carbon_emissions contribute greenhouse effect debate gone temperatures risen causing glaciers polar,health
STP_2009.L428,9,9,principe made determined efforts especially achieve goals areas,health,education almost although yet completely satisfied biggest debates related global_warming concentrate substitutions fossil fuels order reducecarbon_emissionscontribute greenhouse effect debate gone temperatures risen causing glaciers polar,health
STP_2009.L430,7,7,determined efforts especially achieve goals areas,health,education almost although yet completely satisfied biggest debates related global_warming concentrate substitutions fossil fuels order reduce carbon_emissions contributegreenhouseeffect debate gone temperatures risen causing glaciers polar,health
STP_2009.L612,16,16,increased participation united nations republic china taiwan regard welcome admission nation million people observer world,health,organization hope united nations agencies united nations framework conventionclimate_changeinternational civil aviation organization can also take advantage valuable contributions developed country can make respect urgent needs,health
