docname,from,to,pre,keyword,post,pattern
MHL_2011.L813,39,39,overlook taiwan's strong efforts promoting peace 11-51398 stability asia-pacific region including regardclimate_change2009 invitation world health organization taiwan participate observer benefited global medical progress including non-communicable,diseases,also serves effective model wider participation key organizations urge united,health
MRT_2011.L122,29,29,organization wish full success commend persistent herculean efforts resolve many issues including strengthening international peace security achieving millennium development goals mdgs combatingclimate_changemitigating threats famine endemic,disease,well challenges hinder well-being humanity sixty-sixth session general assembly taking place sensitive political juncture region popular uprisings many arab countries,health
NGA_2011.L952,2,2,non-communicable,diseases,end meeting vein welcome discussions high-level meeting desertification land degradation issues continue pose challenges development efforts nigeria strongly supports united nations framework conventionclimate_changeconvention biological diversity,health
NIC_2011.L616,20,20,levelled territory affected fukushima accident vehemently call states nuclear reactor installations take measures avoid similar accidents gravely endanger people's,health,harm environment 11-51398 upcoming durbanclimate_changeconference rio conference sustainable development provide renewed opportunities must allow squander truly break destructive logic redirect humankind towards development harmony mother,health
PLW_2011.L1078,23,23,order promote efficacy goals ideals united nations recommend taiwan invited participate meaningfully united nations system believe united nations fully properly address issues,health,aviation safetyclimate_changeunless taiwan allowed participate activities world health organization international civil aviation organization united nations framework convention climate_change appeal world allow taiwan participate important united,health
PLW_2011.L1078,31,31,united nations recommend taiwan invited participate meaningfully united nations system believe united nations fully properly address issues health aviation safetyclimate_changeunless taiwan allowed participate activities world,health,organization international civil aviation organization united nations framework convention climate_change appeal world allow taiwan participate important united nations,health
PLW_2011.L1095,6,6,nations fully properly address issues,health,aviation safety climate_change unless taiwan allowed participate activities world health organization international civil aviation organization united nations framework conventionclimate_changeappeal world allow taiwan participate important united,health
PLW_2011.L1095,16,16,nations fully properly address issues health aviation safety climate_change unless taiwan allowed participate activities world,health,organization international civil aviation organization united nations framework conventionclimate_changeappeal world allow taiwan participate important united nations entities finally palau relatively new state joined world community,health
PNG_2011.L184,22,22,way united nations deliver mandate particularly new country programme papua new guinea rolled beginning january 2012 target areas governance social justice,health,education gender environmentclimate_changedisaster management new country programme part overall efforts achieve millennium development goals mdgs since inaugural mdg report published 2004 papua new guinea produced,health
SLB_2011.L1358,12,12,system terms wide range international development programmes welcome participation observer world,health,assembly continue call arrangements extended united nations treaty bodies including united nations conventionclimate_changeunfccc ensure meaningful participation taiwan people affairs international community solomon islands also acknowledges,health
SLE_2011.L906,35,35,excessive indulgence repression perpetrated strong like emphasize international cooperation peaceful settlement disputes life blood organization deliberationsglobal_warminghuman trafficking threats nuclear weapons scourge abject poverty communicable non-communicable,diseases,ruthless natural disasters flow illicit drugs seemingly unending upheavals financial markets always remember need,health
SMR_2011.L617,34,34,issues leading role global governance questioned anyone destinies peoples linked global threats increasingly direct way today threatsclimate_changebiodiversity loss economic financial employment crises food security public,health,disarmament non-proliferation weapons fight terrorism recognized interdependent basis create new form international cooperation multilateralism coordinate,health
SUR_2011.L134,1,1,,pandemics,aids malaria non-communicable diseases threats related terrorism weapons mass destruction human trafficking illicit trade use small arms light weapons illicit drug trade risks posedclimate_changecontinuing vulnerability,health
SUR_2011.L134,3,3,pandemics aids,malaria,non-communicable diseases threats related terrorism weapons mass destruction human trafficking illicit trade use small arms light weapons illicit drug trade risks posedclimate_changecontinuing vulnerability women youth,health
SUR_2011.L134,5,5,pandemics aids malaria non-communicable,diseases,threats related terrorism weapons mass destruction human trafficking illicit trade use small arms light weapons illicit drug trade risks posedclimate_changecontinuing vulnerability women youth call upon,health
TUV_2011.L369,26,26,tuvalu national sustainable development strategy fourth united nations conference least developed countries scheduled next month furthermore least developed country tuvalu vulnerable global economic shocks impactsclimate_changeoutbreaks,disease,including non-communicable diseases tuvalu continues call appeal united nations take vulnerabilities seriously consideration addressing question graduation ldcs despite ambitious target istanbul programme action,health
TUV_2011.L369,29,29,development strategy fourth united nations conference least developed countries scheduled next month furthermore least developed country tuvalu vulnerable global economic shocks impactsclimate_changeoutbreaks disease including non-communicable,diseases,tuvalu continues call appeal united nations take vulnerabilities seriously consideration addressing question graduation ldcs despite ambitious target istanbul programme action,health
TUV_2011.L591,9,9,calls upon united nations subsidiary bodies especially world,health,organization international civil aviation organization allow taiwan participate fully meaningfully meetings activities including united nations meetingsclimate_changeclimate_change priority global issue twenty-first century beyond therefore requires global,health
TUV_2011.L592,8,8,upon united nations subsidiary bodies especially world,health,organization international civil aviation organization allow taiwan participate fully meaningfully meetings activities including united nations meetings climate_changeclimate_changepriority global issue twenty-first century beyond therefore requires global,health
UKR_2011.L745,1,1,,health,reducing child mortality curbing spread hiv aids tuberculosis ensuring gender equality working today's immediate tasks believe necessary pay greater attention 11-50702 increasingly acute issueclimate_changeenvironmental protection,health
UKR_2011.L745,4,4,health reducing child,mortality,curbing spread hiv aids tuberculosis ensuring gender equality working today's immediate tasks believe necessary pay greater attention 11-50702 increasingly acute issueclimate_changeenvironmental protection endorse idea creating,health
USA_2011.L1978,13,13,nations join us meeting goal making sure nations core capacities address public,health,emergencies place 2012 commitment health people demands preserve planet must put actionclimate_changedemands tap power science save resources scarce together must continue work build progress made,health
USA_2011.L1978,18,18,nations join us meeting goal making sure nations core capacities address public health emergencies place 2012 commitment,health,people demands preserve planet must put actionclimate_changedemands tap power science save resources scarce together must continue work build progress made copenhagen cancún major economies represented,health
VNM_2011.L97,27,27,member organization today peace cooperation development remain over-arching themes time yet tensions conflicts persist continents regions owing unresolved differences within nations threat use forceclimate_changenatural disasters,pandemics,transnational crime proliferation weapons mass destruction international terrorism still challenges demand effective responses world economy's unstable recovery coupled economic downturns many developed,health
VNM_2011.L295,37,37,initiatives mobilize resources capacities fulfil internationally agreed action plans including mdgs facilitate multilateral negotiationsclimate_changewell disarmament non-proliferation weapons mass destruction provide solutions pressing issues desertification non-communicable,diseases,nuclear safety security respond global financial economic crisis help mentioning efforts united,health
BGD_2012.L735,18,18,per cent school-age children enrolled primary schools achieved gender parity primary secondary education established community clinics ensure,nutrition,health care rural people especially mothers childrenclimate_changetrust fund set implement adaptation mitigation programmes undertakings helped achieving millennium development goals mdgs gender parity infant maternal mortality,health
BGD_2012.L735,19,19,per cent school-age children enrolled primary schools achieved gender parity primary secondary education established community clinics ensure nutrition,health,care rural people especially mothers childrenclimate_changetrust fund set implement adaptation mitigation programmes undertakings helped achieving millennium development goals mdgs gender parity infant maternal mortality ahead,health
BGD_2012.L735,43,43,nutrition health care rural people especially mothers childrenclimate_changetrust fund set implement adaptation mitigation programmes undertakings helped achieving millennium development goals mdgs gender parity infant maternal,mortality,ahead 2015 achievements earned us global,health
BGD_2012.L802,21,21,lead group champion education first initiative welcome high-level panel post-2015 development agenda consider coherence sustainable development goals prioritize poverty hunger,nutrition,global food energy securityclimate_changeglobal partnership sustainable development hope high-level panel also consider formulating position painful plight autistic disadvantaged children constitute per cent world's population home,health
BGD_2012.L865,6,6,speaks launched global autism public,health,initiative current assembly session submit draft resolution autism spectrum disorder hope receive assembly's support efforts hindered unjust developments resultingclimate_changeincreasing poverty property loss human displacement consequent,health
BWA_2012.L270,28,28,aggression republic south sudan north led instability region typical sudanese regime many years live times common well-being seriously compromised threats nuclear proliferation terrorismclimate_changeenvironmental degradation underdevelopment,pandemic,diseases coupled effects global economic financial crisis internal conflicts resolution myriad challenges threats confronting mankind requires urgent concerted action international community,health
BWA_2012.L270,29,29,republic south sudan north led instability region typical sudanese regime many years live times common well-being seriously compromised threats nuclear proliferation terrorismclimate_changeenvironmental degradation underdevelopment pandemic,diseases,coupled effects global economic financial crisis internal conflicts resolution myriad challenges threats confronting mankind requires urgent concerted action international community,health
COG_2012.L800,2,2,education,health,affected crisis light delegation reaffirms responsibility central role united nations forging spirit solidarity cooperation can enable commitments made areas aid financing development respectedclimate_changeremains serious threat,health
CPV_2012.L1004,27,27,affirmed princeton university united nations needed new vision new paradigm new multilateralism help ensure global economic financial stability combat poverty re-establish peace respond effectsclimate_changeimprove global,health,fight terrorism ensure disarmament non-proliferation closing ceremony united nations conference sustainable development rio june stated rio shown multilateralism irreplaceable instrument global expression,health
DMA_2012.L44,34,34,al-nasser able manner presided sixty- sixth session sixty-seventh session general assembly convened time face myriad challenges impactclimate_changecivil conflicts hunger starvation poverty hiv aids chronic non-communicable,diseases,challenges however equally matched tremendous opportunities created rapid advancement science technology unprecedented level international cooperation,health
FSM_2012.L524,5,5,pacific accept primary responsibility,health,rests government seeking assistance international community capacity-building institutional strengthening policy formulation recognize contributing effects nutrition lifestyle epidemic also mindful factclimate_changemagnified challenge result threat poses food,health
FSM_2012.L524,20,20,pacific accept primary responsibility health rests government seeking assistance international community capacity-building institutional strengthening policy formulation recognize contributing effects,nutrition,lifestyle epidemic also mindful factclimate_changemagnified challenge result threat poses food security traditional lifestyle micronesians federated states micronesia supports greater participation women social political economic development,health
FSM_2012.L524,22,22,pacific accept primary responsibility health rests government seeking assistance international community capacity-building institutional strengthening policy formulation recognize contributing effects nutrition lifestyle,epidemic,also mindful factclimate_changemagnified challenge result threat poses food security traditional lifestyle micronesians federated states micronesia supports greater participation women social political economic development look development,health
GMB_2012.L278,33,33,late relevance organization times questioned one element remains unchallenged character best forum confronting global challenges convene discuss issuesclimate_changeeconomic crises financial turmoil food insecurity conflicts fighting,disease,poverty special interests africa convening power united nations confers legitimacy indeed unparalleled elsewhere developing countries therefore,health
IRL_2012.L808,7,7,closely secretary- general build support scaling,nutrition,movement must collectively must act now recognize systemic linkages recurring food price crises humanitarian emergencies chronic undernourishment effectsclimate_changenothing connects us across borders across oceans across,health
JAM_2012.L149,26,26,feeling secure time across world increasing sense impatience agitation born sense growing global insecurity accordingly united nations agenda expanded focus address multifaceted challenges food securityclimate_changeglobal,pandemics,global economic financial crisis already witnessed citizens several nations spring action demands change others chose occupy various spaces protest light reality many indeed,health
KNA_2012.L1415,30,30,energy information technology community development education name just nation even region however taiwan's unfailing valued contributions work united nations framework conventionclimate_changeinternational civil aviation organization world,health,assembly forums long demonstrated outstanding credentials valued impactful member global community fitting just remaining strictures pertaining taiwan's standing among,health
KOR_2012.L39,26,26,session every confidence able leadership session crowned great success humankind continues advance drawing collective wisdom address challenges throughout human history although new global challenges mankindclimate_changepoverty,disease,underdevelopment terrorism proliferation weapons mass destruction now testing international community doubt overcome challenges future path united nations symbol collective wisdom take greater responsibility,health
KWT_2012.L1065,39,39,countries consequences global financial crisis rise basic commodity prices clear negative impactclimate_changegrowing frequency natural disasters intensification terrorism put focus ugly face poverty hunger well spread,epidemics,communicable dangerous diseases despite notable accomplishments many states efforts reach,health
KWT_2012.L1065,42,42,financial crisis rise basic commodity prices clear negative impactclimate_changegrowing frequency natural disasters intensification terrorism put focus ugly face poverty hunger well spread epidemics communicable dangerous,diseases,despite notable accomplishments many states efforts reach,health
MEX_2012.L2344,11,11,region united nations considers finds solutions global problems threaten integrity,health,lives millions around world deals famine starvation horn africa epidemics h1n1 virus mexico tacklesclimate_changemust also take action stop wave death suffering drug trade blights lives,health
MEX_2012.L2344,21,21,region united nations considers finds solutions global problems threaten integrity health lives millions around world deals famine starvation horn africa,epidemics,h1n1 virus mexico tacklesclimate_changemust also take action stop wave death suffering drug trade blights lives people respectfully urge exhort united nations take part lead discussion,health
MLI_2012.L777,21,21,in-depth dialogue new strategies aimed mobilizing additional stable predictable resources ensure financing development programmes achievement millennium development goals particular areas,health,education food security environmentclimate_changeone major challenges facing world survival planet threatened natural disasters caused phenomenon seriously affecting living conditions countries sahel mine inter alia inexorable,health
NIC_2012.L935,10,10,important results struggle poverty strengthens process restoring rights translates,health,better education productive service-oriented infrastructure higher living standard citizens soon transformed energy matrix using sourcesrenewable_energy2017 per cent energy consumed renewable_energy decided take necessary steps construction,health
NIC_2012.L941,4,4,restoring rights translates,health,better education productive service-oriented infrastructure higher living standard citizens soon transformed energy matrix using sources renewable_energy 2017 per cent energy consumedrenewable_energydecided take necessary steps construction,health
SLE_2012.L478,27,27,goals many member states particularly global south voyage rough times turbulent worse still effects food fuel financial crises struck global community 2008 well impactclimate_changeconflicts deadly,pandemics,exacerbated situation compromised determination efforts developing countries especially least developed countries ldcs attain internationally agreed development goals including mdgs commend brazil successfully,health
SMR_2012.L1459,15,15,group population subjected violence abuse exploitation vast number children world still access basic services,health,care education besides facing global challenges economic crisis problems connectedclimate_changestates must find resources necessary best meet needs children immediately improve conditions living poorest areas world,health
TTO_2012.L603,42,42,move decisively fully implement obligations united nations framework conventionclimate_changekyoto protocol guarantee survival us vulnerable climate_change climate_variability sea-level rise every moment delay takes us closer demise,health,well-being people central development prevalence non-communicable diseases,health
TTO_2012.L603,49,49,framework conventionclimate_changekyoto protocol guarantee survival us vulnerable climate_change climate_variability sea-level rise every moment delay takes us closer demise health well-being people central development prevalence non-communicable,diseases,,health
TTO_2012.L610,35,35,move decisively fully implement obligations united nations framework convention climate_change kyoto protocol guarantee survival us vulnerableclimate_changeclimate_variability sea-level rise every moment delay takes us closer demise,health,well-being people central development prevalence non-communicable diseases particular poses serious threat caribbean development trinidad,health
TTO_2012.L610,42,42,framework convention climate_change kyoto protocol guarantee survival us vulnerableclimate_changeclimate_variability sea-level rise every moment delay takes us closer demise health well-being people central development prevalence non-communicable,diseases,particular poses serious threat caribbean development trinidad,health
TTO_2012.L611,34,34,move decisively fully implement obligations united nations framework convention climate_change kyoto protocol guarantee survival us vulnerable climate_changeclimate_variabilitysea-level rise every moment delay takes us closer demise,health,well-being people central development prevalence non-communicable diseases particular poses serious threat caribbean development trinidad tobago,health
TTO_2012.L611,41,41,framework convention climate_change kyoto protocol guarantee survival us vulnerable climate_changeclimate_variabilitysea-level rise every moment delay takes us closer demise health well-being people central development prevalence non-communicable,diseases,particular poses serious threat caribbean development trinidad tobago,health
BGR_2013.L96,5,5,still suffer extreme poverty,malnutrition,basic health services many women babies remain remote luxury disparities wealth distribution quality life personal opportunities become extreme across globeclimate_changeenvironmental degradation reached alarming level require,health
BGR_2013.L96,7,7,still suffer extreme poverty malnutrition basic,health,services many women babies remain remote luxury disparities wealth distribution quality life personal opportunities become extreme across globeclimate_changeenvironmental degradation reached alarming level require urgent collective,health
BRB_2013.L155,46,46,made worse many manifestations impactclimate_changeextreme_weather events food crises volatile food crises compounded unprecedented levels terror violence time seen global determination tackle issues barbados recognizes stability,health,productivity global environment,health
BRB_2013.L156,45,45,made worse many manifestations impact climate_changeextreme_weatherevents food crises volatile food crises compounded unprecedented levels terror violence time seen global determination tackle issues barbados recognizes stability,health,productivity global environment particularly,health
BRB_2013.L507,32,32,believes post-2015 development agenda involve commitments eradication poverty hunger environmental sustainability strong emphasis coastal marine resources development sustainable accessiblerenewable_energytechnologies pursuit sustainable agriculture agenda tandem food,nutrition,security gender equality women's empowerment youth development education employment also call emphasis inclusion vulnerable groups including persons,health
BWA_2013.L148,18,18,agenda therefore pledge full support cooperation president ashe efforts usher new development paradigm doubt challenges extreme poverty,disease,lack access affordable energy potable water sanitationclimate_changegender inequality continue haunt millions people especially developing countries account delegation strong view formulation sustainable development goals predicated outcome,health
BWA_2013.L325,41,41,middle-income countries botswana among sub-saharan african countries suffer adverse impactclimate_changenotable manifestations climate_change extreme temperatures water shortages land degradation desertification persistent drought climate_change also adverse impacts,health,food security gratifying progress continues made many countries,health
BWA_2013.L328,38,38,middle-income countries botswana among sub-saharan african countries suffer adverse impact climate_change notable manifestationsclimate_changeextreme temperatures water shortages land degradation desertification persistent drought climate_change also adverse impacts,health,food security gratifying progress continues made many countries implementation united nations,health
BWA_2013.L338,28,28,middle-income countries botswana among sub-saharan african countries suffer adverse impact climate_change notable manifestations climate_change extreme temperatures water shortages land degradation desertification persistent droughtclimate_changealso adverse impacts,health,food security gratifying progress continues made many countries implementation united nations framework convention climate_change delegation believes needs done particularly assist vulnerable,health
BWA_2013.L356,12,12,water shortages land degradation desertification persistent drought climate_change also adverse impacts,health,food security gratifying progress continues made many countries implementation united nations framework conventionclimate_changedelegation believes needs done particularly assist vulnerable countries arid semi-arid areas landlocked transit,health
