docname,from,to,pre,keyword,post,pattern
AUT_1988.L2392,49,49,scientific unionscarbon_dioxideemissions reflects grave concern climatic changes hope elaboration protocol control redaction nitrogen oxide emissions take us another important step forward implementation convention long-range transboundary,air_pollution,,health
SWE_1988.L722,34,34,large-scale effects threat survival inferior arms race alarming research reports tell us climate begun change probable resultgreenhouseeffect life-giving resources destroyed erosion desertification devastation forests people's,health,increasingly affected poisoning water food chains depletion ozone layer causes threats environment lie excessive exploitation,health
FIN_1989.L614,37,37,industrialized developing countries directly affected depletion ozone layer increasing emissions carbon dioxides produce so-calledgreenhouseeffect climate earth increasing presence substances atmosphere cause acid rain direct dangers,health,therefore hardly surprise witnessed increasing international activity field several initiatives taken launch,health
JPN_1989.L2211,22,22,past years blink eye vast continuum history mankind ventured far reaches space sought explore oceans- depths ominous acceleration pace environmental destruction,health,planet gravely threatenedglobal_warmingdestruction ozone layer depletion tropical rain forests acid rain desertification global environmental problems confront us today must dealt entire international community working together,health
LBY_1989.L2164,20,20,unprecedented environmental crisis nature sending us urgent warnings can ignored peril numerous growing indicators crisis around us addition serious,air_pollution,desertification soil erosion depletion forestsgreenhouseeffect unusual climatic changes deterioration ozone layer also problem nuclear industrial toxic wastes given rise justifiable concern especially third world scheming,health
DEU_1990.L2661,39,39,made worthwhile companies squandering energy resources another key problem changing world climategreenhouseeffect depletion ozone layer bach earth's many environmental problems exacerbated two central problems solved,air_pollution,extinction species erosion increase dramatically reduce chances survival future generations,health
ATG_1991.L898,8,8,united nations antarctica important barometer earth's environmental,health,significant source food oceans fish fragile ecological system allow raped hope successful exploitation industrial activity antarctica tiltcarbon_dioxideimbalance atmosphere drill larger holes earth's protective ozone layer,health
BTN_1991.L1109,34,34,world's resources far goal indeed every day brings alarming evidence diminishing capacity planet sustain life ominous signsgreenhouseeffect depletion ozone layer include climatic changes increase certain,health,problems air water pollution soil degradation desertification deforestation threaten world's food supplies living conditions overpopulation,health
CAN_1991.L1807,43,43,towards two solitudes rich poor true canada worriedclimate_changeworried loss species pollutants arctic food chain ocean resources forests developed country recognise developing countries eliminating poverty ensuring,nutrition,eradicating disease top priorities inextricably linked,health
CAN_1991.L1807,45,45,solitudes rich poor true canada worriedclimate_changeworried loss species pollutants arctic food chain ocean resources forests developed country recognise developing countries eliminating poverty ensuring nutrition eradicating,disease,top priorities inextricably linked,health
ATG_1993.L562,18,18,emitted atmosphere altering global environment fatal consequences forecast earth's climate biodiverse flora fauna agriculture living animals human,health,well-being borne mind contribution small island statesclimate_changeglobal_warming sea-level rise zero effects climate_change global_warming sea-level rise reduce small island states like mine zero existence stake peace,health
ATG_1993.L563,17,17,atmosphere altering global environment fatal consequences forecast earth's climate biodiverse flora fauna agriculture living animals human,health,well-being borne mind contribution small island states climate_changeglobal_warmingsea-level rise zero effects climate_change global_warming sea-level rise reduce small island states like mine zero existence stake peace,health
ATG_1993.L568,12,12,consequences forecast earth's climate biodiverse flora fauna agriculture living animals human,health,well-being borne mind contribution small island states climate_change global_warming sea-level rise zero effectsclimate_changeglobal_warming sea-level rise reduce small island states like mine zero existence stake peace,health
ATG_1993.L569,11,11,forecast earth's climate biodiverse flora fauna agriculture living animals human,health,well-being borne mind contribution small island states climate_change global_warming sea-level rise zero effects climate_changeglobal_warmingsea-level rise reduce small island states like mine zero existence stake peace,health
BHS_1995.L178,21,21,scourge war managed far global war concerned saved generations heritage future good enough save seemingly inevitable lot chronic poverty ignorance,disease,threat nuclear annihilation consequencesglobal_warminggood enough save generations life security existence planet live jeopardy clearly responsible establishing parameters action past produced result desirable necessary ensure stable,health
FJI_1995.L2113,9,9,given overriding priority remain combatting poverty recognizing present,health,world's climate system result detrimental patterns production consumption industrialized countries countries continue take lead reducing emissiongreenhousegases fiji welcomes successful completion united nations conference straddling fish,health
JPN_1995.L152,15,15,geneva approach end twentieth century billion people living absolute poverty billion receive even basic,health,care needless say remain increasingly grave problems environmental degradation includingglobal_warmingdeforestation marine pollution united nations universal international organization exists cope grave problems ensure international community enjoys,health
LUX_1995.L979,18,18,take cognizance fact countries faced new phenomena often diverse alike reaching beyond national borders thinking inter alia,health,problems aids environmental problems depletion ozone layerglobal_warmingalso social phenomena population growth pressure migration problem refugees violations human rights trans-border issues increasing concern drug trafficking new,health
GBR_1996.L818,10,10,developing human resources full potential giving priority needs poor,health,education clean water small enterprises increasingly partnership development amongst us deal growing problems planet survivalclimate_changeenvironment future world's oceans forests pandemic diseases development ignores sustainable united,health
GBR_1996.L818,30,30,potential giving priority needs poor health education clean water small enterprises increasingly partnership development amongst us deal growing problems planet survivalclimate_changeenvironment future world's oceans forests,pandemic,diseases development ignores sustainable united nations central forum focusing attention action governments civil society challenges enter next century next,health
GBR_1996.L818,31,31,giving priority needs poor health education clean water small enterprises increasingly partnership development amongst us deal growing problems planet survivalclimate_changeenvironment future world's oceans forests pandemic,diseases,development ignores sustainable united nations central forum focusing attention action governments civil society challenges enter next century next,health
SLB_1996.L657,8,8,development assistance therefore directed needed fostering public,health,literacy electrification recent completion first solar-powered village important us implementing habitat agenda encouraging self-reliance village development solarrenewable_energyresources water wind economic education health development plans several,health
SLB_1996.L657,30,30,needed fostering public health literacy electrification recent completion first solar-powered village important us implementing habitat agenda encouraging self-reliance village development solarrenewable_energyresources water wind economic education,health,development plans several weeks ago internet reached solomon islands personal computers growing number secondary schools possibility lap-top computers hands,health
AUT_1998.L1758,47,47,prepared take lead combatingclimate_changeeuropean community member states determined translate commitments made kyoto concrete actions achievements context sustainable development population issues particular concern directly relate human,health,quality life,health
TTO_1998.L1178,24,24,fund international partnerships strengthen partnerships support united nations projects deliver resources programmes peoples served united nations agencies approval grants projects broad categories children's,health,environmentclimate_changewomen population food security drug control poverty alleviation landmines contribute significantly pursuit goals united nations establishment fund testimony can achieved shared vision commitment principles ideals,health
FRA_1999.L888,48,48,desertification kyoto protocolclimate_changecurrent negotiations protocol biosafety attest importance achievements uncertain future climates recurrence natural catastrophes urge us make efforts earth fragile human species spread new,epidemics,endangers,health
MHL_1999.L280,42,42,devastating effect may livelihood culture natural resources economy existenceclimate_changeus now must stressed bad weather climate_change however extreme events observed recent years indications expected climate_change climate_change,disease,observing symptoms pacific experienced number severe weather,health
MHL_1999.L287,35,35,devastating effect may livelihood culture natural resources economy existence climate_change us now must stressed bad weatherclimate_changehowever extreme events observed recent years indications expected climate_change climate_change,disease,observing symptoms pacific experienced number severe weather events changes normal climate kiribati northern cook,health
MHL_1999.L296,26,26,devastating effect may livelihood culture natural resources economy existence climate_change us now must stressed bad weather climate_change however extreme events observed recent years indications expectedclimate_changeclimate_change,disease,observing symptoms pacific experienced number severe weather events changes normal climate kiribati northern cook islands become wetter fiji tonga become drier samoa difference,health
MHL_1999.L403,43,43,steps limit already small emissions part effort developrenewable_energysector regard pleased inform assembly government approved solar energy policy first stage project install solar panels outer island,health,centres one high schools support united,health
USA_1999.L544,14,14,adopted plan reduce per cent outstanding debt world's poorest countries freeing resources education,health,growth us developed developing countries alike take action now halt globalclimate_changefighting poverty great deal vulnerable members human family hurt first hurt rising temperatures devastate agriculture,health
USA_1999.L544,42,42,developed developing countries alike take action now halt globalclimate_changefighting poverty great deal vulnerable members human family hurt first hurt rising temperatures devastate agriculture accelerate spread,disease,tropical countries flood island nations mean developing,health
KGZ_2000.L811,28,28,stability political economic aspects also environmental perspective submitted secretary- general year instruments ratification accession following treaties concerning environmental issues united nations framework conventionclimate_changeconvention long-range transboundary,air_pollution,rotterdam convention prior informed consent procedure certain hazardous chemicals pesticides international trade vienna convention protection ozone layer montreal protocol substances deplete,health
PLW_2000.L81,22,22,seriously looked body international regional organizations solutions may found remedies provided alleviate suffering impose world peoples problems ranging hunger poverty tuberculosis,malaria,spread hiv aidsglobal_warmingenvironmental degradation vulnerability just responsibilities countries regions affected every member global community must play part order planet inhabitants survive destructive forces today live,health
PLW_2000.L205,13,13,mankind must confront real danger hiv aids work collectively towards eradication horrible,disease,uncontrolled unregulated human activities affected continue affect ecosystem thereby endangering threatening existenceglobal_warmingdifficult scientifically complicated phenomenon even today scientists still divided issue particularly causes effects agree,health
MHL_2001.L419,13,13,salinity direct impact subsistence cropping vulnerabilities together prolonged drought constitute deadly peril,health,survival welcome successful outcome sixth session conference parties united nations framework conventionclimate_changerecently concluded marrakesh kyoto protocol best available solution address environmental concerns able look back,health
PNG_2001.L962,30,30,1998 came tsunami la niña phenomenon bringing floods landslides leaving death destruction wake acknowledge prompt generous support neighbours dealing effects disastersglobal_warmingalso brought increased numbers cases,diseases,malaria higher-altitude populous region country threat increased incidence malaria region real negatively affect demographics country definitely link among climate_change,health
PNG_2001.L962,31,31,came tsunami la niña phenomenon bringing floods landslides leaving death destruction wake acknowledge prompt generous support neighbours dealing effects disastersglobal_warmingalso brought increased numbers cases diseases,malaria,higher-altitude populous region country threat increased incidence malaria region real negatively affect demographics country definitely link among climate_change,health
PNG_2001.L962,39,39,leaving death destruction wake acknowledge prompt generous support neighbours dealing effects disastersglobal_warmingalso brought increased numbers cases diseases malaria higher-altitude populous region country threat increased incidence,malaria,region real negatively affect demographics country definitely link among climate_change,health
PNG_2001.L987,7,7,global_warming also brought increased numbers cases,diseases,malaria higher-altitude populous region country threat increased incidence malaria region real negatively affect demographics country definitely link amongclimate_changenatural disaster spread increased incidence disease papua new,health
PNG_2001.L987,8,8,global_warming also brought increased numbers cases diseases,malaria,higher-altitude populous region country threat increased incidence malaria region real negatively affect demographics country definitely link amongclimate_changenatural disaster spread increased incidence disease papua new guinea,health
PNG_2001.L987,16,16,global_warming also brought increased numbers cases diseases malaria higher-altitude populous region country threat increased incidence,malaria,region real negatively affect demographics country definitely link amongclimate_changenatural disaster spread increased incidence disease papua new guinea exempt hiv aids epidemic tuberculosis grateful australia partners,health
PNG_2001.L987,30,30,numbers cases diseases malaria higher-altitude populous region country threat increased incidence malaria region real negatively affect demographics country definitely link amongclimate_changenatural disaster spread increased incidence,disease,papua new guinea exempt hiv aids epidemic tuberculosis grateful australia partners provided assistance field health care also welcome last,health
PNG_2001.L987,37,37,country threat increased incidence malaria region real negatively affect demographics country definitely link amongclimate_changenatural disaster spread increased incidence disease papua new guinea exempt hiv aids,epidemic,tuberculosis grateful australia partners provided assistance field health care also welcome last,health
PNG_2001.L987,45,45,affect demographics country definitely link amongclimate_changenatural disaster spread increased incidence disease papua new guinea exempt hiv aids epidemic tuberculosis grateful australia partners provided assistance field,health,care also welcome last,health
SLB_2001.L756,6,6,development planning depends significantly continued,health,marine environment unique circumstances small island developing states must fully understood international community strive address serious threats natural disastersclimate_changesea-level rise kyoto protocol remains significant first,health
ATG_2002.L721,7,7,water proper sanitation energy services improve,health,conditions agriculture particularly dry lands better protect world's biodiversity ecosystems however summit's failure agree target date increasing userenewable_energymajor disappointment small island developing states true test,health
EGY_2002.L1374,11,11,hiv aids threatens stability owing lack capacity resources unable contain,pandemic,thus necessitating assistance countries dealing crisis world also confronts numerous environmental challenges related biodiversityclimate_changedrought desertification require redoubling international efforts address order safeguard right future generations,health
FRA_2002.L1101,14,14,strengthen concrete cooperation permit access basic resources water energy basic social services education,health,food security let us also call ratification full implementation kyoto protocolclimate_changelet us establish true global governance sustainable development give necessary coherence france proposes creation economic,health
KHM_2002.L754,22,22,essential continue work together build caring community nations development gap developed developing countries reduced threat terrorism totally eliminated menace hiv aids,pandemic,curbed poverty alleviatedglobal_warmingkept check possible building better cooperation closer partnership fostering mutual respect cultivating greater tolerance enhancing spirit real united nations strongly believe can collective,health
LVA_2002.L462,7,7,children endemic poverty unemployment drug addiction,disease,environmental pollution global ecological crisis planet now experiencing resulted reckless disregard earth sustains us radically curb excessive amountgreenhousegases pollutants produce every day continue experience natural,health
NRU_2002.L233,43,43,china ratify instrument first step universal campaign addressclimate_changetherefore join call united states australia see way clear not-too-distant future ratifying protocol another issue special importance nauru,health,ocean custodians largest ocean rich natural,health
PNG_2002.L883,29,29,shipment radioactive materials region called states engaging activities accept full responsibility liability compensation damage may result directly indirectly transport radioactive material regionglobal_warmingbrought increase number cases,diseases,like malaria higher- altitude regions country still major threat papua new guinea particularly populous region highlands papua new guinea immune,health
PNG_2002.L883,31,31,materials region called states engaging activities accept full responsibility liability compensation damage may result directly indirectly transport radioactive material regionglobal_warmingbrought increase number cases diseases like,malaria,higher- altitude regions country still major threat papua new guinea particularly populous region highlands papua new guinea immune,health
SLB_2002.L986,48,48,seriously commit reducinggreenhousegas emissions least developed countries still grapple harsh realities poverty vulnerability external economic shocks debt burden poor infrastructure poor limited access better education,health,social,health
DMA_2003.L159,15,15,complex problems threaten global security problems require urgent attention united nations include hiv aids,diseases,poverty marginalization indigenous people terrorism global crime growing scarcity freshwaterglobal_warmingspread light arms threaten peaceful countries like dominica nuclear proliferation armed civil conflicts refugees give rise,health
LAO_2003.L139,31,31,appreciation efforts made present problems plaguing planet alas limited considered political military also affect environmental social economic fronts striking issuesglobal_warmingpollution natural disasters hiv aids incurable,diseases,poverty underdevelopment crises refugees debt economic stagnation yet find effective solutions severity problems even acute globalized world gap,health
LVA_2003.L721,5,5,particular attention reduction child,mortality,improvement mothers health twentieth century mankind inflicted environmental damage planet previous centuries combined devote greater efforts reducing environmental pollution includinggreenhousegas emissions future generations stand inherit,health
LVA_2003.L721,8,8,particular attention reduction child mortality improvement mothers,health,twentieth century mankind inflicted environmental damage planet previous centuries combined devote greater efforts reducing environmental pollution includinggreenhousegas emissions future generations stand inherit planet increasingly destructive,health
PLW_2003.L277,45,45,can trigger exacerbate conflict environmental threatsclimate_changedepletion stratospheric ozone introduction nuisance plant animal species overharvesting fish living natural resources transnational movement hazardous chemicals waste directly threaten,health,economic well-being every people,health
PNG_2003.L717,27,27,serve us papua new guinea fully endorses recent declarations plans action doha monterrey johannesburg conferences resolved meet challenges poverty eradication hunger illiteracy environmental degradationclimate_changehiv aids,malaria,preventable diseases also committed addressing issues good governance desire government papua new guinea incorporate millennium development goals national development priorities process adopting,health
PNG_2003.L717,29,29,papua new guinea fully endorses recent declarations plans action doha monterrey johannesburg conferences resolved meet challenges poverty eradication hunger illiteracy environmental degradationclimate_changehiv aids malaria preventable,diseases,also committed addressing issues good governance desire government papua new guinea incorporate millennium development goals national development priorities process adopting,health
RUS_2003.L433,42,42,resolve acute environmental problems milestone achieved area world conferenceclimate_changescheduled convene next week russia's capital moscow also believe essential global system established monitor neutralize dangerous infectious,diseases,consider work done global fund real demonstration,health
SVK_2003.L929,24,24,though undisputed validity principles remains undiminished shy away seeking answers solutions fundamental global challenges face today including extreme poverty drug smuggling spread deadly,diseases,globalclimate_changefinding appropriate solutions issues requires multilateral cooperation viable united nations core wish see strong decisive united nations capable effectively responding current future challenges slovakia remains,health
HRV_2004.L339,24,24,dire need assistance protect imbalances injustice shy away seeking available solutions fundamental global challenges face today including extreme poverty drug smuggling spread deadly,diseases,globalclimate_changeglobalization needs mastered opportunities offers need assessed excesses rectified finding appropriate answers fundamental questions requires multilateral cooperation viable effective united nations core wish see strong,health
KIR_2004.L95,31,31,confront us individual nations global community ongoing conflicts iraq parts world scourge terrorism existence nuclear arsenals accelerated environmental degradation threatglobal_warmingsea-level rise hunger poverty hiv aids,pandemic,non- communicable diseases marginalization least developed countries within global economy underdevelopment continue pose major challenges organization must address,health
KIR_2004.L95,34,34,nations global community ongoing conflicts iraq parts world scourge terrorism existence nuclear arsenals accelerated environmental degradation threatglobal_warmingsea-level rise hunger poverty hiv aids pandemic non- communicable,diseases,marginalization least developed countries within global economy underdevelopment continue pose major challenges organization must address,health
LAO_2004.L708,29,29,development much success enter twenty-first century world today still confronted numerous complex problems including wars armed conflicts terrorism global crime human traffickingglobal_warmingenvironmental degradation hiv aids,diseases,marginalization developing countries particular three vulnerable groups among least developed countries landlocked developing countries small island developing states international community,health
MHL_2004.L242,35,35,increasingly globalized world marshall islands faces challenges shared many small island states environment extremely vulnerable effectsclimate_changenatural disasters small population faces challenge managing high levels major,diseases,diabetes risk rapid spread hiv aids sexually transmitted diseases limited resource base remoteness restrict,health
MHL_2004.L242,44,44,small island states environment extremely vulnerable effectsclimate_changenatural disasters small population faces challenge managing high levels major diseases diabetes risk rapid spread hiv aids sexually transmitted,diseases,limited resource base remoteness restrict,health
