docname,from,to,pre,keyword,post,pattern
SWZ_2008.L58,22,22,secretary-general ban ki-moon entire staff united nations efforts carrying vision programmes united nations world continues face many challenges include catastrophic effects,climate_change,complicated diseases tuberculosismalariahiv aids epidemic food shortages situation compounded high prices fuel food instability international finance slow efforts fight poverty attain sustainable development encouraging note,climate
SWZ_2008.L61,19,19,entire staff united nations efforts carrying vision programmes united nations world continues face many challenges include catastrophic effects,climate_change,complicated diseases tuberculosis malaria hiv aidsepidemicfood shortages situation compounded high prices fuel food instability international finance slow efforts fight poverty attain sustainable development encouraging note,climate
TUR_2008.L98,28,28,quickly possible enormous gap wealthiest least fortunate certainly made considerable progress direction including towards meeting millennium development goals however common fight poverty illiteracyepidemicdiseases child mortality,climate_change,still far contrary volatile fuel prices food crisis global economic slowdown brought even 08-51570 challenging development security environment circumstances fight terrorism,climate
TUR_2008.L99,27,27,quickly possible enormous gap wealthiest least fortunate certainly made considerable progress direction including towards meeting millennium development goals however common fight poverty illiteracy epidemicdiseaseschild mortality,climate_change,still far contrary volatile fuel prices food crisis global economic slowdown brought even 08-51570 challenging development security environment circumstances fight terrorism racism,climate
VCT_2008.L832,44,44,reason equally vibrant people denied participation worldhealthorganization specialized agencies caribbean midst annual hurricane season awesome winds sea surges torrential rains gustav hanna ike brought issue,climate_change,sharp relief matter life death,climate
VNM_2008.L383,20,20,observed commitments actively participated addressing global issues strongly support bali road map aims establish legal framework international cooperation addressing,climate_change,beyond 2012 despite natural disastersepidemicsviet nam honouring commitments maintain volume rice exports million tons annually intend continue efforts ease pressures caused rising price food preserve,climate
ZMB_2008.L814,8,8,zambia like sub-saharan africa spared adverse effects,climate_change,increased exposure drought rising temperatures erratic rainfall extreme_weather conditions threatening water agricultural systems thereby condemning millions facemalnutritionwater shortages mr tanin afghanistan vice-president took chair let,climate
ZMB_2008.L814,16,16,zambia like sub-saharan africa spared adverse effects climate_change increased exposure drought rising temperatures erratic rainfall,extreme_weather,conditions threatening water agricultural systems thereby condemning millions facemalnutritionwater shortages mr tanin afghanistan vice-president took chair let now turn ongoing reforms united nations particular protracted,climate
ATG_2009.L95,35,35,tested worst economic crisis since great depression additional challenges currently confront us include increased incidence impactpandemicdiseases worsening poverty hunger trap millions around globe adverse consequences,climate_change,tensions peace security increasing environmental degradation history recorded success leaders determined stewardship turbulent times,climate
ATG_2009.L96,34,34,tested worst economic crisis since great depression additional challenges currently confront us include increased incidence impact pandemicdiseasesworsening poverty hunger trap millions around globe adverse consequences,climate_change,tensions peace security increasing environmental degradation history recorded success leaders determined stewardship turbulent times years,climate
BEN_2009.L498,40,40,mandatory primary education making free caesarean sections available better approach reproductivehealthsocial measures implemented time major work begun infrastructure however ongoing economic recession worsening harmful consequences,climate_change,threaten seriously jeopardize considerable progress made implementing pivotal national,climate
BGD_2009.L665,10,10,adversely impacting low-lying deltaic monsoonal country although bangladesh's contribution,climate_change,negligible one worst victims erratic floods cyclones droughts earthquakes disrupting agriculture challenging water resources wellhealthenergy urban planning particular cyclones battering coastal areas taken countless lives,climate
BHR_2009.L977,32,32,process initiated security council maintain momentum activate peace development twin concerns world natural feel frustration face prevailing environmental degradationpandemicsdesertification poverty water scarcity depletion ozone layer,climate_change,world financial crisis challenges represent imminent threat life now future generations therefore overstatement say twenty-first century destinies,climate
BRB_2009.L120,24,24,face need effective global responses indeed world facing major economic political social upheaval threat food fuel scarcity worst economic financial crisis decades challenge,climate_change,influenzapandemicsassumed international multidimensional character together undermined foundations multilateral system exacerbating already existing disparities approach developed economies crisis create national stimulus packages bail failing industries short,climate
CHE_2009.L40,22,22,brought global financial system verge breakdown ensuing turbulence finance sector led severe global economic downturn illustrates interconnectedness world reminds us issues,climate_change,food crisis migrationpandemicsterrorism proliferation weapons mass destruction confined national borders rising global challenges requires determined coordinated action national regional international levels international cooperation become vital,climate
CHN_2009.L76,19,19,remains grip financial crisis prospects economic recovery still clear worldwide unemployment poverty worsening development imbalances acute global issues,climate_change,food security energy resource security publichealthsecurity thrown sharp relief non-traditional security threats including terrorism proliferation weapons mass destruction transnational organized crime major communicable diseases threatening,climate
CHN_2009.L484,19,19,cooperation open markets one another step south-south cooperation thirdly pursue cooperation open mind work mutual benefit common progress,climate_change,food security energy resource security publichealthsecurity global challenges country immune way us meet challenges ensure harmony peace engage closer international cooperation climate_change one serious challenges,climate
CHN_2009.L484,41,41,benefit common progress climate_change food security energy resource security publichealthsecurity global challenges country immune way us meet challenges ensure harmony peace engage closer international cooperation,climate_change,one serious challenges human survival development international cooperation,climate
CMR_2009.L540,4,4,every country regarding,climate_change,particular africa like continents hard hit despite low level greenhouse gas emissions global_warming salient feature affects many socio-economic sectors including energyhealthagriculture livestock production ecosystems rapid,climate
CMR_2009.L540,14,14,every country regarding climate_change particular africa like continents hard hit despite low level,greenhouse,gas emissions global_warming salient feature affects many socio-economic sectors including energyhealthagriculture livestock production ecosystems rapid desertification regard spectacular drying lake chad surface shrunk square kilometres,climate
CMR_2009.L540,17,17,every country regarding climate_change particular africa like continents hard hit despite low level greenhouse gas emissions,global_warming,salient feature affects many socio-economic sectors including energyhealthagriculture livestock production ecosystems rapid desertification regard spectacular drying lake chad surface shrunk square kilometres 1960s square kilometres,climate
COG_2009.L158,27,27,forged freedom human rights solidarity universal justice word destiny humankind men women know billion people still live less dollar day children die unnecessarily hungerdiseaseus know,climate_change,abetting scourges countries least responsible suffer effects producing per cent greenhouse gas emissions continent affected global_warming poor populations main victims agriculture fauna,climate
COG_2009.L158,38,38,women know billion people still live less dollar day children die unnecessarily hungerdiseaseus know climate_change abetting scourges countries least responsible suffer effects producing per cent,greenhouse,gas emissions continent affected global_warming poor populations main victims agriculture fauna,climate
COG_2009.L158,43,43,live less dollar day children die unnecessarily hungerdiseaseus know climate_change abetting scourges countries least responsible suffer effects producing per cent greenhouse gas emissions continent affected,global_warming,poor populations main victims agriculture fauna,climate
CYP_2009.L214,8,8,world today faces multiple challenges threats including,climate_change,depletion resources human rights abuses failure protect vulnerable populations increased regional inter-state conflict proliferation weapons mass destructionpandemicsrostrum heard desperate voices live small-island states despairing appeal,climate
CYP_2009.L214,39,39,failure protect vulnerable populations increased regional inter-state conflict proliferation weapons mass destructionpandemicsrostrum heard desperate voices live small-island states despairing appeal young people dramatic warnings scientists,climate_change,take measures now face risk extinction join voice lend support,climate
DEU_2009.L162,32,32,largest economies stands global responsibility developing countries must also live responsibilities responsible governance respect human rights environmental protection fightepidemicsstrengthening rights women challenges country responsibility meet,climate_change,pre-eminent challenge twenty-first century threatens well-being security economic development lead uncontrollable risks dramatic damage take resolute action,climate
EGY_2009.L71,2,2,facing,climate_change,food crisis crises international peace supplemented additional emerging global challenges make essential us redouble efforts coordinated collective manner global financial crisis together spreaddiseasesh1n1 virus threatens,climate
EGY_2009.L1327,29,29,middle east palestinian question reform united nations unilateral sanctions global financial economic crisis internationally agreed development goals food security africa's special needsdiseasespandemics role civil society,climate_change,energy human trafficking international terrorism dialogue among civilizations religions second declaration necessity ending economic commercial financial embargo imposed 09-52586 united,climate
EGY_2009.L1328,28,28,middle east palestinian question reform united nations unilateral sanctions global financial economic crisis internationally agreed development goals food security africa's special needs diseasespandemicsrole civil society,climate_change,energy human trafficking international terrorism dialogue among civilizations religions second declaration necessity ending economic commercial financial embargo imposed 09-52586 united states,climate
FJI_2009.L87,27,27,state enriched membership participation united nations fiji people like small developing island states among first victims contemporary global crises financial economic crisis 2009 h1n1pandemicdramatic phenomenon,climate_change,small economies like global events real effect daily livelihoods people part attempted respond crises making policy changes adjustments encouraging people grow food,climate
FSM_2009.L853,27,27,become reason failure can economic considerations become excuse inaction 09-52470 throughout history humankind examples nations disagreed coming together survival crisis time war economic hardshipepidemictoday crisis,climate_change,simply time waste therefore stop talk cheap action speaks louder words need action let us go copenhagen seal deal meet copenhagen,climate
GBR_2009.L281,45,45,put place act together prevent avoidableillnesscan plan save tomorrow children dying africa today every day say need world agreement urgent challenges now let elaborate first,climate_change,despite promises made road,climate
JOR_2009.L194,23,23,establishment organization well technological advancements information communications revolution well-known effects globalization made world global village everybody feels negative effects problems challenges desertification,climate_change,terrorism povertypandemicsproliferation weapons mass destruction among major achievements united nations pioneering role seeking eliminate colonization occupation order ensure right peoples self-determination although organization assumed ongoing,climate
LBY_2009.L83,11,11,world come together unite efforts defeat challenges principal common enemy,climate_change,international crises capitalist economic decline food water crises desertification terrorism immigration piracy man-made naturalepidemicsnuclear proliferation perhaps influenza h1n1 virus created laboratory got control originally meant,climate
MCO_2009.L316,47,47,sanitation cause outbreaks infectiousdiseasespandemics phenomena desertification drought well acidification seas oceans exacerbated man-made climatic change failure copenhagen negotiations option commitment worldwide counterparts stated yesterday framework,climate_change,summit convened,climate
MCO_2009.L317,46,46,sanitation cause outbreaks infectious diseasespandemicsphenomena desertification drought well acidification seas oceans exacerbated man-made climatic change failure copenhagen negotiations option commitment worldwide counterparts stated yesterday framework,climate_change,summit convened secretary-,climate
MDA_2009.L71,26,26,complex times distinguished speakers taken floor debate elaborated extensively pressing issues international community faced past year current financial economic crisis food energy crises first flupandemiccentury,climate_change,core deliberations united nations revealing central role organization dealing problems reformed robust effective organization deliver prompt reactions sustainable responses major challenges peace security,climate
MMR_2009.L249,11,11,comprehensive consistent principle common differentiated responsibilities global financial economic crisis,climate_change,crisis compounded problems faced recent years include rising food prices high energy prices spreadpandemicdiseases single country can effectively overcome problems alone global community must work,climate
MMR_2009.L250,10,10,consistent principle common differentiated responsibilities global financial economic crisis,climate_change,crisis compounded problems faced recent years include rising food prices high energy prices spread pandemicdiseasessingle country can effectively overcome problems alone global community must work,climate
MNE_2009.L69,24,24,ban ki-moon outstanding efforts leading organization trying times heard statements previous distinguished speakers given impact world economic financial crisis related food energy crises,climate_change,flupandemiceconomic social growth development politics global relations including achievement millennium development goals mdgs internationally agreed development goals coordinated concerted global effort can yield positive results,climate
MNE_2009.L548,5,5,montenegro organize regional conference,climate_change,sustainable development mediterranean south-east european countries budva october millennium development goals require every one us redouble efforts reduce poverty improvehealtheducation promote peace human rights achieve,climate
MNE_2009.L646,37,37,regard support message 2008 yokohama declaration aimed giving momentum current development issues including educationhealthsanitary measures within framework mdgs development agriculture improve food security measures tackle,climate_change,well establishing maintaining peace prerequisite economic growth emphasize crucial importance debate concept,climate
MOZ_2009.L271,38,38,social growth just described mozambique welcomes launching united nations september 2009 african leadersmalariaalliance pledges play active role support new mechanism aimed coordinating responses scourge malaria,climate_change,another pressing challenge therefore afford fail seal deal december fifteenth conference,climate
MOZ_2009.L284,42,42,active role support new mechanism aimed coordinating responses scourgemalariaclimate_change another pressing challenge therefore afford fail seal deal december fifteenth conference parties united nations framework convention,climate_change,copenhagen hope commitments made summit climate_change held,climate
MOZ_2009.L284,48,48,coordinating responses scourgemalariaclimate_change another pressing challenge therefore afford fail seal deal december fifteenth conference parties united nations framework convention climate_change copenhagen hope commitments made summit,climate_change,held,climate
NAM_2009.L286,9,9,secretary-general mobilize political ensure good legally binding agreement,climate_change,copenhagen december namibia one countries highest socio-economic inequality world colonial past nevertheless country made progress provisionhealtheducation critical services majority population course meet number mdgs however,climate
NGA_2009.L306,44,44,intends host abuja-plus ten summit roll backmalaria2011 therefore appreciate support secretary-general make proposed summit possible also facilitate realization objective quality participation just concluded 2009 summit,climate_change,testimony global realization climate_change truly,climate
NGA_2009.L306,48,48,summit roll backmalaria2011 therefore appreciate support secretary-general make proposed summit possible also facilitate realization objective quality participation just concluded 2009 summit climate_change testimony global realization,climate_change,truly,climate
NPL_2009.L1017,34,34,floods become frequent destructive delayed insufficient rainfall affected crop production poorest poor farmers suffered worst effects agriculturehealthlivelihoods infrastructure affected nepal recently hosted high-level regional conference,climate_change,focusing himalayan region order highlight seriousness problem global_warming impacts himalayan range unprecedented snow melt himalayas,climate
NPL_2009.L1017,42,42,crop production poorest poor farmers suffered worst effects agriculturehealthlivelihoods infrastructure affected nepal recently hosted high-level regional conference climate_change focusing himalayan region order highlight seriousness problem,global_warming,impacts himalayan range unprecedented snow melt himalayas,climate
NRU_2009.L611,1,1,,climate_change,live every day flooding inundation already eroding shores contaminating water supply higher water temperatures ocean acidification damaging marine ecosystems depend food economic livelihood praymalariafind way,climate
NRU_2009.L611,44,44,marine ecosystems depend food economic livelihood praymalariafind way doorstep applaud commitment secretary- general addressing issue efforts build consensus among world leaders week high- level summit,climate_change,asia africa arctic visited affected,climate
NRU_2009.L714,4,4,order avoid dire,climate_change,scenarios however developed countries proposed emissions targets result concentrations far higher acceptable policy human lives stake doctor prescribes medicine treat seriousillnessgive patient half needed engineer,climate
PER_2009.L815,6,6,also proposes comprehensive programmes adaptation,climate_change,established programmes financed global environment facility world bank identify comprehensive approach sectoral adaptation emphasize strategies reduce occurrence disasters protecthealthfood security affected populations economic infrastructure biodiversity,climate
PLW_2009.L706,49,49,health assemblyhealthsafety world's peoples heart ideals united nations order promote ideals recommend taiwan invited participate meaningfully international civil aviation organization icao united nations framework convention,climate_change,,climate
PNG_2009.L241,15,15,many global issues challenges face collectively human family together must confront first continuing threats,climate_change,global_warming global food crisis now compounded global financial crisis threatsdiseasesknow borders h1n1 hiv aids malaria tuberculosis cholera et cetera secondly must achieve together social agenda,climate
PNG_2009.L241,16,16,many global issues challenges face collectively human family together must confront first continuing threats climate_change,global_warming,global food crisis now compounded global financial crisis threatsdiseasesknow borders h1n1 hiv aids malaria tuberculosis cholera et cetera secondly must achieve together social agenda millennium,climate
PNG_2009.L247,9,9,human family together must confront first continuing threats,climate_change,global_warming global food crisis now compounded global financial crisis threats diseases know borders h1n1 hiv aidsmalariatuberculosis cholera et cetera secondly must achieve together social agenda,climate
PNG_2009.L247,10,10,human family together must confront first continuing threats climate_change,global_warming,global food crisis now compounded global financial crisis threats diseases know borders h1n1 hiv aidsmalariatuberculosis cholera et cetera secondly must achieve together social agenda millennium,climate
PNG_2009.L960,21,21,facing humanity consequences appear dire truly global global challenge can met concerted global response papua new guinea today see evidence,climate_change,inundation coastal areas increasemalariadue warming highlands region country especially plight people carteret islands sea level risen people resettled therefore strongly support recent alliance small island,climate
PNG_2009.L960,49,49,areas increasemalariadue warming highlands region country especially plight people carteret islands sea level risen people resettled therefore strongly support recent alliance small island states declaration,climate_change,,climate
POL_2009.L146,20,20,crisis extent crisis new problem participating general assembly session first time can state earlier problems conflicts many recent problem,climate_change,problem poverty new add problemhealthaids epidemics however problem current crisis appeared last year coming like refer president ukraine said many causes conflict world one violation,climate
POL_2009.L148,18,18,crisis new problem participating general assembly session first time can state earlier problems conflicts many recent problem,climate_change,problem poverty new add problem health aidsepidemicshowever problem current crisis appeared last year coming like refer president ukraine said many causes conflict world one violation,climate
ROU_2009.L154,15,15,democracy's transformational sweep throughout world now face important challenges humanity ever faced negative impact,climate_change,exacerbated global financial economic crisis food crisis rise energy pricespandemicsworld experiencing increasingly tense situations make efforts meet challenges new century even sensitive now address terrorism,climate
ROU_2009.L548,22,22,system consider least four essential elements first managing current economic crisis secure sustainable development growth second staying focused demanding interconnected issues,climate_change,poverty food securityhealthenergy migration lack democracy parts world maintaining international peace security stability third element concerns consolidation international law fourth concerns strengthening increasing efficiency international,climate
SLB_2009.L295,16,16,well degrees celsius prevent acidification oceans threatening existence deforestation forest degradation contribute nearly per cent,greenhouse,gas emissions solomon islands agrees one mitigating solutions protectinghealthenvironment urge considered outcome copenhagen country currently carrying inventory forests intends participate carbon market also hope multilateral,climate
SLE_2009.L128,20,20,civilizations began magnificent blueprints meeting challenges specific particular regions world advances technology communications made problems longer specific particular regions,climate_change,hiv aids tuberculosis swine flupandemicsfood fuel crises including present global economic meltdown terrorism nuclear proliferation drug trafficking beyond capacity world's civilizations tackle without international cooperation,climate
STP_2009.L411,34,34,hopes declaration embodies need attention can say sao tome principe made determined efforts especially achieve goals areashealtheducation almost although yet completely satisfied biggest debates related,global_warming,concentrate substitutions fossil fuels order reduce carbon_emissions contribute greenhouse effect debate gone temperatures risen causing,climate
STP_2009.L411,41,41,sao tome principe made determined efforts especially achieve goals areashealtheducation almost although yet completely satisfied biggest debates related global_warming concentrate substitutions fossil fuels order reduce,carbon_emissions,contribute greenhouse effect debate gone temperatures risen causing,climate
