docname,from,to,pre,keyword,post,pattern
AUT_1988.L2417,1,1,,carbon_dioxide,emissions reflects grave concern climatic changes hope elaboration protocol control redaction nitrogen oxide emissions take us another important step forward implementation convention long-range transboundaryair_pollutionprimary task,climate
SWE_1988.L732,16,16,threat survival inferior arms race alarming research reports tell us climate begun change probable result,greenhouse,effect life-giving resources destroyed erosion desertification devastation forests people'shealthincreasingly affected poisoning water food chains depletion ozone layer causes threats environment lie excessive exploitation natural resources,climate
FIN_1989.L627,13,13,countries directly affected depletion ozone layer increasing emissions carbon dioxides produce so-called,greenhouse,effect climate earth increasing presence substances atmosphere cause acid rain direct dangershealththerefore hardly surprise witnessed increasing international activity field several initiatives taken launch concerted international,climate
JPN_1989.L2207,28,28,irrevocable just past years blink eye vast continuum history mankind ventured far reaches space sought explore oceans- depths ominous acceleration pace environmental destructionhealthplanet gravely threatened,global_warming,destruction ozone layer depletion tropical rain forests acid rain desertification global environmental problems confront us today must dealt entire international community,climate
LBY_1989.L2158,30,30,world facing unprecedented environmental crisis nature sending us urgent warnings can ignored peril numerous growing indicators crisis around us addition seriousair_pollutiondesertification soil erosion depletion forests,greenhouse,effect unusual climatic changes deterioration ozone layer also problem nuclear industrial toxic wastes given rise justifiable concern especially third,climate
DEU_1990.L2676,11,11,companies squandering energy resources another key problem changing world climate,greenhouse,effect depletion ozone layer bach earth's many environmental problems exacerbated two central problems solvedair_pollutionextinction species erosion increase dramatically reduce chances survival future generations federal republic,climate
ATG_1991.L880,42,42,umbrella control united nations antarctica important barometer earth's environmentalhealthsignificant source food oceans fish fragile ecological system allow raped hope successful exploitation industrial activity antarctica tilt,carbon_dioxide,imbalance atmosphere drill larger holes earth's protective,climate
BTN_1991.L1119,16,16,far goal indeed every day brings alarming evidence diminishing capacity planet sustain life ominous signs,greenhouse,effect depletion ozone layer include climatic changes increase certainhealthproblems air water pollution soil degradation desertification deforestation threaten world's food supplies living conditions overpopulation puts strains,climate
CAN_1991.L1826,7,7,solitudes rich poor true canada worried,climate_change,worried loss species pollutants arctic food chain ocean resources forests developed country recognise developing countries eliminating poverty ensuringnutritioneradicating disease top priorities inextricably linked environment recognise,climate
CAN_1991.L1828,5,5,poor true canada worried,climate_change,worried loss species pollutants arctic food chain ocean resources forests developed country recognise developing countries eliminating poverty ensuring nutrition eradicatingdiseasetop priorities inextricably linked environment recognise,climate
ATG_1993.L554,32,32,gases toxins emitted atmosphere altering global environment fatal consequences forecast earth's climate biodiverse flora fauna agriculture living animals humanhealthwell-being borne mind contribution small island states,climate_change,global_warming sea-level rise zero effects climate_change global_warming sea-level rise reduce small island states like mine zero existence,climate
ATG_1993.L554,33,33,toxins emitted atmosphere altering global environment fatal consequences forecast earth's climate biodiverse flora fauna agriculture living animals humanhealthwell-being borne mind contribution small island states climate_change,global_warming,sea-level rise zero effects climate_change global_warming sea-level rise reduce small island states like mine zero existence,climate
ATG_1993.L554,38,38,environment fatal consequences forecast earth's climate biodiverse flora fauna agriculture living animals humanhealthwell-being borne mind contribution small island states climate_change global_warming sea-level rise zero effects,climate_change,global_warming sea-level rise reduce small island states like mine zero existence,climate
ATG_1993.L554,39,39,fatal consequences forecast earth's climate biodiverse flora fauna agriculture living animals humanhealthwell-being borne mind contribution small island states climate_change global_warming sea-level rise zero effects climate_change,global_warming,sea-level rise reduce small island states like mine zero existence,climate
BHS_1995.L173,29,29,succeeding generations scourge war managed far global war concerned saved generations heritage future good enough save seemingly inevitable lot chronic poverty ignorancediseasethreat nuclear annihilation consequences,global_warming,good enough save generations life security existence planet live jeopardy clearly responsible establishing parameters action past produced result desirable necessary,climate
FJI_1995.L2096,41,41,developing countries given overriding priority remain combatting poverty recognizing presenthealthworld's climate system result detrimental patterns production consumption industrialized countries countries continue take lead reducing emission,greenhouse,gases fiji welcomes successful completion united nations conference,climate
JPN_1995.L141,35,35,recent statement geneva approach end twentieth century billion people living absolute poverty billion receive even basichealthcare needless say remain increasingly grave problems environmental degradation including,global_warming,deforestation marine pollution united nations universal international organization exists cope grave problems ensure international,climate
LUX_1995.L971,32,32,problems review take cognizance fact countries faced new phenomena often diverse alike reaching beyond national borders thinking inter aliahealthproblems aids environmental problems depletion ozone layer,global_warming,also social phenomena population growth pressure migration problem refugees violations human rights trans-border issues increasing concern drug,climate
GBR_1996.L802,40,40,growth equity developing human resources full potential giving priority needs poorhealtheducation clean water small enterprises increasingly partnership development amongst us deal growing problems planet survival,climate_change,environment future world's oceans forests pandemic diseases development ignores,climate
GBR_1996.L824,20,20,priority needs poor health education clean water small enterprises increasingly partnership development amongst us deal growing problems planet survival,climate_change,environment future world's oceans forestspandemicdiseases development ignores sustainable united nations central forum focusing attention action governments civil society challenges enter next century next year's general,climate
GBR_1996.L825,19,19,needs poor health education clean water small enterprises increasingly partnership development amongst us deal growing problems planet survival,climate_change,environment future world's oceans forests pandemicdiseasesdevelopment ignores sustainable united nations central forum focusing attention action governments civil society challenges enter next century next year's general,climate
SLB_1996.L639,42,42,decision-making overseas development assistance therefore directed needed fostering publichealthliteracy electrification recent completion first solar-powered village important us implementing habitat agenda encouraging self-reliance village development solar,renewable_energy,resources water wind economic education health development,climate
SLB_1996.L663,20,20,public health literacy electrification recent completion first solar-powered village important us implementing habitat agenda encouraging self-reliance village development solar,renewable_energy,resources water wind economic educationhealthdevelopment plans several weeks ago internet reached solomon islands personal computers growing number secondary schools possibility lap-top computers hands teachers students,climate
AUT_1998.L1781,3,3,lead combating,climate_change,european community member states determined translate commitments made kyoto concrete actions achievements context sustainable development population issues particular concern directly relate humanhealthquality life coming decades,climate
TTO_1998.L1176,26,26,united nations fund international partnerships strengthen partnerships support united nations projects deliver resources programmes peoples served united nations agencies approval grants projects broad categories children'shealthenvironment,climate_change,women population food security drug control poverty alleviation landmines contribute significantly pursuit goals united nations establishment fund testimony can achieved shared vision commitment,climate
FRA_1999.L912,2,2,protocol,climate_change,current negotiations protocol biosafety attest importance achievements uncertain future climates recurrence natural catastrophes urge us make efforts earth fragile human species spread newepidemicsendangers health entire,climate
MHL_1999.L298,8,8,may livelihood culture natural resources economy existence,climate_change,us now must stressed bad weather climate_change however extreme events observed recent years indications expected climate_change climate_changediseaseobserving symptoms pacific experienced number severe weather events changes,climate
MHL_1999.L298,15,15,may livelihood culture natural resources economy existence climate_change us now must stressed bad weather,climate_change,however extreme events observed recent years indications expected climate_change climate_changediseaseobserving symptoms pacific experienced number severe weather events changes normal climate kiribati northern cook islands become,climate
MHL_1999.L298,24,24,may livelihood culture natural resources economy existence climate_change us now must stressed bad weather climate_change however extreme events observed recent years indications expected,climate_change,climate_changediseaseobserving symptoms pacific experienced number severe weather events changes normal climate kiribati northern cook islands become wetter fiji tonga become drier samoa difference daytime night-time,climate
MHL_1999.L422,7,7,already small emissions part effort develop,renewable_energy,sector regard pleased inform assembly government approved solar energy policy first stage project install solar panels outer islandhealthcentres one high schools support united nations trust,climate
USA_1999.L532,36,36,g-7 nations adopted plan reduce per cent outstanding debt world's poorest countries freeing resources educationhealthgrowth us developed developing countries alike take action now halt global,climate_change,fighting poverty great deal vulnerable members human family hurt first hurt rising temperatures,climate
USA_1999.L562,8,8,countries alike take action now halt global,climate_change,fighting poverty great deal vulnerable members human family hurt first hurt rising temperatures devastate agriculture accelerate spreaddiseasetropical countries flood island nations mean developing countries must,climate
KGZ_2000.L815,22,22,economic aspects also environmental perspective submitted secretary- general year instruments ratification accession following treaties concerning environmental issues united nations framework convention,climate_change,convention long-range transboundaryair_pollutionrotterdam convention prior informed consent procedure certain hazardous chemicals pesticides international trade vienna convention protection ozone layer montreal protocol substances deplete ozone layer,climate
PLW_2000.L77,28,28,problems must seriously looked body international regional organizations solutions may found remedies provided alleviate suffering impose world peoples problems ranging hunger poverty tuberculosismalariaspread hiv aids,global_warming,environmental degradation vulnerability just responsibilities countries regions affected every member global community must play part order planet inhabitants survive destructive forces,climate
PLW_2000.L192,37,37,responsibility security mankind must confront real danger hiv aids work collectively towards eradication horriblediseaseuncontrolled unregulated human activities affected continue affect ecosystem thereby endangering threatening existence,global_warming,difficult scientifically complicated phenomenon even today scientists still divided issue particularly causes,climate
MHL_2001.L406,37,37,intrusion increasing salinity direct impact subsistence cropping vulnerabilities together prolonged drought constitute deadly perilhealthsurvival welcome successful outcome sixth session conference parties united nations framework convention,climate_change,recently concluded marrakesh kyoto protocol best available solution address environmental concerns able,climate
PNG_2001.L968,20,20,tsunami la niña phenomenon bringing floods landslides leaving death destruction wake acknowledge prompt generous support neighbours dealing effects disasters,global_warming,also brought increased numbers casesdiseasesmalaria higher-altitude populous region country threat increased incidence malaria region real negatively affect demographics country definitely link among climate_change natural disaster,climate
PNG_2001.L968,43,43,effects disasters global_warming also brought increased numbers casesdiseasesmalaria higher-altitude populous region country threat increased incidence malaria region real negatively affect demographics country definitely link among,climate_change,natural disaster spread increased incidence disease,climate
PNG_2001.L969,19,19,la niña phenomenon bringing floods landslides leaving death destruction wake acknowledge prompt generous support neighbours dealing effects disasters,global_warming,also brought increased numbers cases diseasesmalariahigher-altitude populous region country threat increased incidence malaria region real negatively affect demographics country definitely link among climate_change natural disaster,climate
PNG_2001.L969,42,42,effects disasters global_warming also brought increased numbers cases diseasesmalariahigher-altitude populous region country threat increased incidence malaria region real negatively affect demographics country definitely link among,climate_change,natural disaster spread increased incidence disease papua,climate
PNG_2001.L977,11,11,destruction wake acknowledge prompt generous support neighbours dealing effects disasters,global_warming,also brought increased numbers cases diseases malaria higher-altitude populous region country threat increased incidencemalariaregion real negatively affect demographics country definitely link among climate_change natural disaster,climate
PNG_2001.L977,34,34,effects disasters global_warming also brought increased numbers cases diseases malaria higher-altitude populous region country threat increased incidencemalariaregion real negatively affect demographics country definitely link among,climate_change,natural disaster spread increased incidence disease papua new guinea exempt hiv aids epidemic tuberculosis grateful,climate
PNG_2001.L993,20,20,diseases malaria higher-altitude populous region country threat increased incidence malaria region real negatively affect demographics country definitely link among,climate_change,natural disaster spread increased incidencediseasepapua new guinea exempt hiv aids epidemic tuberculosis grateful australia partners provided assistance field health care also welcome last year's announcement,climate
PNG_2001.L1000,13,13,increased incidence malaria region real negatively affect demographics country definitely link among,climate_change,natural disaster spread increased incidence disease papua new guinea exempt hiv aidsepidemictuberculosis grateful australia partners provided assistance field health care also welcome last year's announcement,climate
PNG_2001.L1008,5,5,country definitely link among,climate_change,natural disaster spread increased incidence disease papua new guinea exempt hiv aids epidemic tuberculosis grateful australia partners provided assistance fieldhealthcare also welcome last year's announcement,climate
SLB_2001.L736,44,44,success national development planning depends significantly continuedhealthmarine environment unique circumstances small island developing states must fully understood international community strive address serious threats natural disasters,climate_change,sea-level rise kyoto protocol remains,climate
ATG_2002.L702,43,43,access clean water proper sanitation energy services improvehealthconditions agriculture particularly dry lands better protect world's biodiversity ecosystems however summit's failure agree target date increasing use,renewable_energy,major disappointment small island developing states,climate
EGY_2002.L1359,39,39,suffer spread hiv aids threatens stability owing lack capacity resources unable containpandemicthus necessitating assistance countries dealing crisis world also confronts numerous environmental challenges related biodiversity,climate_change,drought desertification require redoubling international efforts address order safeguard right,climate
FRA_2002.L1089,36,36,time come strengthen concrete cooperation permit access basic resources water energy basic social services educationhealthfood security let us also call ratification full implementation kyoto protocol,climate_change,let us establish true global governance sustainable development give necessary coherence france proposes,climate
KHM_2002.L750,28,28,point view essential continue work together build caring community nations development gap developed developing countries reduced threat terrorism totally eliminated menace hiv aidspandemiccurbed poverty alleviated,global_warming,kept check possible building better cooperation closer partnership fostering mutual respect cultivating greater tolerance enhancing spirit real united nations strongly believe,climate
LVA_2002.L443,43,43,exploitation women children endemic poverty unemployment drug addictiondiseaseenvironmental pollution global ecological crisis planet now experiencing resulted reckless disregard earth sustains us radically curb excessive amount,greenhouse,gases pollutants produce every day continue,climate
NRU_2002.L252,7,7,instrument first step universal campaign address,climate_change,therefore join call united states australia see way clear not-too-distant future ratifying protocol another issue special importance nauruhealthocean custodians largest ocean rich natural marine resources,climate
PNG_2002.L888,21,21,materials region called states engaging activities accept full responsibility liability compensation damage may result directly indirectly transport radioactive material region,global_warming,brought increase number casesdiseaseslike malaria higher- altitude regions country still major threat papua new guinea particularly populous region highlands papua new guinea immune hiv aids,climate
PNG_2002.L890,19,19,called states engaging activities accept full responsibility liability compensation damage may result directly indirectly transport radioactive material region,global_warming,brought increase number cases diseases likemalariahigher- altitude regions country still major threat papua new guinea particularly populous region highlands papua new guinea immune hiv aids,climate
SLB_2002.L1010,2,2,reducing,greenhouse,gas emissions least developed countries still grapple harsh realities poverty vulnerability external economic shocks debt burden poor infrastructure poor limited access better educationhealthsocial services list,climate
DMA_2003.L148,35,35,entangled web complex problems threaten global security problems require urgent attention united nations include hiv aidsdiseasespoverty marginalization indigenous people terrorism global crime growing scarcity freshwater,global_warming,spread light arms threaten peaceful countries like dominica nuclear proliferation armed civil conflicts refugees,climate
LAO_2003.L146,19,19,made present problems plaguing planet alas limited considered political military also affect environmental social economic fronts striking issues,global_warming,pollution natural disasters hiv aids incurablediseasespoverty underdevelopment crises refugees debt economic stagnation yet find effective solutions severity problems even acute globalized world gap developed developing,climate
LVA_2003.L700,45,45,group devoting particular attention reduction childmortalityimprovement mothers health twentieth century mankind inflicted environmental damage planet previous centuries combined devote greater efforts reducing environmental pollution including,greenhouse,gas emissions future generations,climate
LVA_2003.L703,42,42,group devoting particular attention reduction child mortality improvement mothershealthtwentieth century mankind inflicted environmental damage planet previous centuries combined devote greater efforts reducing environmental pollution including,greenhouse,gas emissions future generations stand inherit planet,climate
PLW_2003.L298,5,5,exacerbate conflict environmental threats,climate_change,depletion stratospheric ozone introduction nuisance plant animal species overharvesting fish living natural resources transnational movement hazardous chemicals waste directly threatenhealtheconomic well-being every people world palau,climate
PNG_2003.L720,23,23,papua new guinea fully endorses recent declarations plans action doha monterrey johannesburg conferences resolved meet challenges poverty eradication hunger illiteracy environmental degradation,climate_change,hiv aidsmalariapreventable diseases also committed addressing issues good governance desire government papua new guinea incorporate millennium development goals national development priorities process adopting medium-term development,climate
PNG_2003.L722,21,21,guinea fully endorses recent declarations plans action doha monterrey johannesburg conferences resolved meet challenges poverty eradication hunger illiteracy environmental degradation,climate_change,hiv aids malaria preventablediseasesalso committed addressing issues good governance desire government papua new guinea incorporate millennium development goals national development priorities process adopting medium-term development,climate
RUS_2003.L451,8,8,environmental problems milestone achieved area world conference,climate_change,scheduled convene next week russia's capital moscow also believe essential global system established monitor neutralize dangerous infectiousdiseasesconsider work done global fund real demonstration international solidarity,climate
SVK_2003.L927,26,26,nations charter though undisputed validity principles remains undiminished shy away seeking answers solutions fundamental global challenges face today including extreme poverty drug smuggling spread deadlydiseasesglobal,climate_change,finding appropriate solutions issues requires multilateral cooperation viable united nations core wish see strong decisive united nations capable effectively responding current future challenges,climate
HRV_2004.L337,26,26,respond expectations dire need assistance protect imbalances injustice shy away seeking available solutions fundamental global challenges face today including extreme poverty drug smuggling spread deadlydiseasesglobal,climate_change,globalization needs mastered opportunities offers need assessed excesses rectified finding appropriate answers fundamental questions requires multilateral cooperation viable effective united nations core wish,climate
KIR_2004.L102,19,19,individual nations global community ongoing conflicts iraq parts world scourge terrorism existence nuclear arsenals accelerated environmental degradation threat,global_warming,sea-level rise hunger poverty hiv aidspandemicnon- communicable diseases marginalization least developed countries within global economy underdevelopment continue pose major challenges organization must address today challenges,climate
KIR_2004.L105,16,16,community ongoing conflicts iraq parts world scourge terrorism existence nuclear arsenals accelerated environmental degradation threat,global_warming,sea-level rise hunger poverty hiv aids pandemic non- communicablediseasesmarginalization least developed countries within global economy underdevelopment continue pose major challenges organization must address today challenges,climate
LAO_2004.L713,21,21,success enter twenty-first century world today still confronted numerous complex problems including wars armed conflicts terrorism global crime human trafficking,global_warming,environmental degradation hiv aidsdiseasesmarginalization developing countries particular three vulnerable groups among least developed countries landlocked developing countries small island developing states international community cooperate work,climate
MHL_2004.L253,15,15,world marshall islands faces challenges shared many small island states environment extremely vulnerable effects,climate_change,natural disasters small population faces challenge managing high levels majordiseasesdiabetes risk rapid spread hiv aids sexually transmitted diseases limited resource base remoteness restrict ability integrate,climate
