docname,from,to,pre,keyword,post,pattern
TTO_2016.L163,15,15,development goals sdgs covers multitudinous threats collective well-being longevity civilization existential hazard caused unmitigated,climate_change,insidious threats violence extremism terrorism crises forced displacement spread infectiousdiseasesillnesses ebola chikungunya zika clear challenges time far exceed limits geography demography therefore diminish efficacy unilateral,climate
TTO_2016.L164,14,14,goals sdgs covers multitudinous threats collective well-being longevity civilization existential hazard caused unmitigated,climate_change,insidious threats violence extremism terrorism crises forced displacement spread infectious diseasesillnessesebola chikungunya zika clear challenges time far exceed limits geography demography therefore diminish efficacy unilateral,climate
VCT_2016.L367,23,23,mind saint vincent grenadines government comprehensively incorporated 2030 agenda planning focused economic development job creation quality education poverty eradication strengthening institutions infrastructure,renewable_energy,climate resiliencehealthwell-being security citizens central national medium-term development plans year saint vincent grenadines launched zero-hunger trust fund inspired goals sdgs zero-hunger trust fund employs narrowly,climate
VNM_2016.L185,23,23,promises bring humanity new higher level development challenges means developing countries particular continue suffer weak global economic recovery rising protectionism major economies,climate_change,natural disastersepidemicsfood water security depletion natural resources humanitarian migration crises also negative far-reaching implications many countries regions development income gaps widening national regional global levels,climate
VUT_2016.L502,4,4,development paris agreement,climate_change,efforts make pacific resilient climate_change natural disasters remain essential components journey towards sustainable future region oceans fisheries gender equality human rightshealthcare education important priorities region,climate
VUT_2016.L502,9,9,development paris agreement climate_change efforts make pacific resilient,climate_change,natural disasters remain essential components journey towards sustainable future region oceans fisheries gender equality human rightshealthcare education important priorities region given coherence 2030 agenda sustainable,climate
VUT_2016.L782,49,49,number problemsepidemicsmultiplication destructive insects undermining food security affecting variability precipitation situation caused various problems public health presence extreme climate events caused major harm infrastructure economy,climate_change,,climate
VUT_2016.L797,34,34,number problems epidemics multiplication destructive insects undermining food security affecting variability precipitation situation caused various problems publichealthpresence extreme climate events caused major harm infrastructure economy,climate_change,vanuatu responsible loss land sea also devastating effect food eat subsistence economy else health people,climate
VUT_2016.L821,12,12,public health presence extreme climate events caused major harm infrastructure economy,climate_change,vanuatu responsible loss land sea also devastating effect food eat subsistence economy elsehealthpeople despite fact pacific known floods owing rise sea levels disappearance entire islands,climate
VUT_2016.L821,49,49,economy elsehealthpeople despite fact pacific known floods owing rise sea levels disappearance entire islands means people vanuatu forced move inland however transforming ways life adapt,climate_change,,climate
WSM_2016.L961,30,30,income many communities around world sustainable management oceans seas therefore critical economic social development poverty eradication raising living standards worldwide yethealthoceans increasingly compromised pressures overfishing,climate_change,ocean acidification habitat loss pollution health marine ecosystems declines capacity provide food livelihoods incomes impacts disproportionately affect island countries,climate
WSM_2016.L973,20,20,seas therefore critical economic social development poverty eradication raising living standards worldwide yet health oceans increasingly compromised pressures overfishing,climate_change,ocean acidification habitat loss pollutionhealthmarine ecosystems declines capacity provide food livelihoods incomes impacts disproportionately affect island countries vulnerable least able adapt trends continue critical thresholds,climate
AUS_2017.L554,23,23,sendai declaration world humanitarian summit's grand bargain blueprint global action addresses problems can addressed working together challenges face respect national borders includes,climate_change,diseases includingmalariamanagement precious water resources modern slavery unpalatable truth forced labour child labour human trafficking modern slavery rampant world australia strongly committed working international community,climate
BLZ_2017.L297,37,37,every caribbean woman every caribbean child initiative leaders also renewing deepening efforts tackle non-communicablediseasestargeted approaches aimed promoting healthy lifestyles starting youngest members communities region security,climate_change,equally fundamental threats survival region risen meet challenges adopting counter-terrorism strategy pioneering,climate
BTN_2017.L337,2,2,effects,climate_change,work together threat natural disasters always remain can must ensure directly linked human- induced activity world bank estimates million people live poverty hungermalnourishmentdeprivation everyday realities,climate
CHE_2017.L43,27,27,2000 humankind made remarkable progress fight major scourges hunger extreme poverty difficulties accessing education famine still affects million people world every seconds child diesmalnutritionchallenges include,climate_change,global inequality conflict humanitarian disasters well forced displacement migration country actor world stage position find alone answers challenges today large complex transcend,climate
COG_2017.L529,17,17,congo basin second-largest green lung world amazon invite international community support congo initiative aimed protecting planet,global_warming,decent life also means allowing populations benefit high-qualityhealthcare proliferation counterfeit sub-standard medicines increasingly serious threat world particularly developing countries expansion scourge brings mind various carefully,climate
EGY_2017.L71,23,23,serve hope provide peace development new generations look us realize dreams decent life within just international order global order can face challenges,climate_change,natural disastersdiseasesepidemics well man-made crises war terrorism huge discrepancies distribution resources development opportunities evident purposes principles united nations still valid basis world offers everyone opportunity,climate
EGY_2017.L72,22,22,hope provide peace development new generations look us realize dreams decent life within just international order global order can face challenges,climate_change,natural disasters diseasesepidemicswell man-made crises war terrorism huge discrepancies distribution resources development opportunities evident purposes principles united nations still valid basis world offers everyone opportunity,climate
ERI_2017.L453,49,49,transport communicationshealthcare educational services well cultural sports recreational facilities eritrea also embarked massive water soil conservation programme afforestation programme part comprehensive plan enhance environment fight,climate_change,,climate
GNQ_2017.L358,26,26,cooperate states ensure peace world mean ensuring peace country protecting political economic social cultural rights also great deal uncertainty fact despite commendable initiatives 1990s combatmalnutritionhunger,climate_change,others despite high-level plenary meeting general assembly millennium development goals held 2010 years much progress seen areas contrary increase number people world go,climate
GTM_2017.L437,15,15,pact environment support aware high degree vulnerability threats nature guatemala already national action plan,climate_change,domestic legislation may carried achieve mitigation adaptation resilience climate_change regardnutritionfood security support world food programme put together final report strategic review situation guatemala regard emphasis,climate
GTM_2017.L437,24,24,pact environment support aware high degree vulnerability threats nature guatemala already national action plan climate_change domestic legislation may carried achieve mitigation adaptation resilience,climate_change,regardnutritionfood security support world food programme put together final report strategic review situation guatemala regard emphasis chronic malnutrition root causes tool working hard national strategy,climate
GTM_2017.L455,6,6,carried achieve mitigation adaptation resilience,climate_change,regard nutrition food security support world food programme put together final report strategic review situation guatemala regard emphasis chronicmalnutritionroot causes tool working hard national strategy,climate
KEN_2017.L345,35,35,care first partnership resulted drastic reduction maternal child deaths intend transform primary care pave way universalhealthcoverage million kenyans 2021 thereby ensuring pledged one left behind,climate_change,region disrupting livelihoods millions people generating conflicts dwindling resources especially land water climate_change today,climate
KEN_2017.L345,48,48,pave way universalhealthcoverage million kenyans 2021 thereby ensuring pledged one left behind climate_change region disrupting livelihoods millions people generating conflicts dwindling resources especially land water,climate_change,today,climate
KHM_2017.L256,7,7,general assembly 2030 agenda sustainable development,climate_change,2030 agenda inextricably linked many issues perturb world today pressing climate_change direct threat also multiplier many threats povertydiseasesfood insecurity mass migrations regional conflicts view climate_change,climate
KHM_2017.L256,18,18,general assembly 2030 agenda sustainable development climate_change 2030 agenda inextricably linked many issues perturb world today pressing,climate_change,direct threat also multiplier many threats povertydiseasesfood insecurity mass migrations regional conflicts view climate_change global human security issue presents serious unprecedented threat global peace security,climate
KHM_2017.L256,32,32,climate_change 2030 agenda inextricably linked many issues perturb world today pressing climate_change direct threat also multiplier many threats povertydiseasesfood insecurity mass migrations regional conflicts view,climate_change,global human security issue presents serious unprecedented threat global peace security generally cambodia regularly ranked among top,climate
MDV_2017.L1271,5,5,linked taking meaningful action,climate_change,maldives island nations custodians large expanses ocean yet every person hall every community represent every country come benefits oceans dependshealthwealth oceans seas every breath take,climate
MHL_2017.L1026,24,24,prevention practical approaches allow us work existing controversies order achieve global benefits universal participation including international civil aviation organization united nations framework convention,climate_change,worldhealthorganization security council resolution 2758 1971 misused justify people taiwan's exclusion united nations result missing important opportunity cooperate proactive contributor peace common global good united,climate
MLI_2017.L943,7,7,mali's commitment effective implementation paris agreement,climate_change,party regard international community must remain committed implementation preserve ecosystem present future generations world continues face numerous publichealthchallenges hiv aids malaria tuberculosis ebola commending progress,climate
MLI_2017.L947,3,3,paris agreement,climate_change,party regard international community must remain committed implementation preserve ecosystem present future generations world continues face numerous public health challenges hiv aidsmalariatuberculosis ebola commending progress,climate
NRU_2017.L819,31,31,development particularly technical prowess know-how concerned wishes contribute participate freely partnerships activities united nations system including sustainable development goals worldhealthorganization unesco united nations framework convention,climate_change,united nations-related agencies activities order ensure taiwanese people can make positive contributions societies around world must given freedom,climate
PNG_2017.L132,24,24,general mr ban ki-moon outstanding work tenure world continues confronted multiple unprecedented challenges increasingly complex nature facing serious adverse impacts uncertain global economy,climate_change,declininghealthmarine habitats heightened security fears challenges face unlikely overcome major goals achieved individual countries acting sure view shared many must work together build better stable,climate
PNG_2017.L563,2,2,convention,climate_change,work together successful meeting bonn papua new guinea island nation well-being economic development people tied resources coming oceans seas share growing concern declininghealthoceans seas sustain,climate
RUS_2017.L1202,16,16,secure future humankind without mutual trust hope effective implementation ambitious sustainable development goals paris agreement,climate_change,solutions global issues crucial developing countries food security demographicshealthcare fundamental principles international relations include recognition political pluralism freedom choice rule law must stop relying military,climate
SWZ_2017.L159,13,13,united nations reach greater heights support countries implementing 2030 agenda paris agreement,climate_change,united nations staff also congratulated remarkable work supporting inclusive sustainable development tacklingdiseasespromoting peace stability creating conducive environment humankind live sometimes extremely inimical conditions theme session,climate
TGO_2017.L111,45,45,encompasses imperatives peace development access qualityhealthcare healthy environment food security jobs particular young people challenges state faces particular developing countries reminder importance implementing paris agreement,climate_change,2030 agenda sustainable development,climate
TUN_2017.L431,46,46,development put end poverty marginalizationepidemicswork towards peaceful just inclusive prosperous african communities believe environmental considerations important achieving sustainable development world's nations therefore signed paris agreement,climate_change,2015 voluntarily committed,climate
TUV_2017.L692,30,30,council given direct threat global peace security tuvalu many low-lying islands peace security imperilled traditional threats conflict violence drugs weapons faminediseaseinstead male declaration human dimension,climate_change,recognized 2007 impacts climate_change pose immediate fundamental far-reaching threat individuals communities vulnerable states threaten wide range human rights including,climate
TUV_2017.L692,34,34,global peace security tuvalu many low-lying islands peace security imperilled traditional threats conflict violence drugs weapons faminediseaseinstead male declaration human dimension climate_change recognized 2007 impacts,climate_change,pose immediate fundamental far-reaching threat individuals communities vulnerable states threaten wide range human rights including,climate
TUV_2017.L741,29,29,life right take part cultural life right use enjoy property right adequate standard living right food right highest attainable standard physical mentalhealthten years ago recognized,climate_change,single greatest major threat peace security ultimately survival remains today situation grows urgent every day current warming trends islands may,climate
TUV_2017.L1103,3,3,established tuvalu,climate_change,disaster survival fund facility help people respond quickly impacts climate_change enhance adaptation work access appropriate infrastructures maritime ports islands airports technology connectivityhealthcare quality education renewable_energy,climate
TUV_2017.L1103,13,13,established tuvalu climate_change disaster survival fund facility help people respond quickly impacts,climate_change,enhance adaptation work access appropriate infrastructures maritime ports islands airports technology connectivityhealthcare quality education renewable_energy critical areas particular priority tuvalu welcome development genuine durable partnerships,climate
TUV_2017.L1103,28,28,climate_change disaster survival fund facility help people respond quickly impacts climate_change enhance adaptation work access appropriate infrastructures maritime ports islands airports technology connectivityhealthcare quality education,renewable_energy,critical areas particular priority tuvalu welcome development genuine durable partnerships aspired sids accelerated modalities action pathway regard issue ldc graduation view,climate
UKR_2017.L1314,45,45,sustainable infrastructure well promoting effective publichealthsystem affordable education decent work convinced country alone can achieve sustainable development without sustainable peace sustainable security also doubt mitigation,global_warming,remains indispensable element sustainable,climate
VNM_2017.L378,31,31,path sustainable development must place interests people centre policies actions able ensure decent life believe life can decent poverty unemploymentepidemicsstill effectively addressed decent still threatened,climate_change,disasters succeed quest sustainable development decent life secure sustainable peace enjoyed peace independence past four decades now know,climate
VUT_2017.L852,16,16,united nations persevere therefore urge united states part one world reverse decision enforce paris agreement,climate_change,country deeply concerned climate_change paris agreement committed reversing declinehealthoceans united nations ocean conference held new york june shown quality oceans contribute livelihoods seriously undermined urgent,climate
VUT_2017.L852,20,20,united nations persevere therefore urge united states part one world reverse decision enforce paris agreement climate_change country deeply concerned,climate_change,paris agreement committed reversing declinehealthoceans united nations ocean conference held new york june shown quality oceans contribute livelihoods seriously undermined urgent immediate attention part required,climate
VUT_2017.L884,48,48,know important concernedhealthocean impact humankind's survival government committed implementing resolutions conference including sustainable development goal 2030 partnerships national efforts committed achieving national goal per cent,renewable_energy,2030,climate
VUT_2017.L929,5,5,national goal per cent,renewable_energy,2030 support development partners launched national oceans policy also ban use plastic bags 2018 order reduce amount ocean debris preservehealthpacific islands forum leaders meeting apia,climate
ATG_2018.L675,27,27,humankind global community provides us enduring citizenship loyalty myopic nationalistic ideals trump patriotism towards common humankind recognize today nations world interdependent effort stop spreaddiseasecurb effects,climate_change,make peoples safe terrorists organized crime share knowledge technology access one another's markets trade goods services thereby improving lives people today's world,climate
BEL_2018.L1002,29,29,free-trade agreement continent continent global reciprocal partnership win-win situation 2030 agenda sustainable development sets path better fairer world everything poverty eradication accesshealtheducation gender equality fight,global_warming,possible option general mobilization ownership joint programme us levels let us roll sleeves decide act countdown urgency results fundamental climate_change,climate
BEL_2018.L1002,49,49,eradication accesshealtheducation gender equality fight global_warming possible option general mobilization ownership joint programme us levels let us roll sleeves decide act countdown urgency results fundamental,climate_change,,climate
BEL_2018.L1064,3,3,denying reality,climate_change,order stubbornness past denied earth round prosperity must sustainable can longer based frenetic selfish exploitation precious natural resources oceans biodiversity air qualityhealthprecious assets must cherished,climate
BIH_2018.L372,44,44,eliminating smallpox vaccinating record numbers infants preventablediseasesbeating back menace aids concerted efforts alliance nations necessary contain risks nuclear confrontation successfully address global issues gender equality,climate_change,prosecution war criminals international level,climate
CHE_2018.L54,24,24,given considerable challenges transformations must face world today person country capacity stand alone mean globalization inequality war internal conflict well extremism migration flows,climate_change,evenhealthcrises digital revolution shared responsibility responsibility every state member united nations ensure international institutions organizations task supporting us endeavour unfortunately seems tendency moment seek answers,climate
CHE_2018.L447,35,35,made towards achieving goals specifically contributed countries providing better statistical data also engaging innovative projects areashealthcare education energy innovation nonetheless aware still work done combat,global_warming,negative environmental impacts economic development want take opportunity stress essential contribution culture cultural diversity,climate
CHL_2018.L597,42,42,treat societies vulnerable members children women elderly people sufferingdiseasepoorest many areas many countries still long way go today planet faces major threats challenges deteriorating environment,global_warming,growing desertification destruction ozone layer depletion natural,climate
COM_2018.L861,6,6,pay close attention ever-growing issue,climate_change,particularly small island developing states country union comoros one exacerbating destruction ecosystems biodiversity climate_change also likely increase poverty variousdiseaseslead upsurge climate-related migration thereby compromising future,climate
COM_2018.L861,20,20,pay close attention ever-growing issue climate_change particularly small island developing states country union comoros one exacerbating destruction ecosystems biodiversity,climate_change,also likely increase poverty variousdiseaseslead upsurge climate-related migration thereby compromising future future generations national level major events marking decisive turning point sociopolitical evolution country taken,climate
CZE_2018.L60,26,26,universal ideals us states members united nations strive together face many challenges areas dignity individuals global prosperity sustainable development including gender inequality youth unemployment globalhealththreats,climate_change,violent extremism terrorism forced displacement uncontrolled migration furthermore multilateralism rules-based system benefit everyone long held many threats bay increasingly undermined questioned one way,climate
DMA_2018.L393,39,39,hungry night night light arms small weapons continue infiltrate vulnerable societies non-communicablediseasesaccount many preventable deaths yes agree poverty inequality violence shared responsibilities modern-day manifestations wrapped,climate_change,climate_change arises activities support reflect inequalities always poor suffer poor,climate
DMA_2018.L393,40,40,night night light arms small weapons continue infiltrate vulnerable societies non-communicablediseasesaccount many preventable deaths yes agree poverty inequality violence shared responsibilities modern-day manifestations wrapped climate_change,climate_change,arises activities support reflect inequalities always poor suffer poor,climate
DMA_2018.L439,38,38,homes destroyed whose loved ones perish poor least capacity escape heavy burdens povertydiseasedeath much violence flows directly climate change-induced scarcity things like water productive lands,climate_change,main symptom world's broken economy society humanity precisely issues united nations,climate
FJI_2018.L814,6,6,us goal agreed paris agreement,climate_change,reducing rate global_warming well c target let alone ambitious target c matters now action fiji press action climate_change oceanhealthevery forum part simply wait rest world,climate
FJI_2018.L814,9,9,us goal agreed paris agreement climate_change reducing rate,global_warming,well c target let alone ambitious target c matters now action fiji press action climate_change oceanhealthevery forum part simply wait rest world come around effects,climate
FJI_2018.L814,24,24,us goal agreed paris agreement climate_change reducing rate global_warming well c target let alone ambitious target c matters now action fiji press action,climate_change,oceanhealthevery forum part simply wait rest world come around effects climate_change already bearing us already taking steps boost resilience fiji begun project improve access sustainable,climate
FJI_2018.L814,35,35,well c target let alone ambitious target c matters now action fiji press action climate_change oceanhealthevery forum part simply wait rest world come around effects,climate_change,already bearing us already taking steps boost resilience fiji begun project improve access sustainable,climate
FRA_2018.L1671,39,39,tuberculosis malaria replenishment conference take initiative fight counterfeit medicines intensify response majorpandemicscall everyone mobilize lastly must fight urgently body soul environmental inequality unacceptable per cent,greenhouse-gas,emissions produced per cent planet's richest inhabitants case solar energy,climate
