docname,from,to,pre,keyword,post,pattern
MEX_2011.L875,5,5,can simultaneously reduce poverty,climate_change,finally another challenge social basis reducing poverty marginalization mexico established programme transferring money poorest population incentives mothers take children schoolhealthclinics programme offers average monthly bottom,climate
MHL_2011.L817,22,22,primary purpose united nations maintain international peace world afford overlook taiwan's strong efforts promoting peace 11-51398 stability asia-pacific region including regard,climate_change,2009 invitation worldhealthorganization taiwan participate observer benefited global medical progress including non-communicable diseases also serves effective model wider participation key organizations urge united nations member,climate
MHL_2011.L828,11,11,strong efforts promoting peace 11-51398 stability asia-pacific region including regard,climate_change,2009 invitation world health organization taiwan participate observer benefited global medical progress including non-communicablediseasesalso serves effective model wider participation key organizations urge united nations member,climate
MRT_2011.L127,21,21,full success commend persistent herculean efforts resolve many issues including strengthening international peace security achieving millennium development goals mdgs combating,climate_change,mitigating threats famine endemicdiseasewell challenges hinder well-being humanity sixty-sixth session general assembly taking place sensitive political juncture region popular uprisings many arab countries led revolutions,climate
NGA_2011.L928,48,48,prevention control non-communicablediseasesend meeting vein welcome discussions high-level meeting desertification land degradation issues continue pose challenges development efforts nigeria strongly supports united nations framework convention,climate_change,convention,climate
NIC_2011.L610,30,30,victims earthquake levelled territory affected fukushima accident vehemently call states nuclear reactor installations take measures avoid similar accidents gravely endanger people'shealthharm environment 11-51398 upcoming durban,climate_change,conference rio conference sustainable development provide renewed opportunities must allow squander truly break destructive logic redirect humankind towards development,climate
PLW_2011.L1075,27,27,province china order promote efficacy goals ideals united nations recommend taiwan invited participate meaningfully united nations system believe united nations fully properly address issueshealthaviation safety,climate_change,unless taiwan allowed participate activities world health organization international civil aviation organization united nations framework convention climate_change appeal world allow taiwan participate,climate
PLW_2011.L1075,44,44,believe united nations fully properly address issueshealthaviation safety climate_change unless taiwan allowed participate activities world health organization international civil aviation organization united nations framework convention,climate_change,appeal world allow taiwan participate,climate
PLW_2011.L1085,19,19,recommend taiwan invited participate meaningfully united nations system believe united nations fully properly address issues health aviation safety,climate_change,unless taiwan allowed participate activities worldhealthorganization international civil aviation organization united nations framework convention climate_change appeal world allow taiwan participate important united nations entities finally,climate
PLW_2011.L1085,34,34,believe united nations fully properly address issues health aviation safety climate_change unless taiwan allowed participate activities worldhealthorganization international civil aviation organization united nations framework convention,climate_change,appeal world allow taiwan participate important united nations entities finally palau relatively new state joined,climate
PNG_2011.L180,28,28,effective efficient way united nations deliver mandate particularly new country programme papua new guinea rolled beginning january 2012 target areas governance social justicehealtheducation gender environment,climate_change,disaster management new country programme part overall efforts achieve millennium development goals mdgs since inaugural mdg report published 2004 papua new,climate
SLB_2011.L1344,38,38,global health system terms wide range international development programmes welcome participation observer worldhealthassembly continue call arrangements extended united nations treaty bodies including united nations convention,climate_change,unfccc ensure meaningful participation taiwan people affairs international community solomon islands,climate
SLE_2011.L917,15,15,repression perpetrated strong like emphasize international cooperation peaceful settlement disputes life blood organization deliberations,global_warming,human trafficking threats nuclear weapons scourge abject poverty communicable non-communicablediseasesruthless natural disasters flow illicit drugs seemingly unending upheavals financial markets always remember need world connected,climate
SMR_2011.L627,16,16,role global governance questioned anyone destinies peoples linked global threats increasingly direct way today threats,climate_change,biodiversity loss economic financial employment crises food security publichealthdisarmament non-proliferation weapons fight terrorism recognized interdependent basis create new form international cooperation multilateralism coordinate policies international,climate
SUR_2011.L109,49,49,pv agreepandemicsaids malaria non-communicable diseases threats related terrorism weapons mass destruction human trafficking illicit trade use small arms light weapons illicit drug trade risks posed,climate_change,,climate
SUR_2011.L111,47,47,pv agree pandemics aidsmalarianon-communicable diseases threats related terrorism weapons mass destruction human trafficking illicit trade use small arms light weapons illicit drug trade risks posed,climate_change,continuing vulnerability,climate
SUR_2011.L113,45,45,pv agree pandemics aids malaria non-communicablediseasesthreats related terrorism weapons mass destruction human trafficking illicit trade use small arms light weapons illicit drug trade risks posed,climate_change,continuing vulnerability women youth,climate
TUV_2011.L371,24,24,sustainable development strategy fourth united nations conference least developed countries scheduled next month furthermore least developed country tuvalu vulnerable global economic shocks impacts,climate_change,outbreaksdiseaseincluding non-communicable diseases tuvalu continues call appeal united nations take vulnerabilities seriously consideration addressing question graduation ldcs despite ambitious target istanbul programme action per cent,climate
TUV_2011.L374,21,21,fourth united nations conference least developed countries scheduled next month furthermore least developed country tuvalu vulnerable global economic shocks impacts,climate_change,outbreaks disease including non-communicablediseasestuvalu continues call appeal united nations take vulnerabilities seriously consideration addressing question graduation ldcs despite ambitious target istanbul programme action per cent,climate
TUV_2011.L574,41,41,particular tuvalu calls upon united nations subsidiary bodies especially worldhealthorganization international civil aviation organization allow taiwan participate fully meaningfully meetings activities including united nations meetings,climate_change,climate_change priority global issue twenty-first century beyond therefore,climate
TUV_2011.L574,42,42,tuvalu calls upon united nations subsidiary bodies especially worldhealthorganization international civil aviation organization allow taiwan participate fully meaningfully meetings activities including united nations meetings climate_change,climate_change,priority global issue twenty-first century beyond therefore,climate
UKR_2011.L720,49,49,protection improvinghealthreducing child mortality curbing spread hiv aids tuberculosis ensuring gender equality working today's immediate tasks believe necessary pay greater attention 11-50702 increasingly acute issue,climate_change,,climate
UKR_2011.L723,46,46,protection improving health reducing childmortalitycurbing spread hiv aids tuberculosis ensuring gender equality working today's immediate tasks believe necessary pay greater attention 11-50702 increasingly acute issue,climate_change,environmental protection endorse,climate
USA_2011.L1965,37,37,today urge nations join us meeting goal making sure nations core capacities address publichealthemergencies place 2012 commitment health people demands preserve planet must put action,climate_change,demands tap power science save resources scarce together must continue work build,climate
USA_2011.L1970,32,32,today urge nations join us meeting goal making sure nations core capacities address public health emergencies place 2012 commitmenthealthpeople demands preserve planet must put action,climate_change,demands tap power science save resources scarce together must continue work build progress made copenhagen cancún major,climate
VNM_2011.L100,23,23,today peace cooperation development remain over-arching themes time yet tensions conflicts persist continents regions owing unresolved differences within nations threat use force,climate_change,natural disasterspandemicstransnational crime proliferation weapons mass destruction international terrorism still challenges demand effective responses world economy's unstable recovery coupled economic downturns many developed nations exposed,climate
VNM_2011.L308,13,13,resources capacities fulfil internationally agreed action plans including mdgs facilitate multilateral negotiations,climate_change,well disarmament non-proliferation weapons mass destruction provide solutions pressing issues desertification non-communicablediseasesnuclear safety security respond global financial economic crisis help mentioning efforts united nations funds,climate
BGD_2012.L727,32,32,people nearly per cent school-age children enrolled primary schools achieved gender parity primary secondary education established community clinics ensurenutritionhealth care rural people especially mothers children,climate_change,trust fund set implement adaptation mitigation programmes undertakings helped achieving millennium development goals mdgs gender parity infant,climate
BGD_2012.L728,31,31,people nearly per cent school-age children enrolled primary schools achieved gender parity primary secondary education established community clinics ensure nutritionhealthcare rural people especially mothers children,climate_change,trust fund set implement adaptation mitigation programmes undertakings helped achieving millennium development goals mdgs gender parity infant maternal,climate
BGD_2012.L754,7,7,care rural people especially mothers children,climate_change,trust fund set implement adaptation mitigation programmes undertakings helped achieving millennium development goals mdgs gender parity infant maternalmortalityahead 2015 achievements earned us global recognition mdg,climate
BGD_2012.L797,29,29,scaling nutrition lead group champion education first initiative welcome high-level panel post-2015 development agenda consider coherence sustainable development goals prioritize poverty hungernutritionglobal food energy security,climate_change,global partnership sustainable development hope high-level panel also consider formulating position painful plight autistic disadvantaged children constitute per cent world's,climate
BGD_2012.L845,44,44,organization autism speaks launched global autism publichealthinitiative current assembly session submit draft resolution autism spectrum disorder hope receive assembly's support efforts hindered unjust developments resulting,climate_change,increasing poverty property loss human,climate
BWA_2012.L274,22,22,south sudan north led instability region typical sudanese regime many years live times common well-being seriously compromised threats nuclear proliferation terrorism,climate_change,environmental degradation underdevelopmentpandemicdiseases coupled effects global economic financial crisis internal conflicts resolution myriad challenges threats confronting mankind requires urgent concerted action international community universality united,climate
BWA_2012.L275,21,21,sudan north led instability region typical sudanese regime many years live times common well-being seriously compromised threats nuclear proliferation terrorism,climate_change,environmental degradation underdevelopment pandemicdiseasescoupled effects global economic financial crisis internal conflicts resolution myriad challenges threats confronting mankind requires urgent concerted action international community universality united,climate
COG_2012.L776,48,48,poverty employment educationhealthaffected crisis light delegation reaffirms responsibility central role united nations forging spirit solidarity cooperation can enable commitments made areas aid financing development respected,climate_change,remains,climate
CPV_2012.L1007,23,23,university united nations needed new vision new paradigm new multilateralism help ensure global economic financial stability combat poverty re-establish peace respond effects,climate_change,improve globalhealthfight terrorism ensure disarmament non-proliferation closing ceremony united nations conference sustainable development rio june stated rio shown multilateralism irreplaceable instrument global expression democracy reaffirm,climate
DMA_2012.L54,16,16,manner presided sixty- sixth session sixty-seventh session general assembly convened time face myriad challenges impact,climate_change,civil conflicts hunger starvation poverty hiv aids chronic non-communicablediseaseschallenges however equally matched tremendous opportunities created rapid advancement science technology unprecedented level international cooperation therefore need,climate
FSM_2012.L503,45,45,epidemic proportions pacific accept primary responsibilityhealthrests government seeking assistance international community capacity-building institutional strengthening policy formulation recognize contributing effects nutrition lifestyle epidemic also mindful fact,climate_change,magnified challenge result threat,climate
FSM_2012.L518,30,30,epidemic proportions pacific accept primary responsibility health rests government seeking assistance international community capacity-building institutional strengthening policy formulation recognize contributing effectsnutritionlifestyle epidemic also mindful fact,climate_change,magnified challenge result threat poses food security traditional lifestyle micronesians federated states micronesia supports greater participation women social political,climate
FSM_2012.L520,28,28,epidemic proportions pacific accept primary responsibility health rests government seeking assistance international community capacity-building institutional strengthening policy formulation recognize contributing effects nutrition lifestyleepidemicalso mindful fact,climate_change,magnified challenge result threat poses food security traditional lifestyle micronesians federated states micronesia supports greater participation women social political economic development,climate
GMB_2012.L287,17,17,organization times questioned one element remains unchallenged character best forum confronting global challenges convene discuss issues,climate_change,economic crises financial turmoil food insecurity conflicts fightingdiseasepoverty special interests africa convening power united nations confers legitimacy indeed unparalleled elsewhere developing countries therefore believe work,climate
IRL_2012.L789,43,43,partners worked closely secretary- general build support scalingnutritionmovement must collectively must act now recognize systemic linkages recurring food price crises humanitarian emergencies chronic undernourishment effects,climate_change,nothing connects us across borders across,climate
JAM_2012.L151,24,24,time across world increasing sense impatience agitation born sense growing global insecurity accordingly united nations agenda expanded focus address multifaceted challenges food security,climate_change,globalpandemicsglobal economic financial crisis already witnessed citizens several nations spring action demands change others chose occupy various spaces protest light reality many indeed many us,climate
KNA_2012.L1421,20,20,technology community development education name just nation even region however taiwan's unfailing valued contributions work united nations framework convention,climate_change,international civil aviation organization worldhealthassembly forums long demonstrated outstanding credentials valued impactful member global community fitting just remaining strictures pertaining taiwan's standing among international community,climate
KOR_2012.L41,24,24,confidence able leadership session crowned great success humankind continues advance drawing collective wisdom address challenges throughout human history although new global challenges mankind,climate_change,povertydiseaseunderdevelopment terrorism proliferation weapons mass destruction now testing international community doubt overcome challenges future path united nations symbol collective wisdom take greater responsibility coping challenges,climate
KWT_2012.L1080,11,11,global financial crisis rise basic commodity prices clear negative impact,climate_change,growing frequency natural disasters intensification terrorism put focus ugly face poverty hunger well spreadepidemicscommunicable dangerous diseases despite notable accomplishments many states efforts reach millennium development,climate
KWT_2012.L1083,8,8,rise basic commodity prices clear negative impact,climate_change,growing frequency natural disasters intensification terrorism put focus ugly face poverty hunger well spread epidemics communicable dangerousdiseasesdespite notable accomplishments many states efforts reach millennium development,climate
MEX_2012.L2329,39,39,thousands lives region united nations considers finds solutions global problems threaten integrityhealthlives millions around world deals famine starvation horn africa epidemics h1n1 virus mexico tackles,climate_change,must also take action stop wave death suffering drug trade,climate
MEX_2012.L2339,29,29,thousands lives region united nations considers finds solutions global problems threaten integrity health lives millions around world deals famine starvation horn africaepidemicsh1n1 virus mexico tackles,climate_change,must also take action stop wave death suffering drug trade blights lives people respectfully urge exhort united nations take part,climate
MLI_2012.L772,29,29,need undertake in-depth dialogue new strategies aimed mobilizing additional stable predictable resources ensure financing development programmes achievement millennium development goals particular areashealtheducation food security environment,climate_change,one major challenges facing world survival planet threatened natural disasters caused phenomenon seriously affecting living conditions countries sahel mine inter,climate
NIC_2012.L919,40,40,people achieving important results struggle poverty strengthens process restoring rights translateshealthbetter education productive service-oriented infrastructure higher living standard citizens soon transformed energy matrix using sources,renewable_energy,2017 per cent energy consumed renewable_energy decided take necessary,climate
NIC_2012.L919,46,46,strengthens process restoring rights translateshealthbetter education productive service-oriented infrastructure higher living standard citizens soon transformed energy matrix using sources renewable_energy 2017 per cent energy consumed,renewable_energy,decided take necessary,climate
SLE_2012.L481,23,23,member states particularly global south voyage rough times turbulent worse still effects food fuel financial crises struck global community 2008 well impact,climate_change,conflicts deadlypandemicsexacerbated situation compromised determination efforts developing countries especially least developed countries ldcs attain internationally agreed development goals including mdgs commend brazil successfully hosting united,climate
SMR_2012.L1448,35,35,still vulnerable group population subjected violence abuse exploitation vast number children world still access basic serviceshealthcare education besides facing global challenges economic crisis problems connected,climate_change,states must find resources necessary best meet needs children immediately improve conditions living poorest,climate
TTO_2012.L621,8,8,fully implement obligations united nations framework convention,climate_change,kyoto protocol guarantee survival us vulnerable climate_change climate_variability sea-level rise every moment delay takes us closer demisehealthwell-being people central development prevalence non-communicable diseases particular poses,climate
TTO_2012.L621,15,15,fully implement obligations united nations framework convention climate_change kyoto protocol guarantee survival us vulnerable,climate_change,climate_variability sea-level rise every moment delay takes us closer demisehealthwell-being people central development prevalence non-communicable diseases particular poses serious threat caribbean development trinidad tobago laments,climate
TTO_2012.L621,16,16,fully implement obligations united nations framework convention climate_change kyoto protocol guarantee survival us vulnerable climate_change,climate_variability,sea-level rise every moment delay takes us closer demisehealthwell-being people central development prevalence non-communicable diseases particular poses serious threat caribbean development trinidad tobago laments lack,climate
TTO_2012.L628,1,1,,climate_change,kyoto protocol guarantee survival us vulnerable climate_change climate_variability sea-level rise every moment delay takes us closer demise health well-being people central development prevalence non-communicablediseasesparticular poses,climate
TTO_2012.L628,8,8,climate_change kyoto protocol guarantee survival us vulnerable,climate_change,climate_variability sea-level rise every moment delay takes us closer demise health well-being people central development prevalence non-communicablediseasesparticular poses serious threat caribbean development trinidad tobago laments,climate
TTO_2012.L628,9,9,climate_change kyoto protocol guarantee survival us vulnerable climate_change,climate_variability,sea-level rise every moment delay takes us closer demise health well-being people central development prevalence non-communicablediseasesparticular poses serious threat caribbean development trinidad tobago laments lack,climate
BGR_2013.L75,45,45,billion people still suffer extreme povertymalnutritionbasic health services many women babies remain remote luxury disparities wealth distribution quality life personal opportunities become extreme across globe,climate_change,environmental degradation reached alarming,climate
BGR_2013.L77,43,43,billion people still suffer extreme poverty malnutrition basichealthservices many women babies remain remote luxury disparities wealth distribution quality life personal opportunities become extreme across globe,climate_change,environmental degradation reached alarming level require,climate
BRB_2013.L177,4,4,many manifestations impact,climate_change,extreme_weather events food crises volatile food crises compounded unprecedented levels terror violence time seen global determination tackle issues barbados recognizes stabilityhealthproductivity global environment particularly coastal,climate
BRB_2013.L177,5,5,many manifestations impact climate_change,extreme_weather,events food crises volatile food crises compounded unprecedented levels terror violence time seen global determination tackle issues barbados recognizes stabilityhealthproductivity global environment particularly coastal marine,climate
BRB_2013.L515,18,18,development agenda involve commitments eradication poverty hunger environmental sustainability strong emphasis coastal marine resources development sustainable accessible,renewable_energy,technologies pursuit sustainable agriculture agenda tandem foodnutritionsecurity gender equality women's empowerment youth development education employment also call emphasis inclusion vulnerable groups including persons disabilities requisite,climate
BWA_2013.L140,32,32,2015 development agenda therefore pledge full support cooperation president ashe efforts usher new development paradigm doubt challenges extreme povertydiseaselack access affordable energy potable water sanitation,climate_change,gender inequality continue haunt millions people especially developing countries account delegation strong view formulation sustainable development goals,climate
BWA_2013.L342,9,9,botswana among sub-saharan african countries suffer adverse impact,climate_change,notable manifestations climate_change extreme temperatures water shortages land degradation desertification persistent drought climate_change also adverse impactshealthfood security gratifying progress continues made many countries implementation united,climate
BWA_2013.L342,12,12,botswana among sub-saharan african countries suffer adverse impact climate_change notable manifestations,climate_change,extreme temperatures water shortages land degradation desertification persistent drought climate_change also adverse impactshealthfood security gratifying progress continues made many countries implementation united nations framework convention,climate
